景区名称,评论日期,评论内容,主题,评论对主题贡献度,主题关键字,评论分词,评价方面,景区编号,emotional_value,index,情感等级
A18,2020-04-28,1.天气交通很给力，天气预报的雷阵雨没有下，昨天深圳下雨还差点改期，虎门大桥也没堵车，在港珠澳大桥挨着的人工岛拍到很漂亮的照片，开心2.午餐不错，有鱼鸡鸭猪肉，炒青菜也新鲜，还有烧白完全超出我预期，没辣椒感觉也挺好吃，我四川人3.所列的行程都去了，虽然一天下来比较赶，但是充实4.带着老人和小孩，我家小孩不到1米2，澳门环岛游轮是免费的。望远镜千万别租，效果很差，我还租了俩，浪费了20块5.导游讲解很卖力，但是因为音响效果不太好，我们坐后排，基本听不清6.总之，这个价格超出预期，点个赞！,6.0,0.2430000007152557,"上山, 广东, 导游, 山顶, 时, 走, 到达, 两个, 下午, 坐","['天气', '交通', '力', '天气预报', '雷阵雨', '昨天', '深圳', '下雨', '差点', '改期', '虎门', '大桥', '堵车', '港', '珠', '澳', '大桥', '人工岛', '拍', '很漂亮', '照片', '开心', '午餐', '鱼', '鸡鸭', '猪肉', '炒青菜', '新鲜', '烧白', '超出', '预期', '辣椒', '感觉', '挺好吃', '四川人', '所列', '行程', '充实', '我家', '不到', '米', '澳门', '环岛', '游轮', '免费', '望远镜', '千万别', '租', '效果', '差', '租', '俩', '浪费', '块', '导游', '讲解', '卖力', '音响效果', '不太好', '坐', '后排', '听不清', '价格', '超出', '预期', '赞']",服务,18,-2.0,42444,1
A18,2020-10-16,**是北京的著名景点，而珠海也有一个**，名曰**！珠海的**是投资了超过6亿，以北京**为原稿，按1:1还原打造**四十景中的十八景而成，景点还原度高，实属中国的第二座**。**位于珠海市香洲区兰埔路与白石路交界处，是一座依山傍水，集园林湖泊、西洋建筑、古典建筑、花园亭台等为景观的建筑群。**三面环山，一面为湖，其主要建筑物有安佑宫、海晏堂、万花阵、福海、远瀛观、平湖秋月等，还可以乘坐缆车观赏**的全局面貌，感受热带南国下**的优雅娴静。**免门票入场，不过里面的各个玩乐区域以及节目表演是另外付费的。整个园区很大，小桥流水，亭台楼阁，雕梁画栋，环境优美，配合历史典故。因为景区就在市区内，乘坐公交车就能到达，而我就利用共享打车过来的！这是第二次来这里，这次的重点是西洋景区！说到**中最为惊艳的园区当属西洋景区，也是最吸引我的所在。而这个区域位置又相对偏僻，甚至容易错过！因为很多人包括我第一次去都没有见到这个区域，后来看攻略才发现有这样一个精华景点！来这里，要从**大门往左直走到达，西洋景区很幽静，散客一般会错过，而旅游团来也没有把这里当做必到之处。而这块区域却是拍照圣地，非常容易拍出西洋环境大片。西洋楼，由海晏堂、远瀛观、大水法等十余个建筑和庭园组成。建筑主体为西洋式，楼顶装饰则采用中国古代传统的琉璃瓦。西洋楼群有几组人工喷泉颇为别致。海晏堂是西洋楼群中最大的宫殿。宫殿阶前有一大型水池，池左右呈八字型排列有十二只兽面人身铜像，分别是鼠、牛、虎、兔、龙、蛇、马、羊、猴、鸡、狗、猪，也正是我国的十二个属相，人们称之为十二星兽。远瀛观原位于海晏堂以东，南北轴线上分三个部分，最北的高台上是远瀛观，中间是大水法，最南端是观水法。西洋楼位于**的西北处，整座宫殿充满欧式风情，气势恢宏，当年乾隆皇帝亲政避暑的场所，也曾是香妃居住的场所，乾隆皇帝是将大量各国进献的珍宝安放于此，宫殿的奢华可见一斑。关于西洋楼建筑的拍摄，最好使用广角镜头，这样能较完整拍出建筑全貌，无论是中心构图，还是其他的机位都非常出片。西洋楼是众多网红打卡地点，这边跟整个**里红墙绿瓦的故宫式建筑不同，建筑都是蓝顶白墙的主体建筑，就很适合小姐姐们拍大片哦。小贴士：建议游览路线：顺时针方向-进门-正大光明-九州清晏-西洋楼-万方安和-曲院风荷-上下天光-方壶胜境-涵虚朗鉴-濂溪乐处-西洋楼-平湖秋月。这样一圈大概就可以游遍**，时间约2小时。公交：乘坐1、B7、25、30、991、992路到**站，或乘坐13、62、69、991路到**总站。门票：免费，如需观赏表演需要单独购票,3.0,0.3617999851703644,"走, 高, 性价比, 免费, 太, 坐, 建议, 观音, 开车, 感觉","['北京', '著名景点', '珠海', '名曰', '珠海', '投资', '超过', '亿', '北京', '原稿', '还原', '打造', '四十', '中', '十八', '成', '还原', '度', '高', '实属', '中国', '第二座', '位于', '珠海市', '香洲区', '兰埔路', '白石', '路', '交界处', '一座', '依山傍水', '集', '园林', '湖泊', '西洋', '建筑', '古典建筑', '花园', '亭台', '等为', '景观', '建筑群', '三面', '环山', '湖', '建筑物', '安佑', '宫', '海晏堂', '万花阵', '福海', '远', '瀛', '观', '平湖', '秋月', '乘坐', '缆车', '观赏', '全局', '面貌', '感受', '热带', '南国', '优雅', '娴静', '免', '入场', '玩乐', '区域', '节目', '表演', '付费', '园区', '很大', '小桥流水', '亭台楼阁', '雕梁画栋', '环境优美', '配合', '历史', '典故', '市区', '乘坐', '公交车', '到达', '利用', '共享', '打车', '第二次', '重点', '西洋', '中', '最为', '惊艳', '园区', '属', '西洋', '吸引', '区域', '位置', '偏僻', '错过', '包括', '第一次', '见到', '区域', '攻略', '发现', '精华', '大门', '左', '直', '走', '到达', '西洋', '幽静', '散客', '错过', '旅游团', '当做', '之处', '这块', '区域', '却是', '拍照', '圣地', '非常容易', '拍', '西洋', '环境', '大片', '西洋楼', '海晏堂', '远', '瀛', '观', '大水法', '十余个', '建筑', '庭园', '建筑', '主体', '西洋式', '楼顶', '装饰', '采用', '中国', '古代', '传统', '琉璃瓦', '西洋楼', '群', '几组', '人工', '喷泉', '颇为', '别致', '海晏堂', '西洋楼', '群', '中', '宫殿', '宫殿', '阶', '前', '大型', '水池', '呈', '八字', '型', '排列', '十二只', '兽面', '人身', '铜像', '鼠', '牛', '虎', '兔', '龙', '蛇', '马', '羊', '猴', '鸡', '狗', '猪', '我国', '十二个', '属相', '称之为', '十二', '星兽', '远', '瀛', '观', '原', '位于', '海晏堂', '以东', '南北', '轴线', '三个', '最北', '高', '台上', '远', '瀛', '观', '大水法', '最南端', '观', '水法', '西洋楼', '位于', '西北', '处', '整座', '宫殿', '充满', '欧式', '风情', '气势恢宏', '当年', '乾隆皇帝', '亲政', '避暑', '场所', '香妃', '居住', '场所', '乾隆皇帝', '各国', '进献', '珍宝', '安放', '宫殿', '奢华', '可见一斑', '西洋楼', '建筑', '拍摄', '广角镜头', '较完整', '拍', '建筑', '全貌', '无论是', '中心', '构图', '机位', '出片', '西洋楼', '众多', '网红', '打卡', '地点', '红墙', '绿瓦', '故宫', '式', '建筑', '建筑', '蓝顶', '白墙', '主体', '建筑', '适合', '小姐姐', '拍', '大片', '小贴士', '建议', '游览', '路线', '顺时针', '方向', '进门', '正大光明', '九州', '清晏', '西洋楼', '万方', '安', '曲院风', '荷', '天光', '方壶', '胜境', '涵虚朗', '鉴', '濂', '溪', '乐', '处', '西洋楼', '平湖', '秋月', '一圈', '游遍', '约', '公交', '乘坐', '路', '站', '乘坐', '路', '总站', '免费', '需', '观赏', '表演', '单独', '购票']",性价比,18,0.0,42445,1
A18,2020-06-14,天气很好，珠海比前几年环境更好了，座船登上九洲岛观港珠澳大桥，价格实惠，取票方便。,3.0,0.2414000034332275,"走, 高, 性价比, 免费, 太, 坐, 建议, 观音, 开车, 感觉","['天气', '珠海', '前', '几年', '环境', '更好', '座', '船', '登上', '九洲', '岛观', '港', '珠', '澳', '大桥', '价格', '实惠']",性价比,18,1.5,42446,3
A18,2020-05-27,一直想去看看排名第一的跨海大桥，港珠澳大桥。然后刚刚好就看到这个行程，顺便游玩一下珠海。日月贝贝壳形式的歌剧院也别具特色，特别适合文青拍照，哈哈。一般一日游时间都很紧凑，但是这个行程很舒适，特别适合周末散心放空自我。坐邮轮还可以环澳门岛游，整个澳门风景尽收眼底呀。还有我们的谢导，超级耐心尽责,0.0,0.2777999937534332,"值得, 适合, 环境, 干净, 休闲, 公园, 空气清新, 瀑布, 水, 很漂亮","['想', '排名', '第一', '跨海大桥', '港', '珠', '澳', '大桥', '刚刚', '行程', '顺便', '珠海', '日月', '贝', '贝壳', '形式', '歌剧院', '别具特色', '特别', '适合', '文青', '拍照', '一日游', '紧凑', '行程', '舒适', '特别', '适合', '周末', '散心', '放空', '自我', '坐', '邮轮', '环', '澳门', '岛游', '澳门', '风景', '尽收眼底', '谢导', '超级', '耐心', '尽责']",卫生,18,4.0,42447,5
A18,2020-08-25,客服回信息快，有礼貌。船票比码头卖的便宜，取票也方便，好评！起初原本担心船会颠，会晕船，结果不会，挺稳挺干净的。珠海除了空气好，夜景也很好看，而且能离得很近地看澳门，体验很好,6.0,0.2782000005245209,"上山, 广东, 导游, 山顶, 时, 走, 到达, 两个, 下午, 坐","['客服', '回', '信息', '礼貌', '船票', '码头', '卖', '便宜', '好评', '原本', '担心', '船会', '颠', '晕船', '稳挺', '干净', '珠海', '空气', '夜景', '好看', '近地', '澳门', '体验']",服务,18,1.0,42448,2
A18,2020-12-23,车上丢了手链，没心情。感觉珠海很套路。不是这样就是那样,10.0,0.4582000076770782,"喜欢, 下次, 漂亮, 朋友, 值得, 去过, 机会, 字, 开心, 风景优美","['车上', '丢', '手链', '心情', '感觉', '珠海', '套路']",位置,18,1.5,42449,3
A18,2020-02-13,因为之前如果**，所以很好奇苏果**没被毁了是什么样子大概看到两处欧式建筑能联想到那些残骸不过协和**整体布局有点乱，里面有很多儿童游乐设施…更像个公园吧好在门票不要钱，于是就很有性价比了,9.0,0.214599996805191,"山, 爬山, 好多, 希望, 太, 美的, 钱, 水, 骑, 活动","['好奇', '苏果', '毁', '样子', '两处', '欧式建筑', '联想', '残骸', '协和', '整体', '布局', '乱', '儿童', '游乐', '设施', '公园', '钱', '性价比']",设施,18,0.0,42450,1
A18,2020-06-08,还不错的团，性价比不错，游玩起来也不累，导游也不错,3.0,0.215499997138977,"走, 高, 性价比, 免费, 太, 坐, 建议, 观音, 开车, 感觉","['团', '性价比', '不累', '导游']",性价比,18,1.5,42451,3
A18,2020-07-08,虽然珠海经常去，但是每次在珠海好像都是匆匆一别，要么就是经过珠海去澳门，要么就是去珠海出差，一下就回去，好像从来没有在这座美丽的城市逗留太久，这次趁着过来珠海工作谈业务，就顺便到这边的**看一下。**在小时候的时候看电视广告就已经知道有这个地方，那时候对这个地方的了解并不是特别多，后来才知道，原来是按照1:1的比例还原北京**。刚好上年年底去了**看了一下，这就过来这个还原的看一下吧！（坐标）这个地方在珠海，不算是在市中心，不过，随着这边的发展，其实这里也是挺发达的，开车过来挺方便的，九州大道附近。（环境）去过北京**的，都知道**的是非常的大，这边1比1还原的也真的是超大的。而且每个区域都是按照那边去做，所以这边还能够更好地还原，不过，气候上面的话就特别的热，差点那天就把我晒死，体感温度至少有40度，基本上看着天空都可以晕倒。（遗址区）最吸引我的当然就是遗址区域的还原，大水法，十二生肖，还有香妃楼…虽然建筑物没有原物精致，这其实远观还是可以的。如果要把整个**都走完的话，大概也是需要4到5个小时，所以基本上就走马观花看了一个多小时就走了，因为实在是太热了。（配套）这里是免费的，这么大的工程，居然是完全免费，觉得有点惊讶，虽然有很多的商业设施，但是这边既然是免费的，肯定就会有这样子的情况，而且的话，丰俭由人。下次过来一定要冬天才可以，这夏天实在是太热了。,3.0,0.218199998140335,"走, 高, 性价比, 免费, 太, 坐, 建议, 观音, 开车, 感觉","['珠海', '每次', '珠海', '好像', '珠海', '澳门', '珠海', '出差', '回去', '好像', '座', '美丽', '城市', '逗留', '太久', '珠海', '工作', '谈', '业务', '顺便', '小时候', '电视广告', '特别', '比例', '还原', '北京', '上年', '年底', '还原', '坐标', '珠海', '不算', '市中心', '发展', '发达', '开车', '九州', '大道', '环境', '去过', '北京', '还原', '真的', '超大', '区域', '做', '更好', '还原', '气候', '特别', '热', '差点', '那天', '晒', '死', '体感', '温度', '至少', '度', '看着', '天空', '晕倒', '遗址', '区', '吸引', '遗址', '区域', '还原', '大水法', '十二生肖', '香妃', '楼', '建筑物', '原物', '精致', '远观', '走', '走马观花', '一个多', '走', '实在', '太', '热', '配套', '免费', '工程', '完全免费', '惊讶', '商业', '设施', '免费', '肯定', '样子', '情况', '丰俭', '下次', '冬天', '夏天', '实在', '太', '热']",性价比,18,11.0,42452,5
A18,2020-05-14,**是珠海的一个旅游景区，门票是免费的。也是各个旅行社带游客过来玩的打卡之地。到珠海，这个是必去的地方。不过，总体而言，可玩性不是很强。,3.0,0.3614000082015991,"走, 高, 性价比, 免费, 太, 坐, 建议, 观音, 开车, 感觉","['珠海', '免费', '旅行社', '游客', '打卡', '珠海', '总体而言', '可玩性', '强']",性价比,18,1.0,42453,2
A18,2020-05-06,很愉快的体验，导游很热心很照顾大家。风景也很好，主要是不用通行证就能满足看港珠澳大桥的想法，真的很方便。,0.0,0.1503999978303909,"值得, 适合, 环境, 干净, 休闲, 公园, 空气清新, 瀑布, 水, 很漂亮","['愉快', '体验', '导游', '热心', '照顾', '风景', '不用', '通行证', '港', '珠', '澳', '大桥', '想法', '真的']",卫生,18,2.0,42454,4
A18,2020-09-28,总体还是不错的，值得去一次旅行,5.0,0.7692000269889832,"温泉, 服务, 服务态度, 满意, 泡温泉, 热情, 家人, 工作人员, 方便快捷, 态度","['总体', '值得', '旅行']",服务,18,1.0,42455,2
A18,2020-03-18,珠海**赞夏宫精塑幸福城，浴火重生皇苑新。宝殿园林炫珠海，圆明雅典ㄐ麓骸Ｎ餮舐ャ诠坼远，正大光明福海清。春夏秋冬四园美，中西合璧万花馨。(七律),3.0,0.2614000141620636,"走, 高, 性价比, 免费, 太, 坐, 建议, 观音, 开车, 感觉","['珠海', '赞夏宫', '精塑', '幸福', '城', '浴火重生', '皇苑', '新', '宝殿', '园林', '炫', '珠海', '圆明', '雅典', '', '新春', '西洋楼', '阙', '观', '瀛', '远', '正大光明', '福海', '清', '春夏秋冬', '四园', '美', '中西合璧', '万花馨', '七律']",性价比,18,1.0,42456,2
A18,2020-06-13,非常满意，体验很棒，客服耐心、专业。,5.0,0.8680999875068665,"温泉, 服务, 服务态度, 满意, 泡温泉, 热情, 家人, 工作人员, 方便快捷, 态度","['满意', '体验', '很棒', '客服', '耐心', '专业']",服务,18,2.0,42457,4
A18,2020-03-19,尽管**是一个复制品，规模也仅有原来的三分之二，但它的富丽堂皇依然可见。看着园内景色，心情难以平静。好端端的一个园区竟然被高喊“自由、民主、平等”的强盗们焚之一炬，国宝文物被宣扬“仁爱、博爱、仁慈”的信徒们掳掠一空！炎黄子孙要记住这段历史！要将强盗们钉在历史的耻辱柱上。,11.0,0.3711999952793121,"景色, 美, 感觉, 山上, 值得, 中, 优美, 拍, 交通, 少","['复制品', '规模', '三分之二', '富丽堂皇', '依然', '看着', '园内', '景色', '心情', '难以', '平静', '好端端', '园区', '高喊', '自由', '民主', '平等', '强盗', '焚', '炬', '国宝', '文物', '宣扬', '仁爱', '博爱', '仁慈', '信徒', '掳掠', '空', '炎黄子孙', '记住', '段', '历史', '强盗', '钉', '历史', '耻辱柱']",位置,18,3.0,42458,5
A18,2020-05-06,导游特别负责，整个旅途特别愉快。这个价格简直就是超值！ 一天的行程下来超乎我的预期，真心推荐。 行程安排跟导游服务值得点赞！,5.0,0.3416000008583069,"温泉, 服务, 服务态度, 满意, 泡温泉, 热情, 家人, 工作人员, 方便快捷, 态度","['导游', '特别', '负责', '旅途', '特别', '愉快', '价格', '超值', '行程', '超乎', '预期', '真心', '推荐', '行程', '安排', '导游', '服务', '值得', '赞']",服务,18,6.0,42459,5
A18,2020-07-09,过来这边看了一下环境还算可以的，而且最好的地方就是完全免费的，还原度还是可以的，起码地方真的很大，人不算多，旅游团也有，蓝天白云下，感受远方宫廷。,7.0,0.6098999977111816,"环境, 贵, 很好, 没什么, 吃, 东西, 太, 差, 感觉, 风景","['环境', '算', '完全免费', '还原', '度', '起码', '真的', '很大', '不算', '旅游团', '蓝天白云', '感受', '远方', '宫廷']",性价比,18,1.5,42460,3
A18,2020-09-15,**是珠海的一个著名景点，第二次来**了，上次来门票要100元，这次是免费入园，那天来游览的游客挺多的**是以北京**为原稿，按1：1比十景中的十八景修建而成，大殿“正大光明”、“九州清晏”、“蓬岛瑶台”、“方壶胜景”组成中轴线为皇家宫殿式建筑群**的长城是按一比二的比例仿北京古长城而建，起点为南海雄关，终点至郭超山顶，沿途设有众多烽火台供游客观赏珠海全景及澳门景观，交通方便，很多路公交车经过这里，很方便，值得一游,3.0,0.3274999856948852,"走, 高, 性价比, 免费, 太, 坐, 建议, 观音, 开车, 感觉","['珠海', '著名景点', '第二次', '上次', '免费', '入园', '那天', '游览', '游客', '北京', '原稿', '十景', '中', '十八', '修建', '成', '大殿', '正大光明', '九州', '清晏', '蓬岛瑶', '台', '方壶', '胜景', '中轴线', '皇家', '宫殿式', '建筑群', '长城', '一比', '比例', '仿', '北京', '古长城', '建', '起点', '南海', '雄关', '终点', '郭超', '山顶', '沿途', '设有', '众多', '烽火台', '供', '游客', '观赏', '珠海', '全景', '澳门', '景观', '交通', '路', '公交车', '值得']",性价比,18,2.0,42461,4
A18,2020-05-13,"珠海只呆了一天，所以搜了下，去了**和珠海渔女两个景点。**免门票，不过因为前两天在澳门暴走人比较累；所以就坐了电瓶车，因为人少所以等于这辆车就包给我们了,到了一个景点放我们下去几分钟拍拍照，还挺不错哒。",11.0,0.2487999945878982,"景色, 美, 感觉, 山上, 值得, 中, 优美, 拍, 交通, 少","['珠海', '呆', '搜', '珠海', '渔女', '两个', '免', '前两天', '澳门', '暴走', '累', '坐', '电瓶车', '少', '等于', '这辆', '车', '包给', '放', '几分钟', '拍拍', '挺不错', '哒']",位置,18,1.5,42462,3
A18,2020-03-11,值得一去，门票免费，总体还可以，没什么惊喜的地方，有时间可以去爬一下**里的长城锻炼下身体，今天去的时候有部分区域在装修。,0.0,0.3840999901294708,"值得, 适合, 环境, 干净, 休闲, 公园, 空气清新, 瀑布, 水, 很漂亮","['值得', '免费', '总体', '没什么', '惊喜', '爬', '长城', '锻炼', '身体', '区域', '装修']",卫生,18,4.0,42463,5
A18,2020-01-01,2020年1月1日元旦第一次来珠海。行程安排途有变动，时间有一点赶。,6.0,0.2958000004291534,"上山, 广东, 导游, 山顶, 时, 走, 到达, 两个, 下午, 坐","['年月日', '元旦', '第一次', '珠海', '行程', '安排', '途', '变动', '一点']",服务,18,-1.0,42464,1
A18,2020-12-26,玩得开心，饭菜不错，值得推荐,0.0,0.3079999983310699,"值得, 适合, 环境, 干净, 休闲, 公园, 空气清新, 瀑布, 水, 很漂亮","['开心', '饭菜', '值得', '推荐']",卫生,18,3.0,42465,5
A18,2020-06-08,珠海**依山伴水，是按照**的原建筑，以1:1比例仿建的部分建筑，配上周边的自然风景，景色还不错，免门票参观，许多人都来此拍照。,1.0,0.225500002503395,"风景, 表演, 值得, 一般般, 位于, 晚上, 好看, 建筑, 美丽, 大自然","['珠海', '依山', '伴水', '原', '建筑', '比例', '仿建', '建筑', '配', '周边', '自然风景', '景色', '免', '参观', '拍照']",服务,18,1.5,42466,3
A18,2020-02-06,樱花园不要去玩，最多三四百平方左右，在周边摆了一些花供大家观赏，还收费32元真不值得去看，另外在**里也没有标识不好找到此位置！,7.0,0.2032999992370605,"环境, 贵, 很好, 没什么, 吃, 东西, 太, 差, 感觉, 风景","['樱花园', '三四百', '平方', '周边', '摆', '花供', '观赏', '收费', '真不', '值得', '标识', '不好', '找到', '位置']",性价比,18,0.0,42467,1
A18,2020-06-06,这里主要是仿建的**部分景点，九洲盛宴、正大光明、西洋楼、福海基本上代表了最有名气的景点，内部还按照原有的陈设进行了复原，免门票参观，感兴趣的话可以去看看。,3.0,0.3461999893188476,"走, 高, 性价比, 免费, 太, 坐, 建议, 观音, 开车, 感觉","['仿建', '九洲', '盛宴', '正大光明', '西洋楼', '福海', '代表', '有名气', '内部', '原有', '陈设', '复原', '免', '参观', '感兴趣']",性价比,18,1.5,42468,3
A18,2020-06-05,这里是1:1仿造**主要景点进行的仿古建筑，再现了**的辉煌盛景，配上周边山体自然环境，景色还不错，免门票参观，性价比还不错。,3.0,0.4357999861240387,"走, 高, 性价比, 免费, 太, 坐, 建议, 观音, 开车, 感觉","['仿造', '仿古', '建筑', '再现', '辉煌', '盛景', '配', '周边', '山体', '自然环境', '景色', '免', '参观', '性价比']",性价比,18,0.0,42469,1
A18,2020-11-11,和家人畅游半天，水上游玩可以，入园宫建也可以,5.0,0.4133999943733215,"温泉, 服务, 服务态度, 满意, 泡温泉, 热情, 家人, 工作人员, 方便快捷, 态度","['家人', '畅游', '半天', '水上', '入园宫建']",服务,18,1.5,42470,3
A18,2020-07-29,免费，里面有个小湖，还有水上乐园。坐缆车可以上山观景。里面树很多，比较凉快。有可以坐的带空调的甜品店，可以点个冰点休息一下。,3.0,0.2612000107765198,"走, 高, 性价比, 免费, 太, 坐, 建议, 观音, 开车, 感觉","['免费', '有个', '小湖', '水上', '乐园', '坐', '缆车', '上山', '观景', '树', '凉快', '坐', '空调', '甜品店', '冰点', '休息']",性价比,18,4.0,42471,5
A18,2020-06-24,此行程非常棒，玩的好，吃的也好。我们全车游客对谢导无不称赞。开车的师傅也棒。,6.0,0.5612000226974487,"上山, 广东, 导游, 山顶, 时, 走, 到达, 两个, 下午, 坐","['行程', '棒', '吃', '全', '车', '游客', '谢导', '无不', '称赞', '开车', '师傅', '棒']",服务,18,1.0,42472,2
A18,2020-06-02,是一处按照1:1的比例仿建的圆明新圆，是当地利用天然的山势，选取**比较有代表性的建筑而建，总体来说景色一般，但是在这里拍照还不错。,11.0,0.4327999949455261,"景色, 美, 感觉, 山上, 值得, 中, 优美, 拍, 交通, 少","['一处', '比例', '仿建', '圆明', '新圆', '利用', '天然', '山势', '选取', '代表性', '建筑', '建', '总体', '景色', '拍照']",位置,18,0.0,42473,1
A18,2020-10-28,超值，港珠澳大桥非常壮观。,11.0,0.2694000005722046,"景色, 美, 感觉, 山上, 值得, 中, 优美, 拍, 交通, 少","['超值', '港', '珠', '澳', '大桥', '壮观']",位置,18,1.0,42474,2
A18,2020-06-04,导游服务很热情，讲解到位，行程安排很合理，带家人来玩，大家都也很开心，还看到了港珠澳大桥，风景很美，下次再和家人来体验这美景,5.0,0.4115999937057495,"温泉, 服务, 服务态度, 满意, 泡温泉, 热情, 家人, 工作人员, 方便快捷, 态度","['导游', '服务', '热情', '讲解', '到位', '行程', '安排', '家人', '开心', '港', '珠', '澳', '大桥', '风景', '美', '下次', '家人', '体验', '美景']",服务,18,2.0,42475,4
A18,2020-11-09,旅程比较开心，导游特别负责，认真带队为我们讲解各个景点,6.0,0.4824000000953674,"上山, 广东, 导游, 山顶, 时, 走, 到达, 两个, 下午, 坐","['旅程', '开心', '导游', '特别', '负责', '带队', '讲解']",服务,18,3.0,42476,5
