A18,2017-11-20,公园挺大，小桥流水，长廊荷塘，最大的亮点就是看大型表演秀。古装剧如康熙王朝等，气势磅礴。值得一看,0.0,0.2768000066280365,"值得, 适合, 环境, 干净, 休闲, 公园, 空气清新, 瀑布, 水, 很漂亮","['公园', '小桥流水', '长廊', '荷塘', '亮点', '大型', '表演', '秀', '古装剧', '康熙', '王朝', '气势磅礴', '值得一看']",卫生,18,1.5,42631,3
A18,2016-10-23,**是珠海的必去的景区，进去不用门票，值得一赞。园内确是风景秀丽，沿着中门的湖环绕一周也要花一个多小时。但建筑物已开始老化，有点残旧。另外就是标示不够，也没有对各景点的简介，游客也只能一知半解。,3.0,0.380400002002716,"走, 高, 性价比, 免费, 太, 坐, 建议, 观音, 开车, 感觉","['珠海', '的必', '不用', '值得', '赞', '园内', '确', '风景秀丽', '中门', '湖', '环绕', '一周', '花', '一个多', '建筑物', '老化', '残旧', '标示', '简介', '游客', '只能', '一知半解']",性价比,18,1.0,42632,2
A18,2017-05-06,很漂亮，进来了就觉得特别舒服。坐在小廊下，凉风习习，夏天来这里就是最好的。,2.0,0.4478000104427337,"好玩, 开心, 太, 天气, 项目, 特别, 舒服, 夏天, 热, 风景","['很漂亮', '特别', '舒服', '坐在', '小廊', '凉风习习', '夏天']",设施,18,2.0,42633,4
A18,2017-06-17,和北京**是一比一的，但是感觉面积有点小一样，里面景色物色也比不上北京的**，玩的项目也比较少了，大部分看景物的去还是不错,12.0,0.3802999854087829,"动物, 爬, 岛, 沙滩, 天然, 氧吧, 表演, 广州, 动物园, 种类","['北京', '一比', '感觉', '面积', '景色', '物色', '比不上', '北京', '项目', '少', '大部分', '景物']",设施,18,1.5,42634,3
A18,2016-11-06,不大地方，大的景点都有，弄了一群小买卖里面，.照相什么的，乱哄哄的。湖边坐一下还是可以的。.旁边观景台可以坐缆车可以爬山，上去了也只能看一下，什么都没有。,3.0,0.5429999828338623,"走, 高, 性价比, 免费, 太, 坐, 建议, 观音, 开车, 感觉","['弄', '一群', '小买卖', '照相', '乱哄哄', '湖边', '坐', '旁边', '观景台', '坐', '缆车', '爬山', '只能']",性价比,18,-1.0,42635,1
A18,2016-05-29,**不用门票，里面有一些项目设施需要收费，价格不会很高，挺实惠的。最有趣的是要数索道缆车和湖上泛舟了，凉风习习，都是很舒服的，很适合周末去放松心情。同时这里古典气息浓重，很适合爱好古典文学者。很想看看那个大型舞台剧，可惜是晚上才播放，由于个人原因只能下次再去观赏了，听说很震撼哦！,0.0,0.3673000037670135,"值得, 适合, 环境, 干净, 休闲, 公园, 空气清新, 瀑布, 水, 很漂亮","['不用', '项目', '设施', '收费', '价格', '高', '实惠', '有趣', '要数', '索道', '缆车', '湖上', '泛舟', '凉风习习', '舒服', '适合', '周末', '放松', '心情', '古典', '气息', '浓重', '适合', '爱好', '古典文学', '想', '大型', '舞台剧', '可惜', '晚上', '播放', '原因', '只能', '下次', '观赏', '听说', '震撼']",卫生,18,5.0,42636,5
A18,2017-01-22,不要门票，里面一些项目要收费，你可以选择不玩。公园不大但是景色别致，值得一去。,0.0,0.4930999875068664,"值得, 适合, 环境, 干净, 休闲, 公园, 空气清新, 瀑布, 水, 很漂亮","['项目', '收费', '选择', '公园', '景色', '别致', '值得']",卫生,18,2.0,42637,4
A18,2017-07-22,**于公元1997年2月2日正式建成并对外开放，它坐落于珠海九州大道石林山下，占地面积为1.39平方公里，以北京**为原稿，按1:1比例精选**四十景中的十八景修建而成，投资6亿元人民币，是中国首批AAAA级景区之一。**融古典皇家建筑群、江南古典园林建筑群和西洋建筑群为一体，为游客再现**。**融古典皇家建筑群、江南古典园林建之幻境，将一座座仙山琼阁散落于福海周围，按徐福海中求之寓意，把东湖命名为福海。它是当年皇帝及后妃们游湖、观龙舟、观烟火的好去处。是**中水上活动的中心。**的福海把这一景象再现，加上帝后们的龙舟巡游表演。,0.0,0.4287999868392944,"值得, 适合, 环境, 干净, 休闲, 公园, 空气清新, 瀑布, 水, 很漂亮","['公元', '年月日', '正式', '建成', '对外开放', '坐落于', '珠海', '九州', '大道', '石林', '山下', '占地面积', '平方公里', '北京', '原稿', '比例', '精选', '四十', '中', '十八', '修建', '成', '投资', '亿元', '人民币', '中国', '首批', '级', '融', '古典', '皇家', '建筑群', '江南', '古典', '园林', '建筑群', '西洋', '建筑群', '一体', '游客', '再现', '融', '古典', '皇家', '建筑群', '江南', '古典', '园林', '建', '幻境', '一座座', '仙山琼阁', '散落', '福海', '徐福', '海中', '求', '寓意', '东湖', '命名', '福海', '当年', '皇帝', '后妃', '游湖', '观', '龙舟', '观', '烟火', '好去处', '中', '水上', '活动', '中心', '福海', '景象', '再现', '帝', '后们', '龙舟', '巡游', '表演']",卫生,18,6.0,42638,5
A18,2017-10-28,按1：1比例精选**四十景中的十八景修建而成，据说投资6亿元人民币，是我国首批4A级景区之一。没有门票，可以一去。2-3个小时可以走完，是市民休闲娱乐的场所，交通便利。,0.0,0.2831999957561493,"值得, 适合, 环境, 干净, 休闲, 公园, 空气清新, 瀑布, 水, 很漂亮","['比例', '精选', '四十', '中', '十八', '修建', '成', '投资', '亿元', '人民币', '我国', '首批', '级', '走', '市民', '休闲', '娱乐', '场所', '交通', '便利']",卫生,18,3.0,42639,5
A18,2016-12-01,必去地方之一，有很强的历史感官，旁边有古玩街，喜欢请来这里。,12.0,0.7692999839782715,"动物, 爬, 岛, 沙滩, 天然, 氧吧, 表演, 广州, 动物园, 种类","['很强', '历史', '感官', '旁边', '古玩', '街', '喜欢', '请来']",设施,18,1.0,42640,2
A18,2016-09-22,我是看了珠海景点介绍决定我们将**作为出行的第一站，珠海旅行的体会是交通实在太方便了，去哪里都可以做公交车，而且票价不贵（空调车2元，非空调车1.5元），**是免费公园，本以为里面不是很大，谁知道我们边走边看也需要2个小时哦。早上会有一些团队去那儿，但是人真是不多的，去的当天正好有百姓演出，我们看了20多分钟，表演节目的大多是上了年纪的老人，有歌舞和乐器演奏真的很不错。这家公园主要就是仿造**的建筑做的，由于当日天气特别好，所以照出来的相片也很美。再有进门有个仿制**的“福海”，那儿有渡船可以到小岛，工作人员会说票价打五折，（原价50元折后25元），建议大家不要去做哦，感觉不是很值哦！去这家公园就是走走看看，让我们仿佛回到了了清朝，呵呵！,3.0,0.4460000097751617,"走, 高, 性价比, 免费, 太, 坐, 建议, 观音, 开车, 感觉","['珠海', '介绍', '出行', '第一站', '珠海', '旅行', '体会', '交通', '实在', '太', '做', '公交车', '票价', '贵', '空调车', '非', '空调车', '免费', '公园', '很大', '边走边看', '早上', '团队', '不多', '当天', '正好', '百姓', '演出', '多分钟', '表演', '节目', '年纪', '歌舞', '乐器', '演奏', '真的', '这家', '公园', '仿造', '建筑', '做', '当日', '天气', '特别', '照出来', '相片', '很美', '进门', '有个', '仿制', '福海', '渡船', '小岛', '工作人员', '票价', '五折', '原价', '折', '后元', '建议', '做', '感觉', '值', '这家', '公园', '走走看看', '仿佛', '回到', '清朝']",性价比,18,1.0,42641,2
A18,2016-12-11,还是很值得一去的，尤其是坐缆车登顶一览全景，遥望澳门。园子里修建的很多亭台楼阁，拍照很美，也不似其他热门景区人山人海，适合休闲散心慢慢发呆,11.0,0.3754999935626983,"景色, 美, 感觉, 山上, 值得, 中, 优美, 拍, 交通, 少","['值得', '一去', '坐', '缆车', '登顶', '一览', '全景', '遥望', '澳门', '园子', '修建', '亭台楼阁', '拍照', '美', '不似', '热门', '人山人海', '适合', '休闲', '散心', '慢慢', '发呆']",位置,18,2.0,42642,4
A18,2017-03-13,以前的**是个收费的主题公园，广告打得很响，很多人慕名而来。但自从被政府对公众免费游览之后，就基本没什么消息了。这里现在是每个到珠海旅游的旅行团必去之地，但这里却跟很多政府将收费改为免费开放的公园一样，有种败落的感觉，这里只能说是个修建了一些仿古建筑的公园了，如果闲得慌可以来走走，没必要专门来一趟。,3.0,0.3761999905109405,"走, 高, 性价比, 免费, 太, 坐, 建议, 观音, 开车, 感觉","['收费', '主题公园', '广告', '响', '慕名而来', '政府', '公众', '免费', '游览', '没什么', '消息', '珠海', '旅行团', '政府', '收费', '改为', '免费', '开放', '公园', '有种', '败落', '感觉', '只能', '修建', '仿古', '建筑', '公园', '闲', '慌', '走走', '一趟']",性价比,18,2.0,42643,4
A18,2016-08-25,**，顾名思义就是仿**而建造的，虽然是免费景点，但是里面有很多坑人的收费项目，大家要小心，各种各样的生意都有，满满的都是套路，让人感觉厌恶，但是**的风景还是不错的，亭台楼阁，小桥流水，鸟语花香，景色宜人，是个休闲的好地方。,3.0,0.2542999982833862,"走, 高, 性价比, 免费, 太, 坐, 建议, 观音, 开车, 感觉","['顾名思义', '仿', '建造', '免费', '坑人', '收费', '项目', '小心', '各种各样', '生意', '满满的', '套路', '感觉', '厌恶', '风景', '亭台楼阁', '小桥流水', '鸟语花香', '景色宜人', '休闲']",性价比,18,1.0,42644,2
A18,2017-05-16,去的时候有点晚下午五点才到那，跟好友逛了两个多小时绕着湖走了一圈，风景不错，空气也不错，看了看深宫后院，虽然下着雨还是很开心的，拍了一些美美哒照片。,6.0,0.2574000060558319,"上山, 广东, 导游, 山顶, 时, 走, 到达, 两个, 下午, 坐","['晚', '下午', '五点', '好友', '逛', '两个', '绕', '湖', '走', '一圈', '风景', '空气', '深宫', '后院', '下着雨', '开心', '拍', '美美', '哒', '照片']",服务,18,1.0,42645,2
A18,2017-04-28,**地方不大，去了**就想着得去故宫，这种古代气息的地方很吸引我,9.0,0.4153999984264374,"山, 爬山, 好多, 希望, 太, 美的, 钱, 水, 骑, 活动","['想着', '得去', '故宫', '古代', '气息', '吸引']",设施,18,1.0,42646,2
A18,2016-07-06,据说以前这边要收费，现在完全免费。景点周围公交车多，很方便。景区内青山绿水，水榭楼阁，有几分江南的味道。加上当天天气给力，风景更是胜似天堂。赞!,2.0,0.4395000040531158,"好玩, 开心, 太, 天气, 项目, 特别, 舒服, 夏天, 热, 风景","['收费', '完全免费', '公交车', '青山绿水', '水榭', '楼阁', '几分', '江南', '味道', '当天', '天气', '力', '风景', '更是', '胜似', '天堂', '赞']",设施,18,1.0,42647,2
A18,2017-06-10,**仿照北京的**修建，如果没有去过北京的话，在广东想近一点看看北京**的结构可以去一下珠海的**，那里除了仿**的建筑外，里面还有个水上乐园，适合夏天一家人在那儿游玩，不过那个水上乐园也收费，大概是50元一个人，性价比跟乐趣就由你们来评判吧,12.0,0.3397000133991241,"动物, 爬, 岛, 沙滩, 天然, 氧吧, 表演, 广州, 动物园, 种类","['仿照', '北京', '修建', '去过', '北京', '广东', '想近', '一点', '北京', '结构', '珠海', '仿', '建筑', '外', '水上', '乐园', '适合', '夏天', '水上', '乐园', '收费', '性价比', '乐趣', '评判']",设施,18,4.0,42648,5
A18,2017-09-06,费尽千辛万苦来了。通知因台风停业。,8.0,0.3589999973773956,"空气, 设施, 可惜, 完善, 还行, 游乐, 有意思, 老板, 负离子, 商业","['费尽', '千辛万苦', '通知', '台风', '停业']",设施,18,0.0,42649,1
A18,2016-08-23,在拱北坐1号可以去到门口。里面有个海底世界40块，比较坑。推荐由古玩城进去，顺路买包5块的鱼料，在水边喂锦鲤，爽。一直走，在剧场那边可以坐缆车上山顶，景色很好，来张全景棒极了。整个**可以逛大半天的呢。,3.0,0.3585000038146972,"走, 高, 性价比, 免费, 太, 坐, 建议, 观音, 开车, 感觉","['拱北', '坐号', '门口', '有个', '海底', '世界', '块', '坑', '推荐', '古玩城', '顺路', '包块', '鱼料', '水边', '锦鲤', '爽', '走', '剧场', '坐', '缆车', '山顶', '景色', '张全景', '棒极了', '逛', '大半天']",性价比,18,1.0,42650,2
A18,2017-02-28,**于公元1997年2月2日正式建成并对外开放，它坐落于珠海九洲大道石林山下，占地面积为1.39平方公里，以北京**为原稿，按1：1比例精选**四十景中的十八景修建而成，投资6亿元人民币，是中国首批AAAA级景区之一。**融古典皇家建筑群、江南古典园林建筑群和西洋建筑群为一体，为游客再现**。**融古典皇家建筑群、江南古典园林建之幻境，将一座座仙山琼阁散落于福海周围，按“徐福海中求”之寓意，把东湖命名为福海。它是当年皇帝及后妃们游湖、观龙舟、观烟火的好去处。是**中水上活动的中心。**的福海把这一景象再现，加上帝后们的龙舟巡游表演。,0.0,0.4287999868392944,"值得, 适合, 环境, 干净, 休闲, 公园, 空气清新, 瀑布, 水, 很漂亮","['公元', '年月日', '正式', '建成', '对外开放', '坐落于', '珠海', '九洲', '大道', '石林', '山下', '占地面积', '平方公里', '北京', '原稿', '比例', '精选', '四十', '中', '十八', '修建', '成', '投资', '亿元', '人民币', '中国', '首批', '级', '融', '古典', '皇家', '建筑群', '江南', '古典', '园林', '建筑群', '西洋', '建筑群', '一体', '游客', '再现', '融', '古典', '皇家', '建筑群', '江南', '古典', '园林', '建', '幻境', '一座座', '仙山琼阁', '散落', '福海', '徐福', '海中', '求', '寓意', '东湖', '命名', '福海', '当年', '皇帝', '后妃', '游湖', '观', '龙舟', '观', '烟火', '好去处', '中', '水上', '活动', '中心', '福海', '景象', '再现', '帝', '后们', '龙舟', '巡游', '表演']",卫生,18,6.0,42651,5
A18,2016-06-11,此园免费，游玩还可以的吧，去的这天下雨，粗略的走了一圈，人不多，商业气息太浓了，这是国内所有景区的通病，湖景还可以，还原的建筑也还好。,3.0,0.3512000143527984,"走, 高, 性价比, 免费, 太, 坐, 建议, 观音, 开车, 感觉","['园', '免费', '这天', '下雨', '粗略', '走', '一圈', '人不多', '商业', '气息', '太', '浓', '国内', '通病', '湖景', '还原', '建筑', '还好']",性价比,18,1.0,42652,2
A18,2017-04-11,来的人不多，，对比起广州哪都人多来说，这是个不错的公园。但是没什么特色，交通方便。珠海站下车就直接有1路车可以到。容易找到,0.0,0.4090999960899353,"值得, 适合, 环境, 干净, 休闲, 公园, 空气清新, 瀑布, 水, 很漂亮","['广州', '公园', '没什么', '特色', '交通', '珠海站', '下车', '路车', '找到']",卫生,18,1.0,42653,2
A18,2017-02-08,因为是免费门票，还是可以去的，只是开了这些建筑，可是都不开门，无法进去。而且好奇怪我都找不到西洋建筑，感觉地方有点小，环境一般般。里面的标识不清楚，比如洗手间走上楼梯就有了，可是那个牌没写。反正去了一次就不会再去了,6.0,0.2913999855518341,"上山, 广东, 导游, 山顶, 时, 走, 到达, 两个, 下午, 坐","['免费', '开', '建筑', '开门', '奇怪', '找', '不到', '西洋', '建筑', '感觉', '环境', '一般般', '标识', '洗手间', '走上', '楼梯', '牌', '没写', '反正']",服务,18,-1.0,42654,1
A18,2016-09-15,景点免费，里面好多儿童娱乐设施，累了坐下来玩玩手机挺不错。,9.0,0.4921999871730804,"山, 爬山, 好多, 希望, 太, 美的, 钱, 水, 骑, 活动","['免费', '好多', '儿童', '娱乐', '设施', '累', '坐下', '玩玩', '手机', '挺不错']",设施,18,2.0,42655,4
A18,2016-03-11,下午游览珠海市仿建的园明新园，虽说是仿建的，但也是耗资巨大，值得一看的景点，白天是免费参观的，园明新园建筑恢宏，气势磅礴，仿建的都这样宏伟，真品应该是何等壮观，遗憾的是园明园中的西洋楼被圈起来改建成冰上滑梯，收费进入，40元一张门票，真是暴殄天物呀，我只在外面围观了一下下，没有进入。值得庆幸的是正值**牡丹花展，御花园满园的牡丹花开的正盛，还有少量的山茶花，本来还想着有一天要去洛阳看牡丹，没想到在**一睹这万花之主的风采,9.0,0.2318000048398971,"山, 爬山, 好多, 希望, 太, 美的, 钱, 水, 骑, 活动","['下午', '游览', '珠海市', '仿建', '园明', '新园', '仿建', '耗资', '值得一看', '白天', '免费参观', '园明', '新园', '建筑', '恢宏', '气势磅礴', '仿建', '宏伟', '真品', '何等', '壮观', '遗憾', '园明', '园中', '西洋楼', '圈起来', '改建', '成', '冰上', '滑梯', '收费', '一张', '暴殄天物', '外面', '围观', '一下下', '值得', '庆幸', '牡丹花', '展', '御花园', '满园', '牡丹花', '开', '正盛', '少量', '山茶花', '本来', '想着', '洛阳', '牡丹', '没想到', '一睹', '万花之主', '风采']",设施,18,2.0,42656,4
A18,2017-02-06,珠海**――西洋楼景区的“大水法”与十二生肖还是挺有看头的！基本能重现昔日风貌，可惜没有保持喷水而已！当然为省维护费啦！毕竟免费嘛！**是珠海曾几何时的热门旅游地！如今已成为免费公园，还好！幸亏风景还是挺优美的！否则谁会来？！,3.0,0.311599999666214,"走, 高, 性价比, 免费, 太, 坐, 建议, 观音, 开车, 感觉","['珠海', '西洋楼', '大水法', '十二生肖', '看头', '重现', '昔日', '风貌', '可惜', '喷水', '省', '维护费', '免费', '珠海', '曾几何时', '热门', '免费', '公园', '还好', '幸亏', '风景', '优美']",性价比,18,2.0,42657,4
A18,2016-08-05,大概因为期望太高，去了有点失望，感觉整个商业气息太浓，就是个游乐园，仿**建筑感觉很粗糙，想要感受**历史的还是建议去北京吧，这里只适合游乐，小孩子会比较喜欢,0.0,0.2984000146389007,"值得, 适合, 环境, 干净, 休闲, 公园, 空气清新, 瀑布, 水, 很漂亮","['期望', '太', '高', '失望', '感觉', '商业', '气息', '太', '浓', '游乐园', '仿', '建筑', '感觉', '粗糙', '想要', '感受', '历史', '建议', '北京', '适合', '游乐', '喜欢']",卫生,18,1.0,42658,2
A18,2017-02-03,无需门票，个人感觉这并不是好事，里面为了赚钱搞了很多游乐，关键的建筑维护保养不够，很可惜。有体力不赶时间的话电瓶车建议不坐，说是可以随下随上，但只限单向一圈。不要门票自己走走逛逛拍拍照还是不错的,3.0,0.3896999955177307,"走, 高, 性价比, 免费, 太, 坐, 建议, 观音, 开车, 感觉","['无需', '个人感觉', '好事', '赚钱', '搞', '游乐', '关键', '建筑维护', '保养', '可惜', '体力', '赶时间', '电瓶车', '建议', '坐', '随下', '随上', '单向', '一圈', '走走', '逛逛', '拍拍']",性价比,18,1.0,42659,2
A18,2017-11-20,演出还可以，场面挺恢宏，气势，宏大，值得看。,1.0,0.4753000140190124,"风景, 表演, 值得, 一般般, 位于, 晚上, 好看, 建筑, 美丽, 大自然","['演出', '场面', '恢宏', '气势', '宏大', '值得']",服务,18,1.0,42660,2
A18,2017-11-20,夏天休闲的好地方，有象征历史的文化,0.0,0.6154000163078308,"值得, 适合, 环境, 干净, 休闲, 公园, 空气清新, 瀑布, 水, 很漂亮","['夏天', '休闲', '象征', '历史', '文化']",卫生,18,1.5,42661,3
A18,2017-11-15,免费游玩，里面有部分收费项目。,3.0,0.7692000269889832,"走, 高, 性价比, 免费, 太, 坐, 建议, 观音, 开车, 感觉","['免费', '收费', '项目']",性价比,18,1.0,42662,2
A18,2017-06-19,没事可以去走走散散心什么的！环境一般般！,0.0,0.4153000116348266,"值得, 适合, 环境, 干净, 休闲, 公园, 空气清新, 瀑布, 水, 很漂亮","['没事', '走走', '散散心', '环境', '一般般']",卫生,18,-1.0,42663,1
A18,2017-11-14,暑假带小孩玩过，挺好的小朋友们喜欢,2.0,0.3596000075340271,"好玩, 开心, 太, 天气, 项目, 特别, 舒服, 夏天, 热, 风景","['暑假', '喜欢']",设施,18,1.0,42664,2
A18,2017-08-09,**还是值得一去的地方，这里的景点都是按1:1的比例做的，有点像去到北京的感角，孩子和我都玩的蛮开心，照了很多相片，就是进门时要她们的衣服拍照有点坑人！,0.0,0.4575999975204468,"值得, 适合, 环境, 干净, 休闲, 公园, 空气清新, 瀑布, 水, 很漂亮","['值得', '一去', '比例', '做', '有点像', '北京', '感角', '开心', '相片', '进门', '时', '衣服', '拍照', '坑人']",卫生,18,2.0,42665,4
A18,2017-11-13,北京**的缩影，直得带上老人小孩参观,8.0,0.3431999981403351,"空气, 设施, 可惜, 完善, 还行, 游乐, 有意思, 老板, 负离子, 商业","['北京', '缩影', '直', '带上', '参观']",设施,18,1.5,42666,3
A18,2017-03-12,是珠海一个非常有意思的景点，时间充裕可以来看看。尤其是没有去过北京**遗址公园的，或是对**有强烈好奇心的，可以来看看。园内景色优美，西洋景区和福海景区最佳。,11.0,0.2833000123500824,"景色, 美, 感觉, 山上, 值得, 中, 优美, 拍, 交通, 少","['珠海', '有意思', '充裕', '去过', '北京', '遗址', '公园', '好奇心', '园内', '景色', '优美', '西洋', '福海', '最佳']",位置,18,3.0,42667,5
A18,2017-10-06,就是一般的园林，没什么亮点，不建议特地去玩，边上的梦幻水城倒是值得一去,0.0,0.3984000086784363,"值得, 适合, 环境, 干净, 休闲, 公园, 空气清新, 瀑布, 水, 很漂亮","['园林', '没什么', '亮点', '建议', '特地去', '边上', '梦幻', '水城', '倒', '值得']",卫生,18,1.0,42668,2
A18,2017-11-17,没啥好看的，和公园差不多，不要门票费,0.0,0.3600000143051147,"值得, 适合, 环境, 干净, 休闲, 公园, 空气清新, 瀑布, 水, 很漂亮","['好看', '公园', '门票费']",卫生,18,1.5,42669,3
A18,2017-11-17,自己一个人去了一次，感觉一般般，没有什么可推荐的。,1.0,0.7692000269889832,"风景, 表演, 值得, 一般般, 位于, 晚上, 好看, 建筑, 美丽, 大自然","['感觉', '一般般', '推荐']",服务,18,1.0,42670,2
A18,2017-07-27,**坐落于珠海九州大道石林山下，占地面积为1.39平方公里，园内所有建筑景观均按当年北京**原建筑尺寸仿建，大殿“正大光明”、“九洲清晏”、“蓬岛瑶台”、“方壶胜景”组成中轴线为皇家宫殿式建筑群,12.0,0.2804999947547912,"动物, 爬, 岛, 沙滩, 天然, 氧吧, 表演, 广州, 动物园, 种类","['坐落于', '珠海', '九州', '大道', '石林', '山下', '占地面积', '平方公里', '园内', '建筑', '景观', '当年', '北京', '原', '建筑', '尺寸', '仿建', '大殿', '正大光明', '九洲', '清晏', '蓬岛瑶', '台', '方壶', '胜景', '中轴线', '皇家', '宫殿式', '建筑群']",设施,18,1.5,42671,3
A18,2017-10-28,非常壮观的场面，活动项目非常的多,1.0,0.4271000027656555,"风景, 表演, 值得, 一般般, 位于, 晚上, 好看, 建筑, 美丽, 大自然","['壮观', '场面', '活动', '项目']",服务,18,1.0,42672,2
A18,2017-10-25,这里很好！可以看到现场拍戏，天天都可以看到大腕明星了！下次还来。,4.0,0.2161000072956085,"便宜, 价格, 优惠, 网上, 现场, 不用, 实惠, 排队, 购票, 订","['现场', '拍戏', '天天', '大腕', '明星', '下次']",性价比,18,1.5,42673,3
