A18,2016-07-31,一般吧，一种情怀罢了，以前没有，看看了解一下,1.0,0.5385000109672546,"风景, 表演, 值得, 一般般, 位于, 晚上, 好看, 建筑, 美丽, 大自然","['一种', '情怀']",服务,18,1.5,43009,3
A18,2016-07-30,表演场地很热，演员敬业,1.0,0.512499988079071,"风景, 表演, 值得, 一般般, 位于, 晚上, 好看, 建筑, 美丽, 大自然","['表演', '场地', '热', '演员', '敬业']",服务,18,1.5,43010,3
A18,2016-05-22,一个小时多一点就走完了，感觉一般般，景色还是不错的。,11.0,0.6047999858856201,"景色, 美, 感觉, 山上, 值得, 中, 优美, 拍, 交通, 少","['多一点', '走', '感觉', '一般般', '景色']",位置,18,1.5,43011,3
A18,2016-09-17,冲那个名字就可以知道里面肯定是和之前北京的**很相象,12.0,0.4805000126361847,"动物, 爬, 岛, 沙滩, 天然, 氧吧, 表演, 广州, 动物园, 种类","['名字', '肯定', '北京', '相象']",设施,18,1.0,43012,2
A18,2016-09-18,后续增加看片软件和网站，免费共享在群里,6.0,0.5110999941825867,"上山, 广东, 导游, 山顶, 时, 走, 到达, 两个, 下午, 坐","['后续', '增加', '片', '软件', '网站', '免费', '共享', '群里']",服务,18,2.0,43013,4
A18,2016-01-17,很值得去的一个地方，景色很舒服，景点干净，人们礼貌。伫立在**跟前，除了景色，能让人心绪万千，期待着下一次的再来！,11.0,0.2687000036239624,"景色, 美, 感觉, 山上, 值得, 中, 优美, 拍, 交通, 少","['值得', '景色', '舒服', '干净', '礼貌', '伫立', '跟前', '景色', '心绪', '万千', '期待', '着下', '再来']",位置,18,4.0,43014,5
A18,2015-10-07,收费项目太多，物非所值。景区缺少特色，很多地方有类似景点。,12.0,0.2878000140190124,"动物, 爬, 岛, 沙滩, 天然, 氧吧, 表演, 广州, 动物园, 种类","['收费', '项目', '太', '物非所值', '缺少', '特色', '类似']",设施,18,0.0,43015,1
A18,2016-06-10,还原**，可以坐船游湖，特别悠闲，能幻水园就在里面，不过没带泳衣，所以没进去玩，在园里散步很悠闲,0.0,0.5026999711990356,"值得, 适合, 环境, 干净, 休闲, 公园, 空气清新, 瀑布, 水, 很漂亮","['还原', '坐船', '游湖', '特别', '悠闲', '能幻', '水园', '泳衣', '园里', '散步', '悠闲']",卫生,18,1.0,43016,2
A18,2016-07-26,表演很精彩，不错，值得去看,1.0,0.7692000269889832,"风景, 表演, 值得, 一般般, 位于, 晚上, 好看, 建筑, 美丽, 大自然","['表演', '精彩', '值得']",服务,18,1.0,43017,2
A18,2015-10-08,"**很大,但景点建筑很旧了，看得出来有些地方很破l日。",1.0,0.3718000054359436,"风景, 表演, 值得, 一般般, 位于, 晚上, 好看, 建筑, 美丽, 大自然","['很大', '建筑', '旧', '看得出来', '破', '日']",服务,18,1.5,43018,3
A18,2016-02-21,公园免费开放，很值班去欣赏，很热闹。,3.0,0.2838999927043915,"走, 高, 性价比, 免费, 太, 坐, 建议, 观音, 开车, 感觉","['公园', '免费', '开放', '值班', '欣赏', '热闹']",性价比,18,4.0,43019,5
A18,2016-01-09,晚上说实话没什么好去的，索道什么的都没玩。,7.0,0.3619000017642975,"环境, 贵, 很好, 没什么, 吃, 东西, 太, 差, 感觉, 风景","['晚上', '说实话', '没什么', '索道', '没玩']",性价比,18,1.5,43020,3
A18,2016-09-06,公园免费，景色不错，氛围与北京差距很大,0.0,0.4106000065803528,"值得, 适合, 环境, 干净, 休闲, 公园, 空气清新, 瀑布, 水, 很漂亮","['公园', '免费', '景色', '氛围', '北京', '差距', '很大']",卫生,18,1.0,43021,2
A18,2015-11-24,值得一去，环境不错，带着老妈慢慢转，一个下午很快就过去了,6.0,0.4359999895095825,"上山, 广东, 导游, 山顶, 时, 走, 到达, 两个, 下午, 坐","['值得', '环境', '老妈', '慢慢', '下午', '很快']",服务,18,1.0,43022,2
A18,2016-09-13,免费的景点，里面园林建筑还是很不错的,3.0,0.5385000109672546,"走, 高, 性价比, 免费, 太, 坐, 建议, 观音, 开车, 感觉","['免费', '园林建筑']",性价比,18,1.0,43023,2
A18,2016-09-02,里面有很多机动儿童游戏，。门票是免费的。环境不错的,10.0,0.4153999984264374,"喜欢, 下次, 漂亮, 朋友, 值得, 去过, 机会, 字, 开心, 风景优美","['机动', '儿童', '游戏', '免费', '环境']",位置,18,1.0,43024,2
A18,2016-09-02,有历史的一个圆了，走走看看聊聊，给孩子普及一些历史知识，也不错的了。,12.0,0.6154999732971191,"动物, 爬, 岛, 沙滩, 天然, 氧吧, 表演, 广州, 动物园, 种类","['历史', '圆', '走走看看', '聊聊', '普及', '历史', '知识']",设施,18,1.5,43025,3
A18,2016-06-11,免费的…商业化太严重了，维护也太差,7.0,0.5881999731063843,"环境, 贵, 很好, 没什么, 吃, 东西, 太, 差, 感觉, 风景","['免费', '商业化', '太', '维护', '太', '差']",性价比,18,1.0,43026,2
A18,2015-11-15,不要门票，乘车方便休闲，娱乐好去处，里面有缆车，游乐场，带孩子游玩的好地方,0.0,0.5820000171661377,"值得, 适合, 环境, 干净, 休闲, 公园, 空气清新, 瀑布, 水, 很漂亮","['乘车', '休闲', '娱乐', '好去处', '缆车', '游乐场']",卫生,18,1.0,43027,2
A18,2016-06-14,端午节免费，免费，免费。老牌的公园，很多维护都旧了。绿化确实不错。但是实在找不到**的感觉。非常劣质的模型。大炮居然是塑料空心的。,3.0,0.4787999987602234,"走, 高, 性价比, 免费, 太, 坐, 建议, 观音, 开车, 感觉","['端午节', '免费', '免费', '免费', '老牌', '公园', '维护', '旧', '绿化', '确实', '实在', '找', '不到', '感觉', '劣质', '模型', '大炮', '塑料', '空心']",性价比,18,3.0,43028,5
A18,2016-08-27,这个还有点内涵，可以去看一看。,9.0,0.5385000109672546,"山, 爬山, 好多, 希望, 太, 美的, 钱, 水, 骑, 活动","['内涵', '看一看']",设施,18,1.5,43029,3
A18,2016-09-02,都是仿照的。人很多。没特色。倒不如去北京看,12.0,0.4120000004768371,"动物, 爬, 岛, 沙滩, 天然, 氧吧, 表演, 广州, 动物园, 种类","['仿照', '特色', '北京']",设施,18,1.0,43030,2
A18,2015-04-25,**是去珠海游玩必不可少的景点之一，入园免费，每天傍晚会有一场演出，看演出要一百多，在去哪儿网是90元，挺划算的值得一去。,1.0,0.294400006532669,"风景, 表演, 值得, 一般般, 位于, 晚上, 好看, 建筑, 美丽, 大自然","['珠海', '必不可少', '入园', '免费', '傍晚', '一场', '演出', '演出', '一百多', '网', '划算', '值得']",服务,18,2.0,43031,4
A18,2016-08-23,不用门票，里面很大，不过也因为是免费的，没有人维修，部门建筑已经残旧,3.0,0.6855999827384949,"走, 高, 性价比, 免费, 太, 坐, 建议, 观音, 开车, 感觉","['不用', '很大', '免费', '维修', '部门', '建筑', '残旧']",性价比,18,1.0,43032,2
A18,2016-08-27,取得一个很古典的名字，却只剩商业化,6.0,0.3644999861717224,"上山, 广东, 导游, 山顶, 时, 走, 到达, 两个, 下午, 坐","['古典', '名字', '剩', '商业化']",服务,18,1.0,43033,2
A18,2016-03-30,好玩，大家有空可以去玩玩，都是真人弄的,10.0,0.3459999859333038,"喜欢, 下次, 漂亮, 朋友, 值得, 去过, 机会, 字, 开心, 风景优美","['好玩', '有空', '玩玩', '真人', '弄']",位置,18,1.5,43034,3
A18,2016-09-01,完全高仿，但是门票价格并不便宜，不太明白为什么要到这里来玩,7.0,0.5085999965667725,"环境, 贵, 很好, 没什么, 吃, 东西, 太, 差, 感觉, 风景","['高', '仿', '门票价格', '便宜', '太', '明白']",性价比,18,2.0,43035,4
A18,2016-02-08,免费的景点，环境不错，内容不多！,0.0,0.557699978351593,"值得, 适合, 环境, 干净, 休闲, 公园, 空气清新, 瀑布, 水, 很漂亮","['免费', '环境', '内容']",卫生,18,1.0,43036,2
A18,2016-08-21,值得去玩一下，晚上有演出很精彩的,1.0,0.8154000043869019,"风景, 表演, 值得, 一般般, 位于, 晚上, 好看, 建筑, 美丽, 大自然","['值得', '晚上', '演出', '精彩']",服务,18,1.0,43037,2
A18,2016-02-10,不错的地方，正值春节，游人多。,5.0,0.3610999882221222,"温泉, 服务, 服务态度, 满意, 泡温泉, 热情, 家人, 工作人员, 方便快捷, 态度","['春节', '游人']",服务,18,1.5,43038,3
A18,2016-08-19,老景区了，现在商业化气息很浓了。,0.0,0.5385000109672546,"值得, 适合, 环境, 干净, 休闲, 公园, 空气清新, 瀑布, 水, 很漂亮","['商业化', '气息', '很浓']",卫生,18,1.5,43039,3
A18,2016-07-28,不开心，取票窗口老是不相信，二十分钟才给,4.0,0.534500002861023,"便宜, 价格, 优惠, 网上, 现场, 不用, 实惠, 排队, 购票, 订","['开心', '窗口', '二十分钟']",性价比,18,1.0,43040,2
A18,2016-08-15,你看我这么帅也只顶多写到十五字,10.0,0.4169000089168548,"喜欢, 下次, 漂亮, 朋友, 值得, 去过, 机会, 字, 开心, 风景优美","['帅', '写', '十五', '字']",位置,18,1.5,43041,3
A18,2016-08-20,已经改成免费景点，入门无需买门票了,0.0,0.2834999859333038,"值得, 适合, 环境, 干净, 休闲, 公园, 空气清新, 瀑布, 水, 很漂亮","['改成', '免费', '入门', '无需']",卫生,18,1.0,43042,2
A18,2015-11-02,占地面积大 环境优美 重要的是居然还免收门票 非常非常值得一去 不管是带远到而来的客人 还是家人出门散步游玩 都不错 已去过N次咯……,0.0,0.3425000011920929,"值得, 适合, 环境, 干净, 休闲, 公园, 空气清新, 瀑布, 水, 很漂亮","['占地面积', '环境优美', '免收', '值得', '远到', '客人', '家人', '出门', '散步', '去过', '次', '咯']",卫生,18,1.0,43043,2
A18,2016-08-15,多年前和家人一起过去游玩，适合老人家走走,0.0,0.4388999938964844,"值得, 适合, 环境, 干净, 休闲, 公园, 空气清新, 瀑布, 水, 很漂亮","['多年', '前', '家人', '适合', '老人家', '走走']",卫生,18,1.0,43044,2
A18,2015-10-26,环境挺好的，且不收门票，还不错。。。。。,7.0,0.5385000109672546,"环境, 贵, 很好, 没什么, 吃, 东西, 太, 差, 感觉, 风景","['环境', '不收']",性价比,18,1.5,43045,3
A18,2016-08-09,还行吧，我来时不用买票，所谓游乐园就,0.0,0.2698999941349029,"值得, 适合, 环境, 干净, 休闲, 公园, 空气清新, 瀑布, 水, 很漂亮","['还行', '来时', '不用', '游乐园']",卫生,18,1.5,43046,3
A18,2015-10-25,地方算是比较大的，就是觉得里面加了许多现代的东西，少了趣味性,7.0,0.4372999966144562,"环境, 贵, 很好, 没什么, 吃, 东西, 太, 差, 感觉, 风景","['算是', '加', '东西', '少', '趣味性']",性价比,18,-1.0,43047,1
A18,2016-01-26,很不错，关键不要门票，真是良心品质，觉得沿海地区真是好,0.0,0.5192000269889832,"值得, 适合, 环境, 干净, 休闲, 公园, 空气清新, 瀑布, 水, 很漂亮","['关键', '良心', '品质', '沿海地区']",卫生,18,1.0,43048,2
A18,2016-08-07,免费景点，管理一般！里面卖糖人的老汉不买他的东西嘟嘟囔囔，看着都不舒服！！,3.0,0.4453999996185303,"走, 高, 性价比, 免费, 太, 坐, 建议, 观音, 开车, 感觉","['免费', '管理', '卖', '糖人', '老汉', '东西', '嘟嘟囔囔', '看着', '舒服']",性价比,18,2.0,43049,4
A18,2016-04-07,没什么可看的，对于一个北方来说，**就是为了满足南方人不能经常看到真正古建筑群，而仿建的建筑，没太大意思，就是不要门票挺好的。图片中的不腊肠真的很好吃,7.0,0.4104000031948089,"环境, 贵, 很好, 没什么, 吃, 东西, 太, 差, 感觉, 风景","['没什么', '可看', '北方', '南方人', '古建筑群', '仿建', '建筑', '太', '图片', '中', '腊肠', '真的', '好吃']",性价比,18,1.0,43050,2
A18,2016-05-01,6人成行的VIP团，本身对珠海的旅游景点就不抱什么期待，所以着重还是评价服务。车子不错，导游黄达琪很可爱，很尽职。她的广普虽然听起来有点吃力，但是已经很努力了，谢谢。,10.0,0.3014000058174133,"喜欢, 下次, 漂亮, 朋友, 值得, 去过, 机会, 字, 开心, 风景优美","['成行', '团', '珠海', '旅游景点', '抱', '期待', '着重', '评价', '服务', '车子', '导游', '黄达琪', '可爱', '尽职', '广普', '听', '吃力', '努力', '谢谢']",位置,18,4.0,43051,5
A18,2016-05-01,一人成团，从未享受这样的待遇。车子也不错，司机师傅和导游陈楚茵都很好。只是时间过的太快。温馨提示，夏季出行，要带泳裤哦。最后，告诉大家一个秘密。陈楚茵是陈楚生的妹妹哟！！！,6.0,0.3693999946117401,"上山, 广东, 导游, 山顶, 时, 走, 到达, 两个, 下午, 坐","['成团', '享受', '待遇', '车子', '司机', '师傅', '导游', '陈楚茵', '太', '温馨', '提示', '夏季', '出行', '泳裤', '告诉', '秘密', '陈楚茵', '陈楚生', '妹妹']",服务,18,1.0,43052,2
A18,2016-01-09,珠海其实真的没什么好玩的，这里还算不错吧，建筑风格有点皇家园林的感觉，但跟**比起来简直没有可比性,7.0,0.4208000004291534,"环境, 贵, 很好, 没什么, 吃, 东西, 太, 差, 感觉, 风景","['珠海', '真的', '没什么', '好玩', '算', '建筑风格', '皇家', '园林', '感觉', '可比性']",性价比,18,1.5,43053,3
A18,2016-08-05,免门票的景点，里面干货很多，值得一去,0.0,0.5385000109672546,"值得, 适合, 环境, 干净, 休闲, 公园, 空气清新, 瀑布, 水, 很漂亮","['免', '干货', '值得']",卫生,18,1.0,43054,2
A18,2016-01-20,比起北京正宗的**来说，这个仿版就是太简单了，形似神不似。大水法前面喂鸽子倒是吸引的孩子玩到天黑还不肯走。门票不要钱。,9.0,0.3161999881267547,"山, 爬山, 好多, 希望, 太, 美的, 钱, 水, 骑, 活动","['北京', '正宗', '仿版', '太', '简单', '形似', '神', '不似', '大水法', '鸽子', '倒', '吸引', '天黑', '不肯', '走', '钱']",设施,18,0.0,43055,1
A18,2016-08-04,风景还行，但是继续往里面走竟然变成了游乐园，有点接受不了,3.0,0.5084999799728394,"走, 高, 性价比, 免费, 太, 坐, 建议, 观音, 开车, 感觉","['风景', '行', '往里面', '走', '游乐园', '接受']",性价比,18,1.0,43056,2
A18,2016-06-13,梦幻水城不错 表演就比较一般了 不过套票很划算,4.0,0.3465000092983246,"便宜, 价格, 优惠, 网上, 现场, 不用, 实惠, 排队, 购票, 订","['梦幻', '水城', '表演', '套票', '划算']",性价比,18,1.5,43057,3
A18,2016-07-28,免费的园区，本以为很小，原来是极大的。环境也还好！就是找不到卫生间。,7.0,0.4681999981403351,"环境, 贵, 很好, 没什么, 吃, 东西, 太, 差, 感觉, 风景","['免费', '园区', '很小', '环境', '还好', '找', '不到', '卫生间']",性价比,18,0.0,43058,1
A18,2016-06-10,还好吧，就是设施有点旧，设施还挺好玩的,8.0,0.3283999860286712,"空气, 设施, 可惜, 完善, 还行, 游乐, 有意思, 老板, 负离子, 商业","['还好', '设施', '旧', '设施', '挺好玩']",设施,18,1.5,43059,3
A18,2016-07-27,"重游景色不错,免门票.园林很大,梦幻水城也在这.",0.0,0.5,"值得, 适合, 环境, 干净, 休闲, 公园, 空气清新, 瀑布, 水, 很漂亮","['重游', '景色', '免', '园林', '很大', '梦幻', '水城']",卫生,18,1.5,43060,3
A18,2016-07-30,亮点是免费，作为一个景点，到此一游！,5.0,0.5188999772071838,"温泉, 服务, 服务态度, 满意, 泡温泉, 热情, 家人, 工作人员, 方便快捷, 态度","['亮点', '免费', '到此一游']",服务,18,1.0,43061,2
A18,2015-11-26,周末人会比较多，慢慢逛，拍照，有兴趣还可以租船游湖，湖虽小，还是蛮有乐趣的，特别是几人一起，时不时和其他人互动，很是开心。,12.0,0.3763000071048736,"动物, 爬, 岛, 沙滩, 天然, 氧吧, 表演, 广州, 动物园, 种类","['周末', '人会', '慢慢', '逛', '拍照', '兴趣', '租船', '游湖', '湖', '乐趣', '特别', '时不时', '其他人', '互动', '开心']",设施,18,4.0,43062,5
A18,2016-08-03,免费的，不过维护得比较差，里面很多小摊贩,5.0,0.4850000143051147,"温泉, 服务, 服务态度, 满意, 泡温泉, 热情, 家人, 工作人员, 方便快捷, 态度","['免费', '维护', '差', '小摊贩']",服务,18,1.0,43063,2
A18,2016-07-21,人造景点  可看性不高  胜在不收门票啊,0.0,0.2750999927520752,"值得, 适合, 环境, 干净, 休闲, 公园, 空气清新, 瀑布, 水, 很漂亮","['人造', '可看性', '高', '胜', '不收']",卫生,18,1.5,43064,3
A18,2016-07-17,对于我这样的穷游者来说，这里还是挺不错的地方，,7.0,0.5385000109672546,"环境, 贵, 很好, 没什么, 吃, 东西, 太, 差, 感觉, 风景","['穷', '游者', '挺不错']",性价比,18,1.5,43065,3
A18,2016-01-04,园区湖中龙船游玩一圈，还有节目表演就是时间有点短！,3.0,0.3459999859333038,"走, 高, 性价比, 免费, 太, 坐, 建议, 观音, 开车, 感觉","['园区', '湖中', '龙船', '一圈', '节目', '表演', '短']",性价比,18,1.5,43066,3
A18,2016-01-04,免费开放的景点了。缆车上下山，摇摇晃晃，有点点恐怖。其实，要么是大清王朝**；要么索性开个游乐场。两者结合起来，怪怪滴。。。园区需要修缮维护，希望景区越来越好吧。其实爬山看湖都挺好的，希望园区工作人员维护山路，让更多的游客新**玩。,3.0,0.387800008058548,"走, 高, 性价比, 免费, 太, 坐, 建议, 观音, 开车, 感觉","['免费', '开放', '缆车', '下山', '摇摇晃晃', '点点', '恐怖', '大清', '王朝', '索性', '开', '游乐场', '怪怪', '滴', '园区', '修缮', '维护', '希望', '越来越', '爬山', '湖', '挺好', '希望', '园区', '工作人员', '维护', '山路', '游客', '新']",性价比,18,3.0,43067,5
A18,2016-07-10,就景观而言是四星，不过免费大门票绝对要给五星的，挺漂亮的一个仿古景区，好像也是一个影视城的样子,6.0,0.4921999871730804,"上山, 广东, 导游, 山顶, 时, 走, 到达, 两个, 下午, 坐","['景观', '四星', '免费', '五星', '漂亮', '仿古', '好像', '影视城', '样子']",服务,18,2.0,43068,4
A18,2016-02-17,去的时候碰到有花灯和美食节，那里的格格皇上的体验服务还不错,5.0,0.296999990940094,"温泉, 服务, 服务态度, 满意, 泡温泉, 热情, 家人, 工作人员, 方便快捷, 态度","['碰到', '花灯', '美食节', '格格', '皇上', '体验', '服务']",服务,18,1.5,43069,3
A18,2016-07-14,感觉不错，里面有家餐厅也不错哦给赞,7.0,0.671500027179718,"环境, 贵, 很好, 没什么, 吃, 东西, 太, 差, 感觉, 风景","['感觉', '有家', '餐厅', '赞']",性价比,18,1.5,43070,3
A18,2016-07-08,我和一个脾气暴躁的人一起去的，所以就对他不做评价。,5.0,0.692300021648407,"温泉, 服务, 服务态度, 满意, 泡温泉, 热情, 家人, 工作人员, 方便快捷, 态度","['脾气', '暴躁', '做', '评价']",服务,18,-2.0,43071,1
A18,2015-09-20,取消了门票，整体漂亮，新增加了梦幻水都，但最好的看是剧团演出盛世唐朝,12.0,0.3677999973297119,"动物, 爬, 岛, 沙滩, 天然, 氧吧, 表演, 广州, 动物园, 种类","['取消', '整体', '漂亮', '新', '增加', '梦幻', '水', '的看', '剧团', '演出', '盛世', '唐朝']",设施,18,1.0,43072,2
A18,2016-02-12,值得去，皇家园林还是很大气，喜欢刺激的朋友可以有游玩项目。只看景色是免费的。值得去。,0.0,0.3075999915599823,"值得, 适合, 环境, 干净, 休闲, 公园, 空气清新, 瀑布, 水, 很漂亮","['值得', '皇家', '园林', '很大', '气', '喜欢', '刺激', '朋友', '项目', '景色', '免费', '值得']",卫生,18,3.0,43073,5
A18,2016-07-06,很喜欢的一个地方 之前和家人一起如果 然后今年很巧妙的一次机会又去了 古色古香 关键还是免费的,10.0,0.2590000033378601,"喜欢, 下次, 漂亮, 朋友, 值得, 去过, 机会, 字, 开心, 风景优美","['喜欢', '家人', '巧妙', '机会', '古色古香', '关键', '免费']",位置,18,4.0,43074,5
A18,2016-07-07,不好，像游乐场，无聊极了，孩子可以去,9.0,0.5259000062942505,"山, 爬山, 好多, 希望, 太, 美的, 钱, 水, 骑, 活动","['不好', '游乐场', '无聊']",设施,18,-2.0,43075,1
A18,2015-10-04,风景不错，游乐场也比较好玩，观园免费之后太商业化了,2.0,0.5063999891281128,"好玩, 开心, 太, 天气, 项目, 特别, 舒服, 夏天, 热, 风景","['风景', '游乐场', '好玩', '观园', '免费', '太', '商业化']",设施,18,1.0,43076,2
A18,2015-09-16,仿照故宫建的，以前还要收门票，现在不收了，进去玩玩还是不错的，里面也有一些游乐设施，可供小孩子玩耍，不错不错。,0.0,0.5680999755859375,"值得, 适合, 环境, 干净, 休闲, 公园, 空气清新, 瀑布, 水, 很漂亮","['仿照', '故宫', '建', '收', '不收', '玩玩', '游乐', '设施', '供', '玩耍']",卫生,18,1.5,43077,3
A18,2015-09-01,去的时候专门买的嘉宾票，取票的时候给的普通票，还说这就是嘉宾票。我确认了3次。进场后检票的说这就是普通票，嘉宾票是有座号的，随后打电话给票务才说嘉宾坐是随便坐的没人管。表演一般般吧。没有非值得一看的理由。,6.0,0.4501999914646148,"上山, 广东, 导游, 山顶, 时, 走, 到达, 两个, 下午, 坐","['嘉宾', '嘉宾', '确认', '次', '进场', '检票', '的说', '嘉宾', '座', '号', '打电话', '票务', '嘉宾', '坐', '随便', '坐', '没人管', '表演', '一般般', '非', '值得一看', '理由']",服务,18,-1.0,43078,1
A18,2016-01-27,都是人造景观，有山有水的大公园，好像没有太突出**的历史意义和教育意义！不过不收门票的公园，带孩子喂喂鱼，玩玩游艺项目，还不错吧！,0.0,0.5884000062942505,"值得, 适合, 环境, 干净, 休闲, 公园, 空气清新, 瀑布, 水, 很漂亮","['人造', '景观', '有山有水', '公园', '好像', '太', '历史', '意义', '教育', '意义', '收', '公园', '喂喂', '鱼', '玩玩', '游艺', '项目']",卫生,18,1.5,43079,3
A18,2016-05-03,值得一看，展现中华民族历史，很有教育意义，舞蹈演员也声情并茂，展现专业一面。和观众有互动！,1.0,0.3856000006198883,"风景, 表演, 值得, 一般般, 位于, 晚上, 好看, 建筑, 美丽, 大自然","['值得一看', '展现', '中华民族', '历史', '教育', '意义', '舞蹈演员', '声情并茂', '展现', '专业', '观众', '互动']",服务,18,1.5,43080,3
A18,2016-03-14,园明新园不需要买门票，和所有城市一样，有划船，儿童的娱乐项目。可能是取消了门票，里面维护的不是太好。,0.0,0.2184000015258789,"值得, 适合, 环境, 干净, 休闲, 公园, 空气清新, 瀑布, 水, 很漂亮","['园明', '新园', '城市', '划船', '儿童', '娱乐', '项目', '取消', '维护', '不是太好']",卫生,18,0.0,43081,1
A18,2016-03-20,玩的夜间场，很多表演都是白天的，人造景观，学生票便宜多了，珠海旅游其实没什么意思，还不如过关去澳门……,12.0,0.2312999963760376,"动物, 爬, 岛, 沙滩, 天然, 氧吧, 表演, 广州, 动物园, 种类","['夜间', '场', '表演', '白天', '人造', '景观', '学生票', '便宜', '珠海', '没什么', '过关', '澳门']",设施,18,2.0,43082,4
A18,2016-06-19,园民新园里面，经常有演出活动，有的是公益的，可以去玩玩,1.0,0.5192999839782715,"风景, 表演, 值得, 一般般, 位于, 晚上, 好看, 建筑, 美丽, 大自然","['园民', '新园', '演出', '活动', '公益', '玩玩']",服务,18,1.5,43083,3
A18,2016-06-19,蛮精致的园林，还有小桥流水，在广东很难看到这么美的,0.0,0.3461999893188476,"值得, 适合, 环境, 干净, 休闲, 公园, 空气清新, 瀑布, 水, 很漂亮","['精致', '园林', '小桥流水', '广东', '难', '美的']",卫生,18,1.0,43084,2
A18,2016-06-23,很一般，东西设施都挺陈旧的。没什么特色。,7.0,0.4212999939918518,"环境, 贵, 很好, 没什么, 吃, 东西, 太, 差, 感觉, 风景","['东西', '设施', '陈旧', '没什么', '特色']",性价比,18,-1.0,43085,1
A18,2016-02-18,好玩好风景可以去走一走,3.0,0.4196000099182129,"走, 高, 性价比, 免费, 太, 坐, 建议, 观音, 开车, 感觉","['好玩', '风景', '走', '走']",性价比,18,1.5,43086,3
A18,2016-06-18,从香洲去九洲大道过来很方便，遗址图索复建，逼真形象，适合合影留恋,12.0,0.221000000834465,"动物, 爬, 岛, 沙滩, 天然, 氧吧, 表演, 广州, 动物园, 种类","['香洲', '九洲', '大道', '遗址', '图索', '复建', '逼真', '形象', '适合', '合影', '留恋']",设施,18,2.0,43087,4
A18,2016-02-06,里面没什么可看的，就是有几处穿服装照相的，还有一个在船上的表演，表演很一般,1.0,0.2560999989509582,"风景, 表演, 值得, 一般般, 位于, 晚上, 好看, 建筑, 美丽, 大自然","['没什么', '可看', '几处', '穿', '服装', '照相', '船上', '表演', '表演']",服务,18,1.5,43088,3
A18,2016-01-15,园子小巧，黄家达院子，南方的植物，精致！,12.0,0.3774999976158142,"动物, 爬, 岛, 沙滩, 天然, 氧吧, 表演, 广州, 动物园, 种类","['园子', '小巧', '黄家', '达', '院子', '南方', '植物', '精致']",设施,18,1.0,43089,2
