A18,2016-06-10,这里是珠海必去的目的地之一，也是仿古建筑群中的佼佼者。这里有一比一复原明清皇宫，也有异域风情的西洋楼建筑。最主要的是各种游乐设施的结合，对小孩子比较有吸引力。主要是免费，体验还是不错的。,12.0,0.2892000079154968,"动物, 爬, 岛, 沙滩, 天然, 氧吧, 表演, 广州, 动物园, 种类","['珠海', '目的地', '仿古', '建筑群', '中', '佼佼者', '有一', '复原', '明清', '皇宫', '异域', '风情', '西洋楼', '建筑', '游乐', '设施', '吸引力', '免费', '体验']",设施,18,2.0,42797,4
A18,2017-05-14,去不了北京看**，可以来这里看到，感觉跟历史书里的相差无几,12.0,0.7692999839782715,"动物, 爬, 岛, 沙滩, 天然, 氧吧, 表演, 广州, 动物园, 种类","['北京', '感觉', '历史', '书', '相差无几']",设施,18,1.5,42798,3
A18,2017-05-13,**，20年前来过这里！感觉没什么变化,1.0,0.3901999890804291,"风景, 表演, 值得, 一般般, 位于, 晚上, 好看, 建筑, 美丽, 大自然","['年', '前来', '感觉', '没什么', '变化']",服务,18,1.5,42799,3
A18,2016-10-26,**于公元一九九七年二月二日正式建成并开放，它坐落于珠海九洲大道石林山下，占地面积为1.39平方公里，以北京**为原稿，按1：1比例精选**四十景中的十八景修建而成，投资6亿元人民币，是我国首批4A级景区之一。它以其浓厚的清文化、精雅别致的亭、台、楼、阁和气势磅礴的大型舞蹈表演吸引了无数国内外游客。,0.0,0.3443999886512756,"值得, 适合, 环境, 干净, 休闲, 公园, 空气清新, 瀑布, 水, 很漂亮","['公元', '一九九七年', '二月', '二日', '正式', '建成', '开放', '坐落于', '珠海', '九洲', '大道', '石林', '山下', '占地面积', '平方公里', '北京', '原稿', '比例', '精选', '四十', '中', '十八', '修建', '成', '投资', '亿元', '人民币', '我国', '首批', '级', '浓厚', '清', '文化', '精雅', '别致', '亭', '台', '楼', '阁', '气势磅礴', '大型', '舞蹈', '表演', '吸引', '无数', '国内外', '游客']",卫生,18,5.0,42800,5
A18,2017-05-10,不收费的AAAA景区，而且在市中心,3.0,0.3589999973773956,"走, 高, 性价比, 免费, 太, 坐, 建议, 观音, 开车, 感觉","['收费', '市中心']",性价比,18,1.5,42801,3
A18,2017-05-07,值得去，景色怡人，期待下次再去,10.0,0.441100001335144,"喜欢, 下次, 漂亮, 朋友, 值得, 去过, 机会, 字, 开心, 风景优美","['值得', '景色', '怡', '期待', '下次']",位置,18,2.0,42802,4
A18,2017-05-13,跟横店差不多吧，横店有时有表演，,1.0,0.5386000275611877,"风景, 表演, 值得, 一般般, 位于, 晚上, 好看, 建筑, 美丽, 大自然","['横店', '横店', '表演']",服务,18,1.5,42803,3
A18,2017-05-09,免费的园景，常住可以常往，不错的地方,3.0,0.5385000109672546,"走, 高, 性价比, 免费, 太, 坐, 建议, 观音, 开车, 感觉","['免费', '园景', '常住', '常往']",性价比,18,1.0,42804,2
A18,2016-10-09,没有感受到在北京看到的**遗址的那种幻想中的气势，宏大壮观，富丽堂皇，优雅清新，景色宜人。这里到处充满着商品的气味，一个历史文化的教育基地，荡然无存！国人的文化意识可悲啊！关键在政府，在政府对中华民族文化传承的认知，重视程度，应该学会明白我们仿建一个历史遗址的初终。,0.0,0.5230000019073486,"值得, 适合, 环境, 干净, 休闲, 公园, 空气清新, 瀑布, 水, 很漂亮","['感受', '北京', '遗址', '那种', '幻想', '中', '气势', '宏大', '壮观', '富丽堂皇', '优雅', '清新', '景色宜人', '充满', '商品', '气味', '历史', '文化', '教育', '基地', '荡然无存', '国人', '文化', '意识', '可悲', '关键', '政府', '政府', '中华民族', '文化', '传承', '认知', '重视', '程度', '学会', '明白', '仿建', '历史', '遗址', '初终']",卫生,18,4.0,42805,5
A18,2016-09-03,免费开放，里面景点也不错，玩境也挺大的,5.0,0.4431999921798706,"温泉, 服务, 服务态度, 满意, 泡温泉, 热情, 家人, 工作人员, 方便快捷, 态度","['免费', '开放', '玩境', '挺大']",服务,18,2.0,42806,4
A18,2017-01-23,人很少，可能是到珠海的人都去横琴了。景区有点破落了，就是为看曾经的**风貌。演出还不错，但相对收费来说，性价比不高,3.0,0.6266000270843506,"走, 高, 性价比, 免费, 太, 坐, 建议, 观音, 开车, 感觉","['珠海', '横琴', '破落', '风貌', '演出', '收费', '性价比', '高']",性价比,18,-1.0,42807,1
A18,2016-10-20,将圆明圆的经典建筑，按一比一的比例复建，可以感受那北京残存**的模样，值得一看，现在也已免门票了。看到这些建筑越发的感想颇多，国家一定要强大。,1.0,0.3470999896526336,"风景, 表演, 值得, 一般般, 位于, 晚上, 好看, 建筑, 美丽, 大自然","['圆明圆', '经典', '建筑', '一比', '比例', '复建', '感受', '北京', '残存', '模样', '值得一看', '已免', '建筑', '越发', '感想', '国家', '强大']",服务,18,1.0,42808,2
A18,2016-08-20,里面设施很商业化，游乐场之类，我就觉得挺坑爹，说**，也就是一个门口而已，其他地方都是一些建筑，加上下雨，花了一个钟就逛完了。,6.0,0.3571999967098236,"上山, 广东, 导游, 山顶, 时, 走, 到达, 两个, 下午, 坐","['设施', '商业化', '游乐场', '坑', '爹', '门口', '建筑', '下雨', '花', '钟', '逛']",服务,18,1.5,42809,3
A18,2015-11-01,值得一去的景c，门票是免M的，可以感受到以前的A明A，他的制造是按照一比一制造的，有好多m鹊奈锲罚一路有h保，周的餐d吃也好方便，有d趣的朋友可以去看看。,8.0,0.3436000049114227,"空气, 设施, 可惜, 完善, 还行, 游乐, 有意思, 老板, 负离子, 商业","['值得', '一去', '景c', '免M', '感受', 'A明', 'A', '制造', '一比', '制造', '', '好多', 'm', '物品', '一路', '', 'h保', '', '周', '餐d', '吃', '', 'd趣', '朋友']",设施,18,1.0,42810,2
A18,2016-12-18,仿造**建造的仿古式的公园，免费游玩。作为休闲游去走走还是可以的。至少园子里靠山傍湖，绿植又比较多，可以泛舟湖上，放松下。,0.0,0.4695999920368194,"值得, 适合, 环境, 干净, 休闲, 公园, 空气清新, 瀑布, 水, 很漂亮","['仿造', '建造', '仿古', '式', '公园', '免费', '休闲游', '走走', '至少', '园子', '靠山', '傍', '湖', '绿植', '泛舟', '湖上', '放松']",卫生,18,0.0,42811,1
A18,2016-11-21,来珠海一定要来**，虽然跟北京的**有区别。不用收门票，里面有个必玩项目就是坐船。步行进去觉得大开眼界。建议游玩时间一小时。,3.0,0.3847000002861023,"走, 高, 性价比, 免费, 太, 坐, 建议, 观音, 开车, 感觉","['珠海', '北京', '区别', '不用', '收', '有个', '项目', '坐船', '步行', '大开眼界', '建议']",性价比,18,1.5,42812,3
A18,2017-04-16,要逛一上午才能逛完，来珠海一定要来看哦。,12.0,0.7692000269889832,"动物, 爬, 岛, 沙滩, 天然, 氧吧, 表演, 广州, 动物园, 种类","['逛', '一上午', '逛', '珠海']",设施,18,1.5,42813,3
A18,2016-06-27,梦回圆明圆！好看，各景区非常美，只是个别景点在维修！值得一游！希望园区公司和政府把景区搞得更好，是很好教育基地，知历史而后知奋斗，民族复兴不远了！,0.0,0.4081000089645386,"值得, 适合, 环境, 干净, 休闲, 公园, 空气清新, 瀑布, 水, 很漂亮","['梦回', '圆明圆', '好看', '美', '维修', '值得', '希望', '园区', '公司', '政府', '搞', '更好', '教育', '基地', '知', '历史', '知', '奋斗', '民族', '复兴', '不远']",卫生,18,3.0,42814,5
A18,2017-03-10,这景点直得一去，景色不错。空气又清新，闹市中的氧吧。我个人比较喜欢那个锦鲤鱼塘，好多好多锦鲤。,8.0,0.2317000031471252,"空气, 设施, 可惜, 完善, 还行, 游乐, 有意思, 老板, 负离子, 商业","['直', '景色', '空气', '清新', '闹市', '中', '氧吧', '喜欢', '锦鲤', '鱼塘', '好多好多', '锦鲤']",设施,18,1.0,42815,2
A18,2017-04-13,大型公园，免费开放，晚上人流很多,3.0,0.4503999948501587,"走, 高, 性价比, 免费, 太, 坐, 建议, 观音, 开车, 感觉","['大型', '公园', '免费', '开放', '晚上', '人流']",性价比,18,2.0,42816,4
A18,2017-04-12,不收费的AAAA景区，赞，超赞,5.0,0.5325999855995178,"温泉, 服务, 服务态度, 满意, 泡温泉, 热情, 家人, 工作人员, 方便快捷, 态度","['收费', '赞', '超赞']",服务,18,1.5,42817,3
A18,2016-12-09,对于一个免费的公园来说还是非常不错的，还原了部分的北京**。走一圈下来，也就一个小时左右吧。整个园林也是很有气势的，园内还有一个大湖可以沿着湖边，慢慢的游览。,3.0,0.435699999332428,"走, 高, 性价比, 免费, 太, 坐, 建议, 观音, 开车, 感觉","['免费', '公园', '还原', '北京', '走', '一圈', '园林', '气势', '园内', '大湖', '湖边', '慢慢', '游览']",性价比,18,1.0,42818,2
A18,2017-04-08,大大的湖 大水法 休闲好去处 很不错的公园,0.0,0.6794000267982483,"值得, 适合, 环境, 干净, 休闲, 公园, 空气清新, 瀑布, 水, 很漂亮","['大大的', '湖', '大水法', '休闲', '好去处', '公园']",卫生,18,1.5,42819,3
A18,2017-04-08,景色优美，环境优雅，没有门票，建筑复古。,11.0,0.3314999938011169,"景色, 美, 感觉, 山上, 值得, 中, 优美, 拍, 交通, 少","['景色', '优美', '环境', '优雅', '建筑', '复古']",位置,18,2.0,42820,4
A18,2016-03-12,非常漂亮的地方，看不到真正的园明园了，这座仿建的也是气势恢宏，大气磅礴，九州清晏，海晏堂，西洋楼，都是出名的美景，而且还是免费的，性价比超高有木有,3.0,0.4440000057220459,"走, 高, 性价比, 免费, 太, 坐, 建议, 观音, 开车, 感觉","['漂亮', '看不到', '园明园', '座', '仿建', '气势恢宏', '大气磅礴', '九州', '清晏', '海晏堂', '西洋楼', '出名', '美景', '免费', '性价比', '超高', '木']",性价比,18,3.0,42821,5
A18,2016-05-02,日期：2016.05.02星期一天气：小雨转多云目的地：珠海园明新园今年五一小长假，没有计划出外游玩，主要因为不想到景区挤，所以只能在本市周边游。吃过中午饭就从北山开车到园明新园，全程没堵车，但是因为前山大桥行车缓慢，本来十几分钟的车程，最后用了大半小时才到达。今天如我所料，并不算多人，可能是因为节假日的最后一天的缘故，游园的体验度还可以，像平时的周六。今天来园明新园主要是想玩皇家乐园的儿童机动游戏，所以直奔目的地。原来发现，平时5元每次的儿童机动游戏今天涨价至10元，虽然涨价不爽，但是依然接受，只要小朋友喜欢。玩了几个游戏就离开了皇家乐园，在园区内漫步，感觉很写意。,6.0,0.2004999965429306,"上山, 广东, 导游, 山顶, 时, 走, 到达, 两个, 下午, 坐","['日期', '星期一', '天气', '小雨', '多云', '目的地', '珠海', '园明', '新园', '五一', '长假', '计划', '出外', '想到', '挤', '只能', '本市', '周边游', '吃', '中午饭', '北山', '开车', '园明', '新园', '全程', '堵车', '前山', '大桥', '行车', '缓慢', '本来', '十几分钟', '车程', '大半', '到达', '所料', '不算', '是因为', '节假日', '缘故', '游园', '体验', '度', '平时', '周六', '来园', '明', '新园', '想', '皇家', '乐园', '儿童', '机动', '游戏', '直奔', '目的地', '发现', '平时', '每次', '儿童', '机动', '游戏', '涨价', '涨价', '不爽', '依然', '接受', '喜欢', '几个', '游戏', '离开', '皇家', '乐园', '园区', '漫步', '感觉', '写意']",服务,18,1.0,42822,2
A18,2017-04-06,仿**而建，依稀可见当年的风景。,1.0,0.3591000139713287,"风景, 表演, 值得, 一般般, 位于, 晚上, 好看, 建筑, 美丽, 大自然","['仿', '建', '依稀可见', '当年', '风景']",服务,18,1.5,42823,3
A18,2016-02-04,没有想象中的好，可能因为现在免费开放了，维护就不到位了，有的景点颜色脱落非常严重，有的游人稀疏，总体感觉一般,5.0,0.3919999897480011,"温泉, 服务, 服务态度, 满意, 泡温泉, 热情, 家人, 工作人员, 方便快捷, 态度","['想象', '中', '免费', '开放', '维护', '到位', '颜色', '脱落', '游人', '稀疏', '总体', '感觉']",服务,18,1.0,42824,2
A18,2017-04-15,感觉一般，除了门票不花钱，其他没啥吸引力,3.0,0.692300021648407,"走, 高, 性价比, 免费, 太, 坐, 建议, 观音, 开车, 感觉","['感觉', '花钱', '吸引力']",性价比,18,1.0,42825,2
A18,2016-09-18,以前不知道珠海有个**，据说是仿**建造，里面有湖水，山峦，长城，皇家建筑群，舞台表演，观光缆车等，亭台水榭，古色古香，再现清朝皇家园林，又是一处温习历史的景点，很赞。,0.0,0.3528999984264374,"值得, 适合, 环境, 干净, 休闲, 公园, 空气清新, 瀑布, 水, 很漂亮","['珠海', '有个', '仿', '建造', '湖水', '山峦', '长城', '皇家', '建筑群', '舞台', '表演', '观光', '缆车', '亭台', '水榭', '古色古香', '再现', '清朝', '皇家', '园林', '一处', '温习', '历史', '赞']",卫生,18,1.5,42826,3
A18,2017-04-03,珠海最早大型人造景点。 模仿经典。,0.0,0.5940999984741211,"值得, 适合, 环境, 干净, 休闲, 公园, 空气清新, 瀑布, 水, 很漂亮","['珠海', '最早', '大型', '人造', '模仿', '经典']",卫生,18,1.5,42827,3
A18,2017-04-02,几年前去过，不用门票，感觉挺荒凉的，但晚上的表演很精彩！,1.0,0.4751000106334686,"风景, 表演, 值得, 一般般, 位于, 晚上, 好看, 建筑, 美丽, 大自然","['几年', '前去', '不用', '感觉', '荒凉', '晚上', '表演', '精彩']",服务,18,-1.0,42828,1
A18,2017-03-31,其实没什么意思，但珠海市区没什么可去的地方，游玩意义不大,7.0,0.4153999984264374,"环境, 贵, 很好, 没什么, 吃, 东西, 太, 差, 感觉, 风景","['没什么', '珠海市', '区', '没什么', '可去', '意义']",性价比,18,1.5,42829,3
A18,2016-12-18,坐落于珠海九州大道石林山下，以北京**被焚烧前的建筑为原稿，按1：1比例选建**四十景中的十八景建造,3.0,0.267300009727478,"走, 高, 性价比, 免费, 太, 坐, 建议, 观音, 开车, 感觉","['坐落于', '珠海', '九州', '大道', '石林', '山下', '北京', '焚烧', '前', '建筑', '原稿', '比例', '选建', '四十', '中', '十八', '建造']",性价比,18,1.5,42830,3
A18,2017-04-06,说是**，但是维护不行，很多都商业化！只是看，没有什么活动！,9.0,0.4758000075817108,"山, 爬山, 好多, 希望, 太, 美的, 钱, 水, 骑, 活动","['维护', '不行', '商业化', '活动']",设施,18,1.5,42831,3
A18,2016-11-05,**模仿了**的场景再现，但是没有**么宏伟因为我去的时候是万圣节的第二天，所以场内还和有许多的布置没有撤出，可能因为年久失修很老旧，但是免费很值得看看！,3.0,0.3260000050067901,"走, 高, 性价比, 免费, 太, 坐, 建议, 观音, 开车, 感觉","['模仿', '场景', '再现', '宏伟', '万圣节', '第二天', '场内', '布置', '撤出', '年久失修', '旧', '免费', '值得']",性价比,18,3.0,42832,5
A18,2017-03-29,北京有**，珠海有**！但是规模和档次肯定不及北京！不过也有用心打造！总体感觉还不错！,12.0,0.5906000137329102,"动物, 爬, 岛, 沙滩, 天然, 氧吧, 表演, 广州, 动物园, 种类","['北京', '珠海', '规模', '档次', '肯定', '不及', '北京', '用心', '打造', '总体', '感觉']",设施,18,1.0,42833,2
A18,2017-03-29,来到珠海这座城市6年啦那里都玩过就觉得这里最好玩,3.0,0.2583000063896179,"走, 高, 性价比, 免费, 太, 坐, 建议, 观音, 开车, 感觉","['来到', '珠海', '座', '城市', '年', '好玩']",性价比,18,1.5,42834,3
A18,2015-12-04,位置蛮好找的，园子也不小，就是缺乏维护和修缮，远瀛观的字都剥落了，很多景观仿制的不走心，本来就是山寨了，感觉更山寨，还有好多古装拍照好闹心。如果历史的景观都可以这么复制，好像也不需要穿越回去了。没啥可圈可点的地方，胜在免费，所以才会去逛逛。,6.0,0.2664999961853027,"上山, 广东, 导游, 山顶, 时, 走, 到达, 两个, 下午, 坐","['位置', '好找', '园子', '不小', '缺乏', '维护', '修缮', '远瀛观', '字', '剥落', '景观', '仿制', '走心', '本来', '山寨', '感觉', '山寨', '好多', '古装', '拍照', '闹心', '历史', '景观', '复制', '好像', '穿越', '回去', '可圈可点', '胜', '免费', '逛逛']",服务,18,-2.0,42835,1
A18,2017-01-03,**对中国人来说就是一个痛苦的记忆，现在大多数的人只是知道中国以前有个美轮美奂的皇家园林，珠海的这个只能算一个公园，除了名字有圆明这两个字,6.0,0.313400000333786,"上山, 广东, 导游, 山顶, 时, 走, 到达, 两个, 下午, 坐","['中国', '痛苦', '记忆', '中国', '有个', '美轮美奂', '皇家', '园林', '珠海', '只能', '算', '公园', '名字', '圆明', '两个', '字']",服务,18,-1.0,42836,1
A18,2017-02-02,过年人太多啦，节目虎头蛇尾。,6.0,0.3061000108718872,"上山, 广东, 导游, 山顶, 时, 走, 到达, 两个, 下午, 坐","['过年', '太', '节目', '虎头蛇尾']",服务,18,1.5,42837,3
A18,2016-10-25,珠海的**被齐天大圣孙悟空占领了，旁边还有很多美食可以享受，后面还有机动游戏可以玩，不知道乾隆皇帝知道了会不会发火呢？,12.0,0.398499995470047,"动物, 爬, 岛, 沙滩, 天然, 氧吧, 表演, 广州, 动物园, 种类","['珠海', '齐天大圣', '孙悟空', '占领', '旁边', '美食', '享受', '机动', '游戏', '乾隆皇帝', '了会', '发火']",设施,18,0.0,42838,1
A18,2016-04-05,虽有些破旧但仍然有岁月的痕迹，最值得欣赏的是字画，小径通幽，闲云野鹤的仙境！,11.0,0.7692999839782715,"景色, 美, 感觉, 山上, 值得, 中, 优美, 拍, 交通, 少","['破旧', '岁月', '痕迹', '值得', '欣赏', '字画', '小径', '通幽', '闲云野鹤', '仙境']",位置,18,1.0,42839,2
A18,2015-11-28,新**，仿**建筑，无需门票。前半段的参观感觉不错，都是仿古建筑，但后半段融合了太多现代化的元素，就像是一个公园，带孩子来玩玩还行，有游船和小朋友玩的设施。,3.0,0.4323999881744385,"走, 高, 性价比, 免费, 太, 坐, 建议, 观音, 开车, 感觉","['新', '仿', '建筑', '无需', '前半段', '参观', '感觉', '仿古', '建筑', '后半段', '融合', '太', '现代化', '元素', '像是', '公园', '玩玩', '行', '游船', '设施']",性价比,18,1.5,42840,3
A18,2015-12-30,已经是免费景点了。很大，适合2-3人慢慢逛。蓝天，绿树，亭台，楼阁，仿古建筑和西洋楼，各种各样。,3.0,0.4596999883651733,"走, 高, 性价比, 免费, 太, 坐, 建议, 观音, 开车, 感觉","['免费', '很大', '适合', '慢慢', '逛', '蓝天', '绿树', '亭台', '楼阁', '仿古', '建筑', '西洋楼', '各种各样']",性价比,18,2.0,42841,4
A18,2017-03-19,很好的公园，虽然都是假的，但逛逛挺好的！,0.0,0.4144999980926513,"值得, 适合, 环境, 干净, 休闲, 公园, 空气清新, 瀑布, 水, 很漂亮","['很好', '公园', '假', '逛逛']",卫生,18,1.5,42842,3
A18,2016-05-28,台风过后的飘零，有水的点缀更显灵气,6.0,0.2946999967098236,"上山, 广东, 导游, 山顶, 时, 走, 到达, 两个, 下午, 坐","['台风', '过后', '飘零', '水', '点缀', '显', '灵气']",服务,18,1.5,42843,3
A18,2017-03-11,照原北京**修建的，可了解未被毁掉之前的**，值得一去…,9.0,0.2791999876499176,"山, 爬山, 好多, 希望, 太, 美的, 钱, 水, 骑, 活动","['照原', '北京', '修建', '未', '毁掉', '值得']",设施,18,0.0,42844,1
A18,2017-01-19,现在起不收取门票了，很值得去看看！,0.0,0.5385000109672546,"值得, 适合, 环境, 干净, 休闲, 公园, 空气清新, 瀑布, 水, 很漂亮","['收取', '值得']",卫生,18,1.0,42845,2
A18,2017-03-09,很好，景色非常迷人，趣味很好阿！,11.0,0.5198000073432922,"景色, 美, 感觉, 山上, 值得, 中, 优美, 拍, 交通, 少","['景色', '迷人', '趣味']",位置,18,2.0,42846,4
A18,2017-03-07,现在已经不要门票 除了春节期间里面的小展区和平时的儿童游玩区 需收取一定的费用 总体可玩性不错,4.0,0.5547999739646912,"便宜, 价格, 优惠, 网上, 现场, 不用, 实惠, 排队, 购票, 订","['春节', '期间', '展区', '平时', '儿童', '区需', '收取', '费用', '总体', '可玩性']",性价比,18,1.5,42847,3
A18,2017-03-18,实际上与（园明园）完全没有关系，只是故宫的仿造，很粗糙，拍拍电视剧可以骗骗人而已,9.0,0.5194000005722046,"山, 爬山, 好多, 希望, 太, 美的, 钱, 水, 骑, 活动","['实际上', '园明园', '关系', '故宫', '仿造', '粗糙', '拍拍', '电视剧', '骗骗']",设施,18,-2.0,42848,1
A18,2016-05-02,很普通，不算大，入去走了不久后，见到个湖，依山而建的建筑，有点看头，其它真的有点普通。,3.0,0.6898000240325928,"走, 高, 性价比, 免费, 太, 坐, 建议, 观音, 开车, 感觉","['不算', '入', '走', '见到', '湖', '依山', '建', '建筑', '看头', '真的']",性价比,18,1.5,42849,3
A18,2017-02-18,**虽是仿古建筑群，但还是值得一看，古典味较足，以前门票要150元一张，现在免费，还不去看吗。,0.0,0.1889999955892563,"值得, 适合, 环境, 干净, 休闲, 公园, 空气清新, 瀑布, 水, 很漂亮","['仿古', '建筑群', '值得一看', '古典', '味', '较足', '一张', '免费']",卫生,18,2.0,42850,4
A18,2017-03-01,**的表演场地的，表演感觉挺一般的，不能跟**的相比的,12.0,0.6248000264167786,"动物, 爬, 岛, 沙滩, 天然, 氧吧, 表演, 广州, 动物园, 种类","['表演', '场地', '表演', '感觉', '相比']",设施,18,1.5,42851,3
A18,2017-02-23,珠海早期把一处人工景点的，还是挺漂亮的，很多戏组在这里开工，跟横店影视城差不多,12.0,0.3192000091075897,"动物, 爬, 岛, 沙滩, 天然, 氧吧, 表演, 广州, 动物园, 种类","['珠海', '早期', '一处', '人工', '漂亮', '戏组', '开工', '横店', '影视城']",设施,18,1.0,42852,2
A18,2016-11-16,“**”这个景点很好！景色美极了！非常有趣！性价比高！以前去过北京的**，建筑物偏旧，珠海的“**”相比北京的**，建筑新、没有北京的面积大，在广东、在珠海，可以有这样一个景点，挺好的！,12.0,0.5073999762535095,"动物, 爬, 岛, 沙滩, 天然, 氧吧, 表演, 广州, 动物园, 种类","['景色', '美极了', '有趣', '性价比', '高', '去过', '北京', '建筑物', '偏旧', '珠海', '相比', '北京', '建筑', '新', '北京', '面积', '广东', '珠海']",设施,18,1.0,42853,2
A18,2016-06-19,免费景点，带你走进中国古代的园林生活，有皇宫，有游乐场，有游湖，有登山缆车，有大炮，有古董，去吧。,0.0,0.5231000185012817,"值得, 适合, 环境, 干净, 休闲, 公园, 空气清新, 瀑布, 水, 很漂亮","['免费', '走进', '中国', '古代', '园林', '生活', '皇宫', '游乐场', '游湖', '登山', '缆车', '大炮', '古董']",卫生,18,1.0,42854,2
A18,2016-09-18,珠海**一比一的比例有身临其境的感觉，哪怕你到了北京也不过如此，到珠海不到**会让你遗憾终身，好好体验帝皇们那种悠闲的生活还是**最好。,12.0,0.4153999984264374,"动物, 爬, 岛, 沙滩, 天然, 氧吧, 表演, 广州, 动物园, 种类","['珠海', '一比', '比例', '身临其境', '感觉', '北京', '不过如此', '珠海', '不到', '遗憾终身', '好好', '体验', '帝皇', '那种', '悠闲', '生活']",设施,18,-1.0,42855,1
A18,2017-02-12,好！非常好！景色好！趣味好！性价比高！,3.0,0.3740000128746032,"走, 高, 性价比, 免费, 太, 坐, 建议, 观音, 开车, 感觉","['景色', '趣味', '性价比', '高']",性价比,18,1.0,42856,2
A18,2016-12-30,值得一看，值得一看，值得一看,1.0,0.7692000269889832,"风景, 表演, 值得, 一般般, 位于, 晚上, 好看, 建筑, 美丽, 大自然","['值得一看', '值得一看', '值得一看']",服务,18,1.5,42857,3
A18,2016-09-18,终于在南方看到了古老建筑，还以为在北京呢……偶遇老年合唱团表演，看来珠海人民也挺休闲的。里面风景还可以，可以湖边散步，也可湖中划船，也可湖边喂鱼，很休闲，老人小孩都不累,0.0,0.3079999983310699,"值得, 适合, 环境, 干净, 休闲, 公园, 空气清新, 瀑布, 水, 很漂亮","['终于', '南方', '古老', '建筑', '北京', '偶遇', '老年', '合唱团', '表演', '珠海', '休闲', '风景', '湖边', '散步', '湖中', '划船', '湖边', '喂鱼', '休闲', '不累']",卫生,18,-1.0,42858,1
A18,2016-06-12,门票是免费的，里面的项目需要自费，不过也不算贵。,3.0,0.5601000189781189,"走, 高, 性价比, 免费, 太, 坐, 建议, 观音, 开车, 感觉","['免费', '项目', '自费', '不算', '贵']",性价比,18,1.0,42859,2
