景区名称,评论日期,评论内容,主题,评论对主题贡献度,主题关键字,评论分词,评价方面,景区编号,emotional_value,index,情感等级
A41,2020-10-08,还是国庆抢着吃饭比较麻烦，各种项目很好，阳光明媚，海风吹，真是无敌海景,0.0,0.2549999952316284,"值得, 适合, 环境, 干净, 休闲, 公园, 空气清新, 瀑布, 水, 很漂亮","['国庆', '抢', '吃饭', '麻烦', '项目', '阳光明媚', '海风', '吹', '无敌', '海景']",卫生,41,0.0,55598,2
A41,2020-05-04,没想到茂名也有这么美的海边,9.0,0.5257999897003174,"山, 爬山, 好多, 希望, 太, 美的, 钱, 水, 骑, 活动","['没想到', '茂名', '美的', '海边']",设施,41,-1.0,55599,2
A41,2020-09-07,人不多，设施有些旧了。,9.0,0.2901000082492828,"山, 爬山, 好多, 希望, 太, 美的, 钱, 水, 骑, 活动","['人不多', '设施', '旧']",设施,41,1.0000000000000004,55600,3
A41,2020-06-25,和家人一起去的，全程步行:码头――野菠萝公园――天后宫――鸡冠石。不过天后宫基本没怎么看，一共用了不到5个小时。因为赶不上9点那班船所以坐得11点的船上岛，因此主要游玩时间在下午，大部分景点都有遮阴，但还是很热，请各位注意防晒。,3.0,0.3689999878406524,"走, 高, 性价比, 免费, 太, 坐, 建议, 观音, 开车, 感觉","['家人', '全程', '步行', '码头', '野', '菠萝', '公园', '天后宫', '鸡冠石', '天后宫', '共用', '不到', '赶不上', '班船', '坐', '船上', '岛', '下午', '大部分', '遮阴', '热', '请', '防晒']",性价比,41,-1.0,55601,2
A41,2020-06-30,网上提前买票比在现场买优惠一点，取票也方便，里面的服务员也很热情的。岛上貌似只有两家酒店，价格挺贵的，之前看那些评论说酒店很差，但实际我们四百多入住的花园别墅酒店也还不错啊，挺大的，就是隔音比较差。岛上也没啥娱乐设施，除了租个电动车环岛游行一圈一个小时，起步价100元，每超一分钟多一元，我们刚好103元。这个**真的很不适合游泳，沙滩边很多很粗的石块，海里圈出来的游泳区域底下也全是石块，没有沙子，走上去超级硌脚！而且水里半米距离深浅度能差一个头！我170的个子，从岸边走入水八米左右一下子水就淹没过头了，一定要结伴同行，不然很危险。吃的话，就在酒店旁边的便利店吃了个快餐38元一个饭，感觉没吃过这么难吃的菜，这厨子不会煮菜的，肉也是很不新鲜的。因为这岛上的物资都要运进来才有，所以能理解，放宽心就好。店里饮料都是市价的两倍，能接受。这**之旅，除了贵，的确也没啥特别的好玩的，但也是开心的，因为和喜欢的人在一起。（以上供游客参考，因为自己出门在外选择行程的时候，也希望能看到更多的评论提前了解情况）,7.0,0.1771000027656555,"环境, 贵, 很好, 没什么, 吃, 东西, 太, 差, 感觉, 风景","['网上', '提前', '现场', '优惠', '一点', '服务员', '热情', '岛上', '貌似', '两家', '价格', '挺贵', '评论', '差', '四百多', '入住', '花园别墅', '挺大', '隔音', '差', '岛上', '娱乐', '设施', '租', '电动车', '环岛', '游行', '一圈', '起步价', '超', '一分钟', '一元', '真的', '适合', '游泳', '沙滩', '很粗', '石块', '海里', '圈', '游泳', '区域', '底下', '全', '石块', '沙子', '走上', '超级', '硌', '脚', '水', '半米', '距离', '深浅', '度能', '差', '一个头', '个子', '岸边', '走入', '水八', '米左右', '一下子', '水', '淹没', '过头', '结伴同行', '危险', '吃', '旁边', '便利店', '吃', '快餐', '饭', '感觉', '没吃过', '难吃', '菜', '厨子', '煮菜', '肉', '新鲜', '岛上', '物资', '运', '理解', '放宽心', '店里', '饮料', '市价', '两倍', '接受', '旅', '贵', '特别', '好玩', '开心', '喜欢', '供', '游客', '参考', '出门在外', '选择', '行程', '希望', '更多', '评论', '提前', '情况']",性价比,41,8.0,55602,5
A41,2020-02-09,海水很干净，海风吹过来感觉舒适。设施陈旧，房子酒店等有年代感，外墙都剥落了也没有翻新。没有任何娱乐设施，除了观海就是爬山了……管理混乱，可以说没有管理了，很多垃圾，建材随地乱放，清洁不到位，洗手间真的一言难尽。最不开心的是，回程时登船没人引导，好好地在排队，被一群没素质的人插队，跟工作人员反馈了，也不管，最后乱成一锅。作为一个收费景点，而且不便宜，这样的配套和服务，真的很不值。,3.0,0.2529000043869018,"走, 高, 性价比, 免费, 太, 坐, 建议, 观音, 开车, 感觉","['海水', '干净', '海风', '吹过来', '感觉', '舒适', '设施', '陈旧', '房子', '年代', '感', '外墙', '剥落', '翻新', '娱乐', '设施', '观海', '爬山', '管理混乱', '管理', '垃圾', '建材', '随地', '乱放', '清洁', '到位', '洗手间', '真的', '一言难尽', '最不开心', '回程', '时', '登船', '引导', '好好', '排队', '一群', '素质', '插队', '工作人员', '反馈', '乱成', '锅', '收费', '便宜', '配套', '服务', '真的', '不值']",性价比,41,1.0,55603,3
A41,2020-02-17,酒店环境优美，空气清新宜人，冬天去人比较少，休闲游可以的，岛上没什么吃的比较贵，酒店还行。,7.0,0.4234000146389007,"环境, 贵, 很好, 没什么, 吃, 东西, 太, 差, 感觉, 风景","['环境优美', '空气清新', '宜人', '冬天', '少', '休闲游', '岛上', '没什么', '吃', '贵', '行']",性价比,41,1.0,55604,3
A41,2020-02-08,我们是早上去的，没有什么人，玩也挺舒服过去的时候搭的是飞艇，不过我们买的是大船。环境还在建设中，环岛车另外给钱50。吃饭听说比较贵，所以在码头哪里买了东西过去吃，,7.0,0.4041999876499176,"环境, 贵, 很好, 没什么, 吃, 东西, 太, 差, 感觉, 风景","['早上', '挺舒服', '搭', '飞艇', '大船', '环境', '在建设中', '环岛', '车', '给钱', '吃饭', '听说', '贵', '码头', '东西', '吃']",性价比,41,-1.0,55605,2
A41,2020-06-25,值得去的好地放，岸边的海鲜很新鲜！小朋友和妈妈都说好玩，我们都很开心……一个很赞哦……【性价比】【趣味】十年再约丨,10.0,0.3224000036716461,"喜欢, 下次, 漂亮, 朋友, 值得, 去过, 机会, 字, 开心, 风景优美","['值得', '放', '岸边', '海鲜', '新鲜', '妈妈', '好玩', '开心', '赞', '性价比', '趣味', '十年', '约', '丨']",位置,41,4.0,55606,5
A41,2020-05-20,基础设施不完善，岛上比较热近几年不推荐去玩,8.0,0.4153999984264374,"空气, 设施, 可惜, 完善, 还行, 游乐, 有意思, 老板, 负离子, 商业","['基础设施', '完善', '岛上', '热', '近几年', '推荐']",设施,41,1.0,55607,3
A41,2020-04-07,海水干净，景色漂亮，整体设施还在建设中！岛上物价贵,7.0,0.3199000060558319,"环境, 贵, 很好, 没什么, 吃, 东西, 太, 差, 感觉, 风景","['海水', '干净', '景色', '漂亮', '整体', '设施', '在建设中', '岛上', '物价', '贵']",性价比,41,1.0,55608,3
A41,2020-04-20,三月三，广西特有的假期，和女朋友一起自驾游。早就听说**的大名了，身边的亲戚朋友都来过，评价也挺好，所以我们还是比较期待的     票是在去哪儿网买的（每次出去玩都是用去哪儿，感觉比较实在、也很方便）165元一张包含往返船票，是前一天订第二天用，在码头售票口出示去哪儿发来的订票信息即可。我们住在城市便捷酒店（出去外面基本都是住它），离码头就500米。一大早起来赶最早的一班船进岛（进岛时间：10点、12点、14点、16点，最晚的是下午4点；离岛时间：11点、13点、15点、17点。不过这个也是看实际情况决定，人多船也会加班）当然了，资金充足完全可以在岛上住宿。        我们本想着坐大船进岛，但工作人员安排的是快艇，不过快艇真的很刺激，建议大家可以坐一坐。后来听说大船易晕，连狗都晕了这是后来在岛上遇到一个带柯基的大哥说的。太不凑巧，来到岛上就开始下雨，所以决定坐环岛观光车，50元人，因为有几个景点是步行无法进去的，比如天后宫、野菠萝公园、许愿树，所以条件允许的朋友建议坐环岛车。对潜水感兴趣的朋友也可以在岛上尝试一下。     由于雨势较大，风中凌乱不堪，只拍了一点照片。如果是晴天，感觉风景还是挺不错，像野菠萝公园里的章鱼保罗，在那里看海风景确实不错。原本我们是计划到沙滩玩水，连泳衣都带上了，无奈天公不作美，岛上风还是蛮大。让我比较气愤的就是我们快要离岛的时候，天却放晴了！放晴了！放晴了！！！（**，想说爱你不容易）至于岛上的物价，感觉还是可以接受，毕竟吃的用的都是从外面运进来。     总的来说，**还是值得来玩，风景漂亮，海水也蓝。但是可不要像我这样碰上雨天哦。,6.0,0.2684000134468078,"上山, 广东, 导游, 山顶, 时, 走, 到达, 两个, 下午, 坐","['三月', '广西', '特有', '假期', '女朋友', '自驾游', '早就', '听说', '大名', '身边', '亲戚朋友', '评价', '期待', '网', '每次', '出去玩', '用去', '感觉', '实在', '一张', '包含', '往返', '船票', '前一天', '订', '第二天', '码头', '售票口', '出示', '发来', '信息', '即可', '住', '城市', '便捷', '外面', '住', '码头', '米', '一大早', '最早', '一班', '船进岛', '进岛', '最晚', '下午', '离岛', '情况', '船', '加班', '资金', '充足', '岛上', '住宿', '想着', '坐', '大船', '进岛', '工作人员', '安排', '快艇', '快艇', '真的', '刺激', '建议', '坐', '坐', '听说', '大船', '易', '晕', '连狗', '晕', '岛上', '柯基', '大哥', '太', '来到', '岛上', '下雨', '坐', '环岛', '观光车', '几个', '步行', '天后宫', '野', '菠萝', '公园', '许愿树', '条件', '朋友', '建议', '坐', '环岛', '车', '潜水', '感兴趣', '朋友', '岛上', '尝试', '雨势', '较大', '风', '中', '凌乱不堪', '拍', '一点', '照片', '晴天', '感觉', '风景', '挺不错', '野', '菠萝', '公园', '章鱼', '保罗', '海', '风景', '确实', '原本', '计划', '沙滩', '玩水', '泳衣', '带上', '无奈', '天公不作美', '岛上', '风', '气愤', '离岛', '天', '放晴', '放晴', '放晴', '想说爱', '岛上', '物价', '感觉', '接受', '吃的用', '是从', '外面', '运', '值得', '风景', '漂亮', '海水', '蓝', '碰上', '雨天']",服务,41,4.0,55609,5
A41,2020-04-17,1、坐大船进岛，坐快艇出岛，快艇几乎快一倍啊，而且不晕船，快艇感觉棒棒哒2、进岛后车接送到酒店，住在凤凰木屋，简直像别墅群，不过设施完善得不够，破坏的物品没及时更换，但住的很恰意3、环岛慢慢的走，第一天在木屋附近的天后宫和沙滩晃悠，第二天上午走了灯塔，许愿树，下午去了野菠萝公园，岛上风景还是很美腻4、美食城吃了鸡蟹煲，分量大大的，味道不错啊，吃得饱饱的,6.0,0.3950999975204468,"上山, 广东, 导游, 山顶, 时, 走, 到达, 两个, 下午, 坐","['坐', '大船', '进岛', '坐', '快艇', '岛', '快艇', '一倍', '晕船', '快艇', '感觉', '棒棒', '哒', '进岛', '车', '接送', '住', '凤凰', '木屋', '别墅', '群', '设施', '完善', '破坏', '物品', '更换', '住', '恰意', '环岛', '慢慢', '走', '第一天', '木屋', '天后宫', '沙滩', '晃悠', '第二天', '上午', '走', '灯塔', '许愿树', '下午', '野', '菠萝', '公园', '岛上', '风景', '美腻', '美食城', '吃', '鸡', '蟹', '煲', '分量', '大大的', '味道', '吃得饱']",服务,41,-1.0,55610,2
A41,2017-07-03,走了一天的海岸线，这么美腻了，海的颜色都是几层的，其他的设施一般般吧，不过吃饭确实有点贵，还有不用花50块钱坐车，走两个小时就差不多走完了，逛逛也挺好,3.0,0.5418000221252441,"走, 高, 性价比, 免费, 太, 坐, 建议, 观音, 开车, 感觉","['走', '海岸线', '美', '腻', '海', '颜色', '几层', '设施', '一般般', '吃饭', '确实', '贵', '不用', '花', '块钱', '坐车', '走', '两个', '走完', '逛逛']",性价比,41,1.0,55611,3
A41,2020-02-13,第二次来了，比之前更美更好了，可以带孩子老人的家庭游，环境好，是个放松心情的好去处,0.0,0.4122999906539917,"值得, 适合, 环境, 干净, 休闲, 公园, 空气清新, 瀑布, 水, 很漂亮","['第二次', '美', '更好', '家庭', '环境', '放松', '心情', '好去处']",卫生,41,1.0000000000000004,55612,3
A41,2020-08-23,在岛上千万不玩潜水，拍个照片要200一个人，除非你是土豪。,11.0,0.3102000057697296,"景色, 美, 感觉, 山上, 值得, 中, 优美, 拍, 交通, 少","['岛上', '潜水', '拍', '照片', '土豪']",位置,41,1.0000000000000004,55613,3
A41,2020-04-21,坐的是快艇，好像随时去到排队就可以上船，单程18分钟，比较快，不会晕船。岛上很大风，有观光车可以坐，比较方便,3.0,0.4366999864578247,"走, 高, 性价比, 免费, 太, 坐, 建议, 观音, 开车, 感觉","['坐', '快艇', '好像', '排队', '上船', '单程', '分钟', '晕船', '岛上', '很大', '风', '观光车', '坐']",性价比,41,1.0000000000000004,55614,3
A41,2020-03-16,鸡头景区不错，可以近距离感受澎湃的海浪。最好是在岛上住1，2天才可充分感受海岛的魅力。活动如果太少，会太过寂静而没有乐趣。最好能控制在岛人数,12.0,0.5006999969482422,"动物, 爬, 岛, 沙滩, 天然, 氧吧, 表演, 广州, 动物园, 种类","['鸡头', '近距离', '感受', '澎湃', '海浪', '岛上', '住', '天才', '感受', '海岛', '魅力', '活动', '太', '少', '太', '寂静', '乐趣', '控制', '岛', '人数']",设施,41,3.0,55615,4
A41,2020-07-30,你好，坐深湛铁路的动车可从广州南站上车，2小时15分到茂名站。在茂名站下车，寻找火车站西侧有**旅游中心购票，集中坐大巴去。或打的士士到茂名市滨海新区博贺港码头，约四十多公里。有**专门码头，坐游船或快艇约180元往返。夏天去**景观还可以，住宿很贵，电瓶车50/人。建议白天游玩，晚上住茂名市区。秋冬岛上冷清凋零，建议夏天去。此岛性价比很低。景观美，但软件服务很差。,3.0,0.440200001001358,"走, 高, 性价比, 免费, 太, 坐, 建议, 观音, 开车, 感觉","['你好', '坐', '深湛', '铁路', '动车', '广州', '南站', '上车', '茂名', '站', '茂名', '站', '下车', '寻找', '火车站', '西侧', '中心', '购票', '坐', '大巴', '的士', '士', '茂名市', '滨海新区', '博贺港', '码头', '约', '四十多', '公里', '码头', '坐', '游船', '快艇', '约', '往返', '夏天', '景观', '住宿', '贵', '电瓶车', '建议', '白天', '晚上', '住', '茂名市', '区', '秋冬', '岛上', '冷清', '凋零', '建议', '夏天', '岛', '性价比', '低', '景观', '美', '软件', '服务', '差']",性价比,41,1.0000000000000004,55616,3
A41,2020-01-19,整体很不错，就是冬季是淡季，人很少，很多地方在装修,7.0,0.5,"环境, 贵, 很好, 没什么, 吃, 东西, 太, 差, 感觉, 风景","['整体', '冬季', '淡季', '装修']",性价比,41,1.0000000000000004,55617,3
A41,2020-04-30,春节来玩，基本上什么店都没开，绕岛走了一圈，差不多4个小时，真的好累，门票挺贵的，海边景色虽不是上乘，但来回搭的那个快艇真的好爽,3.0,0.2887000143527984,"走, 高, 性价比, 免费, 太, 坐, 建议, 观音, 开车, 感觉","['春节', '店', '没开', '绕', '岛', '走', '一圈', '真的', '累', '挺贵', '海边', '景色', '上乘', '来回', '搭', '快艇', '真的', '好爽']",性价比,41,1.0000000000000004,55618,3
A41,2020-09-18,取票很方便，到了售票处出示去哪儿网发送的短信即可取票。门市价180，便宜了15块钱。,6.0,0.6459000110626221,"上山, 广东, 导游, 山顶, 时, 走, 到达, 两个, 下午, 坐","['售票处', '出示', '网', '发送', '短信', '即可', '门市价', '便宜', '块钱']",服务,41,1.0,55619,3
A41,2020-04-22,初五才到的博贺镇，手机订票港口检票上船！人不多，一次开一条大船！！其实已经很稳了，反正我在航行途中能睡着，但还是有女游客吐！航程约30分钟左右吧！,6.0,0.5543000102043152,"上山, 广东, 导游, 山顶, 时, 走, 到达, 两个, 下午, 坐","['初五', '博贺镇', '手机', '港口', '检票', '上船', '人不多', '开', '一条', '大船', '很稳', '反正', '航行', '途中', '睡着', '女', '游客', '吐', '航程', '约', '分钟']",服务,41,1.0000000000000004,55620,3
A41,2020-08-06,对沙滩有点小失望，沙滩太粗糙，好多大沙砾，磕脚。但非常适合逃避喧嚣喜好静思的好地方，特别是在鸡冠山旁静闭眼躺听海涛声，睁眼满天蓝与白交织变化，看云卷云舒。那感觉，真是太赞啦,10.0,0.4399999976158142,"喜欢, 下次, 漂亮, 朋友, 值得, 去过, 机会, 字, 开心, 风景优美","['沙滩', '失望', '沙滩', '太', '粗糙', '好多', '沙砾', '磕', '脚', '非常适合', '逃避', '喧嚣', '喜好', '静思', '特别', '鸡冠', '山旁', '静', '闭眼', '躺', '听', '海涛', '声', '睁眼', '满天', '蓝与白', '交织', '变化', '云卷云舒', '感觉', '真是太', '赞']",位置,41,-3.0,55621,1
A41,2020-04-22,还不错  就是去的时候下了小雨  后来停了也下不了水 有点可惜,9.0,0.5864999890327454,"山, 爬山, 好多, 希望, 太, 美的, 钱, 水, 骑, 活动","['小雨', '停', '水', '可惜']",设施,41,-1.0,55622,2
A41,2020-03-06,一般般，景区还在开发，好多设施不完善,8.0,0.3427000045776367,"空气, 设施, 可惜, 完善, 还行, 游乐, 有意思, 老板, 负离子, 商业","['一般般', '开发', '好多', '设施', '完善']",设施,41,1.0,55623,3
A41,2020-04-11,我去过五次，这次是带妈妈来，觉得适合老人个情侣去度假，那里休闲自在，我特别喜欢那里的清静，不像其他景区那样人山人海，喜欢清静的各位可以去这里度假两天一夜，那里的出海潜水也很好玩，不要去体验潜，一定要是出海潜,0.0,0.3955000042915344,"值得, 适合, 环境, 干净, 休闲, 公园, 空气清新, 瀑布, 水, 很漂亮","['去过', '五次', '妈妈', '适合', '情侣', '度假', '休闲', '特别', '喜欢', '清静', '人山人海', '喜欢', '清静', '度假', '两天', '一夜', '出海', '潜水', '好玩', '体验', '潜', '出海', '潜']",卫生,41,4.0,55624,5
A41,2020-07-15,非常好玩，岛上环境非常舒服，下次有机会还会继续去,10.0,0.3145000040531158,"喜欢, 下次, 漂亮, 朋友, 值得, 去过, 机会, 字, 开心, 风景优美","['好玩', '岛上', '环境', '舒服', '下次', '机会']",位置,41,2.0,55625,4
A41,2020-05-16,作为茂名景点来说**还是挺出名的，就是有点晕船……这个没办法……,5.0,0.3591000139713287,"温泉, 服务, 服务态度, 满意, 泡温泉, 热情, 家人, 工作人员, 方便快捷, 态度","['茂名', '出名', '晕船', '办法']",服务,41,1.0,55626,3
A41,2020-02-25,风景还可以！就是走走行行，有环岛观光车坐。不过我们一行走路的建议坐车太累了,3.0,0.849399983882904,"走, 高, 性价比, 免费, 太, 坐, 建议, 观音, 开车, 感觉","['风景', '走走', '行', '行', '环岛', '观光车', '坐', '一行', '走路', '建议', '坐车', '太', '累']",性价比,41,1.0000000000000004,55627,3
A41,2020-11-13,比涠洲岛还好看，而且门票100多，还是往返的，去涠洲岛光去船票都150了，怕完，还好这里便宜，真心便宜,3.0,0.3136000037193298,"走, 高, 性价比, 免费, 太, 坐, 建议, 观音, 开车, 感觉","['涠', '洲', '岛', '好看', '往返', '涠', '洲', '岛', '船票', '还好', '便宜', '真心', '便宜']",性价比,41,2.0,55628,4
A41,2020-03-16,从来没有见过这么安静的海岛，这么干净的海水，可能是因为淡季的原因吧，岛上的人真的很少，环岛走了一圈一共没有遇到过五个人还遇上了孔雀，岛上的孔雀不怕人的，走的很近了都不会躲，日落和日出都很美，我们是住了一晚的，瑞鑫的商务海景房现在就四百一晚，不含早，因为是淡季的原因岛上很多地方都是歇业的，酒吧也没有人，九点半的篝火晚会也取消了，这个岛上比较适合情侣悠闲的逛逛，现在还有设施没有搞好，情人岛现在不能上去，吃饭比较贵，而且**美食城里面的海鲜并没有什么特色，服务就更差劲了，下次来准备准备住一下木屋别墅，看起来很有意思！,0.0,0.2352000027894973,"值得, 适合, 环境, 干净, 休闲, 公园, 空气清新, 瀑布, 水, 很漂亮","['安静', '海岛', '干净', '海水', '是因为', '淡季', '原因', '岛上', '真的', '环岛', '走', '一圈', '一共', '五个', '遇上', '孔雀', '岛上', '孔雀', '走', '躲', '日落', '日出', '很美', '住', '一晚', '瑞鑫', '商务', '海景房', '四百', '晚', '含', '早', '淡季', '原因', '岛上', '歇业', '酒吧', '九点半', '篝火', '晚会', '取消', '岛上', '适合', '情侣', '悠闲', '逛逛', '设施', '搞好', '情人', '岛', '吃饭', '贵', '美食城', '海鲜', '特色', '服务', '差劲', '下次', '住', '木屋', '别墅', '有意思']",卫生,41,1.0,55629,3
A41,2020-08-05,1、坐大船进岛，坐快艇出岛，快艇几乎快一倍啊，而且不晕船，快艇感觉棒棒哒 2、进岛后车接送到酒店，住在凤凰木屋，简直像别墅群，不过设施完善得不够，破坏的物品没及时更换，但住的很恰意 3、环岛慢慢的走，第一天在木屋附近的天后宫和沙滩晃悠，第二天上午走了灯塔，许愿树，下午去了野菠萝公园，岛上风景还是很美腻 4、美食城吃了鸡蟹煲，分量大大的，味道不错啊，吃得饱饱的,6.0,0.3950999975204468,"上山, 广东, 导游, 山顶, 时, 走, 到达, 两个, 下午, 坐","['坐', '大船', '进岛', '坐', '快艇', '岛', '快艇', '一倍', '晕船', '快艇', '感觉', '棒棒', '哒', '进岛', '车', '接送', '住', '凤凰', '木屋', '别墅', '群', '设施', '完善', '破坏', '物品', '更换', '住', '恰意', '环岛', '慢慢', '走', '第一天', '木屋', '天后宫', '沙滩', '晃悠', '第二天', '上午', '走', '灯塔', '许愿树', '下午', '野', '菠萝', '公园', '岛上', '风景', '美腻', '美食城', '吃', '鸡', '蟹', '煲', '分量', '大大的', '味道', '吃得饱']",服务,41,-1.0,55630,2
A41,2020-02-16,方便，提前3小时就可以用，就是淡季啥都少,3.0,0.5329999923706055,"走, 高, 性价比, 免费, 太, 坐, 建议, 观音, 开车, 感觉","['提前', '淡季', '少']",性价比,41,1.0000000000000004,55631,3
A41,2020-02-20,朋友去的，我只是代订，不过反应还不错,10.0,0.5385000109672546,"喜欢, 下次, 漂亮, 朋友, 值得, 去过, 机会, 字, 开心, 风景优美","['朋友', '代订']",位置,41,1.0000000000000004,55632,3
A41,2017-05-20,去年国庆的时候去的，坐游艇过去感觉特别爽，好刺激。本来想着可以看日落的（然后被小伙伴们蠢哭，一起往着相反的方向走，结果就是看不了的啦。）第二天我们为了看日出五点就起床了，一直等到六点终于出来了太阳，那一刻好震撼，觉得等待的时间都值了，轮船在太阳底下慢慢驶过，看着小渔船的一对夫妇在收渔网。。。,6.0,0.2759999930858612,"上山, 广东, 导游, 山顶, 时, 走, 到达, 两个, 下午, 坐","['去年', '国庆', '坐', '游艇', '感觉', '特别', '爽', '刺激', '本来', '想着', '日落', '小伙伴', '蠢哭', '方向', '走', '第二天', '日出', '五点', '起床', '六点', '终于', '太阳', '那一刻', '震撼', '等待', '都值', '轮船', '太阳', '底下', '慢慢', '驶过', '看着', '渔船', '一对', '夫妇', '收', '渔网']",服务,41,0.0,55633,2
A41,2020-02-11,环境好，幽静的旅游景点，以后再来一次,0.0,0.7692000269889832,"值得, 适合, 环境, 干净, 休闲, 公园, 空气清新, 瀑布, 水, 很漂亮","['环境', '幽静', '旅游景点']",卫生,41,1.0000000000000004,55634,3
A41,2020-04-24,环境舒适，景点漂亮，值得一玩。。。。,0.0,0.5364999771118164,"值得, 适合, 环境, 干净, 休闲, 公园, 空气清新, 瀑布, 水, 很漂亮","['环境', '舒适', '漂亮', '值得']",卫生,41,3.0,55635,4
A41,2020-02-10,总体还不错。如果抱着小孩的就不建议去玩。太累了,3.0,0.8460999727249146,"走, 高, 性价比, 免费, 太, 坐, 建议, 观音, 开车, 感觉","['总体', '抱', '建议', '太', '累']",性价比,41,1.0000000000000004,55636,3
A41,2020-02-08,有点小贵，而且上面设施很多没有完善，景点也只有3个，有点差点感觉,8.0,0.363099992275238,"空气, 设施, 可惜, 完善, 还行, 游乐, 有意思, 老板, 负离子, 商业","['小贵', '设施', '完善', '差点', '感觉']",设施,41,1.0000000000000004,55637,3
