A41,2016-10-05,总得来说对于这里的印象可以归纳为以下几点：风景不错，海景美艳，景点普通，消费特贵，交通不便。,1.0,0.4047999978065491,"风景, 表演, 值得, 一般般, 位于, 晚上, 好看, 建筑, 美丽, 大自然","['总得来说', '印象', '归纳', '以下几点', '风景', '海景', '美艳', '消费', '特贵', '交通不便']",服务,41,1.0000000000000004,55769,3
A41,2016-09-25,不错，海鲜多。。风景也不错。。值得一走。。,7.0,0.5605000257492065,"环境, 贵, 很好, 没什么, 吃, 东西, 太, 差, 感觉, 风景","['海鲜', '风景', '值得', '走']",性价比,41,1.0,55770,3
A41,2016-09-20,出票快捷，领取方便，很棒的一次旅行,5.0,0.6978999972343445,"温泉, 服务, 服务态度, 满意, 泡温泉, 热情, 家人, 工作人员, 方便快捷, 态度","['出票', '快捷', '领取', '很棒', '旅行']",服务,41,1.0,55771,3
A41,2016-06-13,原生态海岛，环境很好，可惜我们去那天一整天都下雨。风景真的很美！,2.0,0.4300000071525574,"好玩, 开心, 太, 天气, 项目, 特别, 舒服, 夏天, 热, 风景","['原生态', '海岛', '环境', '可惜', '那天', '一整天', '下雨', '风景', '真的', '美']",设施,41,-1.0,55772,2
A41,2016-06-19,很方便，又经济，比现场买便宜,4.0,0.5192999839782715,"便宜, 价格, 优惠, 网上, 现场, 不用, 实惠, 排队, 购票, 订","['经济', '现场', '便宜']",性价比,41,1.0,55773,3
A41,2016-11-05,值得一去，环境优美，空气清新，海水很蓝,0.0,0.8151999711990356,"值得, 适合, 环境, 干净, 休闲, 公园, 空气清新, 瀑布, 水, 很漂亮","['值得', '环境优美', '空气清新', '海水', '蓝']",卫生,41,1.0,55774,3
A41,2016-04-13,订票了到取票时遇到了取不了票，耽搁了第一班的轮船，后打电*给客服，只取了成人票，儿童票没有取得，只好付现金在售票处买,6.0,0.4110000133514404,"上山, 广东, 导游, 山顶, 时, 走, 到达, 两个, 下午, 坐","['了到', '时', '了取', '耽搁', '第一班', '轮船', '电', '客服', '只取', '成人', '儿童票', '只好', '付现金', '售票处']",服务,41,-1.0,55775,2
A41,2015-08-31,岛上风光很好，玩得很开心，美中不足的是岛内各种消费价格太贵了！,7.0,0.4747999906539917,"环境, 贵, 很好, 没什么, 吃, 东西, 太, 差, 感觉, 风景","['岛上', '风光', '开心', '美中不足', '岛内', '消费', '价格', '太贵']",性价比,41,1.0,55776,3
A41,2016-08-18,等大船rg比^久，可以x窨焱,8.0,0.5218999981880188,"空气, 设施, 可惜, 完善, 还行, 游乐, 有意思, 老板, 负离子, 商业","['大船', 'rg', '比^', '久', 'x', '快艇']",设施,41,1.0000000000000004,55777,3
A41,2016-08-18,取票方便，可以坐快艇也可以坐大船,3.0,0.692300021648407,"走, 高, 性价比, 免费, 太, 坐, 建议, 观音, 开车, 感觉","['坐', '快艇', '坐', '大船']",性价比,41,1.0000000000000004,55778,3
A41,2016-07-09,可能是因为投资较大，这里的消费都挺高的，而且自驾的话，茂名这边的路太烂了，颠颠簸簸的，农村化比较重，水质还不错，挺清澈的，出海捕鱼，潜水，戏水游乐园等,3.0,0.3312999904155731,"走, 高, 性价比, 免费, 太, 坐, 建议, 观音, 开车, 感觉","['是因为', '投资', '较大', '消费', '高', '自驾', '茂名', '路', '太烂', '颠颠簸簸', '农村化', '重', '水质', '清澈', '出海捕鱼', '潜水', '戏水', '游乐园']",性价比,41,1.0,55779,3
A41,2015-10-30,**很美，看我自己拍的图就知道了哈哈！,11.0,0.5192999839782715,"景色, 美, 感觉, 山上, 值得, 中, 优美, 拍, 交通, 少","['美', '拍', '图']",位置,41,1.0000000000000004,55780,3
A41,2016-10-07,去海边最惬意的是吹着海风吃海鲜，**最舒服的就是坐着电瓶车吹海风。,0.0,0.5649999976158142,"值得, 适合, 环境, 干净, 休闲, 公园, 空气清新, 瀑布, 水, 很漂亮","['海边', '惬意', '吹', '海风', '吃海鲜', '最舒服', '坐', '电瓶车', '吹', '海风']",卫生,41,1.0,55781,3
A41,2016-08-28,船费不算贵，还一般般，上岛吃住，很贵很贵。,9.0,0.3524999916553497,"山, 爬山, 好多, 希望, 太, 美的, 钱, 水, 骑, 活动","['船费', '不算', '贵', '一般般', '上岛', '吃住', '很贵', '很贵']",设施,41,1.0000000000000004,55782,3
A41,2016-08-04,去的时候刚好下雨，没什么人，也没什么地方有好吃的，但是比较安静。,7.0,0.6718000173568726,"环境, 贵, 很好, 没什么, 吃, 东西, 太, 差, 感觉, 风景","['下雨', '没什么', '没什么', '好吃', '安静']",性价比,41,2.0,55783,4
A41,2016-09-14,登岛后可以在那里露营吗？？,8.0,0.0768999978899955,"空气, 设施, 可惜, 完善, 还行, 游乐, 有意思, 老板, 负离子, 商业","['登岛', '露营']",设施,41,1.0000000000000004,55784,3
A41,2016-09-07,"好,值得去,一家人合适去冲浪,有蟹仔捉拉.",0.0,0.6068000197410583,"值得, 适合, 环境, 干净, 休闲, 公园, 空气清新, 瀑布, 水, 很漂亮","['值得', '合适', '冲浪', '蟹', '仔', '捉', '拉']",卫生,41,2.0,55785,4
A41,2016-08-18,挺好玩的，有摩托艇潜水等等。还不错,5.0,0.3591000139713287,"温泉, 服务, 服务态度, 满意, 泡温泉, 热情, 家人, 工作人员, 方便快捷, 态度","['挺好玩', '摩托艇', '潜水']",服务,41,1.0000000000000004,55786,3
A41,2015-10-26,风景确实不错，但是玩的太坑爹，贵，而且不完善，海滩也是非常烂的海滩,10.0,0.2766999900341034,"喜欢, 下次, 漂亮, 朋友, 值得, 去过, 机会, 字, 开心, 风景优美","['风景', '确实', '太坑', '爹', '贵', '完善', '海滩', '烂', '海滩']",位置,41,0.0,55787,2
A41,2016-07-12,船没有什么可以说的 价格也算公道！网上订比现场便宜30块一人！,4.0,0.7440000176429749,"便宜, 价格, 优惠, 网上, 现场, 不用, 实惠, 排队, 购票, 订","['船', '价格', '算', '公道', '网上', '订比', '现场', '便宜', '块']",性价比,41,1.0,55788,3
A41,2016-07-11,好玩好玩真好玩，环境还干净,2.0,0.4174000024795532,"好玩, 开心, 太, 天气, 项目, 特别, 舒服, 夏天, 热, 风景","['好玩', '好玩', '真好玩', '环境', '干净']",设施,41,1.0000000000000004,55789,3
A41,2016-06-20,拿着订单过去非常方便快捷，比在当天买一张便宜了30大元,4.0,0.4690999984741211,"便宜, 价格, 优惠, 网上, 现场, 不用, 实惠, 排队, 购票, 订","['订单', '方便快捷', '当天', '一张', '便宜', '大元']",性价比,41,1.0,55790,3
A41,2016-07-02,海滩景色很美，但**太一般！,11.0,0.6079000234603882,"景色, 美, 感觉, 山上, 值得, 中, 优美, 拍, 交通, 少","['海滩', '景色', '美', '太']",位置,41,1.0000000000000004,55791,3
A41,2016-06-17,天然氧吧，海水清澈，风景秀丽，环境清新，很适合度假散心。,0.0,0.5949000120162964,"值得, 适合, 环境, 干净, 休闲, 公园, 空气清新, 瀑布, 水, 很漂亮","['天然', '氧吧', '海水', '清澈', '风景秀丽', '环境', '清新', '适合', '度假', '散心']",卫生,41,3.0,55792,4
A41,2016-07-28,景区一般，东西不便宜。看心情了。,10.0,0.2694999873638153,"喜欢, 下次, 漂亮, 朋友, 值得, 去过, 机会, 字, 开心, 风景优美","['东西', '便宜', '心情']",位置,41,0.0,55793,2
A41,2016-08-03,门票超贵，景点不多，其实很小的一个小岛。感觉有点不值。,9.0,0.4083000123500824,"山, 爬山, 好多, 希望, 太, 美的, 钱, 水, 骑, 活动","['超贵', '很小', '小岛', '感觉', '不值']",设施,41,-1.0,55794,2
A41,2015-10-04,**还是挺漂亮的，风景好，电瓶车线路设计合理。只要玩半天就可以玩完了。,3.0,0.3623999953269958,"走, 高, 性价比, 免费, 太, 坐, 建议, 观音, 开车, 感觉","['漂亮', '风景', '电瓶车', '线路', '设计', '半天', '玩完']",性价比,41,1.0,55795,3
A41,2016-07-24,值得一去，但要求不要太高哦！！,3.0,0.5266000032424927,"走, 高, 性价比, 免费, 太, 坐, 建议, 观音, 开车, 感觉","['值得', '太', '高']",性价比,41,1.0,55796,3
A41,2015-12-31,风景很美，住的海景酒店，出大门就是海边；在酒店用餐既好味又卫生比外面的大排档好太多了，总之意犹未尽还想再去,3.0,0.2005999982357025,"走, 高, 性价比, 免费, 太, 坐, 建议, 观音, 开车, 感觉","['风景', '美', '住', '海景', '大门', '海边', '用餐', '味', '卫生', '外面', '大排档', '太', '意犹未尽', '想']",性价比,41,1.0,55797,3
A41,2016-06-11,这次网上订购的酒店还可以，唯一不足的是这边的消费实在太贵，东西难吃的要命，不过风景还是可以的,7.0,0.5432000160217285,"环境, 贵, 很好, 没什么, 吃, 东西, 太, 差, 感觉, 风景","['网上', '订购', '唯一', '消费', '实在', '太贵', '东西', '难吃', '要命', '风景']",性价比,41,0.0,55798,2
A41,2015-11-04,海边很美，是散心的好去处，唯一遗憾的就是没有看日出，确实是因为自己懒不想起床,6.0,0.3745999932289123,"上山, 广东, 导游, 山顶, 时, 走, 到达, 两个, 下午, 坐","['海边', '美', '散心', '好去处', '唯一', '遗憾', '日出', '确实', '是因为', '懒', '不想', '起床']",服务,41,0.0,55799,2
A41,2015-10-03,取票方便，**环境不错，就是消费比较贵，比外面贵一倍吧,7.0,0.7214999794960022,"环境, 贵, 很好, 没什么, 吃, 东西, 太, 差, 感觉, 风景","['环境', '消费', '贵', '外面', '贵', '一倍']",性价比,41,1.0000000000000004,55800,3
A41,2016-05-04,还行吧。五一人多，排队登船就要一两个钟。建议大假还是不要凑热闹了。,6.0,0.3481000065803528,"上山, 广东, 导游, 山顶, 时, 走, 到达, 两个, 下午, 坐","['还行', '五一', '排队', '登船', '一两个', '钟', '建议', '大假', '凑热闹']",服务,41,1.0000000000000004,55801,3
A41,2016-06-20,"在木屋里眺望大海,一望无际的大海偶尔有船驶过,是不是太美了呢",12.0,0.2894999980926513,"动物, 爬, 岛, 沙滩, 天然, 氧吧, 表演, 广州, 动物园, 种类","['木屋', '眺望', '大海', '一望无际', '大海', '船', '驶过', '太美']",设施,41,1.0000000000000004,55802,3
A41,2016-05-01,还可以，就是沙滩太少了,2.0,0.5041000247001648,"好玩, 开心, 太, 天气, 项目, 特别, 舒服, 夏天, 热, 风景","['沙滩', '太', '少']",设施,41,1.0000000000000004,55803,3
A41,2016-05-02,好好好好好好好好好好好好,3.0,0.8680999875068665,"走, 高, 性价比, 免费, 太, 坐, 建议, 观音, 开车, 感觉","['好好', '好好', '好好', '好好', '好好', '好好']",性价比,41,1.0000000000000004,55804,3
A41,2016-04-12,淡季去的，还不错，倒是岛比较小，旺季去就没意思了！,9.0,0.293500006198883,"山, 爬山, 好多, 希望, 太, 美的, 钱, 水, 骑, 活动","['淡季', '倒', '岛', '旺季', '没意思']",设施,41,-1.0,55805,2
A41,2016-06-21,还好吧。交通不是太方便。需要开发地方太多了，,7.0,0.6000999808311462,"环境, 贵, 很好, 没什么, 吃, 东西, 太, 差, 感觉, 风景","['还好', '交通', '太', '开发', '太']",性价比,41,1.0,55806,3
A41,2016-06-06,这里值得的拥有！晚上海边散步，非常惬意！,0.0,0.5564000010490417,"值得, 适合, 环境, 干净, 休闲, 公园, 空气清新, 瀑布, 水, 很漂亮","['值得', '拥有', '晚上', '海边', '散步', '惬意']",卫生,41,3.0,55807,4
A41,2016-04-24,很好。里面好玩。好好看看。好好看看,3.0,0.5192000269889832,"走, 高, 性价比, 免费, 太, 坐, 建议, 观音, 开车, 感觉","['好玩', '好好', '好好']",性价比,41,1.0000000000000004,55808,3
A41,2016-03-20,不合适季节去，就不要去，浪费钱,9.0,0.4153999984264374,"山, 爬山, 好多, 希望, 太, 美的, 钱, 水, 骑, 活动","['合适', '季节', '浪费', '钱']",设施,41,0.0,55809,2
A41,2015-10-21,网上订票会比直接买票便宜了好多，取票方便又实惠。岛上风景很美，是摄影爱好者的天堂，住宿饮食之类的配套设施还不是很多，以后应该会改善。最好是游玩两三天，基本可以深度游了。冬天来最佳，不冷，穿个长裙披件小外套即可。,2.0,0.1941000074148178,"好玩, 开心, 太, 天气, 项目, 特别, 舒服, 夏天, 热, 风景","['网上', '便宜', '好多', '实惠', '岛上', '风景', '美', '摄影', '爱好者', '天堂', '住宿', '饮食', '配套', '设施', '改善', '两三天', '深度', '冬天', '最佳', '冷', '穿', '长裙', '披件', '外套', '即可']",设施,41,4.0,55810,5
A41,2015-10-05,这个地方一定要给好评，岛不大，80[%]开发吧，没有什么居民，都是开发后去的工作人员和商家，所以岛上不会人山人海。因为离大陆有一定距离，坐船约需要40多分钟，所以岛边的海水好干净，碧蓝色，十分漂亮，岛上建筑也是风景，岛上有潜水、傍晚捕捞等活动，价格不贵，但我没有尝试，唯一美中不足的就是沙滩面积太小,3.0,0.2675999999046325,"走, 高, 性价比, 免费, 太, 坐, 建议, 观音, 开车, 感觉","['好评', '岛', '开发', '居民', '开发', '后去', '工作人员', '商家', '岛上', '人山人海', '大陆', '距离', '坐船', '约', '多分钟', '岛边', '海水', '干净', '碧蓝色', '漂亮', '岛上', '建筑', '风景', '岛上', '潜水', '傍晚', '捕捞', '活动', '价格', '贵', '尝试', '唯一', '美中不足', '沙滩', '面积', '太小']",性价比,41,3.0,55811,4
A41,2016-02-20,风景非常不错，就是酒店少了点，一定要提前订，否则登岛后很可能没房可订，有房价格也非常高。,4.0,0.3470000028610229,"便宜, 价格, 优惠, 网上, 现场, 不用, 实惠, 排队, 购票, 订","['风景', '少', '提前', '订', '登岛', '没房', '可订', '房价格', '高']",性价比,41,1.0000000000000004,55812,3
A41,2015-12-23,爸爸出差的时候跟着去**玩。总结一下，感觉很坑人。房价超级贵，吃的东西也超级贵。本身门票就要100+一人了，进去的任何项目也还要付钱，除了在海里游泳。景色还是很不错的，就是有待开发。,7.0,0.4212999939918518,"环境, 贵, 很好, 没什么, 吃, 东西, 太, 差, 感觉, 风景","['爸爸', '出差', '跟着', '感觉', '坑人', '房价', '超级', '贵', '吃', '东西', '超级', '贵', '项目', '付钱', '海里', '游泳', '景色', '有待', '开发']",性价比,41,0.0,55813,2
A41,2016-02-16,还算可以，就是风浪太大了，坐小船要特别小心，建议还是坐大船,3.0,0.7031999826431274,"走, 高, 性价比, 免费, 太, 坐, 建议, 观音, 开车, 感觉","['算', '风浪', '太', '坐', '小船', '特别', '小心', '建议', '坐', '大船']",性价比,41,2.0,55814,4
A41,2016-01-16,非常好玩！海鲜不错！,7.0,0.3598999977111816,"环境, 贵, 很好, 没什么, 吃, 东西, 太, 差, 感觉, 风景","['好玩', '海鲜']",性价比,41,1.0000000000000004,55815,3
A41,2015-09-14,坐船四十分钟到，海水很蓝，中午到比较热，建议租电瓶车一小时六十元,3.0,0.5066999793052673,"走, 高, 性价比, 免费, 太, 坐, 建议, 观音, 开车, 感觉","['坐船', '四十分钟', '海水', '蓝', '中午', '热', '建议', '租', '电瓶车', '六十元']",性价比,41,1.0000000000000004,55816,3
A41,2015-10-13,离u，需坐船到u上，远离都市，适合全家人度假.,0.0,0.4081999957561493,"值得, 适合, 环境, 干净, 休闲, 公园, 空气清新, 瀑布, 水, 很漂亮","['离u', '需', '坐船到', 'u上', '远离', '都市', '适合', '全家人', '度假']",卫生,41,0.0,55817,2
A41,2016-01-15,还可以晚上玩的地方少了点,1.0,0.692300021648407,"风景, 表演, 值得, 一般般, 位于, 晚上, 好看, 建筑, 美丽, 大自然","['晚上', '少']",服务,41,1.0000000000000004,55818,3
A41,2016-02-11,导航竟然导到去渔村，白白浪费了了二个小时！,3.0,0.5385000109672546,"走, 高, 性价比, 免费, 太, 坐, 建议, 观音, 开车, 感觉","['导航', '导到', '渔村', '白白浪费', '二个']",性价比,41,1.0000000000000004,55819,3
A41,2015-08-16,岛上不大，如果不住，中午进去也行的，浴场小，海水不清，旁边就是食街，污水流到浴场，很不干净。总的来说不值这个价。,0.0,0.4135999977588653,"值得, 适合, 环境, 干净, 休闲, 公园, 空气清新, 瀑布, 水, 很漂亮","['岛上', '不住', '中午', '行', '浴场', '海水', '清', '旁边', '食街', '污水', '流', '浴场', '干净', '不值', '价']",卫生,41,-2.0,55820,1
A41,2015-08-14,5分，**风景很美，确实好玩，真想还一整天，可惜下雨，9点上岛，15点就出岛了。在去哪儿买上岛门票很便宜。真的玩得很开心。,2.0,0.4023999869823456,"好玩, 开心, 太, 天气, 项目, 特别, 舒服, 夏天, 热, 风景","['风景', '美', '确实', '好玩', '真', '想', '一整天', '可惜', '下雨', '上岛', '岛', '上岛', '便宜', '真的', '开心']",设施,41,2.0,55821,4
A41,2015-06-07,**岛上没放有鸡，哈哈，不过确实是个休闲的好去处，岛上很舒服，有酒店跟餐厅！美中不足的就是娱乐设施少了点，晚上有酒吧，吹海风倒是很舒服，想散心的值得去。,0.0,0.460999995470047,"值得, 适合, 环境, 干净, 休闲, 公园, 空气清新, 瀑布, 水, 很漂亮","['岛上', '没放', '鸡', '确实', '休闲', '好去处', '岛上', '舒服', '餐厅', '美中不足', '娱乐', '设施', '少', '晚上', '酒吧', '吹', '海风', '倒', '舒服', '想', '散心', '值得']",卫生,41,5.0,55822,5
A41,2015-10-26,**就是去吹吹海风，度度假咯,0.0,0.5773000121116638,"值得, 适合, 环境, 干净, 休闲, 公园, 空气清新, 瀑布, 水, 很漂亮","['吹', '吹', '海风', '度', '度假', '咯']",卫生,41,1.0000000000000004,55823,3
A41,2015-12-22,u很大，可以x褡呗愤可以乘坐u上的。吹吹海L晒晒太很舒服。,0.0,0.557200014591217,"值得, 适合, 环境, 干净, 休闲, 公园, 空气清新, 瀑布, 水, 很漂亮","['u', '很大', 'x', '走路', '乘坐', 'u上', '', '吹', '吹', '海L', '晒晒', '太', '舒服']",卫生,41,1.0,55824,3
A41,2015-10-28,5分，**景色优美，空气清新，是休闲度假的好地方。,0.0,0.5127999782562256,"值得, 适合, 环境, 干净, 休闲, 公园, 空气清新, 瀑布, 水, 很漂亮","['景色', '优美', '空气清新', '休闲', '度假']",卫生,41,1.0,55825,3
A41,2015-12-20,非常完美的度假胜地，美不胜收，有机会再去,1.0,0.5126000046730042,"风景, 表演, 值得, 一般般, 位于, 晚上, 好看, 建筑, 美丽, 大自然","['完美', '度假胜地', '美不胜收', '机会']",服务,41,2.0,55826,4
A41,2015-10-26,支持家乡经济建设。地方也不错，就是好像也没什么好玩的，如果晚上住岛一晚，估计会舒服很多。,2.0,0.3170999884605407,"好玩, 开心, 太, 天气, 项目, 特别, 舒服, 夏天, 热, 风景","['支持', '家乡', '经济', '建设', '好像', '没什么', '好玩', '晚上', '住岛', '一晚', '估计', '舒服']",设施,41,2.0,55827,4
A41,2016-01-08,很一般，没意思，下次不会再去了。价格比较高。,7.0,0.6152999997138977,"环境, 贵, 很好, 没什么, 吃, 东西, 太, 差, 感觉, 风景","['没意思', '下次', '价格', '高']",性价比,41,-1.0,55828,2
A41,2015-09-26,沙滩短窄，水清但色灰，沙子粗粒。岛上全部酒店条件都不行，卫生设备等基本的软硬件都差旧，更别说WiFi 了。其实岛上风景很好，应该引进好的酒店品牌。手机信号都不稳定，更别说4G了。,12.0,0.295199990272522,"动物, 爬, 岛, 沙滩, 天然, 氧吧, 表演, 广州, 动物园, 种类","['沙滩', '短窄', '水清', '色灰', '沙子', '粒', '岛上', '条件', '不行', '卫生设备', '软硬件', '差', '旧', '岛上', '风景', '引进', '品牌', '手机信号', '稳定']",设施,41,1.0,55829,3
A41,2015-10-25,5分，优美的景色，新鲜的空气。,11.0,0.4153999984264374,"景色, 美, 感觉, 山上, 值得, 中, 优美, 拍, 交通, 少","['优美', '景色', '新鲜', '空气']",位置,41,2.0,55830,4
A41,2015-10-14,风景还行，但是岛上一切都贵。,7.0,0.6151999831199646,"环境, 贵, 很好, 没什么, 吃, 东西, 太, 差, 感觉, 风景","['风景', '行', '岛上', '贵']",性价比,41,1.0000000000000004,55831,3
A41,2015-03-23,很差。首先租个电瓶车要60一个小时！随便玩5个小时就300。其次岛上都没有玩的地方！！！很多地方都关着。40%是山！40%是各种住的酒店！给我们玩的也就逛一圈了！里面各种设施。什么游泳什么的！都要好几百！！住一晚都要1000出头！山上还各种牛屎！！你们这么坑人大伙知道么！！！！,7.0,0.4359000027179718,"环境, 贵, 很好, 没什么, 吃, 东西, 太, 差, 感觉, 风景","['差', '租', '电瓶车', '随便', '岛上', '关着', '山', '住', '逛', '一圈', '设施', '游泳', '好几百', '住', '一晚', '出头', '山上', '牛', '屎', '坑人', '大伙']",性价比,41,-1.0,55832,2
A41,2015-10-10,算是比较好了放松度假之地吧，岛上项目少了点。,0.0,0.541100025177002,"值得, 适合, 环境, 干净, 休闲, 公园, 空气清新, 瀑布, 水, 很漂亮","['算是', '放松', '度假', '之地', '岛上', '项目', '少']",卫生,41,1.0000000000000004,55833,3
A41,2015-10-03,很好的地方，海岛上转了一圈，确实和其它的地方有不一样的感受，还是值得去一趟，下次再去住一晚！,7.0,0.2919000089168548,"环境, 贵, 很好, 没什么, 吃, 东西, 太, 差, 感觉, 风景","['很好', '海岛', '上转', '一圈', '确实', '感受', '值得', '去一趟', '下次', '住', '一晚']",性价比,41,2.0,55834,4
A41,2015-10-04,**风景不错，可惜玩得一半就下起，提前离岛。,6.0,0.678600013256073,"上山, 广东, 导游, 山顶, 时, 走, 到达, 两个, 下午, 坐","['风景', '可惜', '一半', '下起', '提前', '离岛']",服务,41,-1.0,55835,2
A41,2015-10-03,4分，景色很漂亮，海水很清，海风很凉快。,0.0,0.5745000243186951,"值得, 适合, 环境, 干净, 休闲, 公园, 空气清新, 瀑布, 水, 很漂亮","['景色', '很漂亮', '海水', '清', '海风', '凉快']",卫生,41,1.0,55836,3
A41,2015-11-26,虽然作为本地人应当对本地旅游业给予支持，但是，确实做的不好啊！,11.0,0.4659000039100647,"景色, 美, 感觉, 山上, 值得, 中, 优美, 拍, 交通, 少","['本地人', '旅游业', '给予', '支持', '确实', '做', '不好']",位置,41,1.0,55837,3
A41,2015-10-03,5分，景色不错，空气新鲜，很适合情侣休闲度假，是度蜜月的好去处！,0.0,0.5625,"值得, 适合, 环境, 干净, 休闲, 公园, 空气清新, 瀑布, 水, 很漂亮","['景色', '空气', '新鲜', '适合', '情侣', '休闲', '度假', '度蜜月', '好去处']",卫生,41,2.0,55838,4
A41,2015-10-03,不错，景色秀丽，海水湛蓝,11.0,0.5253000259399414,"景色, 美, 感觉, 山上, 值得, 中, 优美, 拍, 交通, 少","['景色', '秀丽', '海水', '湛蓝']",位置,41,1.0000000000000004,55839,3
A41,2015-09-29,过年去的，人少，船也还好，睡了一觉就到了,6.0,0.428600013256073,"上山, 广东, 导游, 山顶, 时, 走, 到达, 两个, 下午, 坐","['过年', '少', '船', '还好', '睡', '一觉']",服务,41,1.0000000000000004,55840,3
A41,2015-09-28,还可以，岛上的酒店有点旧,1.0,0.3589999973773956,"风景, 表演, 值得, 一般般, 位于, 晚上, 好看, 建筑, 美丽, 大自然","['岛上', '旧']",服务,41,1.0000000000000004,55841,3
A41,2015-09-28,取票方便，含往返船票及入岛费用，比去售票处买便宜。,3.0,0.3233999907970428,"走, 高, 性价比, 免费, 太, 坐, 建议, 观音, 开车, 感觉","['含', '往返', '船票', '入岛', '费用', '售票处', '便宜']",性价比,41,1.0,55842,3
A41,2015-09-12,取票非常方便，而且也便宜很多，唯一的缺点就是没有发票，希望能有发票就好了。,12.0,0.3698000013828277,"动物, 爬, 岛, 沙滩, 天然, 氧吧, 表演, 广州, 动物园, 种类","['便宜', '唯一', '缺点', '发票', '希望', '发票']",设施,41,1.0,55843,3
A41,2015-09-23,非常值得去，国庆人也不多，房间看海，听海。住上晚心情大好,0.0,0.7702000141143799,"值得, 适合, 环境, 干净, 休闲, 公园, 空气清新, 瀑布, 水, 很漂亮","['值得', '国庆', '房间', '海', '听', '海', '住', '上晚', '心情', '大好']",卫生,41,1.0,55844,3
A41,2015-10-31,稍微小了点，水清沙幼，真的很美，就是住宿价格太贵，连小木屋都要几百一晚。有晚上的BbQ,7.0,0.3723999857902527,"环境, 贵, 很好, 没什么, 吃, 东西, 太, 差, 感觉, 风景","['稍微', '水清沙', '幼', '真的', '美', '住宿', '价格', '太贵', '小木屋', '几百', '晚', '晚上']",性价比,41,1.0000000000000004,55845,3
A41,2015-09-05,好挺好的好挺好的..........,1.0,0.0768999978899955,"风景, 表演, 值得, 一般般, 位于, 晚上, 好看, 建筑, 美丽, 大自然","['好挺好', '好挺好', '..........']",服务,41,1.0000000000000004,55846,3
A41,2015-09-05,5分，取票很方便，性价比高，值得一去,3.0,0.5285000205039978,"走, 高, 性价比, 免费, 太, 坐, 建议, 观音, 开车, 感觉","['性价比', '高', '值得']",性价比,41,1.0,55847,3
A41,2015-09-05,5分，景色非常美，视觉效果好,11.0,0.5194000005722046,"景色, 美, 感觉, 山上, 值得, 中, 优美, 拍, 交通, 少","['景色', '美', '视觉效果']",位置,41,1.0000000000000004,55848,3
