A41,2015-10-04,上去时坐大船要40分钟，回来时太多人了坐冲锋舟大约15分钟。岛上还有黑山羊、野生波萝丶旁蟹，国庆期间海景房都没了，只好坐船回去了。,6.0,0.6093000173568726,"上山, 广东, 导游, 山顶, 时, 走, 到达, 两个, 下午, 坐","['时', '坐', '大船', '分钟', '回来', '时太', '坐', '冲锋舟', '分钟', '岛上', '黑山羊', '野生', '波萝', '丶', '旁', '蟹', '国庆', '期间', '海景房', '没了', '只好', '坐船', '回去']",服务,41,1.0000000000000004,55698,3
A41,2017-10-12,价格太贵了，不过服务还可以。,7.0,0.5198000073432922,"环境, 贵, 很好, 没什么, 吃, 东西, 太, 差, 感觉, 风景","['价格', '太贵', '服务']",性价比,41,1.0000000000000004,55699,3
A41,2017-08-09,潜水太坑了，说好的全程90分钟，其中水下30分钟，结果从出发到回来就30分钟。真是太坑，千万别玩。还400元，死贵。,6.0,0.6776000261306763,"上山, 广东, 导游, 山顶, 时, 走, 到达, 两个, 下午, 坐","['潜水', '太坑', '说好', '全程', '分钟', '水下', '分钟', '出发', '回来', '分钟', '真是太', '坑', '千万别', '死', '贵']",服务,41,1.0000000000000004,55700,3
A41,2017-11-20,好地方，感觉很不错，水清能见度超清,11.0,0.5386000275611877,"景色, 美, 感觉, 山上, 值得, 中, 优美, 拍, 交通, 少","['感觉', '水清', '能见度', '超清']",位置,41,1.0000000000000004,55701,3
A41,2017-08-24,没有去过的，可以动身去游一游，这里不是遍地沙滩，还泥海边，但是在离岸不远有很多沙，其申也有凉亭，风景不错，这里的海鲜不错。,1.0,0.2477999925613403,"风景, 表演, 值得, 一般般, 位于, 晚上, 好看, 建筑, 美丽, 大自然","['去过', '动身', '游一', '遍地', '沙滩', '泥', '海边', '离岸', '不远', '沙', '申', '凉亭', '风景', '海鲜']",服务,41,1.0000000000000004,55702,3
A41,2017-10-08,可能是下雨吧，没什么好看的，就2个景点，不玩项目真没必要去,2.0,0.4855000078678131,"好玩, 开心, 太, 天气, 项目, 特别, 舒服, 夏天, 热, 风景","['下雨', '没什么', '好看', '项目', '真']",设施,41,1.0000000000000004,55703,3
A41,2017-11-20,上到岛无什么好玩，游水地方少，无聊。,2.0,0.3095999956130981,"好玩, 开心, 太, 天气, 项目, 特别, 舒服, 夏天, 热, 风景","['上到', '岛', '好玩', '游水', '少', '无聊']",设施,41,-1.0,55704,2
A41,2017-11-01,非常好 朋友很喜欢 下次还会去的,10.0,0.7692000269889832,"喜欢, 下次, 漂亮, 朋友, 值得, 去过, 机会, 字, 开心, 风景优美","['朋友', '喜欢', '下次']",位置,41,1.0,55705,3
A41,2016-08-16,放松，浪漫，休闲度假好去处……,0.0,0.8460999727249146,"值得, 适合, 环境, 干净, 休闲, 公园, 空气清新, 瀑布, 水, 很漂亮","['放松', '浪漫', '休闲', '度假', '好去处']",卫生,41,1.0,55706,3
A41,2017-08-14,环岛步行一圈有点累，不过值得，空气很好，环岛电动观光车居然要50块钱一个人，个人觉得十分不合理！,3.0,0.5795000195503235,"走, 高, 性价比, 免费, 太, 坐, 建议, 观音, 开车, 感觉","['环岛', '步行', '一圈', '有点累', '值得', '空气', '环岛', '电动', '观光车', '块钱', '不合理']",性价比,41,0.0,55707,2
A41,2017-10-11,还行，清静放松很不错的去处,11.0,0.4909000098705292,"景色, 美, 感觉, 山上, 值得, 中, 优美, 拍, 交通, 少","['行', '清静', '放松', '去处']",位置,41,1.0000000000000004,55708,3
A41,2017-10-12,在茂名火车站买票好像实惠一些，美景怡人,11.0,0.5946999788284302,"景色, 美, 感觉, 山上, 值得, 中, 优美, 拍, 交通, 少","['茂名', '火车站', '好像', '实惠', '美景', '怡']",位置,41,1.0000000000000004,55709,3
A41,2017-04-04,美丽的沙滩，清澈的海水，唯一的遗憾不会,0.0,0.3486999869346618,"值得, 适合, 环境, 干净, 休闲, 公园, 空气清新, 瀑布, 水, 很漂亮","['美丽', '沙滩', '清澈', '海水', '唯一', '遗憾']",卫生,41,1.0,55710,3
A41,2017-10-26,环境挺好的，空气质量好，可以去转一下,11.0,0.438400000333786,"景色, 美, 感觉, 山上, 值得, 中, 优美, 拍, 交通, 少","['环境', '空气质量']",位置,41,1.0000000000000004,55711,3
A41,2017-09-20,在茂名火车站买船票160比博贺码头便宜40,3.0,0.5192000269889832,"走, 高, 性价比, 免费, 太, 坐, 建议, 观音, 开车, 感觉","['茂名', '火车站', '船票', '比博贺', '码头', '便宜']",性价比,41,1.0,55712,3
A41,2017-09-01,值得游玩，租台车环岛游一圈，走路几小时还没走完，泡泡海水很不错。,3.0,0.3878999948501587,"走, 高, 性价比, 免费, 太, 坐, 建议, 观音, 开车, 感觉","['值得', '租', '台车', '环岛游', '一圈', '走路', '几小时', '没走', '泡泡', '海水']",性价比,41,1.0,55713,3
A41,2016-10-08,还没出发之前是很期待的，去了以后真心不想去了，建议早上一早进岛，下午出岛就可以了，不过要留意出岛时间，真心没必要在岛上住一晚，住的也太贵了，除了帐篷以外，吃的也还好，反正就差强人意的旅程……,7.0,0.3291000127792358,"环境, 贵, 很好, 没什么, 吃, 东西, 太, 差, 感觉, 风景","['出发', '期待', '真心', '不想', '建议', '早上', '一早', '进岛', '下午', '岛', '留意', '岛', '真心', '岛上', '住', '一晚', '住', '太贵', '帐篷', '吃', '还好', '反正', '差强人意', '旅程']",性价比,41,1.0,55714,3
A41,2017-09-02,暑假快结束的时候去 人少 风景真不错,2.0,0.602400004863739,"好玩, 开心, 太, 天气, 项目, 特别, 舒服, 夏天, 热, 风景","['暑假', '结束', '少', '风景', '真不错']",设施,41,1.0000000000000004,55715,3
A41,2017-08-10,去过的地方属**的性价比最低了，低到无法言喻,3.0,0.3418000042438507,"走, 高, 性价比, 免费, 太, 坐, 建议, 观音, 开车, 感觉","['去过', '属', '性价比', '最低', '低', '言喻']",性价比,41,-1.0,55716,2
A41,2017-08-01,一点都不好玩，还里面都是石子脚踩下去都痛死了，而且里面也没吃的，还不如去阳江。。。,7.0,0.607200026512146,"环境, 贵, 很好, 没什么, 吃, 东西, 太, 差, 感觉, 风景","['一点', '不好玩', '石子', '脚', '踩下去', '痛死', '吃', '阳江']",性价比,41,1.0000000000000004,55717,3
A41,2017-08-15,垃圾地方，还未开放，收费特贵,9.0,0.3975000083446502,"山, 爬山, 好多, 希望, 太, 美的, 钱, 水, 骑, 活动","['垃圾', '未', '开放', '收费', '特贵']",设施,41,0.0,55718,2
A41,2017-08-27,风景很美，就是吃的东西太贵，岛上适合小朋友游玩,7.0,0.7573999762535095,"环境, 贵, 很好, 没什么, 吃, 东西, 太, 差, 感觉, 风景","['风景', '美', '吃', '东西', '太贵', '岛上', '适合']",性价比,41,0.0,55719,2
A41,2017-08-07,**没有第二次去的人。,10.0,0.5385000109672546,"喜欢, 下次, 漂亮, 朋友, 值得, 去过, 机会, 字, 开心, 风景优美",['第二次'],位置,41,1.0000000000000004,55720,3
A41,2017-08-19,水天一色，值得旅行放心自我的地方。,0.0,0.3842999935150146,"值得, 适合, 环境, 干净, 休闲, 公园, 空气清新, 瀑布, 水, 很漂亮","['水天一色', '值得', '旅行', '放心', '自我']",卫生,41,1.0,55721,3
A41,2017-01-27,这个地方是一个荒岛人工开凿成的景点，需要坐游船过去，里面的自然风景还可以，还可以潜水，有个小沙滩，还有好几个人工造的景点，象公鸡下蛋，章鱼保罗之类的，本人不喜欢人工景点，去爬一下山也好，不用坐车上去，山不高的。,3.0,0.3643999993801117,"走, 高, 性价比, 免费, 太, 坐, 建议, 观音, 开车, 感觉","['荒岛', '人工', '开凿', '成', '坐', '游船', '自然风景', '潜水', '有个', '沙滩', '好几个', '人工', '造', '象', '公鸡', '下蛋', '章鱼', '保罗', '喜欢', '人工', '爬', '山', '不用', '坐车', '山', '高']",性价比,41,1.0,55722,3
A41,2017-08-09,值得大家去看看去走走，去享受那份美好的时光！,0.0,0.6503000259399414,"值得, 适合, 环境, 干净, 休闲, 公园, 空气清新, 瀑布, 水, 很漂亮","['值得', '走走', '享受', '份', '美好', '时光']",卫生,41,3.0,55723,4
A41,2017-08-09,不错，相对过度开发的其他海岛还是物有所值，住宿有欠缺,3.0,0.5192999839782715,"走, 高, 性价比, 免费, 太, 坐, 建议, 观音, 开车, 感觉","['过度', '开发', '海岛', '物有所值', '住宿', '欠缺']",性价比,41,-1.0,55724,2
A41,2017-08-09,度假公园很好，很喜欢，特别放松心情,0.0,0.5699999928474426,"值得, 适合, 环境, 干净, 休闲, 公园, 空气清新, 瀑布, 水, 很漂亮","['度假', '公园', '喜欢', '特别', '放松', '心情']",卫生,41,2.0,55725,4
A41,2017-07-24,总体景色非常好，可惜每天航船时间比较紧张，没有玩遍岛上。,8.0,0.2888000011444092,"空气, 设施, 可惜, 完善, 还行, 游乐, 有意思, 老板, 负离子, 商业","['总体', '景色', '可惜', '航船', '紧张', '玩遍', '岛上']",设施,41,-2.0,55726,1
A41,2016-09-22,**很棒呀，度假胜地，这座岛屿水静风轻，沙滩洁白，其条件适合开展浅水潜、深水潜、探险潜这三种目前国际流行的潜水运动，沙子也很干净。,0.0,0.3136000037193298,"值得, 适合, 环境, 干净, 休闲, 公园, 空气清新, 瀑布, 水, 很漂亮","['很棒', '度假胜地', '座', '岛屿', '水', '静风', '轻', '沙滩', '洁白', '条件', '适合', '浅水', '潜', '深水', '潜', '探险', '潜', '三种', '国际', '流行', '潜水', '运动', '沙子', '干净']",卫生,41,3.0,55727,4
A41,2017-03-05,其实只到了码头，因为导航走错路了，到那里己经是下午6点多了，只好在外面吃了饭就返回湛江了,3.0,0.8845999836921692,"走, 高, 性价比, 免费, 太, 坐, 建议, 观音, 开车, 感觉","['码头', '导航', '走', '错路', '经是', '下午', '只好', '外面', '吃了饭', '返回', '湛江']",性价比,41,1.0000000000000004,55728,3
A41,2017-01-13,这里是茂名市电白区最好的海洋风景区，更像一个海洋公园。当地人说**，又名湾舟，原名汾州山，位于广东茂名电白区博贺港对面8公里的海上，面积1.9平方公里，为茂名最大的海岛。最好的好的海洋风景区。,3.0,0.2675999999046325,"走, 高, 性价比, 免费, 太, 坐, 建议, 观音, 开车, 感觉","['茂名市', '电', '白区', '海洋', '风景区', '海洋公园', '当地人', '又名', '湾', '舟', '原名', '汾州山', '位于', '广东', '茂名', '电', '白区', '博贺港', '对面', '公里', '海上', '面积', '平方公里', '茂名', '海岛', '海洋', '风景区']",性价比,41,1.0000000000000004,55729,3
A41,2017-03-06,由于时间匆忙，没来得及上岛游玩，只在**海边玩了一会儿，感觉非常舒服，海风拂面，聆听海声，踩踩细沙，无比的惬意，下次想去上岛游玩。,0.0,0.2108000069856643,"值得, 适合, 环境, 干净, 休闲, 公园, 空气清新, 瀑布, 水, 很漂亮","['匆忙', '岛', '海边', '一会儿', '感觉', '舒服', '海风', '拂面', '聆听', '海声', '踩', '踩', '细沙', '无比', '惬意', '下次', '想去', '上岛']",卫生,41,2.0,55730,4
A41,2017-07-30,特别差，不好玩，又热又晒。还特别贵，不敢花钱，一花就是几千。,7.0,0.4214999973773956,"环境, 贵, 很好, 没什么, 吃, 东西, 太, 差, 感觉, 风景","['特别', '差', '不好玩', '热', '晒', '特别', '贵', '花钱', '花', '几千']",性价比,41,2.0,55731,4
A41,2015-07-26,**之行 天气很给力 坐船很刺激 浪很大 船砰砰的起落 岛上遛一圈景色很美,3.0,0.3878999948501587,"走, 高, 性价比, 免费, 太, 坐, 建议, 观音, 开车, 感觉","['行', '天气', '力', '坐船', '刺激', '浪', '很大', '船', '砰砰', '起落', '岛上', '遛', '一圈', '景色', '美']",性价比,41,-1.0,55732,2
A41,2017-07-02,骑个摩托车环岛一圈很不错，看看风景，玩玩水，逛逛沙滩，哈哈，吃就一般般了，住太贵了,7.0,0.2867999970912933,"环境, 贵, 很好, 没什么, 吃, 东西, 太, 差, 感觉, 风景","['骑', '摩托车', '环岛', '一圈', '风景', '玩玩', '水', '逛逛', '沙滩', '吃', '一般般', '住', '太贵']",性价比,41,1.0000000000000004,55733,3
A41,2016-09-02,去的时候是淡季上午10点第一班船进岛大概30分钟到到了之后直接在码头办理酒店入住岛上的景色确实不错但是沙滩很小能游泳的地方很小如果是去游泳不建议这里岛上的景点不错吃的比外面贵这是景点的通病了,12.0,0.3799999952316284,"动物, 爬, 岛, 沙滩, 天然, 氧吧, 表演, 广州, 动物园, 种类","['淡季', '上午', '第一', '班船', '进岛', '分钟', '码头', '办理', '入住', '岛上', '景色', '确实', '沙滩', '很小', '游泳', '很小', '游泳', '建议', '岛上', '吃', '外面', '贵', '通病']",设施,41,1.0,55734,3
A41,2017-05-01,还是挺方便的，使用很便捷！,5.0,0.5383999943733215,"温泉, 服务, 服务态度, 满意, 泡温泉, 热情, 家人, 工作人员, 方便快捷, 态度",['便捷'],服务,41,1.0000000000000004,55735,3
A41,2017-03-13,服务态度好好，取票很方便。,3.0,0.3589999973773956,"走, 高, 性价比, 免费, 太, 坐, 建议, 观音, 开车, 感觉","['服务态度', '好好']",性价比,41,1.0000000000000004,55736,3
A41,2017-06-07,非常好的一处海滩，沙子柔软细腻，还有潜水项目，非常有趣。,2.0,0.3230000138282776,"好玩, 开心, 太, 天气, 项目, 特别, 舒服, 夏天, 热, 风景","['一处', '海滩', '沙子', '柔软', '细腻', '潜水', '项目', '有趣']",设施,41,3.0,55737,4
A41,2017-01-30,交通方便，岛上宿、吃食价格比较合理，环境优雅！岛上绿化覆盖率达到百分之九十以上，岛上景点之多，道路方便，海上旅游项目适合不同年龄参与！,7.0,0.3440000116825104,"环境, 贵, 很好, 没什么, 吃, 东西, 太, 差, 感觉, 风景","['交通', '岛上', '宿', '吃食', '价格', '环境', '优雅', '岛上', '绿化', '覆盖率', '百分之九十', '岛上', '道路', '海上', '项目', '适合', '年龄', '参与']",性价比,41,2.0,55738,4
A41,2015-09-08,**本来就很漂亮的，只是我们去的时候是阴雨天，海水不蓝，可见度不高，风浪挺大的，坐船的时候爽死了，几个朋友在鸡头那里吹海风，听海水冲击石头的声音，躺在石头上任海风挑逗，很惬意，很祥和，有种身在世外桃源的感觉，远离繁华的都市让自己很轻松很舒服！海岛很小，一个多小时徒步就逛完了，不过岛上消费很贵，住宿最低都要三百多，去玩能自带的吃喝的最好自带了！,3.0,0.3556999862194061,"走, 高, 性价比, 免费, 太, 坐, 建议, 观音, 开车, 感觉","['本来', '很漂亮', '阴雨天', '海水', '蓝', '可见度', '高', '风浪', '挺大', '坐船', '爽死', '几个', '朋友', '鸡头', '吹', '海风', '听', '海水', '冲击', '石头', '声音', '躺', '石头', '上任', '海风', '挑逗', '惬意', '祥和', '有种', '身', '世外桃源', '感觉', '远离', '繁华', '都市', '轻松', '舒服', '海岛', '很小', '一个多', '徒步', '逛', '岛上', '消费', '贵', '住宿', '最低', '三百多', '玩能', '自带', '吃喝', '自带']",性价比,41,-2.0,55739,1
A41,2017-04-28,设施齐全，人文地理，海鲜很多，风景也不错;-),0.0,0.3424000144004822,"值得, 适合, 环境, 干净, 休闲, 公园, 空气清新, 瀑布, 水, 很漂亮","['设施', '齐全', '人文地理', '海鲜', '风景']",卫生,41,1.0000000000000004,55740,3
A41,2017-04-04,景区，里面吃饭的地方都没有，坐一个小时床然后,7.0,0.4411999881267547,"环境, 贵, 很好, 没什么, 吃, 东西, 太, 差, 感觉, 风景","['吃饭', '坐', '床']",性价比,41,1.0000000000000004,55741,3
A41,2016-03-18,鸡岛以形似一只昂首挺胸的雄鸡而得名，也是甲米的标志性景点，可惜鸡岛都是悬崖峭壁，没有沙滩，不能登岛，只能在其背面的海域进行浮潜或游泳！,12.0,0.5516999959945679,"动物, 爬, 岛, 沙滩, 天然, 氧吧, 表演, 广州, 动物园, 种类","['鸡岛', '形似', '一只', '昂首挺胸', '雄鸡', '得名', '甲米', '标志性', '可惜', '鸡岛', '悬崖峭壁', '沙滩', '登岛', '只能', '背面', '海域', '浮潜', '游泳']",设施,41,-1.0,55742,2
A41,2016-09-24,还可以吧，景色很漂亮，就是岛上消费比较高。,7.0,0.5001000165939331,"环境, 贵, 很好, 没什么, 吃, 东西, 太, 差, 感觉, 风景","['景色', '很漂亮', '岛上', '消费', '高']",性价比,41,1.0000000000000004,55743,3
A41,2017-04-05,海上娱乐节目挺多的，而且还有妈**，也有海鲜呢。,7.0,0.5386000275611877,"环境, 贵, 很好, 没什么, 吃, 东西, 太, 差, 感觉, 风景","['海上', '娱乐节目', '妈', '海鲜']",性价比,41,1.0000000000000004,55744,3
A41,2017-04-04,远离市区，必须自驾，风景非常漂亮,3.0,0.4234000146389007,"走, 高, 性价比, 免费, 太, 坐, 建议, 观音, 开车, 感觉","['远离', '市区', '自驾', '风景', '漂亮']",性价比,41,0.0,55745,2
A41,2017-03-19,大概是中午登岛的，坐船的过程很刺激，岛上景色很美，如果是徒步的话估计要走得比较久。推荐指数五颗星吧,3.0,0.4668999910354614,"走, 高, 性价比, 免费, 太, 坐, 建议, 观音, 开车, 感觉","['中午', '登岛', '坐船', '过程', '刺激', '岛上', '景色', '美', '徒步', '估计', '走', '久', '推荐', '指数', '五颗星']",性价比,41,0.0,55746,2
A41,2017-04-01,地方值得一游，但酒店名称不具体，找了很久才知道不是海洋度假公园而是博贺港大酒店。,0.0,0.5055999755859375,"值得, 适合, 环境, 干净, 休闲, 公园, 空气清新, 瀑布, 水, 很漂亮","['值得', '名称', '找', '很久', '海洋', '度假', '公园', '博贺港', '大酒店']",卫生,41,1.0,55747,3
A41,2017-03-31,虽然景色不错，但消费超贵，设施陈旧，不只得去。,3.0,0.320499986410141,"走, 高, 性价比, 免费, 太, 坐, 建议, 观音, 开车, 感觉","['景色', '消费', '超贵', '设施', '陈旧', '只得']",性价比,41,-1.0,55748,2
A41,2016-11-23,景色一般般，可能是冬天去吧，人很少。,2.0,0.2694000005722046,"好玩, 开心, 太, 天气, 项目, 特别, 舒服, 夏天, 热, 风景","['景色', '一般般', '冬天']",设施,41,1.0000000000000004,55749,3
A41,2017-03-22,离市区不远，海水很干净，特别推荐住岛上，早晨的海岛不容错过,0.0,0.5004000067710876,"值得, 适合, 环境, 干净, 休闲, 公园, 空气清新, 瀑布, 水, 很漂亮","['市区', '不远', '海水', '干净', '特别', '推荐', '住', '岛上', '早晨', '海岛', '容错过']",卫生,41,2.0,55750,4
A41,2016-12-01,冬季去**，清净，天蓝蓝水蓝蓝，这里的无敌海景别墅，特别适合情侣约会，面朝大海心花怒放…岛上慢生活，特别适合忙碌的都市人作个休整…来吧，你不会后悔……,0.0,0.441100001335144,"值得, 适合, 环境, 干净, 休闲, 公园, 空气清新, 瀑布, 水, 很漂亮","['冬季', '清净', '天蓝蓝', '水', '蓝蓝', '无敌', '海景', '别墅', '特别', '适合', '情侣', '约会', '面朝', '大海', '心花怒放', '岛上', '慢', '生活', '特别', '适合', '忙碌', '都市人', '作', '休整', '后悔']",卫生,41,6.0,55751,5
A41,2015-08-18,岛上确实很漂亮，在去哪儿上订便宜很多而且取票也方便。就是如果不是自驾游从市区到码头确实有点麻烦，车很难等,3.0,0.4047999978065491,"走, 高, 性价比, 免费, 太, 坐, 建议, 观音, 开车, 感觉","['岛上', '确实', '很漂亮', '上订', '便宜', '自驾游', '市区', '码头', '确实', '麻烦', '车', '难']",性价比,41,2.0,55752,4
A41,2017-03-09,来这里最好能够玩潜水，这里的海水能见度非常高,6.0,0.2718999981880188,"上山, 广东, 导游, 山顶, 时, 走, 到达, 两个, 下午, 坐","['潜水', '海水', '能见度', '高']",服务,41,1.0000000000000004,55753,3
A41,2016-07-30,带上情侣出岛上住一晚海景房是不错的选择……,0.0,0.369700014591217,"值得, 适合, 环境, 干净, 休闲, 公园, 空气清新, 瀑布, 水, 很漂亮","['带上', '情侣', '岛上', '住', '一晚', '海景房', '选择']",卫生,41,1.0000000000000004,55754,3
A41,2017-03-07,来这里应该参加一下潜水，毕竟这里的海水能见度全球第二,3.0,0.271699994802475,"走, 高, 性价比, 免费, 太, 坐, 建议, 观音, 开车, 感觉","['参加', '潜水', '海水', '能见度', '全球']",性价比,41,1.0,55755,3
A41,2017-02-03,环境不错，海天共一色，携人共游美景,11.0,0.4338999986648559,"景色, 美, 感觉, 山上, 值得, 中, 优美, 拍, 交通, 少","['环境', '海天', '一色', '携', '美景']",位置,41,1.0000000000000004,55756,3
A41,2016-12-30,整体环境不错哦，看点很多，,7.0,0.483599990606308,"环境, 贵, 很好, 没什么, 吃, 东西, 太, 差, 感觉, 风景","['整体', '环境', '看点']",性价比,41,1.0000000000000004,55757,3
A41,2017-02-23,很好的一个海岛，就是不大力宣传宣传！,7.0,0.5386999845504761,"环境, 贵, 很好, 没什么, 吃, 东西, 太, 差, 感觉, 风景","['很好', '海岛', '宣传', '宣传']",性价比,41,1.0000000000000004,55758,3
A41,2017-02-20,浪漫七夕情人节！我想应该好好去,3.0,0.3781000077724457,"走, 高, 性价比, 免费, 太, 坐, 建议, 观音, 开车, 感觉","['浪漫', '七夕', '情人节', '想', '好好']",性价比,41,1.0,55759,3
A41,2017-02-17,**不大但风景优美，游人比较少，但是真的是值得去玩的好地方，环岛一周你收获更多。,10.0,0.5001999735832214,"喜欢, 下次, 漂亮, 朋友, 值得, 去过, 机会, 字, 开心, 风景优美","['风景优美', '游人', '少', '真的', '值得', '环岛', '一周', '收获']",位置,41,2.0,55760,4
A41,2015-10-03,网上购票非常方便，到售票窗口直接取票,4.0,0.6092000007629395,"便宜, 价格, 优惠, 网上, 现场, 不用, 实惠, 排队, 购票, 订","['网上', '购票', '售票', '窗口']",性价比,41,1.0000000000000004,55761,3
A41,2015-10-02,水超级清，可能是开发得不是很好，上来的人比较少，海很漂亮！拍照都是美美的。果，花，孔雀，随处可见，,0.0,0.4603999853134155,"值得, 适合, 环境, 干净, 休闲, 公园, 空气清新, 瀑布, 水, 很漂亮","['水', '超级', '清', '开发', '少', '海', '很漂亮', '拍照', '美美', '果', '花', '孔雀', '随处可见']",卫生,41,1.0,55762,3
A41,2016-12-07,直接码头购票处取票，上船方便，节省时间，船很大很稳……就是岛上风景太好了回程显得有点赶了！,3.0,0.2324000000953674,"走, 高, 性价比, 免费, 太, 坐, 建议, 观音, 开车, 感觉","['码头', '购票', '处取', '上船', '节省时间', '船', '很大', '很稳', '岛上', '风景', '太好了', '回程', '显得']",性价比,41,1.0,55763,3
A41,2016-09-08,2015年6月份去的，在淘宝定了个套餐，有一间独幢木屋别墅，好像叫凤凰别墅，加船票门票，两天一夜游。木屋打开窗就看到海，有很多海上设施玩，我没去。租了一辆电动车环岛逛一下。有些小动物放养,3.0,0.3587999939918518,"走, 高, 性价比, 免费, 太, 坐, 建议, 观音, 开车, 感觉","['年', '月份', '淘宝', '套餐', '一间', '幢', '木屋', '别墅', '好像', '凤凰', '别墅', '加', '船票', '两天', '一夜', '木屋', '打开', '窗', '海', '海上', '设施', '租', '一辆', '电动车', '环岛', '逛', '动物', '放养']",性价比,41,1.0000000000000004,55764,3
A41,2016-08-10,沙滩小，乱石多，酒店贵，设备却如小旅馆，绝对不会去下次,12.0,0.216399997472763,"动物, 爬, 岛, 沙滩, 天然, 氧吧, 表演, 广州, 动物园, 种类","['沙滩', '乱石', '贵', '设备', '旅馆', '下次']",设施,41,1.0000000000000004,55765,3
A41,2015-10-04,**真的很美，水清澈见底。环境自然生态优美，很值得一去。但是消费价格太高了，加上我们入岛时遇到台风影响，岛上的管理人员一点都没良心，还骗旅客台风已远离，还让酒店打折来吸引旅客留岛，真的无言。,11.0,0.4271999895572662,"景色, 美, 感觉, 山上, 值得, 中, 优美, 拍, 交通, 少","['真的', '美', '水', '清澈见底', '环境', '自然生态', '优美', '值得', '消费', '价格', '太', '高', '入岛', '时', '台风', '影响', '岛上', '管理人员', '一点', '没良心', '骗', '旅客', '台风', '远离', '打折', '吸引', '旅客', '留岛', '真的', '无言']",位置,41,2.0,55766,4
A41,2016-04-10,岛上风光一般，上岛时下雨，回程人多，等了很久才有船，,6.0,0.4763000011444092,"上山, 广东, 导游, 山顶, 时, 走, 到达, 两个, 下午, 坐","['岛上', '风光', '上岛', '时', '下雨', '回程', '很久', '船']",服务,41,1.0000000000000004,55767,3
A41,2016-10-06,环境非常好，海水很蓝，岛非常大,0.0,0.462799996137619,"值得, 适合, 环境, 干净, 休闲, 公园, 空气清新, 瀑布, 水, 很漂亮","['环境', '海水', '蓝', '岛']",卫生,41,1.0000000000000004,55768,3
