A09,2015-10-06,失望远比惊喜来得多，期望越大，失望越大的道理在这里体现的太好了！不过管理服务不错，如果问以后还来吗，我的回答绝不犹豫：不来了！,10.0,0.2522000074386596,"喜欢, 下次, 漂亮, 朋友, 值得, 去过, 机会, 字, 开心, 风景优美","['失望', '远', '惊喜', '来得', '期望', '越', '失望', '越', '道理', '体现', '太好了', '管理', '服务', '问', '回答', '犹豫', '不来']",位置,9,2.0,31173,4
A09,2015-08-11,觉得小贵毕竟是5A风景是没话说,7.0,0.2924999892711639,"环境, 贵, 很好, 没什么, 吃, 东西, 太, 差, 感觉, 风景","['小贵', '风景', '没话说']",性价比,9,1.5,31174,3
A09,2016-01-02,**还是挺不错的，不过由于时间不够。所以只玩了大半天，建议两天时间，有些地方太陡，没敢上去。,3.0,0.4691999852657318,"走, 高, 性价比, 免费, 太, 坐, 建议, 观音, 开车, 感觉","['挺不错', '大半天', '建议', '两天', '太陡', '敢上去']",性价比,9,1.5,31175,3
A09,2015-10-09,去了才发现景点门票也是140元，里面摊贩超多，不过爬到山顶景色还可以，不过那里也有摊贩,11.0,0.287200003862381,"景色, 美, 感觉, 山上, 值得, 中, 优美, 拍, 交通, 少","['发现', '摊贩', '超多', '爬', '山顶', '景色', '摊贩']",位置,9,1.5,31176,3
A09,2015-06-20,**是丹霞地貌的典型代表，奇林怪石确实让人感叹不已。在韶关东站可以坐专线到景区门口，也有很多面包车在拉客，差不多一个小时的车程。景区门口和景区内也有很多住宿的地方，到饭店吃饭记得要跟店家讲一下价，如果想看日出可以在这里住下。景区还有巴士，免去了许多步行。,6.0,0.3684999942779541,"上山, 广东, 导游, 山顶, 时, 走, 到达, 两个, 下午, 坐","['丹霞地貌', '典型', '代表', '奇林', '怪石', '确实', '感叹', '韶关', '东站', '坐', '专线', '门口', '面包车', '拉客', '车程', '门口', '住宿', '饭店', '吃饭', '记得', '店家', '讲', '价', '想', '日出', '住', '巴士', '免去', '步行']",服务,9,0.0,31177,1
A09,2015-08-04,作为韶关人，丹霞是肯定要推荐的，爬山看风景，丹霞不比什么黄山华山差，只能说是风格有所不同，丹霞是南方的，所以给人感觉更加秀气一点，气势磅礴的景色确实比较少，丹霞从发现阳元石以后名声响亮了很多，可见这阳元石是比较值得一看的,3.0,0.4483999907970428,"走, 高, 性价比, 免费, 太, 坐, 建议, 观音, 开车, 感觉","['韶关', '丹霞', '肯定', '推荐', '爬山', '风景', '丹霞', '黄山', '华山', '差', '只能', '风格', '有所不同', '丹霞', '南方', '感觉', '秀气', '一点', '气势磅礴', '景色', '确实', '少', '丹霞', '发现', '阳元石', '名声', '响亮', '阳元石', '值得一看']",性价比,9,4.0,31178,5
A09,2015-12-19,非常方便！输编号票就出来了！,8.0,0.0768999978899955,"空气, 设施, 可惜, 完善, 还行, 游乐, 有意思, 老板, 负离子, 商业","['输', '编号']",设施,9,1.5,31179,3
A09,2015-12-29,进园挺方便，主要的景点还是比较容易找到的，如果不带小孩可能会舒服点，总算领略了广东四大名山之首。,0.0,0.5256999731063843,"值得, 适合, 环境, 干净, 休闲, 公园, 空气清新, 瀑布, 水, 很漂亮","['进园', '找到', '舒服', '总算', '领略', '广东', '四大', '名山', '首']",卫生,9,1.0,31180,2
A09,2015-10-06,取门票很方便，人不多，排队很快，赞?,5.0,0.5687000155448914,"温泉, 服务, 服务态度, 满意, 泡温泉, 热情, 家人, 工作人员, 方便快捷, 态度","['取', '人不多', '排队', '很快', '赞']",服务,9,1.5,31181,3
A09,2015-10-06,**不错，很好的风光，爬爬山更有意思,12.0,0.3736000061035156,"动物, 爬, 岛, 沙滩, 天然, 氧吧, 表演, 广州, 动物园, 种类","['很好', '风光', '爬', '爬山', '有意思']",设施,9,1.5,31182,3
A09,2015-10-06,玩了一天，也爬了一天，累却开心?,2.0,0.5001000165939331,"好玩, 开心, 太, 天气, 项目, 特别, 舒服, 夏天, 热, 风景","['爬', '累', '开心']",设施,9,1.0,31183,2
A09,2015-03-01,景^取票狠方便，Ｓ么翱冢直接呙瓒Sa。12月淡季去的，人不多，天夂茫T票又打折，太划算t。**不愧是世界自然za，世界地|公@p冠王，群象出山和L老峰L景_震撼！L景^狠大，安排商毂容^合m，L景^染陀谐宰〉模也方便，M分推]！,2.0,0.2443999946117401,"好玩, 开心, 太, 天气, 项目, 特别, 舒服, 夏天, 热, 风景","['景^', '狠', 'Ｓ', '窗口', '呙', '二S', 'a', '月', '淡季', '人不多', '天', 'T票', '打折', '太', '划算', 't', '不愧', '世界', '自然', 'za', '世界', '地|', '公@', 'p', '冠王', '群象', '出山', 'L', '老峰', 'L景', '_', '震撼', 'L景^', '狠大', '安排', '商', '比^', '合m', 'L景^', '', '吃住', 'M分', '推]']",设施,9,1.0,31184,2
A09,2015-10-05,要是在船顶能呆更久就好了,11.0,0.5383999943733215,"景色, 美, 感觉, 山上, 值得, 中, 优美, 拍, 交通, 少","['船顶', '呆', '更久']",位置,9,1.5,31185,3
A09,2015-12-14,其实，一般吧。。去过名山的就别趟这浑水,0.0,0.219200000166893,"值得, 适合, 环境, 干净, 休闲, 公园, 空气清新, 瀑布, 水, 很漂亮","['去过', '名山', '就别', '趟', '浑水']",卫生,9,1.5,31186,3
A09,2015-09-20,景色一般，价格坑爹，性价比非常低。比门票与这差不多的张家界、三峡景区、黄山、桂林山水等差几个档次！最多值80-100元，不能再多了。以上景区去了一次，还想去第二、第三……次，**再不想去第二次！,7.0,0.2449000030755996,"环境, 贵, 很好, 没什么, 吃, 东西, 太, 差, 感觉, 风景","['景色', '价格', '坑', '爹', '性价比', '非常低', '张家界', '三峡', '黄山', '桂林山水', '差', '几个', '档次', '最多', '值', '想', '第三', '次', '不想', '第二次']",性价比,9,1.5,31187,3
A09,2015-12-30,感觉门票特别贵，景区各种设施有点简陋，惨不忍睹。,7.0,0.8154000043869019,"环境, 贵, 很好, 没什么, 吃, 东西, 太, 差, 感觉, 风景","['感觉', '特别', '贵', '设施', '简陋', '惨不忍睹']",性价比,9,-1.0,31188,1
A09,2015-10-01,风景区比较大，丹霞地貌出彩排,0.0,0.692300021648407,"值得, 适合, 环境, 干净, 休闲, 公园, 空气清新, 瀑布, 水, 很漂亮","['风景区', '丹霞地貌', '彩排']",卫生,9,1.5,31189,3
A09,2015-10-01,景色漂亮，山路陡峭，不错,3.0,0.2711000144481659,"走, 高, 性价比, 免费, 太, 坐, 建议, 观音, 开车, 感觉","['景色', '漂亮', '山路', '陡峭']",性价比,9,1.0,31190,2
A09,2015-12-13,有点贵 去到售票处有当地人推销可以优惠10块,4.0,0.3781000077724457,"便宜, 价格, 优惠, 网上, 现场, 不用, 实惠, 排队, 购票, 订","['贵', '售票处', '当地人', '推销', '优惠', '块']",性价比,9,1.5,31191,3
A09,2015-05-08,还不错啦，景色秀丽，配套设施还行，,11.0,0.5284000039100647,"景色, 美, 感觉, 山上, 值得, 中, 优美, 拍, 交通, 少","['景色', '秀丽', '配套', '设施', '行']",位置,9,1.5,31192,3
A09,2015-12-13,如果只去一天 就很不划算 建议住山里的客栈 玩两天,3.0,0.5415999889373779,"走, 高, 性价比, 免费, 太, 坐, 建议, 观音, 开车, 感觉","['不划算', '建议', '住', '山里', '客栈', '两天']",性价比,9,1.5,31193,3
A09,2015-12-12,已经玩完回来了，挺好，取票方便，便宜了。,6.0,0.51910001039505,"上山, 广东, 导游, 山顶, 时, 走, 到达, 两个, 下午, 坐","['玩完', '回来', '便宜']",服务,9,1.0,31194,2
A09,2015-12-09,不错不错，就是收费有点多,3.0,0.5385000109672546,"走, 高, 性价比, 免费, 太, 坐, 建议, 观音, 开车, 感觉",['收费'],性价比,9,1.5,31195,3
A09,2015-12-12,还好，取票方便啊。景区好大逛不完。。。,7.0,0.692300021648407,"环境, 贵, 很好, 没什么, 吃, 东西, 太, 差, 感觉, 风景","['还好', '逛']",性价比,9,1.5,31196,3
A09,2015-07-16,取票，服务都很好，景区很大，觉得玩3天才够，去**一定要去看日出，凌晨都有公交车开到坐缆车的地方，服务都很人性化,6.0,0.3122999966144562,"上山, 广东, 导游, 山顶, 时, 走, 到达, 两个, 下午, 坐","['服务', '很大', '天才', '够', '日出', '凌晨', '公交车', '开到', '坐', '缆车', '服务', '人性化']",服务,9,1.0,31197,2
A09,2015-09-29,好锻炼身体啊，可以去看看,8.0,0.0768999978899955,"空气, 设施, 可惜, 完善, 还行, 游乐, 有意思, 老板, 负离子, 商业",['锻炼身体'],设施,9,1.5,31198,3
A09,2015-12-07,门票贵了，建议不要再涨了,9.0,0.4086999893188476,"山, 爬山, 好多, 希望, 太, 美的, 钱, 水, 骑, 活动","['贵', '建议', '涨']",设施,9,1.5,31199,3
A09,2015-12-07,到达景点门口，取票非常方便，也不用排队，风景确实很美，爬得超累,4.0,0.3312000036239624,"便宜, 价格, 优惠, 网上, 现场, 不用, 实惠, 排队, 购票, 订","['到达', '门口', '不用', '排队', '风景', '确实', '美', '爬', '超累']",性价比,9,1.0,31200,2
A09,2015-12-04,4分，景色还可以，值得去一次，恐高的就没必要去啦。,11.0,0.7692000269889832,"景色, 美, 感觉, 山上, 值得, 中, 优美, 拍, 交通, 少","['景色', '值得', '恐高']",位置,9,1.0,31201,2
A09,2015-12-01,身份证取票，非常方便！,4.0,0.5385000109672546,"便宜, 价格, 优惠, 网上, 现场, 不用, 实惠, 排队, 购票, 订",['身份证'],性价比,9,1.5,31202,3
A09,2015-12-02,5分，景色真的很好看，很奇特！,11.0,0.3953000009059906,"景色, 美, 感觉, 山上, 值得, 中, 优美, 拍, 交通, 少","['景色', '真的', '好看', '奇特']",位置,9,1.5,31203,3
A09,2015-12-01,景点地方大，景色不错，值得走走,0.0,0.4709999859333038,"值得, 适合, 环境, 干净, 休闲, 公园, 空气清新, 瀑布, 水, 很漂亮","['景色', '值得', '走走']",卫生,9,1.0,31204,2
A09,2015-11-30,5分；风景不错，挺美的，这次时间紧迫，下次还要去！,1.0,0.2693000137805938,"风景, 表演, 值得, 一般般, 位于, 晚上, 好看, 建筑, 美丽, 大自然","['风景', '美的', '紧迫', '下次']",服务,9,-1.0,31205,1
A09,2015-09-19,好玩不过真的是体力活,2.0,0.692300021648407,"好玩, 开心, 太, 天气, 项目, 特别, 舒服, 夏天, 热, 风景","['好玩', '真的', '体力活']",设施,9,1.5,31206,3
A09,2015-09-17,门票可以玩两天！风景挺好的！适合去玩一下！,1.0,0.526199996471405,"风景, 表演, 值得, 一般般, 位于, 晚上, 好看, 建筑, 美丽, 大自然","['两天', '风景', '适合']",服务,9,1.0,31207,2
A09,2015-11-29,风景不错，爬山的过程很享受，是个好地方。,1.0,0.4178999960422516,"风景, 表演, 值得, 一般般, 位于, 晚上, 好看, 建筑, 美丽, 大自然","['风景', '爬山', '过程', '享受']",服务,9,1.0,31208,2
A09,2015-11-29,很漂亮，雨中漫步别有一番情趣,0.0,0.2782000005245209,"值得, 适合, 环境, 干净, 休闲, 公园, 空气清新, 瀑布, 水, 很漂亮","['很漂亮', '雨', '中', '漫步', '情趣']",卫生,9,1.5,31209,3
A09,2015-11-29,环境变化很大，看的出下了点功夫，但作为48小时有用的门票，应该基础照明修建一些,0.0,0.4517000019550323,"值得, 适合, 环境, 干净, 休闲, 公园, 空气清新, 瀑布, 水, 很漂亮","['环境', '变化很大', '出下', '功夫', '有用', '基础', '照明', '修建']",卫生,9,1.0,31210,2
A09,2015-09-13,第一次网上订门票，比现场购买便宜了10元一张。,4.0,0.7626000046730042,"便宜, 价格, 优惠, 网上, 现场, 不用, 实惠, 排队, 购票, 订","['第一次', '网上', '订', '现场', '购买', '便宜', '一张']",性价比,9,1.0,31211,2
A09,2015-09-13,景区很不错，好玩，取票方便，景色美,11.0,0.5194000005722046,"景色, 美, 感觉, 山上, 值得, 中, 优美, 拍, 交通, 少","['好玩', '景色', '美']",位置,9,1.5,31212,3
A09,2015-07-02,还好吧，实际就是代理商挂靠携*的，取票的时候还是要报携*的，要不然去不了票，预定的时候代理商没有注明，我是兜兜转转好几圈才取到票，不过去哪儿的客服很给力，遇到问题很快给我解决了，习惯好评,6.0,0.6425999999046326,"上山, 广东, 导游, 山顶, 时, 走, 到达, 两个, 下午, 坐","['还好', '代理商', '挂靠', '携', '报', '携', '预定', '代理商', '注明', '兜兜', '转转', '好几圈', '取到', '客服', '力', '很快', '解决', '习惯', '好评']",服务,9,2.0,31213,4
A09,2015-12-09,一百多的门票，进入觉得不值,7.0,0.3591000139713287,"环境, 贵, 很好, 没什么, 吃, 东西, 太, 差, 感觉, 风景","['一百多', '不值']",性价比,9,-1.0,31214,1
A09,2015-09-10,还行一起买了三张，取票什么的都方便,4.0,0.3589999973773956,"便宜, 价格, 优惠, 网上, 现场, 不用, 实惠, 排队, 购票, 订","['行', '三张']",性价比,9,1.5,31215,3
A09,2015-11-22,5分，99梯和长老峰都不错，值,6.0,0.6229000091552734,"上山, 广东, 导游, 山顶, 时, 走, 到达, 两个, 下午, 坐","['梯', '长老', '峰', '值']",服务,9,1.5,31216,3
A09,2015-11-23,4分，景色很美，空气很好，工作人员服务态度也很好，值得一游,11.0,0.3889999985694885,"景色, 美, 感觉, 山上, 值得, 中, 优美, 拍, 交通, 少","['景色', '美', '空气', '工作人员', '服务态度', '值得']",位置,9,1.0,31217,2
A09,2015-11-19,5 景色非常好 服务管理也到位,5.0,0.4196000099182129,"温泉, 服务, 服务态度, 满意, 泡温泉, 热情, 家人, 工作人员, 方便快捷, 态度","['景色', '服务', '管理', '到位']",服务,9,1.0,31218,2
A09,2015-10-04,国庆好多人....排队排半天，玩才十几分钟....,2.0,0.3578999936580658,"好玩, 开心, 太, 天气, 项目, 特别, 舒服, 夏天, 热, 风景","['国庆', '好多', '....', '排队', '排', '半天', '玩才', '十几分钟', '....']",设施,9,1.5,31219,3
A09,2015-10-01,我们去的时候一日游的人很少，结果那天就我们一对客人，旅行社还是载我们去到景点，搞得有点不好意思。不过遇到下雨，山只爬了一半。,9.0,0.3562999963760376,"山, 爬山, 好多, 希望, 太, 美的, 钱, 水, 骑, 活动","['一日游', '那天', '一对', '客人', '旅行社', '载', '搞', '不好意思', '下雨', '山', '爬', '一半']",设施,9,-1.0,31220,1
A09,2015-12-01,每张优惠了5块钱，没有什么惊喜！,3.0,0.2904999852180481,"走, 高, 性价比, 免费, 太, 坐, 建议, 观音, 开车, 感觉","['每张', '优惠', '块钱', '惊喜']",性价比,9,1.0,31221,2
A09,2015-09-04,很好滴滴答答，滴滴答答,8.0,0.0768999978899955,"空气, 设施, 可惜, 完善, 还行, 游乐, 有意思, 老板, 负离子, 商业","['滴滴答答', '滴滴答答']",设施,9,1.5,31222,3
A09,2015-11-16,还行吧，省内游算不错的了。,8.0,0.3589999973773956,"空气, 设施, 可惜, 完善, 还行, 游乐, 有意思, 老板, 负离子, 商业","['还行', '省内游', '算']",设施,9,1.5,31223,3
A09,2015-11-15,5分，景色说真的很美，我们居然用1天的时间把所有的景色看完啦，嘻嘻,11.0,0.4399000108242035,"景色, 美, 感觉, 山上, 值得, 中, 优美, 拍, 交通, 少","['景色', '说真的', '美', '天', '景色', '看完', '嘻嘻']",位置,9,1.0,31224,2
A09,2015-11-29,没有想象中的那么好，有点小失望,11.0,0.7692000269889832,"景色, 美, 感觉, 山上, 值得, 中, 优美, 拍, 交通, 少","['想象', '中', '失望']",位置,9,-1.0,31225,1
A09,2015-09-25,老同事一行重游古里。40年前，历史原因，我们曾多次经过韶关去江西赣南，一直不知道有**和南华寺这些知名景点，这次圆了梦！,0.0,0.4153999984264374,"值得, 适合, 环境, 干净, 休闲, 公园, 空气清新, 瀑布, 水, 很漂亮","['老同事', '一行', '重游', '古里', '年前', '历史', '原因', '曾多次', '韶关', '江西', '赣南', '南华', '寺', '知名', '圆', '梦']",卫生,9,1.5,31226,3
A09,2015-11-27,**景色非常崎特壮观，好玩，回家告诉我的朋友们来玩,6.0,0.3914999961853027,"上山, 广东, 导游, 山顶, 时, 走, 到达, 两个, 下午, 坐","['景色', '崎特', '壮观', '好玩', '回家', '告诉', '朋友']",服务,9,1.0,31227,2
A09,2016-01-02,我住韶关市，去过很多次，以前门票是五毛钱的，圈地收钱，和土匪没两样，,3.0,0.5231000185012817,"走, 高, 性价比, 免费, 太, 坐, 建议, 观音, 开车, 感觉","['住', '韶关市', '去过', '五毛钱', '圈地', '收钱', '土匪', '两样']",性价比,9,-1.0,31228,1
A09,2015-04-07,景区环境还不错，阳元山的物价估计在全国景区都算低的，节假日东西也没贵多少。网上定的票还要去窗口排队，略不方便，纳闷的是去哪儿下的单，收到的却是同程的短信,6.0,0.2660999894142151,"上山, 广东, 导游, 山顶, 时, 走, 到达, 两个, 下午, 坐","['环境', '阳', '元山', '物价', '估计', '全国', '算', '低', '节假日', '东西', '贵', '网上', '窗口', '排队', '纳闷', '收到', '却是', '同程', '短信']",服务,9,-1.0,31229,1
A09,2015-04-06,自然景色，确实特别，就是景区管理有点松散，好多地方没有指路标，让人迷糊。还有登山处的单行道也没有方向，又上又下，既不安全也堵人堵心。。。。,11.0,0.3815000057220459,"景色, 美, 感觉, 山上, 值得, 中, 优美, 拍, 交通, 少","['自然', '景色', '确实', '特别', '管理', '松散', '好多', '指', '路标', '迷糊', '登山', '处', '单行道', '方向', '堵', '堵心']",位置,9,3.0,31230,5
A09,2015-11-09,5分，景色非常漂亮，值得一玩,10.0,0.4167999923229217,"喜欢, 下次, 漂亮, 朋友, 值得, 去过, 机会, 字, 开心, 风景优美","['景色', '漂亮', '值得']",位置,9,2.0,31231,4
A09,2015-11-08,还不错，看看也挺好的,3.0,0.5383999943733215,"走, 高, 性价比, 免费, 太, 坐, 建议, 观音, 开车, 感觉",['挺好'],性价比,9,1.5,31232,3
A09,2015-11-09,评分5分，景色很美，很好玩，景区内消费不算高！,7.0,0.4137000143527984,"环境, 贵, 很好, 没什么, 吃, 东西, 太, 差, 感觉, 风景","['评分', '景色', '美', '好玩', '消费', '不算', '高']",性价比,9,1.5,31233,3
A09,2015-11-08,不错，在网上订票比售票大厅里买的优惠了一点点,4.0,0.3436999917030334,"便宜, 价格, 优惠, 网上, 现场, 不用, 实惠, 排队, 购票, 订","['网上', '售票', '大厅', '优惠', '一点点']",性价比,9,-1.0,31234,1
A09,2015-04-02,**自然风景很不错，至于游船票可以不买，直接坐20元的渡船效果一样。,3.0,0.7692000269889832,"走, 高, 性价比, 免费, 太, 坐, 建议, 观音, 开车, 感觉","['自然风景', '游船', '坐', '渡船', '效果']",性价比,9,1.5,31235,3
A09,2015-11-08,5分，风景超美，奇特的石像很形象、壮观，佛寺坐落在山内，很清幽、霸气。,1.0,0.3283999860286712,"风景, 表演, 值得, 一般般, 位于, 晚上, 好看, 建筑, 美丽, 大自然","['风景', '超', '美', '奇特', '石像', '形象', '壮观', '佛寺', '坐落', '山内', '清幽', '霸气']",服务,9,1.0,31236,2
A09,2015-11-04,4分吧，风景很不错，山上指路牌不合理，有的地方没有，有的地方重复，门票上印上地图就更好了！,3.0,0.4494000077247619,"走, 高, 性价比, 免费, 太, 坐, 建议, 观音, 开车, 感觉","['风景', '山上', '指路牌', '不合理', '重复', '上印', '地图', '更好']",性价比,9,-1.0,31237,1
A09,2015-11-08,4分。景色不错，水上丹霞风景很美。爬山过程很刺激。就是太远了点,2.0,0.3316999971866607,"好玩, 开心, 太, 天气, 项目, 特别, 舒服, 夏天, 热, 风景","['景色', '水上', '丹霞', '风景', '美', '爬山', '过程', '刺激', '太', '远']",设施,9,-1.0,31238,1
A09,2015-11-02,真是从入园后就开始爬山！！空气清新！！！,0.0,0.2958000004291534,"值得, 适合, 环境, 干净, 休闲, 公园, 空气清新, 瀑布, 水, 很漂亮","['入园', '爬山', '空气清新']",卫生,9,1.5,31239,3
A09,2015-10-31,山好大，没有两天都走不完，空气很好，大氧吧，要是能再便宜点就好了,12.0,0.2213000059127807,"动物, 爬, 岛, 沙滩, 天然, 氧吧, 表演, 广州, 动物园, 种类","['山', '两天', '走', '空气', '氧吧', '便宜']",设施,9,1.0,31240,2
A09,2015-06-07,很不错的地方，去的那二天刚好没下雨，心情真好,10.0,0.5192000269889832,"喜欢, 下次, 漂亮, 朋友, 值得, 去过, 机会, 字, 开心, 风景优美","['二天', '下雨', '心情', '真']",位置,9,1.5,31241,3
A09,2015-10-28,周末去的**，整个行程还是不错的，可以登山锻炼身体,6.0,0.5027999877929688,"上山, 广东, 导游, 山顶, 时, 走, 到达, 两个, 下午, 坐","['周末', '行程', '登山', '锻炼身体']",服务,9,1.5,31242,3
A09,2015-11-13,雨中游**，没有什么不便。雨后看长老峰，白云朵朵缕缕，升腾而上，云山相映，正是雨后的美景。,6.0,0.4113000035285949,"上山, 广东, 导游, 山顶, 时, 走, 到达, 两个, 下午, 坐","['雨', '中游', '不便', '雨后', '长老', '峰', '白云', '朵朵', '升腾', '云山', '相映', '雨后', '美景']",服务,9,-1.0,31243,1
A09,2015-10-25,没有确认，取消了，麻烦,6.0,0.5192000269889832,"上山, 广东, 导游, 山顶, 时, 走, 到达, 两个, 下午, 坐","['确认', '取消', '麻烦']",服务,9,-2.0,31244,1
A09,2015-10-25,5分，很不错，挺好玩的要合理规划时间要不然很多东西看不到,7.0,0.4131999909877777,"环境, 贵, 很好, 没什么, 吃, 东西, 太, 差, 感觉, 风景","['挺好玩', '规划', '东西', '看不到']",性价比,9,-1.0,31245,1
A09,2015-09-05,景色不错，阳元石，阴元石真是大自然的造化，天然就成，景各景点相对集中，就是乘坐缆车和进山门时除了验票外，叭嘶挂按指纹，耽误时间。,3.0,0.6575000286102295,"走, 高, 性价比, 免费, 太, 坐, 建议, 观音, 开车, 感觉","['景色', '阳元石', '阴元石', '大自然', '造化', '天然', '成', '乘坐', '缆车', '进山', '门', '时', '验票', '外', '', '指纹', '耽误时间']",性价比,9,1.0,31246,2
A09,2015-05-30,很靠谱，建议购买！提前做好准备还是有帮助的，买好票以后用手机德二维码直接去售票口那里，有去网票德窗口，不怎么排队，而且很便宜！,4.0,0.5097000002861023,"便宜, 价格, 优惠, 网上, 现场, 不用, 实惠, 排队, 购票, 订","['谱', '建议', '购买', '提前', '做好', '买好', '手机', '德', '二维码', '售票口', '网票', '德', '窗口', '排队', '便宜']",性价比,9,1.0,31247,2
A09,2015-10-24,预付款省心，取票方便,8.0,0.5385000109672546,"空气, 设施, 可惜, 完善, 还行, 游乐, 有意思, 老板, 负离子, 商业","['预付款', '省心']",设施,9,1.5,31248,3
A09,2015-10-23,还行吗，早晨去看日出蛮漂亮的,6.0,0.4156999886035919,"上山, 广东, 导游, 山顶, 时, 走, 到达, 两个, 下午, 坐","['还行', '早晨', '日出', '漂亮']",服务,9,1.0,31249,2
A09,2015-05-29,很有挑战、值得去玩、风景很漂亮,0.0,0.3632000088691711,"值得, 适合, 环境, 干净, 休闲, 公园, 空气清新, 瀑布, 水, 很漂亮","['挑战', '值得', '风景', '很漂亮']",卫生,9,0.0,31250,1
A09,2015-11-05,景色很美，取票非常的快，自动取的,11.0,0.4156999886035919,"景色, 美, 感觉, 山上, 值得, 中, 优美, 拍, 交通, 少","['景色', '美', '自动', '取']",位置,9,1.0,31251,2
A09,2015-10-22,很方便，就是一个身份证只能订一张,4.0,0.6047000288963318,"便宜, 价格, 优惠, 网上, 现场, 不用, 实惠, 排队, 购票, 订","['身份证', '只能', '订', '一张']",性价比,9,1.5,31252,3
A09,2015-05-28,取票点离大门有点偏远，而且要先预付款，没有同*网方便。因为同行有几个人，系统又不能一个手机号订多张票，有点麻烦，应该改进一下,6.0,0.4702999889850616,"上山, 广东, 导游, 山顶, 时, 走, 到达, 两个, 下午, 坐","['点离', '大门', '偏远', '先', '预付款', '网', '同行', '几个', '系统', '手机号', '订', '多张', '麻烦', '改进']",服务,9,0.0,31253,1
A09,2015-10-21,4分，景色没特别，可以选择地方少。,11.0,0.8154000043869019,"景色, 美, 感觉, 山上, 值得, 中, 优美, 拍, 交通, 少","['景色', '特别', '选择', '少']",位置,9,1.0,31254,2
A09,2015-10-20,价格不错，省去排队的麻烦。游玩很愉快！,4.0,0.5045999884605408,"便宜, 价格, 优惠, 网上, 现场, 不用, 实惠, 排队, 购票, 订","['价格', '省去', '排队', '麻烦', '愉快']",性价比,9,0.0,31255,1
A09,2015-10-20,景点很不错，特别是日出,6.0,0.365200012922287,"上山, 广东, 导游, 山顶, 时, 走, 到达, 两个, 下午, 坐","['特别', '日出']",服务,9,1.0,31256,2
A09,2015-08-08,挺不错的，48小时有效，足够时间玩了,12.0,0.4119000136852264,"动物, 爬, 岛, 沙滩, 天然, 氧吧, 表演, 广州, 动物园, 种类","['挺不错', '足够']",设施,9,1.0,31257,2
A09,2015-10-21,5景色很美、空气清新、好玩,11.0,0.4154999852180481,"景色, 美, 感觉, 山上, 值得, 中, 优美, 拍, 交通, 少","['景色', '美', '空气清新', '好玩']",位置,9,1.5,31258,3
A09,2015-10-19,5分，山好水好风景好，值得一游！,9.0,0.4359999895095825,"山, 爬山, 好多, 希望, 太, 美的, 钱, 水, 骑, 活动","['山', '水', '风景', '值得']",设施,9,1.0,31259,2
