A09,2020-10-03,总体来说还是不错，不过验票进站有点麻烦，下次开通眼球识别就好了,5.0,0.4620999991893768,"温泉, 服务, 服务态度, 满意, 泡温泉, 热情, 家人, 工作人员, 方便快捷, 态度","['总体', '验票', '进站', '麻烦', '下次', '开通', '眼球', '识别']",服务,9,-1.0,29870,1
A09,2017-06-03,很美，山和别的地方不一样，发红很神奇，阳元石阴元石太形象啦，栩栩如生，简直让人怀疑，由人工修复一样！门票两日有效，很方便！,3.0,0.3720999956130981,"走, 高, 性价比, 免费, 太, 坐, 建议, 观音, 开车, 感觉","['美', '山和', '发红', '神奇', '阳元石', '阴元石', '太', '形象', '栩栩如生', '怀疑', '人工', '修复', '两日']",性价比,9,-2.0,29871,1
A09,2020-12-08,物起所值，风景美丽，一次好开心以旅游,1.0,0.5192999839782715,"风景, 表演, 值得, 一般般, 位于, 晚上, 好看, 建筑, 美丽, 大自然","['物起所值', '风景', '美丽', '好开心']",服务,9,1.0,29872,2
A09,2017-04-15,**是丹霞地层和丹霞地貌的命名地，是广东省面积最大、景色最美的、以丹霞地貌景观为主的风景区和自然遗产地。与**、**、**合称为广东四大名山。旅游时间：旺季（4-10月）8:00-18:00;淡季（11-3月）8:30-17:30门票价格：景区门票：150元/人（门票两天有效，学生、老人、儿童半价，要出示相关证件。）索道：平时单程上40元/人，双程60元/人。节日单程上45人，双程70元/人翔龙湖船票：单程20元/人，双程35元/人锦江船票：90元/人竹筏漂流：全程票100元/人，半程票50元/人导游费：100元小车停车费：15元大巴停车费：30元,0.0,0.2994999885559082,"值得, 适合, 环境, 干净, 休闲, 公园, 空气清新, 瀑布, 水, 很漂亮","['丹霞', '地层', '丹霞地貌', '命名', '广东省', '面积', '景色', '最美', '丹霞地貌', '景观', '风景区', '自然', '遗产地', '合', '称为', '广东', '四大', '名山', '旺季', '月', '淡季', '月', '门票价格', '两天', '学生', '儿童', '半价', '出示', '相关', '证件', '索道', '平时', '单程', '双程', '节日', '单程', '双程', '人翔', '龙湖', '船票', '单程', '双程', '锦江', '船票', '竹筏', '漂流', '全程', '票元', '半程', '票元', '导游', '费', '小车', '停车费', '大巴', '停车费']",卫生,9,1.0,29873,2
A09,2020-08-14,早上9:30到景区门口，下午16:30游玩结束，，一天行程，爬了2座山（长老峰阴元山和阳元山细美寨），行程很赶。山不是很高，景色优美，毕竟是丹霞地貌的命名出处，当然杠杠的！,6.0,0.4814999997615814,"上山, 广东, 导游, 山顶, 时, 走, 到达, 两个, 下午, 坐","['早上', '门口', '下午', '结束', '行程', '爬', '座', '山', '长老', '峰', '阴', '元山', '和阳', '元山', '细', '美寨', '行程', '山', '高', '景色', '优美', '丹霞地貌', '命名', '出处', '杠杠']",服务,9,1.0,29874,2
A09,2020-11-19,可以，里面的民宿环境很好，可惜遇上下雨天,7.0,0.6326000094413757,"环境, 贵, 很好, 没什么, 吃, 东西, 太, 差, 感觉, 风景","['民宿', '环境', '可惜', '遇上', '下雨天']",性价比,9,-1.0,29875,1
A09,2020-03-20,周末去的，因为是旅游淡季又有点小雨，人不是很多，总体来说景点没什么看的，印象深的就是几段比较陡的爬山栈道，不过路程都不长，没什么挑战性。,3.0,0.3461999893188476,"走, 高, 性价比, 免费, 太, 坐, 建议, 观音, 开车, 感觉","['周末', '淡季', '小雨', '总体', '没什么', '印象', '深', '几段', '陡', '爬山', '栈道', '路程', '不长', '没什么', '挑战性']",性价比,9,1.5,29876,3
A09,2017-09-05,广东四大名山之一，丹霞地貌博物馆，登山的好去处，8月去的，游人不多，爬得畅快。,0.0,0.4817999899387359,"值得, 适合, 环境, 干净, 休闲, 公园, 空气清新, 瀑布, 水, 很漂亮","['广东', '四大', '名山', '丹霞地貌', '博物馆', '登山', '好去处', '月去', '游人', '爬', '畅快']",卫生,9,1.0,29877,2
A09,2017-05-30,喜欢爬山，挑战自己的你值得去一趟哦！陡峭魏延的山峰，崎岖不平的小道。一座座的山峰，当你攀上顶峰，一览众山小，挑战自我，征服自己的感觉。,0.0,0.3364000022411346,"值得, 适合, 环境, 干净, 休闲, 公园, 空气清新, 瀑布, 水, 很漂亮","['喜欢', '爬山', '挑战', '值得', '去一趟', '陡峭', '魏延', '山峰', '崎岖不平', '小道', '一座座', '山峰', '攀上', '顶峰', '一览', '众山', '挑战', '自我', '征服', '感觉']",卫生,9,-1.0,29878,1
A09,2020-11-15,不错，挺好，值得一去，很好的地方。,7.0,0.692300021648407,"环境, 贵, 很好, 没什么, 吃, 东西, 太, 差, 感觉, 风景","['值得', '很好']",性价比,9,1.0,29879,2
A09,2020-11-25,一般吧，如果带小孩逛，还是买船票吧,3.0,0.692300021648407,"走, 高, 性价比, 免费, 太, 坐, 建议, 观音, 开车, 感觉","['逛', '船票']",性价比,9,1.5,29880,3
A09,2020-11-09,很不错的地方，值得一去再去的。,0.0,0.692300021648407,"值得, 适合, 环境, 干净, 休闲, 公园, 空气清新, 瀑布, 水, 很漂亮","['值得', '一去']",卫生,9,1.0,29881,2
A09,2020-04-28,**位于广东省韶关市仁化县城南9 公里处，距韶关市区56公里，**是红砂岩峰林地带，有着**的高山临气，兔耳岭天然公园之妙，到处悬崖峭壁，景色奇特，有“仓渥如丹，灿若明霞”之誉。它以顶平、身陡、麓缓、岩石裸露的地形特点而成为地貌学专用名词“丹霞地貌”的命名地。又被称为“中国红石公园”。丹霞双绝是指世界上独一无二的阳元石和阴元石，奇妙的是两石同在世界地质公园――**中。,3.0,0.3851999938488006,"走, 高, 性价比, 免费, 太, 坐, 建议, 观音, 开车, 感觉","['位于', '广东省', '韶关市', '仁化县', '城南', '公里', '处', '韶关市', '区', '公里', '红砂岩', '峰林', '地带', '高山', '临气', '兔耳岭', '天然', '公园', '妙', '悬崖峭壁', '景色', '奇特', '仓渥', '丹', '灿若明霞', '誉', '顶平', '身', '陡', '麓', '缓', '岩石', '裸露', '地形', '地貌学', '专用名词', '丹霞地貌', '命名', '称为', '中国', '红石', '公园', '丹霞', '双', '绝是', '指', '世界', '独一无二', '阳元石', '阴元石', '奇妙', '两', '石同', '世界', '地质公园', '中']",性价比,9,3.0,29882,5
A09,2017-08-26,来的时候是淡季，再加上学生票半价，门票也就只有80元，因为之前就是奔着来看奇石的，所以觉得价格还算实惠。来**还是建议在这里住一晚，因为我是一个人，又没有车，所以只能选择景区内的旅馆。景区内的东西都要比正常价格贵，吃饭也不便宜，家常味道。我是下午3点到的，韶关东站和高铁站都有直达**的公交车，来到以后到旅馆把东西放下就直奔阳元山景区，爬阳元山大概也就三个小时，不过走了大概一个小时以后突然下雷暴雨，在山里被淋成落汤鸡，幸亏观光车小哥仗义出手，在暴雨中从山上飙车下来不是一般的爽。在景区住主要是方便第二天去长老峰观日亭看日出，4点半等景区大巴到长老峰，然后爬上去或者坐缆车都可以。长老峰有一段阶梯很陡，可以选择缆车上山，步行下山正好可以去阴元石和一线峡，还是很不错的。不过因为第二天下午要去长沙，所以剩下的景点也就只能放弃了。,6.0,0.42289999127388,"上山, 广东, 导游, 山顶, 时, 走, 到达, 两个, 下午, 坐","['淡季', '学生票', '半价', '奔', '奇石', '价格', '算', '实惠', '建议', '住', '一晚', '车', '只能', '选择', '旅馆', '东西', '价格', '贵', '吃饭', '便宜', '家常', '味道', '下午', '点到', '韶关', '东站', '高铁', '站', '直达', '公交车', '来到', '旅馆', '东西', '放下', '直奔', '阳', '元山', '爬阳', '元山', '三个', '走', '雷暴雨', '山里', '淋成', '落汤鸡', '幸亏', '观光车', '小哥', '仗义', '出手', '暴雨', '中', '山上', '飙车', '爽', '住', '第二天', '长老', '峰', '观日亭', '日出', '大巴', '长老', '峰', '爬上去', '坐', '缆车', '长老', '峰', '一段', '阶梯', '陡', '选择', '缆车', '上山', '步行', '下山', '正好', '阴元石', '一线', '峡', '第二天', '下午', '长沙', '剩下', '只能', '放弃']",服务,9,-3.0,29883,1
A09,2020-11-07,**风景美丽，是比较适合爬山的好地方，门票也不贵，值得去游玩。,0.0,0.3853999972343445,"值得, 适合, 环境, 干净, 休闲, 公园, 空气清新, 瀑布, 水, 很漂亮","['风景', '美丽', '适合', '爬山', '不贵', '值得']",卫生,9,3.0,29884,5
A09,2017-07-09,老板态度真的非常好，奥德赛接送，一进店就赠送矿泉水和地图，并详细推荐游玩路线，非常专业，晚上散步，还告诉我们哪里有荷花池，很贴心，早上还主动邀请我们吃老板娘做的小米红枣粥和自家种的玉米，很开心，房间也很干净，保养非常好,6.0,0.3824999928474426,"上山, 广东, 导游, 山顶, 时, 走, 到达, 两个, 下午, 坐","['老板', '态度', '真的', '奥德赛', '接送', '进店', '赠送', '矿泉水', '地图', '详细', '推荐', '路线', '专业', '晚上', '散步', '告诉', '荷花池', '贴心', '早上', '主动', '邀请', '吃', '老板娘', '做', '小米', '红枣', '粥', '玉米', '开心', '房间', '干净', '保养']",服务,9,4.0,29885,5
A09,2016-02-13,进去是不用票的、到景点才需要票、一张票登记一个人的指纹、别人用不了。里面的东西都是十元起步、景区外面的早餐还15元.人又多山路又小、人挤人啊！水上丹霞80元一张票、爬完山下来再去吃饭然后去水上丹霞感觉是最舒服的了.缆车45元一张票单程的、在阳元石那边下来的有一间叫阳元阁的饭菜很好吃！自到了韶关以来最好吃的一顿饭呀????,3.0,0.3785000145435333,"走, 高, 性价比, 免费, 太, 坐, 建议, 观音, 开车, 感觉","['不用', '一张', '登记', '指纹', '东西', '十元', '起步', '外面', '早餐', '山路', '挤', '水上', '丹霞', '一张', '爬', '完山', '吃饭', '水上', '丹霞', '感觉', '最舒服', '缆车', '一张', '单程', '阳元石', '一间', '阳元阁', '饭菜', '好吃', '自到', '韶关', '好吃', '一顿饭']",性价比,9,1.0,29886,2
A09,2017-02-09,票在48小时内有效很人性化，一般人一天内不可能完成所有景区，这一点做的很好。景区内有免费公交车直达长老峰门口，确实好，免去走一大段路程，这个很赞。**内寺庙很多，走一段路往往会有惊喜。自然景观更加不用说，我觉得比桂林好，而且比较原生态，值得再去！！,3.0,0.5906999707221985,"走, 高, 性价比, 免费, 太, 坐, 建议, 观音, 开车, 感觉","['人性化', '一点', '做', '很好', '免费', '公交车', '直达', '长老', '峰', '门口', '确实', '免去', '走', '一大', '段', '路程', '赞', '寺庙', '走', '一段路', '惊喜', '自然景观', '不用说', '桂林', '原生态', '值得']",性价比,9,4.0,29887,5
A09,2016-11-28,很好的**，值得再来。,7.0,0.692300021648407,"环境, 贵, 很好, 没什么, 吃, 东西, 太, 差, 感觉, 风景","['很好', '值得']",性价比,9,1.0,29888,2
A09,2016-09-18,景点不错，但门票有些贵。景区内没有导游简介，路标也不清晰。阳元山你好你好，周边的商户都是坑，能坑一个是一个，买瓶水都会坑你，一定要货比三家，感觉还行，但不一定回来了,6.0,0.3937000036239624,"上山, 广东, 导游, 山顶, 时, 走, 到达, 两个, 下午, 坐","['贵', '导游', '简介', '路标', '清晰', '阳', '元山', '你好', '你好', '周边', '商户', '坑', '能坑', '瓶', '水', '坑', '货比三家', '感觉', '行', '回来']",服务,9,1.0,29889,2
A09,2016-04-23,"景色确实非常迷人，特别爬山了长老峰的观日亭，那个一览众山小的感觉，真是无与伦比！而且票价也不贵，在去哪儿订，才126,值得一来，住景区内的民宿也特别好，便宜卫生也超干净，还能拿点钱给主人家，然后在他们家里吃饭，尝到当地的美食，真是太棒了。空气质量也是杠杠的",11.0,0.2626000046730041,"景色, 美, 感觉, 山上, 值得, 中, 优美, 拍, 交通, 少","['景色', '确实', '迷人', '特别', '爬山', '长老', '峰', '观日亭', '一览', '众山', '感觉', '无与伦比', '票价', '不贵', '订', '值得', '住', '民宿', '特别', '便宜', '卫生', '超', '干净', '钱', '主人家', '家里', '吃饭', '尝到', '美食', '太棒了', '空气质量', '杠杠']",位置,9,7.0,29890,5
A09,2017-10-09,水上丹霞和竹阀真没什么，太无聊，景色一般，整个景区两天以上才能逛完整。阳元村那边的物价和外面基本差不多了，是我见过的景区物价最低的了。看阳元石的台子那有两条路，一条路去细美寨，一条去双乳石。细美寨那边很陡，很多地方只能一人通过，s上下山的就只能中间等了。,3.0,0.4503999948501587,"走, 高, 性价比, 免费, 太, 坐, 建议, 观音, 开车, 感觉","['水上', '丹霞', '竹阀', '真', '没什么', '太', '无聊', '景色', '两天', '逛', '完整', '阳元村', '物价', '外面', '物价', '最低', '阳元石', '台子', '两条路', '一条', '路', '细', '美寨', '一条', '双乳', '石', '细', '美寨', '陡', '只能', 's', '下山', '只能']",性价比,9,-1.0,29891,1
A09,2020-11-02,景区很大，适合慢游，最好住两晚。,0.0,0.3896999955177307,"值得, 适合, 环境, 干净, 休闲, 公园, 空气清新, 瀑布, 水, 很漂亮","['很大', '适合', '慢', '住', '两', '晚']",卫生,9,1.0,29892,2
A09,2020-10-28,广东必去景点之一，最好能预留3天时间，景色宜人，而且某些景点某些时刻会有惊喜。,6.0,0.3867000043392181,"上山, 广东, 导游, 山顶, 时, 走, 到达, 两个, 下午, 坐","['广东', '预留', '天', '景色宜人', '时刻', '惊喜']",服务,9,1.0,29893,2
A09,2020-02-22,真心差。这个**没有下次了。管理乱。里面的卫生差，那个摆摊档，生活垃圾随意丢弃！而且假期，太多小车进景区了，堵车！其实里面有景区车接送，完全可以把小车挡在外面！,3.0,0.3840000033378601,"走, 高, 性价比, 免费, 太, 坐, 建议, 观音, 开车, 感觉","['真心', '差', '下次', '管理', '乱', '卫生', '差', '摆摊', '档', '生活', '垃圾', '随意', '丢弃', '假期', '太', '小车', '进', '堵车', '车', '接送', '小车', '挡', '外面']",性价比,9,0.0,29894,1
A09,2020-04-22,中国红石公园――**，是广东四大名山。这里主要景点长老峰景区和阳元石景区。韶关东有景区到**，每10分钟一班车，很方便。周围也有很多住宿的地方。我们花了一天时间游览景区，上午去阳元石景区，先去看阳元石然后登上最高处嘉遁亭，然后从细美寨下山。按照指示标识，去通泰桥、混元洞、狮子峰等，基本上去往所有的景点，然后出阳元石景区来到路口坐车去长老峰景区。坐车到长老峰景区门口验票登山，半山西行去往锦石岩寺、这里有老路按照指示牌可以去百丈峡看看。出锦石岩寺向东登上去往长老峰的最高处观日亭，途中会经过一处悬崖峭壁，很有意思。在这里要吐槽一下景区的索道，路程远不说，还只能收现金，是什么鬼？能跟上时代吗？,3.0,0.3300999999046325,"走, 高, 性价比, 免费, 太, 坐, 建议, 观音, 开车, 感觉","['中国', '红石', '公园', '广东', '四大', '名山', '长老', '峰', '阳元石', '韶关', '东', '每分钟', '班车', '住宿', '花', '游览', '上午', '阳元石', '先去', '阳元石', '登上', '最高处', '嘉', '遁', '亭', '细', '美寨', '下山', '指示', '标识', '通泰桥', '混元洞', '狮子', '峰', '去往', '阳元石', '来到', '路口', '坐车去', '长老', '峰', '坐车到', '长老', '峰', '门口', '验票', '登山', '山西', '行', '去往', '锦石', '岩寺', '老路', '指示牌', '百丈', '峡', '锦石', '岩寺', '向东', '登上', '去往', '长老', '峰', '最高处', '观日亭', '途中', '一处', '悬崖峭壁', '有意思', '吐', '槽', '索道', '路程', '远', '只能', '收', '现金', '鬼', '跟上', '时代']",性价比,9,1.5,29895,3
A09,2020-06-03,很好玩 值得一去 不留遗憾 性价比高,3.0,0.5005999803543091,"走, 高, 性价比, 免费, 太, 坐, 建议, 观音, 开车, 感觉","['好玩', '值得', '不留', '遗憾', '性价比', '高']",性价比,9,0.0,29896,1
A09,2020-05-14,票价偏高，住宿，饮食实惠。景区新修了沥青路。沥青气味很大，有毒。景区服务跟不上。我13号凌晨4点25分在公交站点等车看日出。遇上当班的公交司机是个大懒虫，不起床不出车。等了半个钟，天开始发白了，车还未到。聪明的同行人打景区电话投诉。5点，车终于来了。等我爬到半山，天亮了，走路都不用电筒。。。。当然，我运气好，还是看到了长老峰日出，，，，哈哈哈。司机不按时出车浪费了我半小时。景区应免费送我一张门票，让我下次再去过。。。。哈哈哈,6.0,0.4013000130653381,"上山, 广东, 导游, 山顶, 时, 走, 到达, 两个, 下午, 坐","['票价', '偏', '高', '住宿', '饮食', '实惠', '新', '修', '沥青路', '沥青', '气味', '很大', '有毒', '服务', '跟不上', '号', '凌晨', '公交站点', '车', '日出', '遇上', '当班', '公交', '司机', '懒虫', '起床', '出车', '半个', '钟', '天', '发白', '车', '未', '聪明', '同行人', '电话', '投诉', '车', '终于', '爬', '半山', '天亮', '走路', '不用', '电筒', '运气', '长老', '峰', '日出', '哈哈哈', '司机', '出车', '浪费', '半小时', '应', '免费送', '一张', '下次', '去过', '哈哈哈']",服务,9,-2.0,29897,1
A09,2017-02-01,酒店不错、环境、卫生都很好，带家人出游，一家老小都满意。房间有免费的矿泉水和牛奶赠送，非常贴心的服务，晚上酒店一楼酒吧有驻唱歌手，游玩后，在酒吧小饮、听听音乐……,5.0,0.375,"温泉, 服务, 服务态度, 满意, 泡温泉, 热情, 家人, 工作人员, 方便快捷, 态度","['环境', '卫生', '家人', '出游', '一家老小', '满意', '房间', '免费', '矿泉水', '牛奶', '赠送', '贴心', '服务', '晚上', '一楼', '酒吧', '驻', '唱歌', '手', '酒吧', '饮', '听听', '音乐']",服务,9,4.0,29898,5
A09,2020-10-26,带娃去的，丹霞风貌与众不同。带着娃去的，所以上去是坐的缆车，下山的路也很陡远。走下来也很累。,3.0,0.6789000034332275,"走, 高, 性价比, 免费, 太, 坐, 建议, 观音, 开车, 感觉","['娃', '丹霞', '风貌', '与众不同', '娃', '坐', '缆车', '下山', '路', '陡远', '走', '累']",性价比,9,1.5,29899,3
A09,2020-10-24,很好，非常好，下次还要再来，记得,10.0,0.3609000146389007,"喜欢, 下次, 漂亮, 朋友, 值得, 去过, 机会, 字, 开心, 风景优美","['下次', '记得']",位置,9,1.5,29900,3
A09,2020-10-10,一般般吧，在省内可以去看看，外地就不用过来了。,3.0,0.3025000095367431,"走, 高, 性价比, 免费, 太, 坐, 建议, 观音, 开车, 感觉","['一般般', '省内', '外地', '不用']",性价比,9,1.5,29901,3
A09,2017-04-13,还不错，适合周末玩两天，风景优美价格实惠，淡季出游人也不算很多，住宿吃饭都方便，虽然没有三清山漂亮，也还是可以的，没去过的可以去玩玩。,0.0,0.314300000667572,"值得, 适合, 环境, 干净, 休闲, 公园, 空气清新, 瀑布, 水, 很漂亮","['适合', '周末', '两天', '风景优美', '价格', '实惠', '淡季', '出游', '不算', '住宿', '吃饭', '三清山', '漂亮', '去过', '玩玩']",卫生,9,2.0,29902,4
A09,2016-11-01,一路遇见 一路再见 景色秀美 值得一[,10.0,0.3973999917507171,"喜欢, 下次, 漂亮, 朋友, 值得, 去过, 机会, 字, 开心, 风景优美","['一路', '遇见', '一路', '再见', '景色', '秀美', '值得', '[']",位置,9,1.0,29903,2
A09,2020-10-10,在省内还算个景点，放在全国，就太一般了,6.0,0.6107000112533569,"上山, 广东, 导游, 山顶, 时, 走, 到达, 两个, 下午, 坐","['省内', '算', '放在', '全国', '太']",服务,9,1.5,29904,3
A09,2020-10-08,风景十分美丽，尤其在山顶的景色,1.0,0.4153999984264374,"风景, 表演, 值得, 一般般, 位于, 晚上, 好看, 建筑, 美丽, 大自然","['风景', '美丽', '山顶', '景色']",服务,9,1.0,29905,2
A09,2020-08-11,挺好的。以后有机会再去一次,10.0,0.5385000109672546,"喜欢, 下次, 漂亮, 朋友, 值得, 去过, 机会, 字, 开心, 风景优美",['机会'],位置,9,1.0,29906,2
A09,2016-10-21,景色秀丽，景区的班车也很方便，棒极了,11.0,0.6159999966621399,"景色, 美, 感觉, 山上, 值得, 中, 优美, 拍, 交通, 少","['景色', '秀丽', '班车', '棒极了']",位置,9,1.5,29907,3
A09,2017-10-20,140比现场买便宜10元，直接机子扫身份证取票。两个景区整体挺大的，进大门后到阳元石和长老峰两个景区间有免费公交接送。门票48小时有效可无限次进出，去的那两天刚好遇到阴天，所以日出日落就不考虑了。像其他游客说的要是在长老峰坐索道的话，买单程就好了，我们是买了上行的，游了各景点都到山下了，离索道已经很远很远了，所以不可能还回去坐索道的。阳元山不大建议太小的小孩去，九九天梯很陡边边没有山体护着，只有铁链和铁栏杆，我们带着5岁的儿子心里庆幸是从九九天梯上，要不都不知怎么带他下来了,3.0,0.385699987411499,"走, 高, 性价比, 免费, 太, 坐, 建议, 观音, 开车, 感觉","['现场', '便宜', '机子', '扫', '身份证', '两个', '整体', '挺大', '进', '大门', '阳元石', '长老', '峰', '两个', '间有', '免费', '公交', '接送', '无限', '次', '进出', '两天', '阴天', '日出日落', '游客', '长老', '峰', '坐', '索道', '单程', '上行', '山下', '索道', '很远', '很远', '回去', '坐', '索道', '阳', '元山', '建议', '太小', '九九', '天梯', '陡', '边边', '山体', '护', '铁链', '铁栏杆', '岁', '儿子', '庆幸', '是从', '九九', '天梯', '不知']",性价比,9,2.0,29908,4
A09,2017-03-15,取票方便，自助取票机有专人帮助。景区不错，惊险刺激，很是神奇，值得推荐！遗憾的是下雨有雾，未能看到全部景点。,5.0,0.3799000084400177,"温泉, 服务, 服务态度, 满意, 泡温泉, 热情, 家人, 工作人员, 方便快捷, 态度","['自助', '取', '票机', '专人', '惊险刺激', '神奇', '值得', '推荐', '遗憾', '下雨', '雾', '未能']",服务,9,2.0,29909,4
A09,2016-10-20,取票快速，服务良好，风景优美,8.0,0.2696000039577484,"空气, 设施, 可惜, 完善, 还行, 游乐, 有意思, 老板, 负离子, 商业","['快速', '服务', '风景优美']",设施,9,1.5,29910,3
A09,2020-05-01,典型的喀斯特地貌，奇特的景色，值得去观赏！,0.0,0.355100005865097,"值得, 适合, 环境, 干净, 休闲, 公园, 空气清新, 瀑布, 水, 很漂亮","['典型', '喀斯特地貌', '奇特', '景色', '值得', '观赏']",卫生,9,1.0,29911,2
A09,2017-04-04,在韶关东站前的广场上乘坐大巴，一个多小时到达**。整个景区由长老峰游览区、阳元石游览区、翔龙湖游览区组成。由于时间原因，只游览了阳元石，不得不佩服大自然的鬼斧神工，下回有时间一定去看看阴元石。,3.0,0.5831999778747559,"走, 高, 性价比, 免费, 太, 坐, 建议, 观音, 开车, 感觉","['韶关', '东站', '前', '广场', '乘坐', '大巴', '一个多', '到达', '长老', '峰', '游览区', '阳元石', '游览区', '翔', '龙湖', '游览区', '原因', '游览', '阳元石', '佩服', '大自然', '鬼斧神工', '下回', '阴元石']",性价比,9,1.5,29912,3
A09,2016-10-19,取票方便，服务周到，景色优美值得走一趟,11.0,0.671999990940094,"景色, 美, 感觉, 山上, 值得, 中, 优美, 拍, 交通, 少","['服务周到', '景色', '优美', '值得', '走', '一趟']",位置,9,2.0,29913,4
A09,2020-08-05,非常好的一次旅行！！！！！！！,5.0,0.5385000109672546,"温泉, 服务, 服务态度, 满意, 泡温泉, 热情, 家人, 工作人员, 方便快捷, 态度",['旅行'],服务,9,1.5,29914,3
A09,2020-05-01,去到景点售票处，很快就拿到了实体票和上船排号，很是方便，水上丹霞看到了很多岸上看不到的景色加上船上讲解人员的介绍，值回票价,6.0,0.3269000053405761,"上山, 广东, 导游, 山顶, 时, 走, 到达, 两个, 下午, 坐","['售票处', '很快', '拿到', '实体', '上船', '排号', '水上', '丹霞', '岸上', '看不到', '景色', '船上', '讲解', '人员', '介绍', '值回', '票价']",服务,9,1.5,29915,3
