景区名称,评论日期,评论内容,主题,评论对主题贡献度,主题关键字,评论分词,评价方面,景区编号,emotional_value,index,情感等级
A09,2020-02-15,取票方便，在售票大厅有自助取票机，凭身份证就可以取，票48小时有效。如果开车入景区，每天收15元，在景区大门，有景区的免费中巴可以乘坐，十多分钟一班，很方便。景区内主要分两大景区:一个是长老峰景区，另一个是阳元山景区。每个景区入去都要查票。前一个景区比较大，可以玩一整天，后一个景区小点，半天足矣。至于吃饭，真的是奇怪，阳元山景区门口的饭店比景区大门口的饭店便宜很多！,6.0,0.6676999926567078,"上山, 广东, 导游, 山顶, 时, 走, 到达, 两个, 下午, 坐","['售票', '大厅', '自助', '机', '身份证', '取', '开车', '入', '收元', '大门', '免费', '中巴', '乘坐', '十多分钟', '一班', '两', '长老', '峰', '阳', '元山', '入去', '查票', '前', '一整天', '小点', '半天', '足矣', '吃饭', '真的', '奇怪', '阳', '元山', '门口', '饭店', '大门口', '饭店', '便宜']",服务,9,2.0,29470,4
A09,2020-05-20,**是我国联合申请世界自然遗产排在第一位的景点，也是丹霞地貌的命名地。我个人坚持认为**是超越我国其他丹霞景点的。不过管理实在太差！首先标志不多不清，许多三岔路口没有标志标牌，即使有，也标的不清不楚，不知道距离，不知道爬升高度，不知道那个点是什么景色。让第一次去的我走了很多冤枉路。其次，水上丹霞的景色很美，但是船太破太破，没有夹板平台，不让人照相，倒是景区竟然派了一个专职照相，目的就是还要收你钱的，特别可恶的是还强行推销所谓船长的纪念品，价格是岸上摊位的4倍。这个情况在5A级景区已经很少见了。第三，公交设置很不合理，站点离开元阳石景区很远，目的就是让你们经过那一长段饭店摊位去消费。游客已经爬了一个景区很累了，你们就不能照顾一下，直接送到下个景区附近？第四，这么多的景点，没有旅游地图，只有沿途有部分导览图，而且不标距离爬高和大致时间，你只能自己去摸索，乱逛，走冤枉路，悲催！这么好的景区，名气那么差，甚至连张掖的丹霞都不如，更不如龙虎山，就是管理的问题。,3.0,0.3783000111579895,"走, 高, 性价比, 免费, 太, 坐, 建议, 观音, 开车, 感觉","['我国', '联合', '申请', '世界', '自然遗产', '排', '第一位', '丹霞地貌', '命名', '超越', '我国', '丹霞', '管理', '实在', '太', '差', '标志', '不多', '清', '三岔路口', '标志', '标牌', '标的', '不清不楚', '距离', '爬升', '高度', '景色', '第一次', '走', '冤枉路', '水上', '丹霞', '景色', '美', '船', '太', '破', '太', '破', '夹板', '平台', '不让', '照相', '倒', '派', '专职', '照相', '目的', '收', '钱', '特别', '可恶', '强行', '推销', '船长', '纪念品', '价格', '岸上', '摊位', '倍', '情况', '级', '第三', '公交', '设置', '不合理', '站点', '离开', '元阳', '石', '远', '目的', '那一', '长段', '饭店', '摊位', '消费', '游客', '爬', '累', '照顾', '送到', '第四', '地图', '沿途', '导览', '图', '不标', '距离', '爬高', '只能', '摸索', '乱逛', '走', '冤枉路', '悲', '催', '名气', '差', '张掖', '丹霞', '龙虎山', '管理']",性价比,9,2.0,29471,4
A09,2020-11-30,景点非常好。交通非常方便。,11.0,0.5385000109672546,"景色, 美, 感觉, 山上, 值得, 中, 优美, 拍, 交通, 少",['交通'],位置,9,1.5,29472,3
A09,2020-05-30,**，位于广东韶关市仁化县内，广东省著名景点之一。在**景区内，有一重要景点:陀石。它实际是一个三面陡壁的巨大石块平台。站在陀石上四面远眺，丹霞风光尽收眼底，顿时有了“一览众山小”的气慨，令人陶醉不已。,1.0,0.2425999939441681,"风景, 表演, 值得, 一般般, 位于, 晚上, 好看, 建筑, 美丽, 大自然","['位于', '广东', '韶关市', '仁化县', '广东省', '著名景点', '陀石', '一个三面', '陡壁', '石块', '平台', '站', '陀石', '四面', '远眺', '丹霞', '风光', '尽收眼底', '一览', '众山', '气慨', '令人', '陶醉']",服务,9,1.0,29473,2
A09,2020-10-04,个人觉得不划算，主要是水上丹霞不划算，来回不到一个小时，就要100元，没看到什么特别的景色，感觉很不值，水上之外的觉得都很好，铁道丹锁和细美寨、九九天梯很惊险刺激，值得一爬，两天的时间，不太够用，很多地方都没去，有机会可以再去玩。网上的价格和实体店是一样的，唯一的好处大概就是不用排队吧,3.0,0.3160000145435333,"走, 高, 性价比, 免费, 太, 坐, 建议, 观音, 开车, 感觉","['不划算', '水上', '丹霞', '不划算', '来回', '不到', '特别', '景色', '感觉', '不值', '水上', '之外', '铁道', '丹锁', '细', '美寨', '九九', '天梯', '惊险刺激', '值得', '爬', '两天', '太', '够用', '没去', '机会', '网上', '价格', '实体店', '唯一', '好处', '不用', '排队']",性价比,9,1.0,29474,2
A09,2020-10-06,取票方便、便宜、靠谱、服务好。,4.0,0.5187000036239624,"便宜, 价格, 优惠, 网上, 现场, 不用, 实惠, 排队, 购票, 订","['便宜', '谱', '服务']",性价比,9,1.0,29475,2
A09,2020-05-30,偶尔累，大部分还是比较轻松的，徒步穿越的行程，景色优美，空气清新，运动和放松一起了，在最高峰一览群山的感觉，真的不一样，每个山峰和山群，都特立独行的，展示自己的特色，群象过江的气势，童子敬茶的虔诚，茶壶峰，栩栩如生。世界真奇妙。,3.0,0.3943000137805938,"走, 高, 性价比, 免费, 太, 坐, 建议, 观音, 开车, 感觉","['累', '大部分', '轻松', '徒步', '穿越', '行程', '景色', '优美', '空气清新', '运动', '放松', '最高峰', '一览', '群山', '感觉', '真的', '山峰', '山群', '特立独行', '展示', '特色', '群象', '过江', '气势', '童子', '敬茶', '虔诚', '茶壶', '峰', '栩栩如生', '世界', '真', '奇妙']",性价比,9,5.0,29476,5
A09,2020-03-31,**主要分为长老峰-翔龙湖游览区和阳元石游览区，此外还有单独售票的锦江画廊和巴寨景区。**长老峰景区分上、中、下三个景观层。下层为锦石岩景层，有始建于北宋的锦石岩石窟寺、梦觉关、通天洞、百丈峡及最典型的赤壁丹崖等景点。中层为别传寺景层，有岭南十大禅林之一的别传寺，还有一线天、双池碧荷等景点。上层则可一览丹霞群峰全貌。,3.0,0.4000000059604645,"走, 高, 性价比, 免费, 太, 坐, 建议, 观音, 开车, 感觉","['分为', '长老', '峰', '翔', '龙湖', '游览区', '阳元石', '游览区', '单独', '售票', '锦江', '画廊', '巴寨', '长老', '峰', '分上', '中', '三个', '景观', '层', '下层', '锦石', '岩', '景层', '始建', '北宋', '锦石', '岩', '石窟寺', '梦', '觉关', '通天', '洞', '百丈', '峡', '典型', '赤壁', '丹崖', '中层', '别传', '寺景层', '岭南', '十', '大禅林', '别传', '寺', '一线天', '双', '池碧荷', '上层', '一览', '丹霞', '群峰', '全貌']",性价比,9,1.5,29477,3
A09,2020-03-31,蛮好用的，下个APP，缓存到本地，到每个景点都有介绍，玩儿的也更明白一些。不过不能定位，不能根据定位自动播报，APP上有这项功能，但是是废的，需要自己手动点着播放。最好用蓝牙耳机，线的不方便，爬上很陡峭。韶关高铁站出来，就有公交大巴，去**门口21元，全程大概80分钟，景区门口有个客运站，07:15首班车回韶关高铁站，半个小时一班车。,6.0,0.7554000020027161,"上山, 广东, 导游, 山顶, 时, 走, 到达, 两个, 下午, 坐","['好用', '缓存', '介绍', '玩儿', '明白', '定位', '定位', '自动', '播报', '这项', '功能', '废', '手动', '点着', '播放', '蓝牙', '耳机', '线', '爬', '陡峭', '韶关', '高铁', '站', '公交', '大巴', '门口', '全程', '分钟', '门口', '有个', '客运站', '首班车', '回', '韶关', '高铁', '站', '半个', '班车']",服务,9,2.0,29478,4
A09,2020-05-02,#**#         这个五一和男朋友一起去了**，总体感觉这个地方还是很值得一去的，比桂林山水性价比高很多(我比较喜欢性价比高的[大笑])       行程4月30号晚上的火车，从广州到韶关，第二天一早到韶关东，等最早一班班车去**。在**外面的客栈住了一晚。总行程两天一夜。**外面有很多客栈，是政府统一规划，当地居民经营的。我们住的是音乐之旅，主要是因为它这个随时可退，里面也挺干净的，性价比挺高[大笑]        因为是早上到的，可以先去客栈休息一下，中午去美团上排名第一的一家饭店吃的午饭，性价比还可以，就是节假日不能用美团，不然性价比更高[可爱]      正好**感觉用一整天可以玩完，但是会很累，如果打算住一晚的话，最好和我们一样，第一天下午去长老峰景区。        长老峰和翔龙湖景区是一起玩的。从景点入口处坐免费大巴到换乘处换乘去长老峰的车。建议先去长老峰再通过阳元石，然后坐船游翔龙湖，这样顺路。       第二天玩阳元石景区，九九天梯一定要去。最高处有最美的风景，所以一定不要半途而废。长老峰峰顶和这里都可以一览众山小，将美景尽收眼底。,3.0,0.4180999994277954,"走, 高, 性价比, 免费, 太, 坐, 建议, 观音, 开车, 感觉","['五一', '男朋友', '总体', '感觉', '值得', '一去', '桂林山水', '性价比', '高', '喜欢', '性价比', '高', '大笑', '行程', '月', '号', '晚上', '火车', '广州', '韶关', '第二天', '一早', '韶关', '东', '最早', '一班', '班车', '外面', '客栈', '住', '一晚', '总', '行程', '两天', '一夜', '外面', '客栈', '政府', '统一规划', '居民', '经营', '住', '音乐', '旅', '是因为', '可退', '干净', '性价比', '高', '大笑', '早上', '先', '客栈', '休息', '中午', '美团', '排名', '第一', '一家', '饭店', '吃', '午饭', '性价比', '节假日', '美团', '性价比', '高', '可爱', '正好', '感觉', '一整天', '玩完', '累', '打算', '住', '一晚', '第一天', '下午', '长老', '峰', '长老', '峰', '和翔龙', '湖景区', '入口处', '坐', '免费', '大巴', '换乘', '处', '换乘', '长老', '峰', '车', '建议', '先', '长老', '峰', '阳元石', '坐船', '游翔', '龙湖', '顺路', '第二天', '阳元石', '九九', '天梯', '最高处', '最美', '风景', '半途而废', '长老', '峰峰', '顶', '一览', '众山', '美景', '尽收眼底']",性价比,9,8.0,29479,5
A09,2020-06-29,又一大自然的杰作，风景秀丽，还流穿着一些孕育美好的传说。我们到此，更主要的是为呼吸更洁净的氧气和健康的生活。附近旅游休闲不错的选择之一！,0.0,0.5906999707221985,"值得, 适合, 环境, 干净, 休闲, 公园, 空气清新, 瀑布, 水, 很漂亮","['大自然', '杰作', '风景秀丽', '流', '穿着', '孕育', '美好', '呼吸', '洁净', '氧气', '健康', '生活', '休闲', '选择']",卫生,9,3.0,29480,5
A09,2020-05-08,风景很美，青山绿水，哈哈。,11.0,0.3589999973773956,"景色, 美, 感觉, 山上, 值得, 中, 优美, 拍, 交通, 少","['风景', '美', '青山绿水']",位置,9,1.5,29481,3
A09,2020-02-25,上午游览阳元山景区，中午游览水上丹霞，下午2点开始游览长老峰景区。长老峰景区由三个山峰联在一起，分别是宝珠峰，海螺峰和长老峰。从宝珠峰索道上山，山上站下去按指示牌很快就到了韶音台；这里是长老峰景区也是整个**最漂亮的风景，在此看完后向长老峰走，山路起伏不大，沿最左侧路走，经片鳞岩雪岩到长老峰，登长老峰一个环形路，不到100个台阶到顶看到相似又不同的风景，可看清山下望夫石，一柱石；环行回到开始处可登海螺峰，在顶上可看到太极状河，再下来二条路下山，走双喜台福音峡是好走的下山路。从这里也可向阴元石走来回需要2个小时，也可过福音峡看摩崖石刻及别传寺下山到景交车站回景区门口，这样一圈下来大约三个半小时。,3.0,0.6445000171661377,"走, 高, 性价比, 免费, 太, 坐, 建议, 观音, 开车, 感觉","['上午', '游览', '阳', '元山', '中午', '游览', '水上', '丹霞', '下午', '游览', '长老', '峰', '长老', '峰', '三个', '山峰', '联', '宝', '珠峰', '海螺', '峰', '长老', '峰', '宝', '珠峰', '索道', '上山', '山上', '站', '指示牌', '很快', '韶音台', '长老', '峰', '漂亮', '风景', '长老', '峰', '走', '山路', '起伏', '左侧', '路', '走', '经片', '鳞岩', '雪岩', '长老', '峰', '登', '长老', '峰', '环形', '路', '不到', '台阶', '顶', '风景', '看清', '山下', '望夫石', '柱石', '环行', '回到', '处', '登', '海螺', '峰', '顶上', '太极', '状河', '二条', '路', '下山', '走', '双喜', '台', '福音', '峡', '走', '山路', '阴元石', '走', '来回', '福音', '峡', '摩崖', '石刻', '别传', '寺', '下山', '景交', '车站', '回', '门口', '一圈', '三个', '半小时']",性价比,9,0.0,29482,1
A09,2020-02-24,一天游全**是困难的，把大部分精华看到是可以的。早上8点乘景交车第一站阳元山景区下车，过桥进景区沿木栈道先上拜阳台看**经典阳元石（上午顺光），下到下面二个分岔，一个是直接走云崖天梯上阳元山，另外一个是走双乳石方向，个人建议走这个方向经双乳石（很牵强）到通泰桥景区（这里是一个进出口一致的闭环）看国内比较少见的拱门形状的通泰桥，上通泰桥看阳元山全景（晒布岩）走环看海豹石从进口出来到九九天梯上阳元山细美寨，山顶尽头亭子里可看漂亮的丹霞地貌景观，走云崖栈道（两处非常陡）敬阳元石回到景区门口，这时基本已是中午，需要休息吃饭并乘船一个半小时游览水上丹霞。下午2点半开始游览长老峰景区。,3.0,0.6061000227928162,"走, 高, 性价比, 免费, 太, 坐, 建议, 观音, 开车, 感觉","['全', '困难', '大部分', '精华', '早上', '乘景', '交车', '第一站', '阳', '元山', '下车', '过桥', '进', '木', '栈道', '先上', '拜', '阳台', '经典', '阳元石', '上午', '顺光', '二个', '分岔', '走', '云崖', '天梯', '上阳', '元山', '走', '双乳', '石', '方向', '建议', '走', '方向', '双乳', '石', '牵强', '通泰桥', '进出口', '闭环', '国内', '少见', '拱门', '形状', '通泰桥', '上通', '泰桥', '看阳', '元山', '全景', '晒', '布岩', '走', '环', '海豹', '石', '进口', '九九', '天梯', '上阳', '元山', '细', '美寨', '山顶', '尽头', '亭子', '可看', '漂亮', '丹霞地貌', '景观', '走', '云崖', '栈道', '两处', '陡', '敬阳元石', '回到', '门口', '中午', '休息', '吃饭', '乘船', '一个半', '游览', '水上', '丹霞', '下午', '游览', '长老', '峰']",性价比,9,1.0,29483,2
A09,2020-11-28,取票很方便，而且这里比现场买便宜了5块钱，非常好，至于景点长老峰确实是很不错，特别是观日亭看日出，一览群山，烟雾缭绕美的不要不要的。相比之下阳元山好差劲，去过的就知道。,6.0,0.4205999970436096,"上山, 广东, 导游, 山顶, 时, 走, 到达, 两个, 下午, 坐","['现场', '便宜', '块钱', '长老', '峰', '确实', '特别', '观日亭', '日出', '一览', '群山', '烟雾', '缭绕', '美的', '相比之下', '阳', '元山', '差劲', '去过']",服务,9,1.0,29484,2
A09,2020-10-04,挺大的景点，赞，很不错,5.0,0.692300021648407,"温泉, 服务, 服务态度, 满意, 泡温泉, 热情, 家人, 工作人员, 方便快捷, 态度","['挺大', '赞']",服务,9,1.5,29485,3
A09,2020-02-08,来广东十多年，第一次去，比想象中的要好，景区分成多个部分，这次主要去的长老峰和阳元山，山虽不算险峻，但道路有部分很是陡峭，爬上去还是不小的挑战，好在山上视野开阔，风景秀丽，也算是一次有意义又健康的尝试吧！,6.0,0.3235000073909759,"上山, 广东, 导游, 山顶, 时, 走, 到达, 两个, 下午, 坐","['广东', '十多年', '第一次', '想象', '中', '分成', '多个', '长老', '峰', '阳', '元山', '山', '不算', '险峻', '道路', '陡峭', '爬上去', '不小', '挑战', '山上', '视野', '开阔', '风景秀丽', '算是', '意义', '健康', '尝试']",服务,9,0.0,29486,1
A09,2020-02-07,春节去的旅游，人不多，取票非常方便，自驾去的门口有停车位，唯一不好的是没有提供景区地图，对游览行走线路没明确线路。,3.0,0.5289000272750854,"走, 高, 性价比, 免费, 太, 坐, 建议, 观音, 开车, 感觉","['春节', '人不多', '自驾', '门口', '停车位', '唯一', '不好', '提供', '地图', '游览', '行走', '线路', '线路']",性价比,9,-1.0,29487,1
A09,2020-05-02,非常值得家庭出游的地方！空气清新景色宜人。具有挑战性，很刺激！简直就是小黄山和小张家界了！孩子和家长都能挑战自己，玩的特别开心,0.0,0.4447999894618988,"值得, 适合, 环境, 干净, 休闲, 公园, 空气清新, 瀑布, 水, 很漂亮","['值得', '家庭', '出游', '空气清新', '景色宜人', '挑战性', '刺激', '黄山', '张家界', '家长', '挑战', '特别', '开心']",卫生,9,1.0,29488,2
A09,2020-05-03,从韶关东站坐大巴可以直接到景区门口 比较正规的线路 进了景区坐免费巴士 不同景点有不同的站点 我坐到索道那一站 上去的,6.0,0.5931000113487244,"上山, 广东, 导游, 山顶, 时, 走, 到达, 两个, 下午, 坐","['韶关', '东站', '坐', '大巴', '门口', '正规', '线路', '进', '坐', '免费', '巴士', '站点', '坐到', '索道', '一站']",服务,9,2.0,29489,4
A09,2020-05-04,还好了，节日期间会有点紧张可以接受,7.0,0.4896000027656555,"环境, 贵, 很好, 没什么, 吃, 东西, 太, 差, 感觉, 风景","['还好', '节日期间', '紧张', '接受']",性价比,9,0.0,29490,1
A09,2020-07-10,**有别于其他山脉，是典型的丹霞地貌，很是独特，来到这里，欣赏丹霞地貌，看湖泊，峡谷，山洞，巨石等，别有一番风味在心头！,12.0,0.2966000139713287,"动物, 爬, 岛, 沙滩, 天然, 氧吧, 表演, 广州, 动物园, 种类","['有别于', '山脉', '典型', '丹霞地貌', '独特', '来到', '欣赏', '丹霞地貌', '湖泊', '峡谷', '山洞', '巨石', '风味', '心头']",设施,9,2.0,29491,4
A09,2020-05-26,好玩，值得一去，我去的时候不收停车费。一百块钱是境区门票，想玩别的例如：坐船，缆车，竹筏等额外给钱。,0.0,0.3700999915599823,"值得, 适合, 环境, 干净, 休闲, 公园, 空气清新, 瀑布, 水, 很漂亮","['好玩', '值得', '收', '停车费', '一百块', '钱', '境区', '想', '坐船', '缆车', '竹筏', '额外', '给钱']",卫生,9,1.0,29492,2
A09,2020-10-07,国庆一家老小自驾开心游**两天，通过层层陡峭的石梯有胆有勇不怕坚难的爬行，特别是69岁的老母亲手脚利索和小女儿6岁都很棒和我们一一目睹了这鬼斧神工的美丽山水景色阳元石、九九天梯、嘉遁亭，阴元石、长老峰等等山顶目睹山下一览无余的美景整片土地都在我们脚下特有自豪感！,3.0,0.426499992609024,"走, 高, 性价比, 免费, 太, 坐, 建议, 观音, 开车, 感觉","['国庆', '一家老小', '自驾', '开心', '两天', '层层', '陡峭', '石梯', '胆有勇', '坚难', '爬行', '特别', '岁', '母亲', '手脚利索', '小女儿', '岁', '很棒', '目睹', '鬼斧神工', '美丽', '山水', '景色', '阳元石', '九九', '天梯', '嘉', '遁', '亭', '阴元石', '长老', '峰', '山顶', '目睹', '山下', '一览无余', '美景', '整片', '土地', '脚下', '特有', '自豪感']",性价比,9,4.0,29493,5
A09,2020-07-05,位于广东韶关的名山，特色丹霞地貌，规模很大，山脚下有湖泊，山上森林密布，巨石林立，登山是不错的选择，呼吸新鲜空气，感受大自然魅力！,0.0,0.255400002002716,"值得, 适合, 环境, 干净, 休闲, 公园, 空气清新, 瀑布, 水, 很漂亮","['位于', '广东', '韶关', '名山', '特色', '丹霞地貌', '规模', '很大', '山脚下', '湖泊', '山上', '森林', '密布', '巨石', '林立', '登山', '选择', '呼吸', '新鲜空气', '感受', '大自然', '魅力']",卫生,9,2.0,29494,4
A09,2020-02-08,门票100一人，春节80一人，有学生老人儿童优惠票。主要分为两个景区，长老峰跟阳元石景区，一天可以走完，**大门口游客中心有免费接驳巴士去长老峰和缆车。我是前一天晚上住在瑶塘新村的民宿，第二天起早开车前往缆车处，坐巴士去长老峰景区上山。不建议大家坐缆车，因为坐缆车上山后还需要步行40分钟才能登上顶峰，并不是坐完缆车就到山顶了，且坐缆车看不到任何风景。可以从长老峰上山然后下山前往阴元石，不走回头路。长老峰景区爬山不太累，老人小孩可前行。阳元石景区就商业化很多，也更多人，建议停去长老峰景区停车场再步行入景区，景区外有很多大排档，小吃街。九九天梯跟云崖栈道比较刺激惊险，恐高者、老人小孩不推荐前往，很多地方需要手脚并用，比较难走，体力不足的可以走到阳元石观赏台就回去了。,6.0,0.4851999878883362,"上山, 广东, 导游, 山顶, 时, 走, 到达, 两个, 下午, 坐","['春节', '学生', '儿童', '优惠', '分为', '两个', '长老', '峰', '阳元石', '走', '大门口', '游客', '中心', '免费', '接驳', '巴士', '长老', '峰', '缆车', '前一天', '晚上', '住', '瑶', '塘', '新村', '民宿', '第二天', '早', '开车', '前往', '缆车', '处', '坐', '巴士', '长老', '峰', '上山', '建议', '坐', '缆车', '坐', '缆车', '上山', '步行', '分钟', '登上', '顶峰', '坐完', '缆车', '山顶', '坐', '缆车', '看不到', '风景', '长老', '峰', '上山', '下山', '前往', '阴元石', '走回头路', '长老', '峰', '爬山', '太', '累', '前行', '阳元石', '商业化', '建议', '停去', '长老', '峰', '停车场', '步行', '入', '外', '大排档', '小吃街', '九九', '天梯', '云崖', '栈道', '刺激', '惊险', '恐', '高者', '推荐', '前往', '手脚', '并用', '难', '走', '体力', '走到', '阳元石', '观赏', '台', '回去']",服务,9,0.0,29495,1
A09,2020-04-04,**风景非常漂亮！而且保护得很好，必须花上两天才可以把重要的景色看一遍，而且很多景致需要走路过去才能看到，这就要良好的体质，这样走路不会太慢，同时还可以看的到更清晰的风景。,3.0,0.2802000045776367,"走, 高, 性价比, 免费, 太, 坐, 建议, 观音, 开车, 感觉","['风景', '漂亮', '保护', '花', '两天', '景色', '看一遍', '景致', '走路', '体质', '走路', '太慢', '清晰', '风景']",性价比,9,3.0,29496,5
A09,2020-07-31,是世界遗址公园，国家5A 景区，国家地址公园，这次巧遇2018年首届**半程马拉松赛事，图片中景点：睡美人（又名玉女拦江）阴元石，高10.3米宽4.8米阳元石，高28米，直径7米阴阳石相距不到5公里，天地生一双，一阳一阴、一刚一柔、一大一小，这般巧合地相峙而立，被誉为丹霞双绝[憨笑]！值得游玩一下！,3.0,0.499099999666214,"走, 高, 性价比, 免费, 太, 坐, 建议, 观音, 开车, 感觉","['世界', '遗址', '公园', '国家', '国家', '地址', '公园', '巧遇', '年', '首届', '半程', '马拉松赛', '事', '图片', '中', '睡美人', '又名', '玉女', '拦', '江', '阴元石', '高', '米', '宽', '米', '阳元石', '高', '米', '直径', '米', '阴阳', '石', '相距', '不到', '公里', '天地生', '一双', '阳一阴', '刚一柔', '一大', '一小', '巧合', '相峙', '而立', '被誉为', '丹霞', '双', '憨笑', '值得']",性价比,9,0.0,29497,1
A09,2020-03-28,**由680多座顶平、身陡、麓缓的红色砂砾岩石构成，色如渥丹，灿若明霞，以赤壁丹崖为特色。是发育最典型、类型最齐全、造型最丰富、景色最优美的丹霞地貌集中分布区。,0.0,0.2270999997854232,"值得, 适合, 环境, 干净, 休闲, 公园, 空气清新, 瀑布, 水, 很漂亮","['多座', '顶平', '身', '陡', '麓', '缓', '红色', '砂砾', '岩石', '色', '渥丹', '灿若明霞', '赤壁', '丹崖', '特色', '发育', '典型', '类型', '齐全', '造型', '景色', '优美', '丹霞地貌', '分布区']",卫生,9,3.0,29498,5
A09,2020-05-03,五一假期游客超多，景区指引不足，取票点其实不需要都挤在大门口的售票处，入景区停车场2公里后还有好几个取票的地方。,6.0,0.5347999930381775,"上山, 广东, 导游, 山顶, 时, 走, 到达, 两个, 下午, 坐","['五一', '假期', '游客', '超多', '指引', '挤', '大门口', '售票处', '入', '停车场', '公里', '好几个']",服务,9,1.5,29499,3
