A22,2016-09-06,不错啊，山高路陡，空气新鲜，不去很遗憾啊,8.0,0.5047000050544739,"空气, 设施, 可惜, 完善, 还行, 游乐, 有意思, 老板, 负离子, 商业","['山高路陡', '空气', '新鲜', '遗憾']",设施,22,0.0,46586,1
A22,2016-09-13,这里可以去爬爬山，平时也是有很多人来这里玩。,12.0,0.2840000092983246,"动物, 爬, 岛, 沙滩, 天然, 氧吧, 表演, 广州, 动物园, 种类","['爬', '爬山', '平时']",设施,22,1.5,46587,3
A22,2016-08-31,美丽的地方，还有一坐观音像，还有个湖，,3.0,0.5195000171661377,"走, 高, 性价比, 免费, 太, 坐, 建议, 观音, 开车, 感觉","['美丽', '坐', '观音像', '湖']",性价比,22,1.0,46588,2
A22,2016-04-06,这里可以玩上半天时间，大佛值得一看！,1.0,0.5386000275611877,"风景, 表演, 值得, 一般般, 位于, 晚上, 好看, 建筑, 美丽, 大自然","['上半天', '大佛', '值得一看']",服务,22,1.5,46589,3
A22,2016-08-27,挺好的地方，有时间再来玩一下！,10.0,0.5383999943733215,"喜欢, 下次, 漂亮, 朋友, 值得, 去过, 机会, 字, 开心, 风景优美",['再来'],位置,22,1.5,46590,3
A22,2016-02-12,不错?就是那观光车司机是为抢客吗？开的像赛车一样，上坡路也是一路超车，有点危险！！！,3.0,0.6796000003814697,"走, 高, 性价比, 免费, 太, 坐, 建议, 观音, 开车, 感觉","['观光车', '司机', '抢客', '开', '赛车', '上坡路', '一路', '超车', '危险']",性价比,22,-1.0,46591,1
A22,2016-08-24,去东莞多次了还没机会去看看。先给个好评。,3.0,0.4146000146865845,"走, 高, 性价比, 免费, 太, 坐, 建议, 观音, 开车, 感觉","['东莞', '机会', '先', '好评']",性价比,22,1.0,46592,2
A22,2016-02-14,看了别人的点评，很有用。首先，在外面买香确实带不进去！其次，里面内设的停车场比较大，5块钱任停。一定要坐电瓶车，因为上山的路很远很远很远很远！即使电瓶车到了之后还要爬八百米才能到观音广场。不过好处就是最后八百米既有台阶路也有水泥路，台阶路很陡，走起来很辛苦。老年人或者带小孩的，强烈建议不要有台阶。山上有买素食自助，就是九菜一汤，38，看起来不咋地，所以最后选择吃方便面，10一桶，到处都有卖。方便。,3.0,0.3896999955177307,"走, 高, 性价比, 免费, 太, 坐, 建议, 观音, 开车, 感觉","['点评', '有用', '外面', '香', '确实', '内设', '停车场', '块钱', '任停', '坐', '电瓶车', '上山', '路', '很远', '很远', '很远', '很远', '电瓶车', '爬', '八百米', '观音', '广场', '好处', '八百米', '既有', '台阶', '路', '水泥路', '台阶', '路', '陡', '走', '辛苦', '老年人', '强烈建议', '台阶', '山上', '素食', '自助', '菜', '汤', '不咋地', '选择', '吃', '方便面', '一桶', '卖']",性价比,22,2.0,46593,4
A22,2016-08-23,门票40，都是水泥路比较好走，延路上还有鸟看,6.0,0.7692000269889832,"上山, 广东, 导游, 山顶, 时, 走, 到达, 两个, 下午, 坐","['水泥路', '走', '延', '路上', '鸟']",服务,22,1.5,46594,3
A22,2016-08-22,好地方，值得一去、赞个再说。。。,5.0,0.692300021648407,"温泉, 服务, 服务态度, 满意, 泡温泉, 热情, 家人, 工作人员, 方便快捷, 态度","['值得', '赞']",服务,22,1.0,46595,2
A22,2016-08-22,还是不错的，风景有挺好，人也挺多，还可以锻炼身体,1.0,0.5386000275611877,"风景, 表演, 值得, 一般般, 位于, 晚上, 好看, 建筑, 美丽, 大自然","['风景', '锻炼身体']",服务,22,1.5,46596,3
A22,2016-08-18,**的设计摆放不好。拜佛地方还有热狗卖。不可思议,9.0,0.8154000043869019,"山, 爬山, 好多, 希望, 太, 美的, 钱, 水, 骑, 活动","['设计', '摆放', '不好', '拜佛', '热狗', '卖', '不可思议']",设施,22,0.0,46597,1
A22,2016-02-04,在风景秀丽的**国家森林公园的**上，有一个小小的感恩湖。 原生态的湖里是一汪清澈的湖水，在微风的吹拂下泛起阵阵涟漪。宁静的湖面上有几只野鸭无忧无虑地生活在那里。但估计决不会独此一家，从野鸭的叫声判断，在灌木竹林丛中，一定还有在视线之外的这一群那一群野鸭兄弟姐妹们。那天，整个感恩湖除了我一个人就这几只野鸭。眼前，满目翠绿；耳畔，鸭语风声。这感觉啊，真是好得不能再好了，简直没法说。现在的城市何处去觅这样的视觉听觉之享受胜景？ 感恩湖就这样不事张扬地静卧在**金顶广场脚下的一侧。,0.0,0.3222000002861023,"值得, 适合, 环境, 干净, 休闲, 公园, 空气清新, 瀑布, 水, 很漂亮","['风景秀丽', '国家森林公园', '小小的', '感恩', '湖', '原生态', '湖里', '一汪', '清澈', '湖水', '微风', '吹拂', '泛起', '阵阵', '涟漪', '宁静', '湖面', '几只', '野鸭', '无忧无虑', '生活', '估计', '决不会', '独此一家', '野鸭', '叫声', '判断', '灌木', '竹林', '丛中', '视线', '之外', '一群', '一群', '野鸭', '兄弟姐妹', '那天', '感恩', '湖', '几只', '野鸭', '眼前', '满目', '翠绿', '耳畔', '鸭语', '风声', '感觉', '没法', '城市', '觅', '视觉', '听觉', '享受', '胜景', '感恩', '湖', '不事', '张扬', '静卧在', '金顶', '广场', '脚下', '一侧']",卫生,22,5.0,46598,5
A22,2015-04-17,总体来说还不错，空气清新，全程林荫小道，络绎不绝的游客。还有一些可爱的小动物免费观赏，天气好的时候去玩，一切都显得特别的美丽。景点门口购票45每人。山顶商店东西很贵，香也贵。出发前最好自备食物和水，想拜佛的又不想乱花钱的也可以自备香。,6.0,0.2680999934673309,"上山, 广东, 导游, 山顶, 时, 走, 到达, 两个, 下午, 坐","['总体', '空气清新', '全程', '林荫', '小道', '络绎不绝', '游客', '可爱', '动物', '免费', '观赏', '天气', '显得', '特别', '美丽', '门口', '购票', '每人', '山顶', '商店', '东西', '贵', '香', '贵', '出发', '前', '自备', '食物', '水', '想', '拜佛', '不想', '乱花钱', '自备', '香']",服务,22,3.0,46599,5
A22,2016-08-13,还不错，不过觉得门票还是有点贵了,7.0,0.5385000109672546,"环境, 贵, 很好, 没什么, 吃, 东西, 太, 差, 感觉, 风景",['贵'],性价比,22,1.5,46600,3
A22,2016-06-27,很好哦，下次还是会再去,10.0,0.5385000109672546,"喜欢, 下次, 漂亮, 朋友, 值得, 去过, 机会, 字, 开心, 风景优美",['下次'],位置,22,1.5,46601,3
A22,2016-08-25,锻练身体，好地方，要去，值得去,8.0,0.3592999875545501,"空气, 设施, 可惜, 完善, 还行, 游乐, 有意思, 老板, 负离子, 商业","['锻练', '身体', '值得']",设施,22,1.0,46602,2
A22,2016-08-10,山不是很好高，适合一家老小，绿化好，空气好，收费有点贵，毕竟东莞所有的公园都免费了。,3.0,0.4004000127315521,"走, 高, 性价比, 免费, 太, 坐, 建议, 观音, 开车, 感觉","['山', '高', '适合', '一家老小', '绿化', '空气', '收费', '贵', '东莞', '公园', '免费']",性价比,22,2.0,46603,4
A22,2016-08-03,还行吧。，有闲功夫，有闲情的话。,8.0,0.3591000139713287,"空气, 设施, 可惜, 完善, 还行, 游乐, 有意思, 老板, 负离子, 商业","['还行', '闲', '功夫', '闲情']",设施,22,1.5,46604,3
A22,2016-08-06,**景色非常不错，空气清新。值得一去。,0.0,0.4709999859333038,"值得, 适合, 环境, 干净, 休闲, 公园, 空气清新, 瀑布, 水, 很漂亮","['景色', '空气清新', '值得']",卫生,22,1.0,46605,2
A22,2016-04-30,路比较弯，尤其是坐车的时候，好惊险的感觉，带上老妈和女儿一起，女儿全程自己走上去，非常棒，途中景色不错，同时希望观音菩萨保佑！,10.0,0.3880999982357025,"喜欢, 下次, 漂亮, 朋友, 值得, 去过, 机会, 字, 开心, 风景优美","['路', '弯', '坐车', '惊险', '感觉', '带上', '老妈', '女儿', '女儿', '全程', '走上', '棒', '途中', '景色', '希望', '观音菩萨', '保佑']",位置,22,0.0,46606,1
A22,2016-08-16,景色一般，L吃不多，可以不去,11.0,0.3723999857902527,"景色, 美, 感觉, 山上, 值得, 中, 优美, 拍, 交通, 少","['景色', 'L', '吃', '']",位置,22,1.5,46607,3
A22,2016-07-26,爬山的好去处，礼佛也不错，关键是空气好。,3.0,0.2381000071763992,"走, 高, 性价比, 免费, 太, 坐, 建议, 观音, 开车, 感觉","['爬山', '好去处', '礼佛', '关键', '空气']",性价比,22,1.5,46608,3
A22,2016-06-06,不错很好，只是山太高，坐车来回的。,3.0,0.692300021648407,"走, 高, 性价比, 免费, 太, 坐, 建议, 观音, 开车, 感觉","['山太高', '坐车', '来回']",性价比,22,1.5,46609,3
A22,2016-07-22,周末没事过来转转，呼吸一下新鲜空气,12.0,0.3465000092983246,"动物, 爬, 岛, 沙滩, 天然, 氧吧, 表演, 广州, 动物园, 种类","['周末', '没事', '转转', '呼吸', '新鲜空气']",设施,22,-1.0,46610,1
A22,2016-07-24,以前过年都会和家人亲戚去一次走走，交通很方便，有公车到达门口，就是里面景色一般，没有多大老头,6.0,0.3370999991893768,"上山, 广东, 导游, 山顶, 时, 走, 到达, 两个, 下午, 坐","['过年', '家人', '亲戚', '走走', '交通', '公车', '到达', '门口', '景色', '老头']",服务,22,1.5,46611,3
A22,2016-07-21,在东莞来说还算是不错的了，凑合看看,3.0,0.3626999855041504,"走, 高, 性价比, 免费, 太, 坐, 建议, 观音, 开车, 感觉","['东莞', '算是', '凑合']",性价比,22,1.5,46612,3
A22,2016-07-18,**挺好的景点，呼吸大自然，真好。,12.0,0.2737999856472015,"动物, 爬, 岛, 沙滩, 天然, 氧吧, 表演, 广州, 动物园, 种类","['呼吸', '大自然', '真']",设施,22,1.5,46613,3
A22,2016-07-16,不错的景点，各位亲们值得一去、,5.0,0.692300021648407,"温泉, 服务, 服务态度, 满意, 泡温泉, 热情, 家人, 工作人员, 方便快捷, 态度","['亲们', '值得']",服务,22,1.0,46614,2
A22,2016-07-20,就是门票太贵了，但物有所值，还可以,7.0,0.3589999973773956,"环境, 贵, 很好, 没什么, 吃, 东西, 太, 差, 感觉, 风景","['太贵', '物有所值']",性价比,22,1.5,46615,3
A22,2016-07-15,环境很不错，不紧空气很好，也没市区那么热。,3.0,0.2186000049114227,"走, 高, 性价比, 免费, 太, 坐, 建议, 观音, 开车, 感觉","['环境', '不紧', '空气', '市区', '热']",性价比,22,1.5,46616,3
A22,2016-04-09,如果你不想爬山的，那么建议一到就坐电瓶车，来回80块，挺值得。因为还有最后800米是要你自己走路的那也是最艰难的路程，呜呼,3.0,0.7440000176429749,"走, 高, 性价比, 免费, 太, 坐, 建议, 观音, 开车, 感觉","['不想', '爬山', '建议', '坐', '电瓶车', '来回', '块', '值得', '米', '走路', '艰难', '路程']",性价比,22,0.0,46617,1
A22,2016-07-15,景色挺好的，氧自由基充足，就是有点累！站在山顶，俯看下面城市，挺赞的。,3.0,0.3445000052452087,"走, 高, 性价比, 免费, 太, 坐, 建议, 观音, 开车, 感觉","['景色', '氧', '自由基', '充足', '有点累', '站', '山顶', '俯看', '城市', '挺赞']",性价比,22,1.0,46618,2
A22,2016-02-18,这是一个好地方，绿色的草地，环境卫生管理好。,10.0,0.3589999973773956,"喜欢, 下次, 漂亮, 朋友, 值得, 去过, 机会, 字, 开心, 风景优美","['绿色', '草地', '环境卫生', '管理']",位置,22,1.0,46619,2
A22,2016-07-14,很好，特别漂亮，特别好玩，一次肯定还去,2.0,0.6751999855041504,"好玩, 开心, 太, 天气, 项目, 特别, 舒服, 夏天, 热, 风景","['特别', '漂亮', '特别', '好玩', '肯定']",设施,22,4.0,46620,5
A22,2016-07-09,还不错的一个地方吧！以前在**下面的工业区打工作的时候放假都会去，不过就是门票太贵。,2.0,0.5192000269889832,"好玩, 开心, 太, 天气, 项目, 特别, 舒服, 夏天, 热, 风景","['工业区', '工作', '放假', '太贵']",设施,22,1.5,46621,3
A22,2016-05-23,山真的很高很陡，虽然累联系还是徒步上去，别有一番风味,3.0,0.6115999817848206,"走, 高, 性价比, 免费, 太, 坐, 建议, 观音, 开车, 感觉","['山', '真的', '高', '陡', '累', '徒步', '风味']",性价比,22,1.5,46622,3
A22,2016-07-07,爬山的话还不错没什么景色不过空气非常好,11.0,0.2176000028848648,"景色, 美, 感觉, 山上, 值得, 中, 优美, 拍, 交通, 少","['爬山', '没什么', '景色', '空气']",位置,22,1.5,46623,3
A22,2016-07-07,门票真的真的真的有点贵了但是几年呢都是这个价 其他非常好的 其实,7.0,0.5134000182151794,"环境, 贵, 很好, 没什么, 吃, 东西, 太, 差, 感觉, 风景","['真的', '真的', '真的', '贵', '几年', '价']",性价比,22,1.5,46624,3
A22,2016-07-07,好美的地方，每次闻着香火味道，就能安心的。,9.0,0.2834999859333038,"山, 爬山, 好多, 希望, 太, 美的, 钱, 水, 骑, 活动","['美的', '每次', '闻', '香火', '味道', '安心']",设施,22,1.0,46625,2
A22,2015-12-24,L景很好，空庖埠茫m合\映鲞[，g迎大家多去走走，有益健康，反正|莞也]什N好玩的了，哈哈,2.0,0.2718000113964081,"好玩, 开心, 太, 天气, 项目, 特别, 舒服, 夏天, 热, 风景","['L景', '空', 'm合', '\', '出[', 'g迎', '走走', '有益健康', '反正', '|莞', ']', '什N', '好玩']",设施,22,1.0,46626,2
A22,2015-09-21,朋友介绍去那里说景色不错，兼有许多食市，但去到发现食市需多，但挡次太低，很嘈杂，所以没有在那里吃饭！,3.0,0.6330000162124634,"走, 高, 性价比, 免费, 太, 坐, 建议, 观音, 开车, 感觉","['朋友', '介绍', '景色', '兼有', '食市', '发现', '食市', '需', '挡', '次', '太', '低', '嘈杂', '吃饭']",性价比,22,-1.0,46627,1
A22,2016-03-06,还是值得去的，特别是尊观音像，特别庄严慈祥！不过建议最好坐车上去，靠爬挺累的！,11.0,0.3614999949932098,"景色, 美, 感觉, 山上, 值得, 中, 优美, 拍, 交通, 少","['值得', '特别', '尊', '观音像', '特别', '庄严', '慈祥', '建议', '坐车', '爬', '挺累']",位置,22,5.0,46628,5
A22,2016-07-13,就是爬山，然后山顶有个大观音，上香拜佛可以去的，纯爬山的感觉价格高了点,3.0,0.3598999977111816,"走, 高, 性价比, 免费, 太, 坐, 建议, 观音, 开车, 感觉","['爬山', '山顶', '有个', '观音', '香', '拜佛', '爬山', '感觉', '价格', '高']",性价比,22,1.5,46629,3
A22,2015-12-19,山不在高有仙则灵，是真正的写照，环境确实优美，值得一游,7.0,0.4120999872684479,"环境, 贵, 很好, 没什么, 吃, 东西, 太, 差, 感觉, 风景","['山', '高', '仙', '灵', '写照', '环境', '确实', '优美', '值得']",性价比,22,3.0,46630,5
A22,2016-07-02,好高哦，爬上去后身心舒服，爽爽的,6.0,0.2696999907493591,"上山, 广东, 导游, 山顶, 时, 走, 到达, 两个, 下午, 坐","['高', '爬上去', '身心', '舒服', '爽爽']",服务,22,1.0,46631,2
A22,2016-07-02,好玩。爬山。和小女友去的。累的我3天走不勇贰ＳC再去,3.0,0.2477999925613403,"走, 高, 性价比, 免费, 太, 坐, 建议, 观音, 开车, 感觉","['好玩', '爬山', '女友', '累', '我天', '走', '不勇', 'C']",性价比,22,1.5,46632,3
A22,2016-05-03,女买了女就看了和你家门口,6.0,0.6922000050544739,"上山, 广东, 导游, 山顶, 时, 走, 到达, 两个, 下午, 坐","['女', '女', '家门口']",服务,22,1.5,46633,3
A22,2016-02-02,**国家森林公园无疑是值得参观游览的。 首先是瞻仰世界上最大的玄武岩观世音菩萨石像。首先的感觉是震撼，接着的感觉祥和。 观世音菩萨雕像矗立在**国家森林公园内海拔四百八十八米的山顶广场上。,3.0,0.3551999926567077,"走, 高, 性价比, 免费, 太, 坐, 建议, 观音, 开车, 感觉","['国家森林公园', '无疑', '值得', '参观', '游览', '瞻仰', '世界', '玄武岩', '观世音', '菩萨', '石像', '感觉', '震撼', '感觉', '祥和', '观世音', '菩萨', '雕像', '矗立', '国家森林公园', '海拔', '四百八十', '八米', '山顶', '广场']",性价比,22,2.0,46634,4
A22,2016-06-24,登山运动非常不错，就是门票贵了点，不值。,7.0,0.692300021648407,"环境, 贵, 很好, 没什么, 吃, 东西, 太, 差, 感觉, 风景","['登山运动', '贵', '不值']",性价比,22,-1.0,46635,1
A22,2016-06-21,祈福之旅！意义非凡！经常要去的圣地,0.0,0.4167999923229217,"值得, 适合, 环境, 干净, 休闲, 公园, 空气清新, 瀑布, 水, 很漂亮","['祈福', '旅', '意义', '非凡', '要去', '圣地']",卫生,22,1.0,46636,2
A22,2016-06-21,休闲娱乐好处去。尤其是此时夏季。可以早晨傍晚去。,0.0,0.439300000667572,"值得, 适合, 环境, 干净, 休闲, 公园, 空气清新, 瀑布, 水, 很漂亮","['休闲', '娱乐', '好处', '夏季', '早晨', '傍晚']",卫生,22,1.0,46637,2
A22,2016-06-30,票价贵，然后自己走到观音那里要很久，回来走不动了坐车也要好多钱，觉得去了一次不想去第二次,6.0,0.3109000027179718,"上山, 广东, 导游, 山顶, 时, 走, 到达, 两个, 下午, 坐","['票价', '贵', '走', '观音', '很久', '回来', '走不动', '坐车', '好多钱', '不想', '第二次']",服务,22,1.5,46638,3
A22,2016-06-18,我们是自驾去的，所以开车上山。人很多，景点看的少，都是直接去山顶拜观音了。,3.0,0.5698999762535095,"走, 高, 性价比, 免费, 太, 坐, 建议, 观音, 开车, 感觉","['自驾', '开车', '上山', '少', '山顶', '拜', '观音']",性价比,22,1.5,46639,3
A22,2016-06-17,环境优美的大公园，还有高大的观音像,0.0,0.5184999704360962,"值得, 适合, 环境, 干净, 休闲, 公园, 空气清新, 瀑布, 水, 很漂亮","['环境优美', '公园', '高大', '观音像']",卫生,22,1.5,46640,3
A22,2016-06-17,自然风景，佛教文化，空气宜人，交通便利,8.0,0.2193000018596649,"空气, 设施, 可惜, 完善, 还行, 游乐, 有意思, 老板, 负离子, 商业","['自然风景', '佛教文化', '空气', '宜人', '交通', '便利']",设施,22,2.0,46641,4
A22,2016-06-15,来到东莞一定要去哦，站的高，看的远……,3.0,0.8460999727249146,"走, 高, 性价比, 免费, 太, 坐, 建议, 观音, 开车, 感觉","['来到', '东莞', '站', '高', '远']",性价比,22,1.5,46642,3
A22,2016-06-09,观音像应该是最大最多的，去的人也很多。,3.0,0.5392000079154968,"走, 高, 性价比, 免费, 太, 坐, 建议, 观音, 开车, 感觉","['观音像', '最多']",性价比,22,1.5,46643,3
A22,2016-04-25,值得去、风景也不错、空气很好、,1.0,0.51910001039505,"风景, 表演, 值得, 一般般, 位于, 晚上, 好看, 建筑, 美丽, 大自然","['值得', '风景', '空气']",服务,22,1.0,46644,2
A22,2016-06-12,门票45，一人，爬山上去两个小时左右，下山就快了一个多点。需要带水和零食,9.0,0.5834000110626221,"山, 爬山, 好多, 希望, 太, 美的, 钱, 水, 骑, 活动","['爬山', '两个', '下山', '多点', '带水', '零食']",设施,22,1.5,46645,3
A22,2016-06-10,风景好，空气好，灵气和转运的好地方,8.0,0.3589999973773956,"空气, 设施, 可惜, 完善, 还行, 游乐, 有意思, 老板, 负离子, 商业","['风景', '空气', '灵气', '转运']",设施,22,1.5,46646,3
A22,2016-06-09,可贴老婆奴模型love谷底读错next嗯,7.0,0.3589999973773956,"环境, 贵, 很好, 没什么, 吃, 东西, 太, 差, 感觉, 风景","['可贴', '老婆', '奴', '模型', '谷底', '读错']",性价比,22,1.5,46647,3
A22,2016-06-08,爬山不错。空气不错值得去玩一次。还有观音菩萨拜拜,9.0,0.2845999896526336,"山, 爬山, 好多, 希望, 太, 美的, 钱, 水, 骑, 活动","['爬山', '空气', '值得', '观音菩萨', '拜拜']",设施,22,1.0,46648,2
A22,2016-02-28,**是最大的大理石做的观音，在山顶上，晴天抬头看观音，真的有种观音在转的感觉，香火非常旺，步行爬上去要两个钟。下来可以坐观光巴士，司机开的飞快。建议自己带水和香过去。还是挺值得一去！,3.0,0.5411999821662903,"走, 高, 性价比, 免费, 太, 坐, 建议, 观音, 开车, 感觉","['大理石', '做', '观音', '山顶', '晴天', '抬头', '观音', '真的', '有种', '观音', '感觉', '香火', '旺', '步行', '爬上去', '两个', '钟', '坐', '观光', '巴士', '司机', '开', '飞快', '建议', '带水', '香', '值得']",性价比,22,0.0,46649,1
A22,2016-04-15,游玩了后，感觉非常好玩，以后我还要去玩！,2.0,0.3639000058174133,"好玩, 开心, 太, 天气, 项目, 特别, 舒服, 夏天, 热, 风景","['感觉', '好玩']",设施,22,1.5,46650,3
A22,2016-06-06,空气非常好！是旅游和健身的好地方！,8.0,0.3677000105381012,"空气, 设施, 可惜, 完善, 还行, 游乐, 有意思, 老板, 负离子, 商业","['空气', '健身']",设施,22,1.5,46651,3
A22,2016-06-13,一切榱朔e分，K於盼碛H{到！,1.0,0.5386999845504761,"风景, 表演, 值得, 一般般, 位于, 晚上, 好看, 建筑, 美丽, 大自然","['榱', 'e分', 'K於盼', '', 'H', '{到']",服务,22,1.5,46652,3
A22,2015-01-26,好不容易写了几百字的点评，加图片发表，立马闪退了，坑爹的软件。总的来说爬山不如长安的**和南城水廉山，游玩不如隐贤山庄。,9.0,0.4070000052452087,"山, 爬山, 好多, 希望, 太, 美的, 钱, 水, 骑, 活动","['好不容易', '写', '几百', '字', '点评', '加', '图片', '发表', '闪退', '坑', '爹', '软件', '爬山', '长安', '南城', '水廉山', '隐贤', '山庄']",设施,22,1.5,46653,3
A22,2016-06-12,一般之下的级别，人多商业气息太重，人工痕迹太明显.,2.0,0.2666000127792358,"好玩, 开心, 太, 天气, 项目, 特别, 舒服, 夏天, 热, 风景","['之下', '级别', '商业', '气息', '太重', '人工', '痕迹', '太']",设施,22,1.5,46654,3
A22,2016-02-22,我和亲朋好友每年都会去**拜拜的！祈福求平安，也顺便锻炼锻炼身体呼吸新鲜空气…,12.0,0.2967999875545501,"动物, 爬, 岛, 沙滩, 天然, 氧吧, 表演, 广州, 动物园, 种类","['亲朋好友', '拜拜', '祈福', '求', '平安', '顺便', '锻炼', '锻炼身体', '呼吸', '新鲜空气']",设施,22,2.0,46655,4
A22,2016-06-09,有点垃圾，还要那么贵的门票。。,7.0,0.692300021648407,"环境, 贵, 很好, 没什么, 吃, 东西, 太, 差, 感觉, 风景","['垃圾', '贵']",性价比,22,-1.0,46656,1
A22,2016-06-09,这里要收45的门票，感觉贵了，应该要降低费用,7.0,0.7692000269889832,"环境, 贵, 很好, 没什么, 吃, 东西, 太, 差, 感觉, 风景","['要收', '感觉', '贵', '降低', '费用']",性价比,22,-1.0,46657,1
A22,2016-04-07,好累 但是环境很不错,7.0,0.692300021648407,"环境, 贵, 很好, 没什么, 吃, 东西, 太, 差, 感觉, 风景","['累', '环境']",性价比,22,1.5,46658,3
A22,2016-05-20,世界最大的花岗岩观音像，东莞是世界工厂，也曾被说成色情之都,0.0,0.4663000106811523,"值得, 适合, 环境, 干净, 休闲, 公园, 空气清新, 瀑布, 水, 很漂亮","['世界', '花岗岩', '观音像', '东莞', '世界', '工厂', '说成', '色情']",卫生,22,1.5,46659,3
A22,2015-11-04,环境很好，适合爬山！同时也可以感受岭南佛文化,0.0,0.7251999974250793,"值得, 适合, 环境, 干净, 休闲, 公园, 空气清新, 瀑布, 水, 很漂亮","['环境', '适合', '爬山', '感受', '岭南', '佛', '文化']",卫生,22,1.0,46660,2
A22,2015-11-08,这里景色很普通，除了巨大的观音菩萨雕像有点特点外，其他毫无特色,9.0,0.2693000137805938,"山, 爬山, 好多, 希望, 太, 美的, 钱, 水, 骑, 活动","['景色', '观音菩萨', '雕像', '外', '特色']",设施,22,1.0,46661,2
A22,2016-03-28,空气好，服务也好，价格也便宜,4.0,0.42289999127388,"便宜, 价格, 优惠, 网上, 现场, 不用, 实惠, 排队, 购票, 订","['空气', '服务', '价格', '便宜']",性价比,22,1.0,46662,2
A22,2016-05-09,热情的都市！幽静的山间小路！好客东莞！不错不错！,0.0,0.2698999941349029,"值得, 适合, 环境, 干净, 休闲, 公园, 空气清新, 瀑布, 水, 很漂亮","['热情', '都市', '幽静', '山间', '小路', '好客', '东莞']",卫生,22,2.0,46663,4
A22,2016-05-12,烧香拜佛的一个神圣的地方，值得去膜拜,0.0,0.5385000109672546,"值得, 适合, 环境, 干净, 休闲, 公园, 空气清新, 瀑布, 水, 很漂亮","['烧香拜佛', '神圣', '值得', '膜拜']",卫生,22,2.0,46664,4
A22,2016-05-09,还可以 小吃很多 风景秀丽 值得一看,0.0,0.4677000045776367,"值得, 适合, 环境, 干净, 休闲, 公园, 空气清新, 瀑布, 水, 很漂亮","['小吃', '风景秀丽', '值得一看']",卫生,22,1.5,46665,3
A22,2016-05-07,还是值得一去的。景色不错，拜拜也是好事啦。,0.0,0.4711000025272369,"值得, 适合, 环境, 干净, 休闲, 公园, 空气清新, 瀑布, 水, 很漂亮","['值得', '一去', '景色', '拜拜', '好事']",卫生,22,2.0,46666,4
A22,2016-01-07,这个地方学生还有刚出来工作的人没有资金去以外，就是门票有点坑爹，,9.0,0.451200008392334,"山, 爬山, 好多, 希望, 太, 美的, 钱, 水, 骑, 活动","['学生', '工作', '资金', '坑', '爹']",设施,22,1.5,46667,3
