A22,2017-04-14,15年去的**，一路阶梯登山太累了！真的是顾不上看风景，就怕天黑了还不上顶！虽然坐了景区观光车到登山点，但是真的hold不住！有耐力的同学可以去试试！还有下山的时候，我们选择走水泥路，那种一直往下冲，刹不住的感觉，你们能理解吗？反正我就是一个字累！,3.0,0.66839998960495,"走, 高, 性价比, 免费, 太, 坐, 建议, 观音, 开车, 感觉","['年去', '一路', '阶梯', '登山', '太', '累', '真的', '顾不上', '风景', '天黑', '不上', '顶', '坐', '观光车', '登山', '真的', '不住', '耐力', '同学', '试试', '下山', '选择', '走', '水泥路', '那种', '刹', '不住', '感觉', '理解', '反正', '字', '累']",性价比,22,-1.0,46216,1
A22,2020-03-28,**国家森林公园，这里的空气很清新！！,8.0,0.3589999973773956,"空气, 设施, 可惜, 完善, 还行, 游乐, 有意思, 老板, 负离子, 商业","['国家森林公园', '空气', '清新']",设施,22,1.5,46217,3
A22,2017-05-31,全程徒步，上下约14公里，还是有点累的，建议坐车上去，走路下山,3.0,0.6184999942779541,"走, 高, 性价比, 免费, 太, 坐, 建议, 观音, 开车, 感觉","['全程', '徒步', '约', '公里', '有点累', '建议', '坐车', '走路', '下山']",性价比,22,1.5,46218,3
A22,2020-03-15,国家森林公园很漂亮，空气超级棒！天然的净化器！,12.0,0.5133000016212463,"动物, 爬, 岛, 沙滩, 天然, 氧吧, 表演, 广州, 动物园, 种类","['国家森林公园', '很漂亮', '空气', '超级', '棒', '天然', '净化器']",设施,22,1.0,46219,2
A22,2020-03-15,感觉不错，出去走走看看也挺好的。,3.0,0.692300021648407,"走, 高, 性价比, 免费, 太, 坐, 建议, 观音, 开车, 感觉","['感觉', '走走看看', '挺好']",性价比,22,1.5,46220,3
A22,2020-03-14,感觉不错，观音像很雄伟，风景自然，是游玩的好去处！,0.0,0.5242000222206116,"值得, 适合, 环境, 干净, 休闲, 公园, 空气清新, 瀑布, 水, 很漂亮","['感觉', '观音像', '雄伟', '风景', '自然', '好去处']",卫生,22,2.0,46221,4
A22,2017-03-31,第一次游玩**，风景很不错！上山的时候坐的观光车，然后还要爬半个多小时才到山顶，下山的时候走了一段小路，坡度好高，花了两个多小时才走回山脚。刚好也碰上风车展，特漂亮！喜欢那里的空气和风景，期待下一次。建议穿舒服一点的鞋子出行哦！,3.0,0.3183999955654144,"走, 高, 性价比, 免费, 太, 坐, 建议, 观音, 开车, 感觉","['第一次', '风景', '上山', '坐', '观光车', '爬', '半个', '山顶', '下山', '走', '一段', '小路', '坡度', '高', '花', '两个', '走', '回', '山脚', '碰上', '风车', '展', '特', '漂亮', '喜欢', '空气', '风景', '期待', '建议', '穿', '舒服', '一点', '鞋子', '出行']",性价比,22,4.0,46222,5
A22,2020-01-09,门口取票很快，取完直接开车上山,6.0,0.8154000043869019,"上山, 广东, 导游, 山顶, 时, 走, 到达, 两个, 下午, 坐","['门口', '很快', '取完', '开车', '上山']",服务,22,1.5,46223,3
A22,2017-11-23,每个周末都来**国家森林公园爬山，既锻炼了身体，有氧健身……竹林深处，静怡悠悠，红花绿树，心旷神怡………………非常不错的度过每一个周末！推荐大家来玩,0.0,0.5799999833106995,"值得, 适合, 环境, 干净, 休闲, 公园, 空气清新, 瀑布, 水, 很漂亮","['周末', '国家森林公园', '爬山', '锻炼', '身体', '有氧', '健身', '竹林', '深处', '静怡', '悠悠', '红花', '绿树', '心旷神怡', '度过', '周末', '推荐']",卫生,22,3.0,46224,5
A22,2017-10-05,风景优美，是个登山、游玩的好去处。,0.0,0.513700008392334,"值得, 适合, 环境, 干净, 休闲, 公园, 空气清新, 瀑布, 水, 很漂亮","['风景优美', '登山', '好去处']",卫生,22,1.5,46225,3
A22,2017-10-05,感觉一个人去挺无聊的，最好是情侣一起咯，我本人又不是佛教文化爱好者，就当是一次爬山咯！,9.0,0.3885999917984009,"山, 爬山, 好多, 希望, 太, 美的, 钱, 水, 骑, 活动","['感觉', '无聊', '情侣', '咯', '佛教文化', '爱好者', '就当', '爬山', '咯']",设施,22,-1.0,46226,1
A22,2017-01-05,风景不错，有演出可以观看，值,1.0,0.6327000260353088,"风景, 表演, 值得, 一般般, 位于, 晚上, 好看, 建筑, 美丽, 大自然","['风景', '演出', '观看', '值']",服务,22,1.5,46227,3
A22,2016-10-21,取票流程方便快捷 当天遇上雨也是难得一次经历,5.0,0.4361000061035156,"温泉, 服务, 服务态度, 满意, 泡温泉, 热情, 家人, 工作人员, 方便快捷, 态度","['流程', '方便快捷', '当天', '遇上', '雨', '经历']",服务,22,1.5,46228,3
A22,2017-04-23,我们到达**的售票处是将近下午4点，我们并不知道停止入园的时间就是4点，幸好没超过4点，不然就错过了爬山的好机会了。我们有学生证，享受半价门票。一开始上去就是很长的楼梯，大概有几百级，那么长的楼梯，都消耗了我30%的热情。不过爬上楼梯之后的山路就很少楼梯了，都是斜坡多一点。没走多久就看到很多漂亮的风车，下图可见，大概是为相亲会做的准备吧。**并没有大家想的这么枯燥，每过一段时间，**就会举行不同的活动。不过**也真的适合举行活动，让大家运动起来。我们爬了一个半小时就到了山顶，在起点的时候看着蜿蜒的山路，还以为要几个小时才能到达山顶，以至于一直害怕公园关门。山顶的温度低很多，风也很大，如果不是大热天上山，建议大家还是带多一件衣服上去。我们爬山的天气是25左右，上到山顶应该就只有十几度，没多带衣服，所以呆了一会就赶紧活动下山了，否则会感冒。现在是4月底，还没正式进入夏天，所以很遗憾，我们没有看到瀑布。想看瀑布的，可以在夏天的时候才去。,6.0,0.3788999915122986,"上山, 广东, 导游, 山顶, 时, 走, 到达, 两个, 下午, 坐","['到达', '售票处', '下午', '并不知道', '停止', '入园', '幸好', '超过', '错过', '爬山', '机会', '学生证', '享受', '半价', '长', '楼梯', '几百', '级', '长', '楼梯', '消耗', '热情', '爬', '楼梯', '山路', '楼梯', '斜坡', '多一点', '走', '多久', '漂亮', '风车', '下图', '相亲会', '做', '想', '枯燥', '一段时间', '活动', '真的', '适合', '活动', '运动', '爬', '一个半', '山顶', '起点', '看着', '蜿蜒', '山路', '几个', '到达', '山顶', '害怕', '公园', '关门', '山顶', '温度', '低', '风', '很大', '大热天', '上山', '建议', '一件', '衣服', '爬山', '天气', '山顶', '十几', '度', '衣服', '呆', '一会', '赶紧', '活动', '下山', '感冒', '月底', '正式', '夏天', '遗憾', '瀑布', '想', '瀑布', '夏天']",服务,22,-1.0,46229,1
A22,2017-06-13,还可以，只是游览车不能到观音广场，一个上去，再下来，双腿软酸。但风景可以，本人比较喜欢风车走廊。值得一游，但要坐车上山与下山哟。,6.0,0.2861999869346618,"上山, 广东, 导游, 山顶, 时, 走, 到达, 两个, 下午, 坐","['游览车', '观音', '广场', '双腿', '软酸', '风景', '喜欢', '风车', '走廊', '值得', '坐车', '上山', '下山']",服务,22,2.0,46230,4
A22,2016-10-05,门票偏贵，45/人，说走就走的行程，后来才发现有团购39/人，但要提前一天下订。自驾车可以开到上山景点停车场停，建议有老人小孩的话坐电瓶车上去20/人，因为路程很远，坡很多。电瓶车不能到达观音寺，还要在爬约800米路程，此段路程坡特陡，老人腿脚不方便挺难爬。到达观音寺，空气清新，风景不错，可以俯瞰樟木头镇，总体值得一去,3.0,0.3057999908924103,"走, 高, 性价比, 免费, 太, 坐, 建议, 观音, 开车, 感觉","['偏贵', '说走就走', '行程', '发现', '团购', '提前', '天下', '订', '自驾车', '开', '上山', '停车场', '停', '建议', '坐', '电瓶车', '路程', '远', '坡', '电瓶车', '不能到达', '观音寺', '爬', '约', '米', '路程', '段', '路程', '坡', '特', '陡', '腿脚', '难', '爬', '到达', '观音寺', '空气清新', '风景', '俯瞰', '樟木', '头镇', '总体', '值得']",性价比,22,1.0,46231,2
A22,2017-02-11,之前住在**下面，天天吃完饭都散步过去，大门往里走不用门票，可以看日落，山上的广场经常也会有表演，而且每年都会有相亲大会。走到山顶可以坐车也可以走路，现在新修了楼梯，走起来不像以前走车路那样绕，节省了不少时间，坐车也要走一小段路程，才到观音像，每年都会去拜一下，心诚则灵。,3.0,0.38960000872612,"走, 高, 性价比, 免费, 太, 坐, 建议, 观音, 开车, 感觉","['住', '天天', '吃完饭', '散步', '大门', '走', '不用', '日落', '山上', '广场', '表演', '相亲', '大会', '走', '山顶', '坐车', '走路', '新', '修', '楼梯', '走', '走', '车路', '绕', '节省', '坐车', '走', '一小', '段', '路程', '观音像', '拜', '心诚则灵']",性价比,22,1.0,46232,2
A22,2017-12-04,感觉还不错，风景也好，只是爬的有点累,9.0,0.3176999986171722,"山, 爬山, 好多, 希望, 太, 美的, 钱, 水, 骑, 活动","['感觉', '风景', '爬', '有点累']",设施,22,1.5,46233,3
A22,2017-02-04,那里的风景、空气质量好好。好多人都去那爬山。感觉爬山回来好爽。下次还去。,9.0,0.3080999851226806,"山, 爬山, 好多, 希望, 太, 美的, 钱, 水, 骑, 活动","['风景', '空气质量', '好好', '好多', '爬山', '感觉', '爬山', '回来', '好爽', '下次']",设施,22,1.5,46234,3
A22,2017-10-07,后面那玻璃栈道，我建议大家还是别去了，广告打得好，还得溜滑道下来，溜得那叫一个心塞，动都动不了，比爬山还累，那玻璃栈道又矮又短，一点都不刺激，真心后悔，还要三十块（大小都是）,3.0,0.5408999919891357,"走, 高, 性价比, 免费, 太, 坐, 建议, 观音, 开车, 感觉","['玻璃', '栈道', '建议', '别去了', '广告', '溜滑', '道', '溜', '心塞', '动', '动', '爬山', '累', '玻璃', '栈道', '矮', '短', '一点', '刺激', '真心', '后悔', '三十块', '大小']",性价比,22,-1.0,46235,1
A22,2017-04-08,爬至山顶，也是考验自己耐力的时候，现在人选择太多，容易放弃，越往后越难，行百里者，半于九十，坚持的力量！小小建议，山中动物园应该恢复开放式。,6.0,0.5224999785423279,"上山, 广东, 导游, 山顶, 时, 走, 到达, 两个, 下午, 坐","['爬', '山顶', '考验', '耐力', '选择', '太', '放弃', '越往后', '越难', '行百里', '九十', '力量', '小小', '建议', '山中', '动物园', '恢复', '开放式']",服务,22,-1.0,46236,1
A22,2017-05-09,我的心都碎了心的人都有一个人在一起了。你是一个人在一起了。你是一个人在一起了。你是一个人在家的确很好很大程度的提高，我是个很,3.0,0.4097999930381775,"走, 高, 性价比, 免费, 太, 坐, 建议, 观音, 开车, 感觉","['心', '碎了心', '在家', '很大', '程度', '提高']",性价比,22,1.0,46237,2
A22,2017-05-05,东莞都很多生态环境保护的很好的公园，**国家森林公园就是其中之一，有氧气含量高的绿化工程，还有很多惊喜在登山的过程中可以看到。值得推荐。,0.0,0.3648000061511993,"值得, 适合, 环境, 干净, 休闲, 公园, 空气清新, 瀑布, 水, 很漂亮","['东莞', '生态', '环境保护', '很好', '公园', '国家森林公园', '氧气', '含量', '高', '绿化', '工程', '惊喜', '登山', '过程', '中', '值得', '推荐']",卫生,22,3.0,46238,5
A22,2016-08-27,这是拜观音者的地方，游玩看风景的最好绕道，真的没啥值得欣赏的。,1.0,0.3190999925136566,"风景, 表演, 值得, 一般般, 位于, 晚上, 好看, 建筑, 美丽, 大自然","['拜', '观音', '风景', '绕道', '真的', '值得', '欣赏']",服务,22,2.0,46239,4
A22,2017-08-21,山好水好风景好，爬山台阶有点陡，山上不能扫码,9.0,0.378600001335144,"山, 爬山, 好多, 希望, 太, 美的, 钱, 水, 骑, 活动","['山', '水', '风景', '爬山', '台阶', '陡', '山上', '扫码']",设施,22,1.5,46240,3
A22,2017-11-07,**是否有玻璃桥呀，各位大哥大姐们,3.0,0.5194000005722046,"走, 高, 性价比, 免费, 太, 坐, 建议, 观音, 开车, 感觉","['玻璃', '桥', '大哥', '大姐']",性价比,22,1.5,46241,3
A22,2017-02-19,"**群山环抱,负氧离子含量高,素有“南天圣地、百粤秘境”和“天然氧吧”之美誉。绿树成荫的佛光路,神秘莫测的千年古树,拔地倚天的慈云阁,鸟语花香的百鸟园,微风阵阵的松涛湾,云雾缭绕的仙宫岭,气吞山河的仙泉飞瀑,微波涟漪的感恩湖水,浪漫幽静的天梯栈道,惊险刺激的高空滑索,一目千里的观音广场,古朴恬静的耀佛丛林。**上一步一景,移步异景,是您修身养心,消除烦恼的心灵家园。",3.0,0.4510000050067901,"走, 高, 性价比, 免费, 太, 坐, 建议, 观音, 开车, 感觉","['群山', '环抱', '负氧离子', '含量', '高', '素有', '南', '天', '圣地', '百', '粤', '秘境', '天然', '氧吧', '美誉', '绿树成荫', '佛光', '路', '神秘莫测', '千年', '古树', '拔地倚天', '慈云阁', '鸟语花香', '百鸟园', '微风', '阵阵', '松涛', '湾', '云雾', '缭绕', '仙宫', '岭', '气吞山河', '仙泉', '飞瀑', '微波', '涟漪', '感恩', '湖水', '浪漫', '幽静', '天梯', '栈道', '惊险刺激', '高空', '滑索', '一目', '千里', '观音', '广场', '古朴', '恬静', '耀佛', '丛林', '一步', '一景', '移步', '异景', '修身', '养心', '消除', '烦恼', '心灵', '家园']",性价比,22,3.0,46242,5
A22,2017-10-20,自然森林公园，山顶的最大观音像是其标志。,11.0,0.51910001039505,"景色, 美, 感觉, 山上, 值得, 中, 优美, 拍, 交通, 少","['自然', '森林公园', '山顶', '观音像', '标志']",位置,22,1.0,46243,2
A22,2017-10-20,公园很大，空气很好，去晨练不错。,0.0,0.5171999931335449,"值得, 适合, 环境, 干净, 休闲, 公园, 空气清新, 瀑布, 水, 很漂亮","['公园', '很大', '空气', '晨练']",卫生,22,1.5,46244,3
A22,2017-03-18,感冒了想去爬山出汗，森林公园其实都差不多，没有太阳，中途还下了小雨，但还是出了好多汗，然并卵，感冒还是不好（tip:如果坐公交，就坐L4进到里面，2元，我们坐了833，3元，还得走进去，司机说我们坐了贼船；最最最好穿舒服的鞋，因为要爬过一个又一个的山头才能见到观音菩萨，当然坐观光车的另当别论）,3.0,0.4857999980449676,"走, 高, 性价比, 免费, 太, 坐, 建议, 观音, 开车, 感觉","['感冒', '想去', '爬山', '出汗', '森林公园', '太阳', '中途', '还下', '小雨', '多汗', '卵', '感冒', '不好', '坐', '公交', '坐', '进到', '坐', '走进', '司机', '坐', '贼船', '最最', '穿', '舒服', '鞋', '爬', '山头', '见到', '观音菩萨', '坐', '观光车', '另当别论']",性价比,22,-2.0,46245,1
A22,2017-03-19,空气很清新，第一次爬有点害怕，尤其是那天梯，看下去脚都在斗，风景很不错，看图吧！本人2014年去的,3.0,0.2177000045776367,"走, 高, 性价比, 免费, 太, 坐, 建议, 观音, 开车, 感觉","['空气', '清新', '第一次', '爬', '害怕', '天梯', '脚', '斗', '风景', '看图', '年去']",性价比,22,-1.0,46246,1
A22,2017-09-26,位于东莞樟木头镇，国家4A级旅游景区，佛教旅游胜地，很多人很信赖这里的香火。,0.0,0.221900001168251,"值得, 适合, 环境, 干净, 休闲, 公园, 空气清新, 瀑布, 水, 很漂亮","['位于', '东莞', '樟木', '头镇', '国家级', '佛教', '旅游胜地', '信赖', '香火']",卫生,22,1.0,46247,2
A22,2017-10-05,还不错吧  主要是天气太热了  还有上去必须带现金  带着一颗虔诚之心去拜观音吧,3.0,0.4284000098705292,"走, 高, 性价比, 免费, 太, 坐, 建议, 观音, 开车, 感觉","['天气', '太', '热', '现金', '一颗', '虔诚', '心', '拜', '观音']",性价比,22,1.0,46248,2
A22,2017-08-30,风景比较好的景点，交通也比较方便。,1.0,0.3589999973773956,"风景, 表演, 值得, 一般般, 位于, 晚上, 好看, 建筑, 美丽, 大自然","['风景', '交通']",服务,22,1.5,46249,3
A22,2017-09-20,祈福的好地方，自然植被保护较好。,0.0,0.4923000037670135,"值得, 适合, 环境, 干净, 休闲, 公园, 空气清新, 瀑布, 水, 很漂亮","['祈福', '自然', '植被', '保护']",卫生,22,2.0,46250,4
A22,2017-05-20,樟木头镇，最知名的旅游胜地，山挺高的，虽然也会有观光车，但是建议要去朝拜的人们还是可以一路爬上去的哈。,3.0,0.5740000009536743,"走, 高, 性价比, 免费, 太, 坐, 建议, 观音, 开车, 感觉","['樟木', '头镇', '知名', '旅游胜地', '山', '高', '观光车', '建议', '朝拜', '一路', '爬上去']",性价比,22,1.5,46251,3
A22,2017-01-13,**景区是生泰观光娱乐健身和宗教文化旅游为一体的综合景区,0.0,0.8842999935150146,"值得, 适合, 环境, 干净, 休闲, 公园, 空气清新, 瀑布, 水, 很漂亮","['生', '泰', '观光', '娱乐', '健身', '宗教', '文化', '一体', '综合']",卫生,22,1.0,46252,2
A22,2017-09-10,公园还蛮大的，有很多植物，在这个城市很难得,0.0,0.402099996805191,"值得, 适合, 环境, 干净, 休闲, 公园, 空气清新, 瀑布, 水, 很漂亮","['公园', '蛮大', '植物', '城市']",卫生,22,1.5,46253,3
A22,2017-08-22,不错的地方，环境很美，价格便宜，值得一去，感觉非常棒！,11.0,0.5184999704360962,"景色, 美, 感觉, 山上, 值得, 中, 优美, 拍, 交通, 少","['环境', '美', '价格便宜', '值得', '感觉', '棒']",位置,22,1.0,46254,2
A22,2016-07-03,第一次一个人爬山，没有那么多心情想其他的了，挺好,10.0,0.6050999760627747,"喜欢, 下次, 漂亮, 朋友, 值得, 去过, 机会, 字, 开心, 风景优美","['第一次', '爬山', '心情', '想']",位置,22,1.5,46255,3
A22,2017-02-04,来这里的人多是祈福拜观音，山上庙宇不多，以观音庙为主，可选择徒步或坐观光车到达，坐车需收费，延途自然景色不错！到达山顶后，有香具售卖，有些偏贵，本地游客多自主家中携带，祈福过后可选择山顶观光，观音像是当地标志性观光建筑，值得留影！分享就到这里了，祝大家旅行愉快！,3.0,0.4068999886512756,"走, 高, 性价比, 免费, 太, 坐, 建议, 观音, 开车, 感觉","['祈福', '拜', '观音', '山上', '庙宇', '观音庙', '选择', '徒步', '坐', '观光车', '到达', '坐车', '需', '收费', '延途', '自然', '景色', '到达', '山顶', '香具', '售卖', '偏贵', '游客', '自主', '家中', '携带', '祈福', '过后', '选择', '山顶', '观光', '观音像', '标志性', '观光', '建筑', '值得', '留影', '分享', '祝', '旅行愉快']",性价比,22,3.0,46256,5
A22,2017-08-17,这是来东莞旅游必去的景点之一！,3.0,0.5374000072479248,"走, 高, 性价比, 免费, 太, 坐, 建议, 观音, 开车, 感觉",['东莞'],性价比,22,1.5,46257,3
A22,2017-05-09,这是一个很好的景点，氧吧的景点。如果周六或周日有空，过去爬爬山是很好的郊外活动。但是如果不坐景区环保车上去的话，爬上去，确实有点累。,9.0,0.2301999926567077,"山, 爬山, 好多, 希望, 太, 美的, 钱, 水, 骑, 活动","['很好', '氧吧', '周六', '周日', '有空', '爬', '爬山', '很好', '郊外', '活动', '坐', '环保车', '爬上去', '确实', '有点累']",设施,22,1.0,46258,2
A22,2016-10-14,樟木头的福地，森林覆盖面积很高，景区规划了步行道，徒步需要两三个小时，也有游览车，山顶有花岗岩大观音坐像，广深港很多人自驾来旅游。,3.0,0.7738000154495239,"走, 高, 性价比, 免费, 太, 坐, 建议, 观音, 开车, 感觉","['樟木', '头', '福地', '森林', '覆盖面积', '高', '规划', '步行', '道', '徒步', '两三个', '游览车', '山顶', '花岗岩', '观音', '坐像', '广', '深港', '自驾']",性价比,22,1.5,46259,3
A22,2017-08-12,非常完美的一个森林公园，空气好的不要不要的。,8.0,0.3591000139713287,"空气, 设施, 可惜, 完善, 还行, 游乐, 有意思, 老板, 负离子, 商业","['完美', '森林公园', '空气']",设施,22,1.0,46260,2
A22,2017-06-19,东莞**景区，值得一去。,3.0,0.3632999956607818,"走, 高, 性价比, 免费, 太, 坐, 建议, 观音, 开车, 感觉","['东莞', '值得']",性价比,22,1.0,46261,2
A22,2017-04-27,去的时候坐公交去的，一个多将近两个小时从南城才到，景色不错，去的时候正赶上粤港澳万人相亲会，他们有专门的车接送很多单身男女，挺有意思,6.0,0.5769000053405762,"上山, 广东, 导游, 山顶, 时, 走, 到达, 两个, 下午, 坐","['坐', '公交', '一个多', '两个', '南城', '景色', '正赶上', '粤港澳', '万', '相亲会', '车', '接送', '单身男女', '有意思']",服务,22,1.5,46262,3
A22,2016-10-24,爬山比较辛苦，景色秀丽宜人，环境优美。上山烧香拜佛求平安，值！价格实惠。建议不要选择节假日期间去，那时候人流较多。丫丫咯,11.0,0.3323000073432922,"景色, 美, 感觉, 山上, 值得, 中, 优美, 拍, 交通, 少","['爬山', '辛苦', '景色', '秀丽', '宜人', '环境优美', '上山', '烧香拜佛', '求', '平安', '值', '价格', '实惠', '建议', '选择', '节假日', '期间', '人流', '丫丫', '咯']",位置,22,1.0,46263,2
A22,2017-04-25,喜欢爬山的朋友和烧香拜佛的朋友可以来这里！这里的风景很好！爬山的同时可以在山顶烧香拜佛！这里的香火更旺奥！,10.0,0.3303999900817871,"喜欢, 下次, 漂亮, 朋友, 值得, 去过, 机会, 字, 开心, 风景优美","['喜欢', '爬山', '朋友', '烧香拜佛', '朋友', '风景', '爬山', '山顶', '烧香拜佛', '香火', '旺', '奥']",位置,22,1.0,46264,2
A22,2017-07-28,风景优美，空气清新，看看大自然的感觉。,10.0,0.3722999989986419,"喜欢, 下次, 漂亮, 朋友, 值得, 去过, 机会, 字, 开心, 风景优美","['风景优美', '空气清新', '大自然', '感觉']",位置,22,1.5,46265,3
A22,2017-08-03,东莞首家国家级森林公园，位于樟木头境内。,3.0,0.4146000146865845,"走, 高, 性价比, 免费, 太, 坐, 建议, 观音, 开车, 感觉","['东莞', '首家', '国家级', '森林公园', '位于', '樟木', '头', '境内']",性价比,22,1.5,46266,3
A22,2017-07-24,环境空气很好，烧香拜佛的地方，很祥和，门票低点就好了,1.0,0.0768999978899955,"风景, 表演, 值得, 一般般, 位于, 晚上, 好看, 建筑, 美丽, 大自然","['环境空气', '烧香拜佛', '祥和', '低点']",服务,22,1.5,46267,3
A22,2017-07-21,停车方便还免费，一定要停入景区。静心休养的一个好去处，拜拜观音一世平安健康。,3.0,0.4481000006198883,"走, 高, 性价比, 免费, 太, 坐, 建议, 观音, 开车, 感觉","['停车', '免费', '停入', '静心', '休养', '好去处', '拜拜', '观音', '一世', '平安', '健康']",性价比,22,3.0,46268,5
A22,2017-07-19,占地面积非常的大，植物种类非常的多。,12.0,0.4713999927043915,"动物, 爬, 岛, 沙滩, 天然, 氧吧, 表演, 广州, 动物园, 种类","['占地面积', '植物', '种类']",设施,22,1.5,46269,3
A22,2016-12-20,整体来说还可以吧，爬山确实还不错，也都是水泥路，偶尔也有一些台阶小路，沿途都有一些小景观，动物什么的，分爬山与观光两大阶段，后面888米处开始就属于观光爬山区了，香火鼎盛，上面气氛还不错，**旁边就是三正半山酒店，五星，里面的早茶特别不错，可以喝个早茶后去爬**，我就住**脚下,7.0,0.2560000121593475,"环境, 贵, 很好, 没什么, 吃, 东西, 太, 差, 感觉, 风景","['整体', '爬山', '确实', '水泥路', '台阶', '小路', '沿途', '景观', '动物', '爬山', '观光', '两', '阶段', '米处', '观光', '爬', '山区', '香火', '鼎盛', '气氛', '旁边', '正', '半山', '五星', '早茶', '特别', '喝', '早茶', '后去', '爬', '住', '脚下']",性价比,22,2.0,46270,4
A22,2017-07-14,山美水美人也美，哈哈哈我就是那个美人,11.0,0.3589999973773956,"景色, 美, 感觉, 山上, 值得, 中, 优美, 拍, 交通, 少","['山美水', '美人也美', '哈哈哈', '美']",位置,22,1.5,46271,3
A22,2017-04-07,冲着爬山去的，环境不错，山不算太高，周遭环境还算整洁，人特别多，观音像特别大，估计都是来拜观音菩萨的，哈哈，还有种很神圣的感觉。,7.0,0.5649999976158142,"环境, 贵, 很好, 没什么, 吃, 东西, 太, 差, 感觉, 风景","['冲着', '爬山', '环境', '山', '不算', '太', '高', '周遭', '环境', '算', '整洁', '特别', '观音像', '特别', '估计', '拜', '观音菩萨', '神圣', '感觉']",性价比,22,4.0,46272,5
A22,2017-07-19,值得去看一下啊，这里是东莞的一个国家森林公园啊。,3.0,0.3632999956607818,"走, 高, 性价比, 免费, 太, 坐, 建议, 观音, 开车, 感觉","['值得', '东莞', '国家森林公园']",性价比,22,1.0,46273,2
