景区名称,评论日期,评论内容,主题,评论对主题贡献度,主题关键字,评论分词,评价方面,景区编号,emotional_value,index,情感等级
A22,2020-03-25,还可以！停车免费！就是有些地方没开放！,3.0,0.7692000269889832,"走, 高, 性价比, 免费, 太, 坐, 建议, 观音, 开车, 感觉","['停车', '免费', '开放']",性价比,22,2.0,46029,4
A22,2020-10-05,建议网上订票，第一次去肯定不能一次到位，在这里做下指引。首先车可以直接开进门楼里面，免费停车。不要在路边，那些要收费的。也不要在路边或外面买香，验票处会没收。观音广场有免费的香领取，但是有个随心意捐赠的箱子，这个大家就随心吧。还有很多烧香的套餐可选，我买了一包有蜡烛、香、宝纸的，98元里面有一些设施需要门票，有需要坐索道的必须要网上购票，但前提告诉你们，不算刺激，总长330米左右，平稳。现场门票45、索道50、上山车费20、下山也是20，机动游戏就不建议玩了，小孩子的玩意体力强大的可以步行上山，有公路有楼梯。但是预计步行上山时间4-5个小时。斜坡太陡。我坐车上到老岩验票处，步行上去都累死了。然后为了省下山车票。在老岩验票处走下山，花了两个小时左右。跨越几个山头里面一路上有些小吃，鸡蛋5元2个，玉米6元，矿泉水5元。建议自备大概就这些，愿自己有求必应，也祝愿大家心想事成！,6.0,0.3617999851703644,"上山, 广东, 导游, 山顶, 时, 走, 到达, 两个, 下午, 坐","['建议', '网上', '第一次', '肯定', '到位', '做', '指引', '车', '开进', '门楼', '免费', '停车', '路边', '收费', '路边', '外面', '香', '验票', '处会', '没收', '观音', '广场', '免费', '香', '领取', '有个', '心意', '捐赠', '箱子', '随心', '烧香', '套餐', '选', '一包', '蜡烛', '香', '宝纸', '设施', '坐', '索道', '网上', '购票', '前提', '告诉', '不算', '刺激', '总长', '米左右', '平稳', '现场', '索道', '上山', '车费', '下山', '机动', '游戏', '建议', '玩意', '体力', '强大', '步行', '上山', '公路', '楼梯', '预计', '步行', '上山', '斜坡', '太陡', '坐车', '上到', '老岩', '验票', '处', '步行', '累死', '省', '下山', '车票', '老岩', '验票', '处', '走', '下山', '花', '两个', '跨越', '几个', '山头', '一路上', '小吃', '鸡蛋', '玉米', '矿泉水', '建议', '自备', '愿', '有求必应', '祝愿', '心想事成']",服务,22,5.0,46030,5
A22,2020-03-18,大年初一的一家人爬了几座山累的快虚脱了，建议大家乘坐观光车，30/人，风景全部在山顶上，一路上都没啥风景，主要还是看观音大佛，佛像很大很壮观，真的有种山重水复疑无路，柳暗花明又一村的感觉，上**就要烧香，这里香火挺旺，空气里弥漫的都是香火味，熏的人睁不开眼睛，总之还挺不错的，既锻炼了身体，又愉悦了身心,3.0,0.2414000034332275,"走, 高, 性价比, 免费, 太, 坐, 建议, 观音, 开车, 感觉","['大年初一', '爬', '几座', '山累', '虚脱', '建议', '乘坐', '观光车', '风景', '山顶', '一路上', '风景', '观音', '大佛', '佛像', '很大', '壮观', '真的', '有种', '山重水复', '疑无路', '柳暗花明又一村', '感觉', '烧香', '香火', '旺', '空气', '弥漫', '香火', '味', '熏', '睁不开', '眼睛', '挺不错', '锻炼', '身体', '愉悦', '身心']",性价比,22,0.0,46031,1
A22,2020-05-25,慕名而去，带年幼的孩子去还愿，一早从深圳赶过去，爬上这么高的山，好不容易登顶结果佛像在维修！不靠谱,3.0,0.2748000025749206,"走, 高, 性价比, 免费, 太, 坐, 建议, 观音, 开车, 感觉","['慕名', '年幼', '还愿', '一早', '深圳', '赶过去', '爬', '高', '山', '好不容易', '登顶', '佛像', '维修', '不靠', '谱']",性价比,22,1.5,46032,3
A22,2020-05-08,不错下次还会去。6.8公里确实是有点小挑战。。。。。。。。。,10.0,0.3549000024795532,"喜欢, 下次, 漂亮, 朋友, 值得, 去过, 机会, 字, 开心, 风景优美","['下次', '公里', '确实', '挑战']",位置,22,0.0,46033,1
A22,2020-02-05,拜佛求观音，香火旺还行，观光游就一般，滑道，滑索，游乐场，上下山观光车，动物园等大部分项目要另行收费。,3.0,0.6155999898910522,"走, 高, 性价比, 免费, 太, 坐, 建议, 观音, 开车, 感觉","['拜佛', '求', '观音', '香火', '旺', '还行', '观光', '滑道', '滑索', '游乐场', '下山', '观光车', '动物园', '大部分', '项目', '收费']",性价比,22,1.5,46034,3
A22,2020-07-08,去**的话，要去某个景点最好就在大门口买票吧，里面单独买票有点贵啊。而且如果打算走路上下山的话，得做好心理准备，上山一次两个半小时的样子，下山到时候就没力气走路了，只好打了车，所以时间没算。按这样算的话，上山最好搭车，更轻松，方便，先到山顶看看再说，下山的话就走路好了，可以看沿途风景，这样安排的目的主要是为了省力……嗯，里面好玩的全部要钱。。。沿途风景也就单纯只有风景。望远镜要钱……总之，登山爱好者，信佛者不错的选择。,6.0,0.5274999737739563,"上山, 广东, 导游, 山顶, 时, 走, 到达, 两个, 下午, 坐","['大门口', '单独', '贵', '打算', '走路', '下山', '做好', '心理准备', '上山', '两个', '半小时', '样子', '下山', '到时候', '力气', '走路', '只好', '车', '没算', '算', '上山', '搭车', '轻松', '先', '山顶', '下山', '走路', '沿途', '风景', '安排', '目的', '省力', '好玩', '要钱', '沿途', '风景', '风景', '望远镜', '要钱', '登山', '爱好者', '信佛', '选择']",服务,22,1.0,46035,2
A22,2020-05-04,一般般，花钱不说连观音菩萨也见不到,3.0,0.5145000219345093,"走, 高, 性价比, 免费, 太, 坐, 建议, 观音, 开车, 感觉","['一般般', '花钱', '观音菩萨', '不到']",性价比,22,-1.0,46036,1
A22,2020-06-03,和父母一起去玩的，上下山都是坐观光车，风景很好，空气也不错 ，周日过去人也不算多，整体来说还是很满意的。,3.0,0.3978999853134155,"走, 高, 性价比, 免费, 太, 坐, 建议, 观音, 开车, 感觉","['父母', '下山', '坐', '观光车', '风景', '空气', '周日', '不算', '整体', '满意']",性价比,22,1.0,46037,2
A22,2020-02-20,还可以 风景很好 空气很清新 本来是奔着玻璃栈道去的 可是却让我有点失望 没有想象中刺激 冰雪城还是挺不错的里面那个冰上滑道挺好玩,3.0,0.3556999862194061,"走, 高, 性价比, 免费, 太, 坐, 建议, 观音, 开车, 感觉","['风景', '空气', '清新', '本来', '奔', '玻璃', '栈道', '失望', '想象', '中', '刺激', '冰雪', '城', '挺不错', '冰上', '滑道', '挺好玩']",性价比,22,-2.0,46038,1
A22,2020-01-02,虽然台阶不多，但走路上去要两个多小时，还可以，适合带着孩子去玩。,6.0,0.5184000134468079,"上山, 广东, 导游, 山顶, 时, 走, 到达, 两个, 下午, 坐","['台阶', '走路', '两个', '适合']",服务,22,1.0,46039,2
A22,2020-03-17,没风景权当走绿道也行，可惜人行道与车道基本一起的，沿途被观光车尾气喷得一路咳咳咳，花几十块门票受罪,3.0,0.4045999944210052,"走, 高, 性价比, 免费, 太, 坐, 建议, 观音, 开车, 感觉","['风景', '权当', '走', '绿道', '行', '可惜', '人行道', '车道', '沿途', '观光车', '尾气', '喷得', '一路', '花', '几十块', '受罪']",性价比,22,-1.0,46040,1
A22,2020-01-07,感觉除了山上的观音佛像一路上真的没什么好玩的，徒步上山要走三个多小时的，坐车一人20块，要去出去走走可以考虑去玩玩！,3.0,0.3745000064373016,"走, 高, 性价比, 免费, 太, 坐, 建议, 观音, 开车, 感觉","['感觉', '山上', '观音', '佛像', '一路上', '真的', '没什么', '好玩', '徒步', '上山', '走', '三个', '坐车', '人块', '走走', '玩玩']",性价比,22,1.5,46041,3
A22,2020-05-17,位于东莞樟木头的**风景区，个人认为风景不错，适合经常去走走 山顶观音非常壮观！,0.0,0.3149999976158142,"值得, 适合, 环境, 干净, 休闲, 公园, 空气清新, 瀑布, 水, 很漂亮","['位于', '东莞', '樟木', '头', '风景区', '风景', '适合', '走走', '山顶', '观音', '壮观']",卫生,22,2.0,46042,4
A22,2020-03-28,去过几次还是可以吧，反正没去过的可以过去看看的，一定要徒步走到去过几次还是可以吧，反正没去过的可以过去看看的，一定要徒步走到去过几次还是可以吧，反正没去过的可以过去看看的，一定要徒步走到,10.0,0.4675000011920929,"喜欢, 下次, 漂亮, 朋友, 值得, 去过, 机会, 字, 开心, 风景优美","['去过', '几次', '反正', '去过', '徒步走', '去过', '几次', '反正', '去过', '徒步走', '去过', '几次', '反正', '去过', '徒步走']",位置,22,1.5,46043,3
A22,2020-02-21,我想说，去了一次就没有第二次了，到处都是捆绑消费，本来是圣神的拜山的地方，搞得非常商业化，环境又脏，而且里面都是什么酸辣粉，没什么别的吃的了 建议老人家最好不要去，就算有上山的观光车，送到上面还要爬四十几分钟才到那个大观音，而且坡度很陡. 高空滑道只能在山顶滑下去，不能从山下滑上去. 而且上面不给自带香火，自己带的小伙伴要藏好，不然会被没收. 上面还有个玻璃栈桥，也是巨坑，四十块钱，要先滑一个玻璃滑道，再走玻璃栈桥，而且那个桥很短，又不高，栈桥下面就是停车场，没什么好看的。 建议想爬山和拜佛的小伙伴不如去番禺的**，风景比较美，比较干净，这边这个**环境不好。 以上仅个人观点，不喜勿喷,3.0,0.5365999937057495,"走, 高, 性价比, 免费, 太, 坐, 建议, 观音, 开车, 感觉","['想', '第二次', '捆绑', '消费', '本来', '圣神', '拜山', '搞', '商业化', '环境', '脏', '酸辣粉', '没什么', '吃', '建议', '老人家', '上山', '观光车', '送到', '爬', '十几分钟', '观音', '坡度', '陡', '高空', '滑道', '只能', '山顶', '滑下去', '山下', '滑上去', '自带', '香火', '小伙伴', '藏', '没收', '玻璃', '栈桥', '巨坑', '四十块', '钱', '先滑', '玻璃', '滑道', '走', '玻璃', '栈桥', '桥', '短', '高', '栈桥', '停车场', '没什么', '好看', '建议', '想', '爬山', '拜佛', '小伙伴', '番禺', '风景', '美', '干净', '环境', '不好', '个人观点', '喜', '勿', '喷']",性价比,22,-2.0,46044,1
A22,2020-07-08,酒店早餐丰盛，交通便利，酒店服务好，出差首选！好的好的好的好吧酒店早餐丰盛，交通便利，酒店服务好，出差首选！好的好的好的好吧酒店早餐丰盛，交通便利，酒店服务好，出差首选！好的好的好的好吧,7.0,0.3199000060558319,"环境, 贵, 很好, 没什么, 吃, 东西, 太, 差, 感觉, 风景","['早餐', '丰盛', '交通', '便利', '服务', '出差', '首选', '早餐', '丰盛', '交通', '便利', '服务', '出差', '首选', '早餐', '丰盛', '交通', '便利', '服务', '出差', '首选']",性价比,22,3.0,46045,5
A22,2020-04-27,之前听朋友说她来拜了观音运气就转好了，我也想来试试，特地走路上来没坐车，用了两个多小时，算是有诚心吧,3.0,0.5942999720573425,"走, 高, 性价比, 免费, 太, 坐, 建议, 观音, 开车, 感觉","['听', '朋友', '拜', '观音', '运气', '转好', '想来', '试试', '特地', '走路', '坐车', '两个', '算是', '诚心']",性价比,22,1.5,46046,3
A22,2020-02-07,真的是太神奇了呀！真的是太美妙了呀！这里真是一个神奇的地方呀！这里真是一个来了，就不想走的地方呀！我下次一定还要再来的！,10.0,0.3149000108242035,"喜欢, 下次, 漂亮, 朋友, 值得, 去过, 机会, 字, 开心, 风景优美","['真的', '太', '神奇', '真的', '太', '美妙', '神奇', '不想', '走', '下次', '再来']",位置,22,1.0,46047,2
A22,2020-01-03,**    呵呵    除了能仰一下观音像之外   其它的都一般般   甚至是有点坑    特别是慕名玻璃栈道之名而来的“包括我。。真的是一万只草泥马奔腾而过   看着照片上面挺好看的其是就是进了大门左手边停车场上面山边上弄的总长三十来米的破玩艺儿   还三十块一位   售票处45一位然后推销坐不坐车玩不玩冰雪乐园套票之类的    坐车单程20一位到不了顶还要走路  冰雪乐园到了玩还要另买票总三百来平方就冰堆的墙玩的就冰滑道碰碰车钻狗洞  运气好能撞到摩托车在铁笼子里表演  古钱博物管不值一看   滑索 动物园就茅坑点大  送子观音庙简陋得不能再。。。蝴蝶园  唉  反正里面各类都买票   总的来说近年才开发起来的   没有什么内涵  玩的代价大还不如去香市动物园或海边逛逛   希望能帮到各位想象是美好的    没去后悔一阵子  去了后悔一生,3.0,0.5701000094413757,"走, 高, 性价比, 免费, 太, 坐, 建议, 观音, 开车, 感觉","['仰', '观音像', '之外', '一般般', '坑', '特别', '慕名', '玻璃', '栈道', '名而来', '包括', '真的', '一万只', '草泥马', '奔腾', '看着', '照片', '好看', '进', '大门', '左手边', '停车场', '山边', '上弄', '总长', '三十', '米', '破', '玩艺儿', '三十块', '一位', '售票处', '一位', '推销', '坐', '坐车', '冰雪', '乐园', '套票', '坐车', '单程', '一位', '顶', '走路', '冰雪', '乐园', '总', '三百', '平方', '冰堆', '墙玩', '冰', '滑道', '碰碰车', '钻狗洞', '运气', '撞到', '摩托车', '铁笼子', '表演', '古钱', '博物', '不值一看', '滑索', '动物园', '茅坑', '送子观音', '庙', '简陋', '蝴蝶', '园', '反正', '各类', '近年', '开发', '内涵', '代价', '香市', '动物园', '海边', '逛逛', '希望', '帮到', '想象', '美好', '没去', '后悔', '一阵子', '后悔', '一生']",性价比,22,4.0,46048,5
A22,2020-06-27,没手机信号，，，，，，，，，，，,0.0,0.0768999978899955,"值得, 适合, 环境, 干净, 休闲, 公园, 空气清新, 瀑布, 水, 很漂亮",['手机信号'],卫生,22,1.5,46049,3
A22,2020-03-05,自助取票挺方便，套票比景区便宜了5元，没有包含高空滑索，森林滑道和玻璃栈道等项目，单独买蛮贵的，建议提供全套票选择更好,3.0,0.6439999938011169,"走, 高, 性价比, 免费, 太, 坐, 建议, 观音, 开车, 感觉","['自助', '套票', '便宜', '包含', '高空', '滑索', '森林', '滑道', '玻璃', '栈道', '项目', '单独', '蛮贵', '建议', '提供', '全套', '选择', '更好']",性价比,22,2.0,46050,4
A22,2020-02-21,**比较大，这边买比现场买便宜上山车费10元，但是没法买下山的，下山就是统一价20元了，幸好买了这个上山的车，走路爬山的话恐怕比较费劲了，有些崎岖山路还是比较陡峭的，景区里面免费停车，取票机只有一台可以用，还好去的早不用排队，希望能够开通其他套餐，比如斋菜之类的，可以选择的话就很好了。,6.0,0.5216000080108643,"上山, 广东, 导游, 山顶, 时, 走, 到达, 两个, 下午, 坐","['买比', '现场', '便宜', '上山', '车费', '没法', '下山', '下山', '统一价', '幸好', '上山', '车', '走路', '爬山', '费劲', '崎岖', '山路', '陡峭', '免费', '停车', '机', '一台', '还好', '早', '不用', '排队', '希望', '开通', '套餐', '斋菜', '选择']",服务,22,1.0,46051,2
A22,2020-06-07,挺好玩的，去的那天在下雨，景色很美像仙境一样。体力不好的还是做游览车上去，山太高，要爬到山顶最少要3个小时。在会展中心有游乐场休闲娱乐的地方！,11.0,0.2224999964237213,"景色, 美, 感觉, 山上, 值得, 中, 优美, 拍, 交通, 少","['挺好玩', '那天', '下雨', '景色', '很美', '仙境', '体力', '不好', '做', '游览车', '山太高', '爬', '山顶', '最少', '会展中心', '游乐场', '休闲', '娱乐']",位置,22,0.0,46052,1
A22,2020-06-01,红红火火恍恍惚惚好好好好好好。啥都没写呢就剩咱俩了,3.0,0.6164000034332275,"走, 高, 性价比, 免费, 太, 坐, 建议, 观音, 开车, 感觉","['红红火火', '恍恍惚惚', '好好', '好好', '好好', '没写', '剩', '咱俩']",性价比,22,1.5,46053,3
A22,2020-06-24,网上订票，身份一刷就可以取票非常方便，喜欢一进门大风车隧道，就象彩虹落入凡间的感觉。一路坐车轻松上山，下山步行，夏季祈福，休闲的好去处。,6.0,0.4593999981880188,"上山, 广东, 导游, 山顶, 时, 走, 到达, 两个, 下午, 坐","['网上', '身份', '刷', '喜欢', '进门', '大风车', '隧道', '象', '彩虹', '落入', '凡间', '感觉', '一路', '坐车', '轻松', '上山', '下山', '步行', '夏季', '祈福', '休闲', '好去处']",服务,22,1.0,46054,2
A22,2020-05-31,喜欢这里的安静宁静，放松自己，放平心态，体会美景,10.0,0.3987999856472015,"喜欢, 下次, 漂亮, 朋友, 值得, 去过, 机会, 字, 开心, 风景优美","['喜欢', '安静', '宁静', '放松', '放平', '心态', '体会', '美景']",位置,22,3.0,46055,5
A22,2020-05-30,登山有氧运动对身体好，景区门口就有停车场，建议自驾的朋友去看看。,3.0,0.6001999974250793,"走, 高, 性价比, 免费, 太, 坐, 建议, 观音, 开车, 感觉","['登山', '有氧', '运动', '身体', '门口', '停车场', '建议', '自驾', '朋友']",性价比,22,1.5,46056,3
A22,2020-05-29,东莞最大的森林公园，上面爬上去看到观音大佛,3.0,0.6920999884605408,"走, 高, 性价比, 免费, 太, 坐, 建议, 观音, 开车, 感觉","['东莞', '森林公园', '爬上去', '观音', '大佛']",性价比,22,1.5,46057,3
A22,2020-04-26,和爸妈一起去的，主要是一个和家里人的感受,10.0,0.3601000010967254,"喜欢, 下次, 漂亮, 朋友, 值得, 去过, 机会, 字, 开心, 风景优美","['爸妈', '家里人', '感受']",位置,22,1.5,46058,3
A22,2020-12-03,就爬山来说不错。祈福吧，好像他们烧了高香的彩票没中,3.0,0.6100000143051147,"走, 高, 性价比, 免费, 太, 坐, 建议, 观音, 开车, 感觉","['爬山', '祈福', '好像', '烧', '高', '香', '彩票', '中']",性价比,22,1.5,46059,3
A22,2020-04-23,节假日可以去的地方，也可以锻炼身体！,3.0,0.5385000109672546,"走, 高, 性价比, 免费, 太, 坐, 建议, 观音, 开车, 感觉","['节假日', '锻炼身体']",性价比,22,1.5,46060,3
A22,2020-02-25,很安静，人很少，****喜欢这种感觉,10.0,0.4977999925613403,"喜欢, 下次, 漂亮, 朋友, 值得, 去过, 机会, 字, 开心, 风景优美","['安静', '喜欢', '感觉']",位置,22,2.0,46061,4
A22,2020-01-01,结三五行人 边爬边聊 拜观音菩萨 许美好愿望 让内心平静下来 真的很好,12.0,0.6924999952316284,"动物, 爬, 岛, 沙滩, 天然, 氧吧, 表演, 广州, 动物园, 种类","['结三', '五行', '爬', '聊拜', '观音菩萨', '许', '美好愿望', '内心', '平静下来', '真的']",设施,22,1.0,46062,2
A22,2020-04-08,好玩 看到了观音姐姐 风景也很美丽,3.0,0.3472000062465668,"走, 高, 性价比, 免费, 太, 坐, 建议, 观音, 开车, 感觉","['好玩', '观音', '姐姐', '风景', '美丽']",性价比,22,1.0,46063,2
A22,2020-04-07,景点各方面不错，值得游玩，就是要体力好。,6.0,0.361299991607666,"上山, 广东, 导游, 山顶, 时, 走, 到达, 两个, 下午, 坐","['值得', '体力']",服务,22,1.0,46064,2
A22,2020-04-07,还不错，雨伞挺有特色的，最上面还有纪念品可以看，可以买,1.0,0.2698000073432922,"风景, 表演, 值得, 一般般, 位于, 晚上, 好看, 建筑, 美丽, 大自然","['雨伞', '特色', '纪念品']",服务,22,1.0,46065,2
A22,2020-08-04,好玩，上面还斋饭吃，但要收费，,3.0,0.2845000028610229,"走, 高, 性价比, 免费, 太, 坐, 建议, 观音, 开车, 感觉","['好玩', '斋饭', '吃', '收费']",性价比,22,1.5,46066,3
A22,2020-04-01,风景很好，值得一去，山上香火旺盛,1.0,0.4415999948978424,"风景, 表演, 值得, 一般般, 位于, 晚上, 好看, 建筑, 美丽, 大自然","['风景', '值得', '山上', '香火', '旺盛']",服务,22,1.0,46067,2
A22,2020-03-20,山路很好走，风景又好 好舒服的风,3.0,0.4456999897956848,"走, 高, 性价比, 免费, 太, 坐, 建议, 观音, 开车, 感觉","['山路', '走', '风景', '好好', '舒服', '风']",性价比,22,1.0,46068,2
A22,2020-03-29,门票使用挺方便的。**拜拜菩萨，净化下心灵。,8.0,0.0768999978899955,"空气, 设施, 可惜, 完善, 还行, 游乐, 有意思, 老板, 负离子, 商业","['拜拜', '菩萨', '净化', '心灵']",设施,22,1.5,46069,3
A22,2020-03-28,还可以，玩的挺开心的，有机会还去。,10.0,0.692300021648407,"喜欢, 下次, 漂亮, 朋友, 值得, 去过, 机会, 字, 开心, 风景优美","['开心', '机会']",位置,22,2.0,46070,4
A22,2020-03-27,爬得累死，爬得累死，爬到一半就爬不动了,12.0,0.4395999908447265,"动物, 爬, 岛, 沙滩, 天然, 氧吧, 表演, 广州, 动物园, 种类","['爬', '累死', '爬', '累死', '爬', '一半', '爬不动']",设施,22,1.5,46071,3
A22,2020-11-25,取票方便，价格合理，服务很好，靠谱,5.0,0.2955999970436096,"温泉, 服务, 服务态度, 满意, 泡温泉, 热情, 家人, 工作人员, 方便快捷, 态度","['价格合理', '服务', '谱']",服务,22,1.5,46072,3
A22,2020-04-09,感觉还可以，比以前增加了很多项目！登上山顶的时候突然下雨了，感觉有点冷！！,11.0,0.6205000281333923,"景色, 美, 感觉, 山上, 值得, 中, 优美, 拍, 交通, 少","['感觉', '增加', '项目', '登上', '山顶', '下雨', '感觉', '冷']",位置,22,1.0,46073,2
A22,2020-12-01,跟爸妈去玩的。不过除了一个观音像就没有其他看头了，对于我来说我觉得这个景区的价格并不值得，可能是我们家乡看多了这样的景区还不要钱,4.0,0.6682999730110168,"便宜, 价格, 优惠, 网上, 现场, 不用, 实惠, 排队, 购票, 订","['爸妈', '观音像', '看头', '价格', '值得', '家乡', '看多', '钱']",性价比,22,1.0,46074,2
A22,2020-10-14,来广东的这几年，每年2月份都有去！,6.0,0.2693000137805938,"上山, 广东, 导游, 山顶, 时, 走, 到达, 两个, 下午, 坐","['广东', '几年', '月份']",服务,22,1.5,46075,3
A22,2020-03-16,唉，不怎么样。观音像的标语是否可以取下来？还有就是上山的车可以改为烧汽油的吗，柴油污染环境,6.0,0.7694000005722046,"上山, 广东, 导游, 山顶, 时, 走, 到达, 两个, 下午, 坐","['不怎么样', '观音像', '标语', '取', '上山', '车', '改为', '烧', '汽油', '柴油', '污染环境']",服务,22,1.5,46076,3
A22,2020-03-06,还行吧还行还行还行还行还行还行,8.0,0.8845999836921692,"空气, 设施, 可惜, 完善, 还行, 游乐, 有意思, 老板, 负离子, 商业","['还行', '还行', '还行', '还行', '还行', '还行', '还行']",设施,22,1.5,46077,3
A22,2020-02-26,风景不错，还有小孩子玩的娱乐设施。而且不用额外买票，只需要购买门票就可以全部玩。,0.0,0.4354000091552734,"值得, 适合, 环境, 干净, 休闲, 公园, 空气清新, 瀑布, 水, 很漂亮","['风景', '娱乐', '设施', '不用', '额外', '购买']",卫生,22,1.0,46078,2
A22,2020-02-18,不错，套票超值，玩的东西很多，小朋友很开心。,2.0,0.4165000021457672,"好玩, 开心, 太, 天气, 项目, 特别, 舒服, 夏天, 热, 风景","['套票', '超值', '东西', '开心']",设施,22,0.0,46079,1
A22,2020-02-17,烧香拜佛还是可以的。妹子多多，可以去艳遇哦,7.0,0.5383999943733215,"环境, 贵, 很好, 没什么, 吃, 东西, 太, 差, 感觉, 风景","['烧香拜佛', '妹子', '艳遇']",性价比,22,1.5,46080,3
A22,2020-08-20,感觉还行      不过走到半路就下雨了      然后一直走   一直走   终于看到观音像,6.0,0.4718999862670898,"上山, 广东, 导游, 山顶, 时, 走, 到达, 两个, 下午, 坐","['感觉', '行', '走', '半路', '下雨', '走', '走', '终于', '观音像']",服务,22,1.5,46081,3
A22,2020-06-07,有点高，风景还行，还有舞台表演，丰富,1.0,0.5199000239372253,"风景, 表演, 值得, 一般般, 位于, 晚上, 好看, 建筑, 美丽, 大自然","['高', '风景', '行', '舞台', '表演']",服务,22,1.5,46082,3
A22,2020-02-17,就是山有点高，路有点绕，很累，风景还是错的，索道距离有点短,3.0,0.4372999966144562,"走, 高, 性价比, 免费, 太, 坐, 建议, 观音, 开车, 感觉","['山', '高', '路', '绕', '累', '风景', '错', '索道', '距离', '短']",性价比,22,1.5,46083,3
A22,2020-02-16,放假了就是人多，变化也不少，企业不停的在关注顾客感受。,6.0,0.3030999898910522,"上山, 广东, 导游, 山顶, 时, 走, 到达, 两个, 下午, 坐","['放假', '变化', '企业', '不停', '关注', '顾客', '感受']",服务,22,1.5,46084,3
A22,2020-04-30,好好好好好好好好好好好好好好好好好,3.0,0.8974000215530396,"走, 高, 性价比, 免费, 太, 坐, 建议, 观音, 开车, 感觉","['好好', '好好', '好好', '好好', '好好', '好好', '好好', '好好']",性价比,22,1.5,46085,3
