A22,2016-04-06,来到东莞**值得一游！需收门票，大约45元至60元之间！风景优美，山青水秀，可以自行登山，平稳速度两个小时！也可做电动车到达半山腰，需另外够票！票价单程15来回25元！个人建议徒步登山可以沿路欣赏美景！里面也有些自费项目高空滑绳！爬到山顶累了也可以享受一下美味的斋饭！喜欢登山，求转运，求财，保健康，求姻缘都是好去处,3.0,0.4160000085830688,"走, 高, 性价比, 免费, 太, 坐, 建议, 观音, 开车, 感觉","['来到', '东莞', '值得', '需收', '之间', '风景优美', '山青水秀', '自行', '登山', '平稳', '速度', '两个', '做', '电动车', '到达', '半山腰', '需', '够', '票价', '单程', '来回', '建议', '徒步', '登山', '沿路', '欣赏', '美景', '自费', '项目', '高空', '滑绳', '爬', '山顶', '累', '享受', '美味', '斋饭', '喜欢', '登山', '求', '转运', '求财', '保', '健康', '求', '姻缘', '好去处']",性价比,22,7.0,46427,5
A22,2016-09-03,一般般吧，室内不是很大，冷的刺激。,2.0,0.399399995803833,"好玩, 开心, 太, 天气, 项目, 特别, 舒服, 夏天, 热, 风景","['一般般', '室内', '很大', '冷', '刺激']",设施,22,-1.0,46428,1
A22,2017-01-20,很好玩，坐车到半山腰，后面登山有点累,9.0,0.2153999954462051,"山, 爬山, 好多, 希望, 太, 美的, 钱, 水, 骑, 活动","['好玩', '坐车到', '半山腰', '登山', '有点累']",设施,22,1.5,46429,3
A22,2016-04-02,是个锻炼身体的好地方，不是很高，选择天气阴凉的时候去，观音看起来很气派，经常有活动旅行，适合结伴旅行。,5.0,0.3968000113964081,"温泉, 服务, 服务态度, 满意, 泡温泉, 热情, 家人, 工作人员, 方便快捷, 态度","['锻炼身体', '高', '选择', '天气', '阴凉', '观音', '气派', '活动', '旅行', '适合', '结伴', '旅行']",服务,22,2.0,46430,4
A22,2017-01-17,不错的选择，休闲好去处,0.0,0.7692000269889832,"值得, 适合, 环境, 干净, 休闲, 公园, 空气清新, 瀑布, 水, 很漂亮","['选择', '休闲', '好去处']",卫生,22,1.5,46431,3
A22,2017-01-16,不错的地方，过完年还会去一次……,1.0,0.5385000109672546,"风景, 表演, 值得, 一般般, 位于, 晚上, 好看, 建筑, 美丽, 大自然","['过完', '年']",服务,22,1.5,46432,3
A22,2017-01-14,适合和朋友们一起散心旅游的好地方,10.0,0.3610000014305115,"喜欢, 下次, 漂亮, 朋友, 值得, 去过, 机会, 字, 开心, 风景优美","['适合', '朋友', '散心']",位置,22,1.0,46433,2
A22,2017-01-14,值得去，空气清新非常好适合爱运动你,0.0,0.4679000079631805,"值得, 适合, 环境, 干净, 休闲, 公园, 空气清新, 瀑布, 水, 很漂亮","['值得', '空气清新', '适合', '爱', '运动']",卫生,22,2.0,46434,4
A22,2017-01-14,有时间去爬爬山，诚心静行德平态。,9.0,0.3589999973773956,"山, 爬山, 好多, 希望, 太, 美的, 钱, 水, 骑, 活动","['爬', '爬山', '诚心', '静行德', '平态']",设施,22,1.5,46435,3
A22,2017-01-13,大东莞是个好地方。只不过。。。,6.0,0.3596999943256378,"上山, 广东, 导游, 山顶, 时, 走, 到达, 两个, 下午, 坐","['东莞', '只不过']",服务,22,1.5,46436,3
A22,2017-01-11,**公园的观音很神圣，大家可以去拜拜，只要诚心，观音娘娘一定知道。,3.0,0.5299999713897705,"走, 高, 性价比, 免费, 太, 坐, 建议, 观音, 开车, 感觉","['公园', '观音', '神圣', '拜拜', '诚心', '观音', '娘娘']",性价比,22,1.0,46437,2
A22,2016-05-02,很大的一个公园，观音像也很壮，但不应该收取门票,0.0,0.6923999786376953,"值得, 适合, 环境, 干净, 休闲, 公园, 空气清新, 瀑布, 水, 很漂亮","['很大', '公园', '观音像', '很壮', '收取']",卫生,22,1.5,46438,3
A22,2016-11-23,还行吧！性价比可以！位置不比较偏！,3.0,0.6154000163078308,"走, 高, 性价比, 免费, 太, 坐, 建议, 观音, 开车, 感觉","['还行', '性价比', '位置', '偏']",性价比,22,1.5,46439,3
A22,2016-12-07,一般，走路太累，车又太多，锻炼身体可以去,3.0,0.6108999848365784,"走, 高, 性价比, 免费, 太, 坐, 建议, 观音, 开车, 感觉","['走路', '太累', '车', '太', '锻炼身体']",性价比,22,1.5,46440,3
A22,2017-01-12,**路好走，可以自己开车上去噢,3.0,0.6140000224113464,"走, 高, 性价比, 免费, 太, 坐, 建议, 观音, 开车, 感觉","['路', '走', '开车', '噢']",性价比,22,1.5,46441,3
A22,2017-01-10,**公园的观音像好像是最大规模的,0.0,0.3693000078201294,"值得, 适合, 环境, 干净, 休闲, 公园, 空气清新, 瀑布, 水, 很漂亮","['公园', '观音像', '好像', '大规模']",卫生,22,1.5,46442,3
A22,2016-11-20,还好吧，跑到山顶了，看到了观音,3.0,0.4745999872684479,"走, 高, 性价比, 免费, 太, 坐, 建议, 观音, 开车, 感觉","['还好', '跑', '山顶', '观音']",性价比,22,1.5,46443,3
A22,2017-01-08,环境保护优美，空气新鲜，站在这里有如韩国大自然感觉,3.0,0.2404000014066696,"走, 高, 性价比, 免费, 太, 坐, 建议, 观音, 开车, 感觉","['环境保护', '优美', '空气', '新鲜', '站', '有如', '韩国', '大自然', '感觉']",性价比,22,2.0,46444,4
A22,2016-06-27,风景优美，山清水秀，爬爬山，运运动，很不错！,9.0,0.1794999986886978,"山, 爬山, 好多, 希望, 太, 美的, 钱, 水, 骑, 活动","['风景优美', '山清水秀', '爬', '爬山', '运', '运动']",设施,22,1.5,46445,3
A22,2016-10-02,走路上山的，有点远，爬山很累，但是到了山顶后，一切都值得，山顶观音很大，拜了菩萨后做车下山的，实在走不动了。,3.0,0.4756999909877777,"走, 高, 性价比, 免费, 太, 坐, 建议, 观音, 开车, 感觉","['走路', '上山', '远', '爬山', '累', '山顶', '值得', '山顶', '观音', '很大', '拜', '菩萨', '做', '车', '下山', '实在', '走不动']",性价比,22,2.0,46446,4
A22,2017-01-05,值得一去的地方，爬山，拜观音，不花钱可以看到很多动物，景色也不错，安保人员工作人员都很负责,3.0,0.337799996137619,"走, 高, 性价比, 免费, 太, 坐, 建议, 观音, 开车, 感觉","['值得', '一去', '爬山', '拜', '观音', '花钱', '动物', '景色', '安保', '人员', '工作人员', '负责']",性价比,22,2.0,46447,4
A22,2017-01-03,多年前去过，好玩，就是山有点高,0.0,0.3564000129699707,"值得, 适合, 环境, 干净, 休闲, 公园, 空气清新, 瀑布, 水, 很漂亮","['多年', '前去', '好玩', '山', '高']",卫生,22,1.5,46448,3
A22,2017-01-04,这里的环境很好空气清新很自然，欢迎大家前来参观考察活动,0.0,0.4444000124931335,"值得, 适合, 环境, 干净, 休闲, 公园, 空气清新, 瀑布, 水, 很漂亮","['环境', '空气清新', '自然', '前来', '参观', '考察', '活动']",卫生,22,1.0,46449,2
A22,2017-01-02,公@^大，花草林木也^多。可以一游。,8.0,0.0768999978899955,"空气, 设施, 可惜, 完善, 还行, 游乐, 有意思, 老板, 负离子, 商业","['公@', '^大', '花草', '林木', '^']",设施,22,1.5,46450,3
A22,2017-01-07,森林公园就是美，很多都没见过的植物。,12.0,0.2705000042915344,"动物, 爬, 岛, 沙滩, 天然, 氧吧, 表演, 广州, 动物园, 种类","['森林公园', '美', '没见', '植物']",设施,22,1.5,46451,3
A22,2017-01-02,不错的地方哟。欢迎没事来逛逛。,0.0,0.3589999973773956,"值得, 适合, 环境, 干净, 休闲, 公园, 空气清新, 瀑布, 水, 很漂亮","['没事', '逛逛']",卫生,22,-1.0,46452,1
A22,2017-01-02,值得一去的地方，环境优美，服务很好。,0.0,0.6025000214576721,"值得, 适合, 环境, 干净, 休闲, 公园, 空气清新, 瀑布, 水, 很漂亮","['值得', '一去', '环境优美', '服务']",卫生,22,1.0,46453,2
A22,2017-01-01,喜欢来这里徒步，风景好，空气清新。,3.0,0.2177000045776367,"走, 高, 性价比, 免费, 太, 坐, 建议, 观音, 开车, 感觉","['喜欢', '徒步', '风景', '空气清新']",性价比,22,1.0,46454,2
A22,2016-12-31,集生态，娱乐和宗教文化旅游为一体的综合景区,0.0,0.7253000140190125,"值得, 适合, 环境, 干净, 休闲, 公园, 空气清新, 瀑布, 水, 很漂亮","['集', '生态', '娱乐', '宗教', '文化', '一体', '综合']",卫生,22,1.0,46455,2
A22,2016-12-30,可以来这里徒步，环境还是不错的,3.0,0.3589999973773956,"走, 高, 性价比, 免费, 太, 坐, 建议, 观音, 开车, 感觉","['徒步', '环境']",性价比,22,1.5,46456,3
A22,2016-06-16,还不错！之前很朋友一起去的！就是爬山，看一下自然风光！活动空间还挺大！喜欢爬山的朋友可以去试试,10.0,0.4512999951839447,"喜欢, 下次, 漂亮, 朋友, 值得, 去过, 机会, 字, 开心, 风景优美","['朋友', '爬山', '自然风光', '活动', '空间', '喜欢', '爬山', '朋友', '试试']",位置,22,1.0,46457,2
A22,2016-12-31,空气很清晰环境很美，有时间可以去玩,11.0,0.2921000123023987,"景色, 美, 感觉, 山上, 值得, 中, 优美, 拍, 交通, 少","['空气', '清晰', '环境', '美']",位置,22,1.0,46458,2
A22,2016-12-29,没去过，听说很不错，有机会去看看,10.0,0.5192000269889832,"喜欢, 下次, 漂亮, 朋友, 值得, 去过, 机会, 字, 开心, 风景优美","['去过', '听说', '机会']",位置,22,1.0,46459,2
A22,2016-04-05,山还是挺陡的，爬的很累，一路上没啥风景，一定要爬到顶才能看到观音！,3.0,0.5138000249862671,"走, 高, 性价比, 免费, 太, 坐, 建议, 观音, 开车, 感觉","['山', '陡', '爬', '很累', '一路上', '风景', '爬', '顶', '观音']",性价比,22,1.5,46460,3
A22,2016-12-27,环境、空气都很好坐游览车好过瘾,8.0,0.3461999893188476,"空气, 设施, 可惜, 完善, 还行, 游乐, 有意思, 老板, 负离子, 商业","['环境', '空气', '坐', '游览车', '过瘾']",设施,22,1.0,46461,2
A22,2016-12-27,这是真的值得一去的，不管其他什么样，冲着观音都必须得去！还能爬山，强身健体！,9.0,0.3521000146865845,"山, 爬山, 好多, 希望, 太, 美的, 钱, 水, 骑, 活动","['真的', '值得', '一去', '冲着', '观音', '得去', '爬山', '强身健体']",设施,22,1.0,46462,2
A22,2016-12-27,去这里玩过之后，可以在樟木头逛街,3.0,0.6919000148773193,"走, 高, 性价比, 免费, 太, 坐, 建议, 观音, 开车, 感觉","['樟木', '头', '逛街']",性价比,22,1.5,46463,3
A22,2016-10-10,说好的瀑布呢？说好的节目呢？瀑布要到下雨下大了才有，节目两个，重阳皆老人表演节目里面的管理人员凶的很，搞的好像欠他们很多钱似的，老人先走大家都明白，大声吼是几个意思？打着神仙的幌子骗人,6.0,0.3564999997615814,"上山, 广东, 导游, 山顶, 时, 走, 到达, 两个, 下午, 坐","['说好', '瀑布', '说好', '节目', '瀑布', '下雨', '下大', '节目', '两个', '重阳', '皆', '表演', '节目', '管理人员', '凶', '搞', '好像', '欠', '钱', '先', '走', '明白', '大声', '吼', '几个', '打着', '神仙', '幌子', '骗人']",服务,22,-1.0,46464,1
A22,2016-12-26,值得一去，风景秀丽江山美人心计,0.0,0.692300021648407,"值得, 适合, 环境, 干净, 休闲, 公园, 空气清新, 瀑布, 水, 很漂亮","['值得', '风景秀丽', '江山美人', '心计']",卫生,22,1.0,46465,2
A22,2016-12-25,可以很好.希望能有很多人关注.,6.0,0.4223999977111816,"上山, 广东, 导游, 山顶, 时, 走, 到达, 两个, 下午, 坐","['希望', '关注']",服务,22,1.0,46466,2
A22,2016-12-23,商业气氛浓厚，不过东莞也就这么几个地方可以溜达一下了,10.0,0.3465000092983246,"喜欢, 下次, 漂亮, 朋友, 值得, 去过, 机会, 字, 开心, 风景优美","['商业', '气氛', '浓厚', '东莞', '几个', '溜达']",位置,22,1.5,46467,3
A22,2016-12-23,空气非常好，走上去雷的两腿发抖，但是山顶可以祭拜观音，也有素食餐厅,3.0,0.3686999976634979,"走, 高, 性价比, 免费, 太, 坐, 建议, 观音, 开车, 感觉","['空气', '走上', '雷', '两', '腿', '发抖', '山顶', '祭拜', '观音', '素食', '餐厅']",性价比,22,-1.0,46468,1
A22,2016-12-23,神来之笔。到的人感觉心情平静。神运无处不在,10.0,0.6923999786376953,"喜欢, 下次, 漂亮, 朋友, 值得, 去过, 机会, 字, 开心, 风景优美","['神来之笔', '感觉', '心情', '平静', '神运', '无处不在']",位置,22,1.0,46469,2
A22,2016-12-24,不错，建议朋友们没事可以去看看,4.0,0.2906000018119812,"便宜, 价格, 优惠, 网上, 现场, 不用, 实惠, 排队, 购票, 订","['建议', '朋友', '没事']",性价比,22,-1.0,46470,1
A22,2016-12-22,听说很不错哦，周末可去行行逛逛呢,0.0,0.5113000273704529,"值得, 适合, 环境, 干净, 休闲, 公园, 空气清新, 瀑布, 水, 很漂亮","['听说', '周末', '可去', '行行', '逛逛']",卫生,22,1.5,46471,3
A22,2016-12-21,这里还不错，风景好，爬山锻炼身体，就是价格在便宜点就好！,4.0,0.4126000106334686,"便宜, 价格, 优惠, 网上, 现场, 不用, 实惠, 排队, 购票, 订","['风景', '爬山', '锻炼身体', '价格', '便宜']",性价比,22,1.0,46472,2
A22,2016-12-20,面积很大，保护的也很好，能为城市提供氧气,0.0,0.2743000090122223,"值得, 适合, 环境, 干净, 休闲, 公园, 空气清新, 瀑布, 水, 很漂亮","['面积', '很大', '保护', '城市', '提供', '氧气']",卫生,22,1.0,46473,2
A22,2016-12-20,听说是亚洲最大的观音像。上去要走很远的路。爬上去要差不多半个多小时。,6.0,0.3634000122547149,"上山, 广东, 导游, 山顶, 时, 走, 到达, 两个, 下午, 坐","['听说', '亚洲', '观音像', '走', '很远', '路', '爬上去', '半个']",服务,22,1.5,46474,3
A22,2016-12-29,还好吧，就是比自己想象中的差，她们那里收费又不合理,3.0,0.3100000023841858,"走, 高, 性价比, 免费, 太, 坐, 建议, 观音, 开车, 感觉","['还好', '想象', '中', '差', '收费', '不合理']",性价比,22,-1.0,46475,1
A22,2016-12-14,环境很好，很干净！挺不错的，每年二月份都会跟家人一起去！,7.0,0.3763999938964844,"环境, 贵, 很好, 没什么, 吃, 东西, 太, 差, 感觉, 风景","['环境', '干净', '挺不错', '二月份', '家人']",性价比,22,1.5,46476,3
A22,2016-12-18,非常值得一去。不会后悔的哦、物超所值,1.0,0.4785000085830688,"风景, 表演, 值得, 一般般, 位于, 晚上, 好看, 建筑, 美丽, 大自然","['值得', '后悔', '物超所值']",服务,22,1.0,46477,2
A22,2015-10-05,**比较陡峭，走上山要两个来小时，最好带点干粮和水，沿途也有小卖部，上山途中可以看到樟木头市区风景，有一个小型的动物园，有些孔雀，鸵鸟可以喂食。上下山有电瓶车跟空调中巴选择，不能走的人最好坐车。到达山顶的车站还要走二三十分钟的路才能到达真正的山顶拜观音，那里有个门口要收门票，如果买的是套票要记得保留票据。最后这段山路是全程最难走的一段路，分两条上山路，平路跟楼梯。平路十分陡峭，坡度较大，老人家走会挺辛苦。楼梯路很狭窄，一样陡峭，仅供两人通过，有些地方要手脚并用。山顶有很多小吃店，提供方便面，酸辣粉等小吃。也有一家素食餐厅，38元一位，一人一个饭盒打饭，八个斋菜可以选择，还有蛋糕水果汤，味道还可以。那个斋菜其实毛利很厉害，就只是几样普通的素食品，笋，木耳炒芹菜，兰豆炒斋烧鹅，年藕，豆腐，冬菇。但那是唯一能吃饭的地方，想吃饭的人只能掏钱吃贵价斋菜。山顶有一大观音像还有佛堂，佛堂旁边有一放生的地方，有鱼跟鸟提供，当然这是收钱的，像麻雀13元一只。山上还有一些小瀑布，一些岩石等看。下山坐电瓶车不能走的人最好还是选择平路下山，楼梯太陡峭，一多人又会堵塞。,3.0,0.4339999854564667,"走, 高, 性价比, 免费, 太, 坐, 建议, 观音, 开车, 感觉","['陡峭', '走上', '山', '两个', '干粮', '水', '沿途', '小卖部', '上山', '途中', '樟木', '头', '市区', '风景', '小型', '动物园', '孔雀', '鸵鸟', '喂食', '下山', '电瓶车', '空调', '中巴', '选择', '走', '坐车', '到达', '山顶', '车站', '走', '二三十', '分钟', '路', '到达', '山顶', '拜', '观音', '有个', '门口', '收', '套票', '记得', '保留', '票据', '段', '山路', '全程', '最难', '走', '一段路', '两条', '山路', '平路', '楼梯', '平', '路', '陡峭', '坡度', '较大', '老人家', '走会', '辛苦', '楼梯', '路', '狭窄', '陡峭', '仅供', '两', '手脚', '并用', '山顶', '小吃店', '提供', '方便面', '酸辣粉', '小吃', '一家', '素食', '餐厅', '一位', '饭盒', '打饭', '八个', '斋菜', '选择', '蛋糕', '水果', '汤', '味道', '斋菜', '毛利', '厉害', '几样', '素', '食品', '笋', '木耳', '炒', '芹菜', '兰豆', '炒', '斋', '烧鹅', '年', '藕', '豆腐', '冬菇', '唯一', '吃饭', '想', '吃饭', '只能', '掏钱', '吃贵', '价', '斋菜', '山顶', '一大', '观音像', '佛堂', '佛堂', '旁边', '放生', '鱼', '鸟', '提供', '收钱', '麻雀', '一只', '山上', '小瀑布', '岩石', '下山', '坐', '电瓶车', '走', '选择', '平', '路', '下山', '楼梯', '太', '陡峭', '一多', '堵塞']",性价比,22,-3.0,46478,1
A22,2016-12-19,很值得，每次心烦气燥一走进去，闻着香火味就好了。,10.0,0.3772999942302704,"喜欢, 下次, 漂亮, 朋友, 值得, 去过, 机会, 字, 开心, 风景优美","['值得', '每次', '心烦', '气燥', '走进', '闻', '香火', '味']",位置,22,0.0,46479,1
A22,2016-12-19,收费不高，休闲旅游的好地方，来到东莞值得走一趟,3.0,0.5608999729156494,"走, 高, 性价比, 免费, 太, 坐, 建议, 观音, 开车, 感觉","['收费', '高', '休闲', '来到', '东莞', '值得', '走', '一趟']",性价比,22,1.0,46480,2
A22,2016-12-14,非常好！环境优美绝伦！每年都去一次！,0.0,0.5385000109672546,"值得, 适合, 环境, 干净, 休闲, 公园, 空气清新, 瀑布, 水, 很漂亮","['环境优美', '绝伦']",卫生,22,1.5,46481,3
A22,2016-10-25,风景很好，空汽清新，爬的很开心,2.0,0.2126999944448471,"好玩, 开心, 太, 天气, 项目, 特别, 舒服, 夏天, 热, 风景","['风景', '空', '汽', '清新', '爬', '开心']",设施,22,1.0,46482,2
A22,2016-12-11,以观景为主，地方好好，值得大家去,1.0,0.5159000158309937,"风景, 表演, 值得, 一般般, 位于, 晚上, 好看, 建筑, 美丽, 大自然","['观景', '好好', '值得']",服务,22,1.0,46483,2
A22,2016-12-19,顺路不s时g，过去走走看看也行。,8.0,0.3630000054836273,"空气, 设施, 可惜, 完善, 还行, 游乐, 有意思, 老板, 负离子, 商业","['顺路', 's', '时g', '走走看看', '行']",设施,22,1.5,46484,3
A22,2016-03-31,注意！如果抱着旅游、观光、度假、游玩的心态的，就不要去了……真心没有任何值得一看的地方，45元的门票太不值。不知道4A是怎么糊涂的评出来的，反正我是被4A骗了。早上出发，开车2个钟，很兴奋的上去，结果30分钟就结束了行程下山了，除了拜观音祈福，其他真无所谓的风景可言，而且还要做观光车上去，35元一个人。辛苦上去本想干脆吃顿斋饭吧，结果一看傻了，那哪里是斋饭，比海鲜还贵，一盘豆腐（小小盘）38元，单点就这个最便宜，套餐两菜一汤198元最便宜，总之，极差，极不值得，浪费我一天假期……,6.0,0.3192999958992004,"上山, 广东, 导游, 山顶, 时, 走, 到达, 两个, 下午, 坐","['抱', '观光', '度假', '心态', '真心', '值得一看', '太', '不值', '糊涂', '评出来', '反正', '骗', '早上', '出发', '开车', '钟', '兴奋', '分钟', '结束', '行程', '下山', '拜', '观音', '祈福', '真', '无所谓', '风景', '可言', '做', '观光车', '辛苦', '想', '干脆', '吃', '顿', '斋饭', '傻', '斋饭', '海鲜', '贵', '一盘', '豆腐', '小小', '盘', '单点', '便宜', '套餐', '两', '菜', '汤', '便宜', '极差', '值得', '浪费', '假期']",服务,22,0.0,46485,1
A22,2016-10-21,订票好不用排队比窗口优惠,4.0,0.8154000043869019,"便宜, 价格, 优惠, 网上, 现场, 不用, 实惠, 排队, 购票, 订","['不用', '排队', '窗口', '优惠']",性价比,22,1.5,46486,3
A22,2016-10-19,很美丽哦，呵呵，赞赞！希望下次再去下次再去,10.0,0.510699987411499,"喜欢, 下次, 漂亮, 朋友, 值得, 去过, 机会, 字, 开心, 风景优美","['美丽', '赞赞', '希望', '下次', '下次']",位置,22,2.0,46487,4
A22,2016-05-27,还可以，就是人没有到，这次希望大家玩得开心。,2.0,0.3612000048160553,"好玩, 开心, 太, 天气, 项目, 特别, 舒服, 夏天, 热, 风景","['希望', '开心']",设施,22,2.0,46488,4
A22,2016-12-08,家门口啦，休闲好去处！经常有去啦！,0.0,0.692300021648407,"值得, 适合, 环境, 干净, 休闲, 公园, 空气清新, 瀑布, 水, 很漂亮","['家门口', '休闲', '好去处']",卫生,22,1.5,46489,3
A22,2016-05-27,总体来说还是不错 就是上山的那段路不好走 古钱币观看一点都不特别索道也太快了没什么表演可以看 观音娘娘很慈祥,3.0,0.3982000052928924,"走, 高, 性价比, 免费, 太, 坐, 建议, 观音, 开车, 感觉","['总体', '上山', '那段', '路', '不好', '走', '古钱币', '观看', '一点', '特别', '索道', '太', '没什么', '表演', '观音', '娘娘', '慈祥']",性价比,22,1.0,46490,2
A22,2016-12-06,地理位置不错交通便利在山顶可以看遍整个小香港,11.0,0.3668000102043152,"景色, 美, 感觉, 山上, 值得, 中, 优美, 拍, 交通, 少","['地理位置', '交通', '便利', '山顶', '看遍', '香港']",位置,22,1.0,46491,2
A22,2016-12-05,环境不错，口味也好，服务好，下次再来，真的不错哟，有缘的可以参考一下！,10.0,0.3397000133991241,"喜欢, 下次, 漂亮, 朋友, 值得, 去过, 机会, 字, 开心, 风景优美","['环境', '口味', '服务', '下次', '真的', '有缘', '参考']",位置,22,1.5,46492,3
A22,2016-10-16,下午去比较好，大概3-4点左右，爬完山吃晚饭刚刚好,6.0,0.5019999742507935,"上山, 广东, 导游, 山顶, 时, 走, 到达, 两个, 下午, 坐","['下午', '爬', '完山', '吃晚饭', '刚刚']",服务,22,1.5,46493,3
A22,2016-02-12,应该叫樟木头森林公园。别把国家，广东，东莞叫上去才对。一片的脏，乱，差。上山的观光车居然是用汽油的。最后一段的800米，又陡又峭！真心难到了老人和小孩。确实不怎么的！！,3.0,0.604200005531311,"走, 高, 性价比, 免费, 太, 坐, 建议, 观音, 开车, 感觉","['樟木', '头', '森林公园', '国家', '广东', '东莞', '叫上去', '脏', '乱', '差', '上山', '观光车', '汽油', '一段', '米', '陡', '峭', '真心', '难', '确实']",性价比,22,1.0,46494,2
A22,2016-10-17,东莞本地，推荐要买景区内观光车上山，路程远,3.0,0.4510000050067901,"走, 高, 性价比, 免费, 太, 坐, 建议, 观音, 开车, 感觉","['东莞', '推荐', '观光车', '上山', '路程', '远']",性价比,22,1.0,46495,2
A22,2016-12-03,据说是东莞最高的山了，周末去吸吸养，休闲还是不错的！,0.0,0.2980000078678131,"值得, 适合, 环境, 干净, 休闲, 公园, 空气清新, 瀑布, 水, 很漂亮","['东莞', '山', '周末', '吸吸', '养', '休闲']",卫生,22,1.5,46496,3
A22,2016-08-25,个人感觉还不错。因为住在樟木头，所以经常会跟父母或者朋友去爬山，那边也有游泳池，一到假期，就会很多人去游泳。**环境的话相对来说是不错的，清晨去空气很好。,3.0,0.1845999956130981,"走, 高, 性价比, 免费, 太, 坐, 建议, 观音, 开车, 感觉","['个人感觉', '住', '樟木', '头', '父母', '朋友', '爬山', '游泳池', '假期', '游泳', '环境', '相对来说', '清晨', '空气']",性价比,22,1.5,46497,3
A22,2016-12-02,爬山运动门票太贵了！！！！！！,9.0,0.2700999975204468,"山, 爬山, 好多, 希望, 太, 美的, 钱, 水, 骑, 活动","['爬山', '运动', '太贵']",设施,22,1.5,46498,3
A22,2016-12-02,**是属于樟木头镇广东三大佛山之一,6.0,0.5385000109672546,"上山, 广东, 导游, 山顶, 时, 走, 到达, 两个, 下午, 坐","['樟木', '头镇', '广东', '大佛山']",服务,22,1.5,46499,3
A22,2016-11-28,这里离市区比较远，要开车过来，地方很大。,3.0,0.8154000043869019,"走, 高, 性价比, 免费, 太, 坐, 建议, 观音, 开车, 感觉","['市区', '远', '开车', '很大']",性价比,22,1.5,46500,3
A22,2016-11-26,樟木头镇的景色，周末的胜地。爬山，,9.0,0.4386999905109405,"山, 爬山, 好多, 希望, 太, 美的, 钱, 水, 骑, 活动","['樟木', '头镇', '景色', '周末', '胜地', '爬山']",设施,22,1.5,46501,3
A22,2016-08-19,**景区，值得一去。山顶大佛，风景不错，空气清新。就是爬上去有点累。。顺便说下，早点去可以不要票的哦,11.0,0.2268999963998794,"景色, 美, 感觉, 山上, 值得, 中, 优美, 拍, 交通, 少","['值得', '山顶', '大佛', '风景', '空气清新', '爬上去', '有点累', '顺便', '早点']",位置,22,1.0,46502,2
