景区名称,评论日期,评论内容,主题,评论对主题贡献度,主题关键字,评论分词,评价方面,景区编号,emotional_value,index,情感等级
A49,2020-08-19,**每年去几次，过年必去一次的地方，一年四季都有不同的花可以欣赏，票价虽然涨价了，但每次去都见到**的变化，变得越来越美，配套设施越来越完善，收了门票有用在建设上，让我们每次去能感受到更美的**。每次去都吃斋，斋菜的价格适中，味道也合口味。节假日去游览门票8折，60岁老人门票半价。,12.0,0.1733999997377395,"动物, 爬, 岛, 沙滩, 天然, 氧吧, 表演, 广州, 动物园, 种类","['几次', '过年', '一年四季', '花', '欣赏', '票价', '涨价', '每次', '见到', '变化', '变得', '越来越', '美', '配套', '设施', '越来越', '完善', '收', '有用', '建设', '每次', '感受', '美的', '每次', '吃斋', '斋菜', '价格', '适中', '味道', '合口味', '节假日', '游览', '折', '岁', '半价']",设施,49,3.0,57716,5
A49,2020-07-14,雨后的空气更为清新，蓝天白云的映衬下，显得格外的清新，游客不少，近期**有很多莲花盛开，吸引了众多游客，近期穿着汉服前来的还免门票喔……,3.0,0.3833999931812286,"走, 高, 性价比, 免费, 太, 坐, 建议, 观音, 开车, 感觉","['雨后', '空气', '清新', '蓝天白云', '映衬', '显得', '清新', '游客', '近期', '莲花', '盛开', '吸引', '众多', '游客', '近期', '穿着', '汉服', '前来', '还免', '喔']",性价比,49,1.0,57717,2
A49,2020-05-29,可以开车到山顶。但是请不要选择高峰期没有地方停车。景区公交十块可以到山顶。景点大部分都比较集中。本地人多是求观音的。景区有度假村泳池和宾馆。门票不贵，环境不错，山上可以望到珠江口。,3.0,0.2849000096321106,"走, 高, 性价比, 免费, 太, 坐, 建议, 观音, 开车, 感觉","['开车', '山顶', '请', '选择', '高峰期', '停车', '公交', '十块', '山顶', '大部分', '本地人', '求', '观音', '度假村', '泳池', '宾馆', '贵', '环境', '山上', '珠江口']",性价比,49,1.5,57718,3
A49,2020-06-02,网上买票就是便宜，取票也很方便，可以登高望远的，可以坐缆车，不会走得太累，不过没有看到很多花，还好看到满池莲花也不太失望，可以入庙参拜，祈求好运。,3.0,0.6818000078201294,"走, 高, 性价比, 免费, 太, 坐, 建议, 观音, 开车, 感觉","['网上', '便宜', '登高望远', '坐', '缆车', '走', '太', '累', '花', '还好', '满池', '莲花', '太', '失望', '入庙', '参拜', '祈求', '好运']",性价比,49,1.0,57719,2
A49,2020-10-19,去过好几次番禺**，昨天又去了，这次运气不错，碰上金秋莲花展。第三届睡莲展，规模的确宏达，品种的确繁多，还人工地弄点雾出来，给人一张身处仙境的感觉，如果有空的话，真的值得去看看。,11.0,0.2786000072956085,"景色, 美, 感觉, 山上, 值得, 中, 优美, 拍, 交通, 少","['去过', '几次', '番禺', '昨天', '运气', '碰上', '金秋', '莲花', '展', '第三届', '睡莲', '展', '规模', '宏达', '品种', '繁多', '人工', '弄', '雾', '一张', '身处', '仙境', '感觉', '有空', '真的', '值得']",位置,49,1.0,57720,2
A49,2020-09-07,番禺**是广东省重点风景名胜区，位于番禺市东部珠江口狮子河畔。**由48座红色砂岩低山组成，海拔最高为108米，占地2.54平方公里。其中有座麒麟峰，因峰顶上有一块酷似莲花的岩石，所以后人把这座山称为**。番禺狮子洋畔，**山麓，矗立着一片赤岩峭壁，绵延千米，蔚为壮观。当你惊叹大自然的鬼斧神工时，也许没有想到，是人类手中的一锤一凿，造就了这一片“人工丹霞”的奇景。山顶粤海度假村住一晚真是惬意无限好！,3.0,0.2520000040531158,"走, 高, 性价比, 免费, 太, 坐, 建议, 观音, 开车, 感觉","['番禺', '广东省', '重点', '风景', '名胜区', '位于', '番禺市', '东部', '珠江口', '狮子', '河畔', '座', '红色', '砂岩', '低', '山', '海拔', '米', '占地', '平方公里', '座', '麒麟', '峰', '峰顶', '一块', '酷似', '莲花', '岩石', '后人', '座', '山', '称为', '番禺', '狮子', '洋畔', '山麓', '矗立', '赤岩', '峭壁', '绵延', '千米', '蔚为壮观', '惊叹', '大自然', '鬼斧神工', '时', '也许', '想到', '人类', '手中', '一锤', '凿', '造就', '人工', '丹霞', '奇景', '山顶', '粤海', '度假村', '住', '一晚', '惬意', '无限']",性价比,49,0.0,57721,1
A49,2020-10-15,**在广州番禺，因为有望海观音而出名。整个景区不是特别大，景点也不太多。东门这边的人很少，不能开车进去，并且东门外也没有专门停车场。国庆期间景区里在做莲花展，可以看到好多不同种类，不同颜色的莲花，还是很涨见识。景区规定不让游客自带香，元宝等物品拜观音，里面有免费的香可以请的。,3.0,0.4029000103473663,"走, 高, 性价比, 免费, 太, 坐, 建议, 观音, 开车, 感觉","['广州', '番禺', '望海', '观音', '而出名', '特别', '太', '东门', '开车', '东门外', '停车场', '国庆', '期间', '做', '莲花', '展', '好多', '种类', '颜色', '莲花', '涨', '见识', '不让', '游客', '自带', '香', '元宝', '物品', '拜', '观音', '免费', '香', '请']",性价比,49,2.0,57722,4
A49,2020-03-06,**是广东省风景名胜区。景区内有两千年历史，保存完好的古采石场遗址，有建于明代万历年间的莲花塔。还有新建的世界最高观音立像。**不仅是名山，还是灵山。一个焚香祈祷的好地方。,0.0,0.4246000051498413,"值得, 适合, 环境, 干净, 休闲, 公园, 空气清新, 瀑布, 水, 很漂亮","['广东省', '风景', '名胜区', '两千年', '历史', '保存', '完好', '采石场', '遗址', '建于', '明代', '万历', '年间', '莲花', '塔', '新建', '世界', '观音', '立像', '名山', '灵山', '焚香', '祈祷']",卫生,49,1.0,57723,2
A49,2020-11-26,第一次体验游船，另类的体验,10.0,0.6018000245094299,"喜欢, 下次, 漂亮, 朋友, 值得, 去过, 机会, 字, 开心, 风景优美","['第一次', '体验', '游船', '另类', '体验']",位置,49,1.5,57724,3
A49,2020-05-12,莲峰观海，山水相衬美如画―― 12月24日登【**】番禺**是广东省风景名胜区，位于番禺市东部珠江口狮子河畔。由48座红色砂岩低山组成，海拔最高108米，占地2.54平方公里。其中有座麒麟峰，因峰顶上有一块酷似莲花的岩石，所以后人把这座山称为**。番禺的**是个风景优美的旅游胜地。进了**的大门，沿着弯弯曲曲的山路，就可以从山脚到山顶。山路两旁生长着茂密的灌木丛和枝繁叶茂的大树，还有许多人工栽种的花卉，它们千姿百态、芬芳迷人、鲜艳无比。微风从南边的海上吹来，使人心情舒畅。南方的冬天，不像北方的冬天或是寒气逼人，朔风劲吹，万木萧索，或是城墙内外，漫天飞雪，大河上下冰冻失滔，人人裹着厚厚的棉衣，行在没有生气冰封世界里。南方冬天天气也冷，气温下降到10度上下，但万物仍然是五彩缤纷的色彩，到处是一幅幅美丽迷人的油画。南方的冬天是生命不息的季节。穿过一条林荫小道，就到了闻名的石景区。听说那里是两千多年前古人在这里采石留下的遗址。从莲花塔下步入观音圣境，笔直宽广的朝境大道一直延伸到一个青石铺砌的广场，一座宝相庄严、慈颜善目、金光耀眼的 望海观音宝像屹立在广场中央。举目瞻仰，湛蓝的天空中一朵朵白云飘浮天际，衬托着观音菩萨好像腾云驾雾，彩霞披身。观音像高40.88米，用120吨青铜铸成，外贴纯金180两，是目前世界上最高的箔金观音铜立像。观音宝像面向东南，遥望浩瀚的狮子洋，“望海观音”因而得名。莲花塔矗立在**主峰，始建于明朝万历四十年（1612年），已有近400年的历史，是省级文物保护单位。莲花塔外9层，内11层，外呈八角形，砖木结构，设有螺旋楼梯，可直达塔顶。在塔的各层有大小不一、造型各异的门洞。塔高50米，是**上的最高点。自古以来，从伶汀洋进珠江的船只，均以莲花塔为进入广州的航标，故有“省会华表”美誉。,3.0,0.2827999889850616,"走, 高, 性价比, 免费, 太, 坐, 建议, 观音, 开车, 感觉","['莲峰', '观海', '山水', '相衬', '美如画', '月', '日', '登', '番禺', '广东省', '风景', '名胜区', '位于', '番禺市', '东部', '珠江口', '狮子', '河畔', '座', '红色', '砂岩', '低', '山', '海拔', '米', '占地', '平方公里', '座', '麒麟', '峰', '峰顶', '一块', '酷似', '莲花', '岩石', '后人', '座', '山', '称为', '番禺', '风景优美', '旅游胜地', '进', '大门', '弯弯曲曲', '山路', '山脚', '山顶', '山路', '两旁', '生长', '茂密', '灌木丛', '枝繁叶茂', '大树', '人工', '栽种', '花卉', '千姿百态', '芬芳', '迷人', '鲜艳', '无比', '微风', '南边', '海上', '吹', '心情舒畅', '南方', '冬天', '北方', '冬天', '寒气逼人', '朔风', '劲吹', '万木', '萧索', '城墙', '内外', '漫天', '飞雪', '大河上下', '冰冻', '失滔', '裹', '厚厚的', '棉衣', '行', '生气', '冰封', '世界', '南方', '冬天', '天气', '冷', '气温', '下降', '到度', '万物', '五彩缤纷', '色彩', '一幅幅', '美丽', '迷人', '油画', '南方', '冬天', '生命不息', '季节', '穿过', '一条', '林荫', '小道', '闻名', '石', '听说', '两千多年', '前', '古人', '采石', '留下', '遗址', '莲花', '塔', '步入', '观音', '圣境', '笔直', '宽广', '朝境', '大道', '延伸', '青石', '铺砌', '广场', '一座', '宝相', '庄严', '慈颜', '善目', '金光', '耀眼', '望海', '观音', '宝像', '屹立', '广场', '中央', '举目', '瞻仰', '湛蓝', '天空', '中', '一朵朵', '白云', '飘浮', '天际', '衬托', '观音菩萨', '好像', '腾云驾雾', '彩霞', '披身', '观音像', '高', '米', '吨', '青铜', '铸成', '外贴', '纯金', '两', '世界', '箔金', '观音', '铜', '立像', '观音', '宝像', '面向', '东南', '遥望', '浩瀚', '狮子', '洋', '望海', '观音', '得名', '莲花', '塔', '矗立', '主峰', '始建', '明朝', '万历', '四十年', '年', '已有', '近年', '历史', '省级', '文物保护', '单位', '莲花', '塔', '外层', '内层', '外', '呈', '八角形', '砖木结构', '设有', '螺旋', '楼梯', '直达', '塔顶', '塔', '层', '大小不一', '造型各异', '门洞', '塔高', '米', '最高点', '自古以来', '伶汀洋', '进', '珠江', '船只', '莲花', '塔', '广州', '航标', '省会', '华表', '美誉']",性价比,49,5.0,57725,5
A49,2020-08-15,不怎么好玩所以带孩子不建议去,2.0,0.4235999882221222,"好玩, 开心, 太, 天气, 项目, 特别, 舒服, 夏天, 热, 风景","['好玩', '建议']",设施,49,1.5,57726,3
A49,2020-07-29,小孩子玩的很开心，有大佛、可以观海、莲花、峭壁、石阶、海鸟。景色秀丽，可以烧香拜佛，周边酒店配套设施齐全，非常值得观赏。,0.0,0.3429999947547912,"值得, 适合, 环境, 干净, 休闲, 公园, 空气清新, 瀑布, 水, 很漂亮","['开心', '大佛', '观海', '莲花', '峭壁', '石阶', '海鸟', '景色', '秀丽', '烧香拜佛', '周边', '配套', '设施', '齐全', '值得', '观赏']",卫生,49,2.0,57727,4
A49,2020-08-24,这里是很值得去。观音特别灵！！！,0.0,0.512499988079071,"值得, 适合, 环境, 干净, 休闲, 公园, 空气清新, 瀑布, 水, 很漂亮","['值得', '观音', '特别', '灵']",卫生,49,2.0,57728,4
A49,2020-05-01,在广州生活了几十年却没有去过**，当然了，**属于番禺区，原来是番禺市，自然就没有想到要去番禺市的景点玩。今年五一闲着，上网搜索了，发现**，就去了，昨天去的，恰好是农历十五。先坐地铁，然后转公交车，路途挺遥远的，公交车上无意中与身边的一个新朋友谈及**，她说人很多，自己开车很塞车，问及人多的原因，说是**上有观音，很灵的。的确，**上求签的人很多，求一支签30元（包括讲解），不要讲解也要30元。门票54元，昨天五一八折43元，**大门边有很多买花的，价格不一，可以讲价。**门票虽然贵了点，但是里面能看的东西还是很多的。,3.0,0.3343000113964081,"走, 高, 性价比, 免费, 太, 坐, 建议, 观音, 开车, 感觉","['广州', '生活', '几十年', '去过', '番禺区', '番禺市', '自然', '想到', '番禺市', '五一', '闲着', '上网', '搜索', '发现', '昨天', '农历', '十五', '先', '坐地铁', '公交车', '路途', '遥远', '公交车', '无意', '中', '身边', '新', '朋友', '谈及', '开车', '塞车', '问及', '原因', '观音', '很灵', '求签', '求', '一支', '签元', '包括', '讲解', '讲解', '昨天', '五一', '八折', '大门', '买花', '价格', '讲价', '贵', '能看', '东西']",性价比,49,-1.0,57729,1
A49,2020-08-12,值得一去，景区管理非常到位，景色不错，人不多，望海观音很震撼，古代采石场也非常有价值,1.0,0.2928999960422516,"风景, 表演, 值得, 一般般, 位于, 晚上, 好看, 建筑, 美丽, 大自然","['值得', '管理', '到位', '景色', '人不多', '望海', '观音', '震撼', '古代', '采石场', '价值']",服务,49,2.0,57730,4
A49,2020-06-18,很早就到码头等了 过了时间才开始取票，船挺稳的 不会晕船，经过海心沙时 可以到船头拍照 近距离看**，票上写的小食茶水…就是一人一瓶水和一小包豌豆，去到尽管已经走很快了 ，但因为开船时间 还是有一小部分没有逛完…紧赶慢赶的午饭也没吃，回程的路上 在附近的市场买了些小鱼干 回来试了还不错，还买了熟食上船吃路上经过海心沙 直接下船继续逛,6.0,0.5515999794006348,"上山, 广东, 导游, 山顶, 时, 走, 到达, 两个, 下午, 坐","['早就', '码头', '了过', '船', '挺稳', '晕船', '海心沙', '时', '船头', '拍照', '近距离', '写', '小食', '茶水', '一瓶', '水', '一小包', '豌豆', '走', '很快', '开船', '一小部分', '逛', '紧', '赶慢', '午饭', '吃', '回程', '路上', '市场', '小鱼', '干', '回来', '试', '熟食', '上船', '吃', '路上', '海心', '沙', '下船', '逛']",服务,49,1.5,57731,3
A49,2020-05-08,从天一码头上船，珠江日游加**景区门票，超赞，比转车方便。就是过年**太热闹了，有点吵，还是喜欢寂静的寺庙。,3.0,0.3941999971866607,"走, 高, 性价比, 免费, 太, 坐, 建议, 观音, 开车, 感觉","['天一', '码头', '上船', '珠江', '日', '游加', '超赞', '转车', '过年', '太', '热闹', '吵', '喜欢', '寂静', '寺庙']",性价比,49,2.0,57732,4
A49,2020-12-12,地理位置非常好，而且里面的景色也非常迷人，很是喜欢这里的景点。里面有很多的奇特石头，都是天然形成的。而且一年四季都会拥有很多花，还有很多古典建筑。,11.0,0.5842999815940857,"景色, 美, 感觉, 山上, 值得, 中, 优美, 拍, 交通, 少","['地理位置', '景色', '迷人', '喜欢', '奇特', '石头', '天然', '一年四季', '拥有', '花', '古典建筑']",位置,49,4.0,57733,5
A49,2020-09-03,春天过去真的很美，桃花依然盛开，只是由于迟开的缘故，叶子都已经长出来，别有一番韵味。春雨蒙蒙，好一派浪漫景色。一个大山坡上都是桃花，很壮观，也融化了我觉得雨天讨厌的心情。以前只是夏天的时候去开荷花，没想到春天去也花的海洋,11.0,0.4086000025272369,"景色, 美, 感觉, 山上, 值得, 中, 优美, 拍, 交通, 少","['春天', '真的', '美', '桃花', '依然', '盛开', '迟开', '缘故', '叶子', '长', '韵味', '春雨', '蒙蒙', '好一派', '浪漫', '景色', '山坡', '桃花', '壮观', '融化', '雨天', '讨厌', '心情', '夏天', '开', '荷花', '没想到', '春天', '花', '海洋']",位置,49,1.0,57734,2
A49,2020-08-28,**位于番禺区狮子河畔，距离市区较远，需要地铁公交接驳，私家车辆可以驶到景区内，游览叫方便。**由48座红色砂岩低山组成，属丹霞地貌的地理构造。正所谓“山不在高，有仙则灵”。周边的信徒前来祈福，香火不断。**的红砂岩石质优，密度高、砂质细，古人用它来作为磨刀石，所以**又叫“石砺冈”。这些红砂岩也是做墙基的好材料。据专家鉴定，建于2100多年前的南越王墓，墓穴所砌的12种石料中，有8种采自**。当年在这里开采的石块是从水路运到广州象岗山的。,3.0,0.5328999757766724,"走, 高, 性价比, 免费, 太, 坐, 建议, 观音, 开车, 感觉","['位于', '番禺区', '狮子', '河畔', '距离', '市区', '远', '地铁', '公交', '接驳', '私家', '车辆', '驶到', '游览', '座', '红色', '砂岩', '低', '山', '属', '丹霞地貌', '地理', '构造', '正', '山', '高', '仙', '灵', '周边', '信徒', '前来', '祈福', '香火不断', '红砂岩', '石', '质优', '密度', '高', '砂质', '细', '古人', '磨刀石', '石砺冈', '红砂岩', '做', '墙基', '材料', '专家', '鉴定', '建于', '多年', '前', '南越王', '墓', '墓穴', '所砌', '石料', '中', '有种', '采自', '当年', '开采', '石块', '是从', '水路', '运到', '广州', '象岗山']",性价比,49,0.0,57735,1
A49,2020-04-13,从广州去过去，乘搭公交还是非常方便的，就是路途有点远。整体还算满意，景区好大好大，一天下来也逛不完的，个人觉得还算是蛮值得一去的，给个五颗星好评呗。,5.0,0.2791999876499176,"温泉, 服务, 服务态度, 满意, 泡温泉, 热情, 家人, 工作人员, 方便快捷, 态度","['广州', '搭', '公交', '路途', '远', '整体', '算', '满意', '大好', '逛', '不完', '算是', '值得', '一去', '五颗星', '好评']",服务,49,2.0,57736,4
A49,2020-04-06,超的景点！性价比特别高！特别推荐一下，有空的朋友记得好好玩。,2.0,0.4399000108242035,"好玩, 开心, 太, 天气, 项目, 特别, 舒服, 夏天, 热, 风景","['超', '性价比', '特别', '高', '特别', '推荐', '有空', '朋友', '记得', '好玩']",设施,49,3.0,57737,5
A49,2020-06-07,好玩，风景好漂亮，美女多多，风铃美好,2.0,0.2258999943733215,"好玩, 开心, 太, 天气, 项目, 特别, 舒服, 夏天, 热, 风景","['好玩', '风景', '漂亮', '美女', '风铃', '美好']",设施,49,2.0,57738,4
A49,2020-10-16,秋天的**，就是一副五彩缤纷的水墨画，道路两旁，随手一拍，都是绚丽的风景。马路宽广，交通顺畅，空气清新，是周末郊外旅行的好地方。,0.0,0.3260000050067901,"值得, 适合, 环境, 干净, 休闲, 公园, 空气清新, 瀑布, 水, 很漂亮","['秋天', '一副', '五彩缤纷', '水墨画', '道路', '两旁', '随手', '拍', '绚丽', '风景', '马路', '宽广', '交通', '顺畅', '空气清新', '周末', '郊外', '旅行']",卫生,49,1.5,57739,3
A49,2020-07-11,空气很好，拜神的好地方，很多荷花看呢！,8.0,0.5396999716758728,"空气, 设施, 可惜, 完善, 还行, 游乐, 有意思, 老板, 负离子, 商业","['空气', '拜神', '荷花']",设施,49,1.5,57740,3
A49,2020-05-16,**的荷花很美，空气特别好，还会去哦！,11.0,0.5130000114440918,"景色, 美, 感觉, 山上, 值得, 中, 优美, 拍, 交通, 少","['荷花', '美', '空气', '特别']",位置,49,1.0,57741,2
A49,2020-05-06,夏天荷花开的时候很美，古采石场很壮观。就是门票贵了些。,2.0,0.2375999987125396,"好玩, 开心, 太, 天气, 项目, 特别, 舒服, 夏天, 热, 风景","['夏天', '荷花', '开', '美', '采石场', '壮观', '贵']",设施,49,1.0,57742,2
A49,2020-03-17,挺好看的玩的人很多的呀，下次还会来,10.0,0.3609000146389007,"喜欢, 下次, 漂亮, 朋友, 值得, 去过, 机会, 字, 开心, 风景优美","['好看', '下次']",位置,49,1.5,57743,3
A49,2020-07-08,莲花开的特别漂亮，各种各样的莲花，睡莲，景区里面非常干净。接天莲叶无穷碧，映日荷花别样红，性价比高，园区大，云雾缭绕，如临仙境。,3.0,0.2971999943256378,"走, 高, 性价比, 免费, 太, 坐, 建议, 观音, 开车, 感觉","['莲花', '开', '特别', '漂亮', '各种各样', '莲花', '睡莲', '干净', '接天', '莲叶', '无穷', '碧', '映', '日', '荷花', '别样红', '性价比', '高', '园区', '云雾', '缭绕', '如临', '仙境']",性价比,49,2.0,57744,4
A49,2020-05-20,虽然天有点热，但景色不错！挺好的！,2.0,0.519599974155426,"好玩, 开心, 太, 天气, 项目, 特别, 舒服, 夏天, 热, 风景","['天', '热', '景色']",设施,49,1.5,57745,3
A49,2020-04-18,开车进的，收费有点贵啊，一车人三百块钱,3.0,0.8461999893188477,"走, 高, 性价比, 免费, 太, 坐, 建议, 观音, 开车, 感觉","['开车', '进', '收费', '贵', '一车', '三百块', '钱']",性价比,49,1.5,57746,3
A49,2020-04-14,很舒服的环境，佛怀慈悲，每年去一次,7.0,0.6923999786376953,"环境, 贵, 很好, 没什么, 吃, 东西, 太, 差, 感觉, 风景","['舒服', '环境', '佛', '怀', '慈悲']",性价比,49,2.0,57747,4
A49,2020-04-10,风景美丽，环境好，服务周到 适合游玩的好地方,0.0,0.5076000094413757,"值得, 适合, 环境, 干净, 休闲, 公园, 空气清新, 瀑布, 水, 很漂亮","['风景', '美丽', '环境', '服务周到', '适合']",卫生,49,2.0,57748,4
A49,2020-04-23,夏天荷花开的时候，很美。各种各样的荷花，络绎不绝的游客、香客。门票有点贵，五十多块,0.0,0.2565000057220459,"值得, 适合, 环境, 干净, 休闲, 公园, 空气清新, 瀑布, 水, 很漂亮","['夏天', '荷花', '开', '美', '各种各样', '荷花', '络绎不绝', '游客', '香客', '贵', '五十多', '块']",卫生,49,1.5,57749,3
A49,2020-04-10,去过很多次，在番禺这一景点不错！,1.0,0.3610000014305115,"风景, 表演, 值得, 一般般, 位于, 晚上, 好看, 建筑, 美丽, 大自然","['去过', '番禺']",服务,49,1.5,57750,3
A49,2020-03-11,**景区，有南海观音菩萨，还有古采石场遗址，非常适合一家大小过来游玩。现在正直春天，春暖花开，非常漂亮。环境干净，绿植宜人。,7.0,0.3501999974250793,"环境, 贵, 很好, 没什么, 吃, 东西, 太, 差, 感觉, 风景","['南海', '观音菩萨', '采石场', '遗址', '非常适合', '一家', '大小', '正直', '春天', '春暖花开', '漂亮', '环境', '干净', '绿', '植', '宜人']",性价比,49,3.0,57751,5
A49,2020-04-02,很方便，入口查验后直接开车上山,6.0,0.7692000269889832,"上山, 广东, 导游, 山顶, 时, 走, 到达, 两个, 下午, 坐","['入口', '查验', '开车', '上山']",服务,49,1.5,57752,3
A49,2020-03-18,景点环境不错，取票方便快捷，下次还会来,10.0,0.5085999965667725,"喜欢, 下次, 漂亮, 朋友, 值得, 去过, 机会, 字, 开心, 风景优美","['环境', '方便快捷', '下次']",位置,49,1.5,57753,3
A49,2020-03-07,花美，布局不错，空气清新，天然氧吧,12.0,0.6154000163078308,"动物, 爬, 岛, 沙滩, 天然, 氧吧, 表演, 广州, 动物园, 种类","['花美', '布局', '空气清新', '天然', '氧吧']",设施,49,1.0,57754,2
A49,2020-02-27,**景色优美，空气质量一流，适合一家大小游玩,11.0,0.5220999717712402,"景色, 美, 感觉, 山上, 值得, 中, 优美, 拍, 交通, 少","['景色', '优美', '空气质量', '一流', '适合', '一家', '大小']",位置,49,3.0,57755,5
A49,2020-03-11,坐船不用挤车挤人，船上还有人弹琴。就是在**时间太短了，11点到15点30就开船了。回程时间也拖得太长。,3.0,0.3172999918460846,"走, 高, 性价比, 免费, 太, 坐, 建议, 观音, 开车, 感觉","['坐船', '不用', '挤车', '挤', '船上', '弹琴', '太短', '点到点', '开船', '回程', '拖', '太', '长']",性价比,49,1.5,57756,3
A49,2017-07-01,在网上预订**来回船票加门票套餐，在天字码头上船，大概2小时到达莲花港码头。船上工作人员带我们从码头走到**东门，大约15分钟左右。**风景不错，绿树成荫，在门口有电瓶车10元一人上到山顶，也可以选择步行，大概行两公里到达。上山途径古代采石场遗址，山顶有莲花塔，望海观音等景点。,3.0,0.4582999944686889,"走, 高, 性价比, 免费, 太, 坐, 建议, 观音, 开车, 感觉","['网上', '预订', '来回', '船票', '加', '套餐', '天字', '码头', '上船', '到达', '莲花', '港', '码头', '船上', '工作人员', '码头', '走', '东门', '分钟', '风景', '绿树成荫', '门口', '电瓶车', '山顶', '选择', '步行', '行', '两公里', '到达', '上山', '途径', '古代', '采石场', '遗址', '山顶', '莲花', '塔', '望海', '观音']",性价比,49,1.5,57757,3
A49,2020-03-08,排队取票超级慢(―)。。。船上有汽油味,4.0,0.5060999989509583,"便宜, 价格, 优惠, 网上, 现场, 不用, 实惠, 排队, 购票, 订","['排队', '超级', '慢', '船上', '汽油味']",性价比,49,1.5,57758,3
