A49,2016-07-01,**上的“莲花仙境”里游人如织，虽然天气不太稳定，间有小雨，不过完全木有影响到大伙游览观赏的兴致,11.0,0.4458000063896179,"景色, 美, 感觉, 山上, 值得, 中, 优美, 拍, 交通, 少","['莲花', '仙境', '游人如织', '天气', '太', '稳定', '间有', '小雨', '木有', '影响', '大伙', '游览', '观赏', '兴致']",位置,49,1.0,57862,2
A49,2016-10-02,采石场不错！热烈值得大家去看看，,0.0,0.5386000275611877,"值得, 适合, 环境, 干净, 休闲, 公园, 空气清新, 瀑布, 水, 很漂亮","['采石场', '热烈', '值得']",卫生,49,2.0,57863,4
A49,2016-11-02,石景奇观，有悬崖峭壁，奇石异洞，很别致,8.0,0.0768999978899955,"空气, 设施, 可惜, 完善, 还行, 游乐, 有意思, 老板, 负离子, 商业","['石景', '奇观', '悬崖峭壁', '奇石', '异洞', '别致']",设施,49,1.0,57864,2
A49,2016-03-18,很好的行程，取票方便。船上有茶水、小食、表演，位置算宽敞，4-5人一桌。船的两边是落地玻璃，坐在船舱里也能欣赏沿途的江景，还能上去二楼的观光平台，舒服。**不大，码头走过去是东门，东门一路上去就是望海观音，路比较好走，而去山不高，不会很累。山上有沙湾糖水、蜜糖、斋堂，走累了、饿了可以休息一下补充能量。,3.0,0.428299993276596,"走, 高, 性价比, 免费, 太, 坐, 建议, 观音, 开车, 感觉","['很好', '行程', '船上', '茶水', '小食', '表演', '位置', '算', '宽敞', '一桌', '船', '两边', '落地', '玻璃', '坐在', '船舱', '欣赏', '沿途', '江景', '二楼', '观光', '平台', '舒服', '码头', '走', '东门', '东门', '一路上', '望海', '观音', '路', '走', '山', '高', '累', '山上', '沙湾', '糖水', '蜜糖', '斋堂', '走累', '饿', '休息', '补充', '能量']",性价比,49,3.0,57865,5
A49,2016-09-30,很好，去的r候荷花_，好美，不^夏天去好瘢得要,8.0,0.5128999948501587,"空气, 设施, 可惜, 完善, 还行, 游乐, 有意思, 老板, 负离子, 商业","['r候', '荷花', '', '_', '美', '不^', '夏天', '', '得', '', '']",设施,49,1.5,57866,3
A49,2016-08-24,古采石场太美了，真的太美了。还有莲花很漂亮，没拍,12.0,0.6115999817848206,"动物, 爬, 岛, 沙滩, 天然, 氧吧, 表演, 广州, 动物园, 种类","['采石场', '太美', '真的', '太美', '莲花', '很漂亮', '没拍']",设施,49,1.5,57867,3
A49,2015-11-01,里面有个挺大的观音像。  那个桃花林还挺多桃花树的。 不过我去的时候已经过去了。 没有看到桃花、  古城墙也值得过去看看。 还有个迷宫。古采石场也挺高的，还有些诗词。,3.0,0.4666999876499176,"走, 高, 性价比, 免费, 太, 坐, 建议, 观音, 开车, 感觉","['有个', '挺大', '观音像', '桃花', '林', '桃花', '树', '桃花', '古城墙', '值得', '迷宫', '采石场', '高', '诗词']",性价比,49,1.0,57868,2
A49,2015-09-05,交通很方便，坐地铁4号线在石站下，站外就有公交车到**，车程大约15分钟左右。景区不是很大，大约3小时就可以逛完，也有观光车坐，好像是10元。里面只有古采石场可以看一下，其他的和普通公园差不多。门票50元感觉有点贵了。,3.0,0.6334999799728394,"走, 高, 性价比, 免费, 太, 坐, 建议, 观音, 开车, 感觉","['交通', '坐地铁', '号线', '石', '', '站', '站外', '公交车', '车程', '分钟', '很大', '逛', '观光车', '坐', '好像', '采石场', '公园', '感觉', '贵']",性价比,49,1.5,57869,3
A49,2016-07-24,碰上观音诞，幸福，希望心想事成。,2.0,0.2178999930620193,"好玩, 开心, 太, 天气, 项目, 特别, 舒服, 夏天, 热, 风景","['碰上', '观音', '诞', '幸福', '希望', '心想事成']",设施,49,3.0,57870,5
A49,2016-08-29,**旅途中，尽量少带现金，更不要将钱放在行李里，要贴身保管。,9.0,0.3064000010490417,"山, 爬山, 好多, 希望, 太, 美的, 钱, 水, 骑, 活动","['旅途', '中', '尽量少', '现金', '钱', '放在', '行李', '贴身']",设施,49,1.5,57871,3
A49,2016-02-08,总体感觉不错，既可以坐船游珠江，也可以游玩**；到达**码头有专车送至**入口，有观光车上到山顶，带着80多岁的老人出行也很方便。**景色秀美，值得游览，性价比比较高。不过取票只能上班时间取，虽说可以出游当天取，但是必须比较早去打印。对于上班族游客而言不够方便，其实天字码头票务窗每天晚上也卖珠江夜游票，何不方便游客，希望改进。,3.0,0.3941999971866607,"走, 高, 性价比, 免费, 太, 坐, 建议, 观音, 开车, 感觉","['总体', '感觉', '坐船', '珠江', '到达', '码头', '专车', '送', '入口', '观光车', '山顶', '多岁', '出行', '景色', '秀美', '值得', '游览', '性价比', '高', '只能', '上班时间', '取', '出游', '当天', '取', '早', '打印', '上班族', '游客', '天字', '码头', '票务', '窗', '每天晚上', '卖', '珠江', '夜游', '何不', '游客', '希望', '改进']",性价比,49,2.0,57872,4
A49,2016-08-15,古代挖石形成的独特山形，逛景区不会太累。,1.0,0.5227000117301941,"风景, 表演, 值得, 一般般, 位于, 晚上, 好看, 建筑, 美丽, 大自然","['古代', '挖石', '独特', '山形', '逛', '太累']",服务,49,1.0,57873,2
A49,2016-06-15,这次是在珠江搭船过去的，放假人比较多，香火鼎盛。景区不算很大很快就能逛完，远远就能看到观世音菩萨。,7.0,0.3882000148296356,"环境, 贵, 很好, 没什么, 吃, 东西, 太, 差, 感觉, 风景","['珠江', '搭船', '放假', '香火', '鼎盛', '不算', '很大', '很快', '逛', '远远', '观世音', '菩萨']",性价比,49,1.5,57874,3
A49,2016-01-10,身处采石场会让人不得不感叹先人开天僻地的勇气和魄力，不可思异，让人佩服。站在山上眺望远方，伴着人们祈福的钟声，有种豁达开朗，一扫阴霾的感慨。,6.0,0.2971000075340271,"上山, 广东, 导游, 山顶, 时, 走, 到达, 两个, 下午, 坐","['身处', '采石场', '感叹', '先人', '开天僻地', '勇气', '魄力', '思异', '佩服', '站', '山上', '眺望', '远方', '伴', '祈福', '钟声', '有种', '豁达', '开朗', '扫', '阴霾', '感慨']",服务,49,-1.0,57875,1
A49,2016-07-07,景区有山面海，比较出名的是荷花展和望海观音，香火很旺，适合全家休闲,0.0,0.3975000083446502,"值得, 适合, 环境, 干净, 休闲, 公园, 空气清新, 瀑布, 水, 很漂亮","['山', '面海', '出名', '荷花', '展', '望海', '观音', '香火', '旺', '适合', '全家', '休闲']",卫生,49,2.0,57876,4
A49,2016-02-17,**，南海观音，普渡众生。去寻点仙气吧,12.0,0.3589999973773956,"动物, 爬, 岛, 沙滩, 天然, 氧吧, 表演, 广州, 动物园, 种类","['南海', '观音', '普渡众生', '寻', '仙气']",设施,49,1.5,57877,3
A49,2015-07-05,风景好，进了**感觉很舒服……,3.0,0.3795999884605407,"走, 高, 性价比, 免费, 太, 坐, 建议, 观音, 开车, 感觉","['风景', '进', '感觉', '舒服']",性价比,49,1.0,57878,2
A49,2015-10-03,**值得大家去旅游，景色很美远远望去还涛涛江水,11.0,0.7694000005722046,"景色, 美, 感觉, 山上, 值得, 中, 优美, 拍, 交通, 少","['值得', '景色', '美', '远远望去', '涛', '涛', '江水']",位置,49,1.0,57879,2
A49,2015-09-18,进去**挺漂亮，来这边的人大多数是拜观音和看莲花的，那望海观音真的好壮观，听说香火特别旺，超多人烧香的，接下来是大片的莲花池这个时间莲花几乎都枯萎了，没多少莲花看，但在小的池里面还是可以看来来自好多国家的莲花，还有古采石场很漂亮，一路逛下来玩的很开心，最后有回家的时候倒霉的事到了，从西门出来，就差五米的距离要跨出**大门时，不知什么原因脚下踩到一颗小石头把我绊倒了，绊倒那一刻起都起不来真正的疼啊!左脚扭伤又青又肿的，到现在都不能走路了!哎!消灾消灾，游玩**有苦有泪也有值得的地方。,3.0,0.3100000023841858,"走, 高, 性价比, 免费, 太, 坐, 建议, 观音, 开车, 感觉","['漂亮', '拜', '观音', '莲花', '望海', '观音', '真的', '壮观', '听说', '香火', '特别', '旺', '超', '烧香', '大片', '莲花池', '莲花', '枯萎', '莲花', '好多', '国家', '莲花', '采石场', '很漂亮', '一路', '逛下来', '开心', '回家', '倒霉', '事', '西门', '差', '五米', '距离', '跨出', '大门', '时', '不知', '原因', '脚下', '踩', '一颗', '小石头', '绊倒', '绊倒', '一刻起', '起不来', '疼', '左', '脚扭伤', '青', '肿', '走路', '消灾', '消灾', '苦', '泪', '值得']",性价比,49,1.0,57880,2
A49,2016-03-13,求神拜佛的好地方，南海观音据说很灵验的，门口买香要15元一把，但是在下车点或半路买就便宜点，无底洞找遍了也不知道在哪里，算爬山倒是不错的,6.0,0.4350000023841858,"上山, 广东, 导游, 山顶, 时, 走, 到达, 两个, 下午, 坐","['求神拜佛', '南海', '观音', '灵验', '门口', '香', '一把', '下车', '半路', '便宜', '无底洞', '找遍', '算', '爬山', '倒']",服务,49,0.0,57881,1
A49,2015-07-06,很好！风景很美！还有闻到莲花的香味！,1.0,0.3607999980449676,"风景, 表演, 值得, 一般般, 位于, 晚上, 好看, 建筑, 美丽, 大自然","['风景', '美', '闻到', '莲花', '香味']",服务,49,1.5,57882,3
A49,2016-06-18,很大的旅游区，开发的很好了，游客很多,3.0,0.4361999928951263,"走, 高, 性价比, 免费, 太, 坐, 建议, 观音, 开车, 感觉","['很大', '旅游区', '开发', '很好', '游客']",性价比,49,1.0,57883,2
A49,2015-10-03,很漂亮虽然说没有**大，但是拍照加逛了大多数地方，也要花上一个下午的时间,0.0,0.4318999946117401,"值得, 适合, 环境, 干净, 休闲, 公园, 空气清新, 瀑布, 水, 很漂亮","['很漂亮', '拍照', '加逛', '花', '下午']",卫生,49,1.5,57884,3
A49,2016-04-27,开车进去比较好，走路上山太远了,3.0,0.623199999332428,"走, 高, 性价比, 免费, 太, 坐, 建议, 观音, 开车, 感觉","['开车', '走路', '上山', '太', '远']",性价比,49,1.5,57885,3
A49,2016-05-12,从番禺出发去香港，坐船很方便，还有接驳车辆,3.0,0.2885000109672546,"走, 高, 性价比, 免费, 太, 坐, 建议, 观音, 开车, 感觉","['番禺', '出发', '香港', '坐船', '接驳', '车辆']",性价比,49,1.5,57886,3
A49,2016-02-14,非常方便，也有优惠，过关也非常顺利快捷，但是取票时有点小麻烦，售票员对程序不太熟悉，不过还是很快办好了，态度也很好。,6.0,0.7056999802589417,"上山, 广东, 导游, 山顶, 时, 走, 到达, 两个, 下午, 坐","['优惠', '过关', '顺利', '快捷', '时', '小麻烦', '售票员', '程序', '不太熟悉', '很快', '办好', '态度']",服务,49,2.0,57887,4
A49,2016-02-13,里面很大有坐观音望海，风景好靓！有很多景色点。,3.0,0.4609000086784363,"走, 高, 性价比, 免费, 太, 坐, 建议, 观音, 开车, 感觉","['很大', '坐', '观音', '望海', '风景', '靓', '景色']",性价比,49,1.5,57888,3
A49,2016-05-12,总体还是挺好的，发船准时，兑换也快，来回的船票加门票，挺划算的，船上还有表演。,3.0,0.3564000129699707,"走, 高, 性价比, 免费, 太, 坐, 建议, 观音, 开车, 感觉","['总体', '发船', '准时', '兑换', '来回', '船票', '加', '划算', '船上', '表演']",性价比,49,1.5,57889,3
A49,2016-01-29,游船沿途风景不错，不过天气不是很好，较阴沉，上**时发生过一些不快。不过未影响游现心情，总体来说，这样的价位还是挺值的，下次有机会还会游二话。,11.0,0.306300014257431,"景色, 美, 感觉, 山上, 值得, 中, 优美, 拍, 交通, 少","['游船', '沿途', '风景', '天气', '阴沉', '时', '发生', '不快', '未', '影响', '游现', '心情', '总体', '价位', '挺值', '下次', '机会', '二话']",位置,49,0.0,57890,1
A49,2016-01-29,是个不错的选择，带亲戚去的，比自驾少了塞车的烦恼，就是游船服务有进步空间，空气不好，茶水都的自助，不过表演不错，那个大姐是表演杂技的，好看，还跟孩子互动了,1.0,0.3521000146865845,"风景, 表演, 值得, 一般般, 位于, 晚上, 好看, 建筑, 美丽, 大自然","['选择', '亲戚', '自驾', '少', '塞车', '烦恼', '游船', '服务', '空间', '空气', '不好', '茶水', '自助', '表演', '大姐', '表演', '杂技', '好看', '互动']",服务,49,-1.0,57891,1
A49,2016-01-01,**，顾名思义来这的旅客都会去望海观音烧香拜佛，闲暇时来这放松下还是不错的，遇上好的季节也可看盛开的莲花，一年四季花草树木如春一般！,3.0,0.358599990606308,"走, 高, 性价比, 免费, 太, 坐, 建议, 观音, 开车, 感觉","['顾名思义', '旅客', '望海', '观音', '烧香拜佛', '闲暇', '时', '放松', '遇上', '季节', '可看', '盛开', '莲花', '一年四季', '花草树木', '如春']",性价比,49,1.5,57892,3
A49,2016-01-01,冬季有梅花可以看，4A景区，环境不错。大观音据说很灵验，香火鼎盛，不过如果许得愿实现了，记得要还愿就是了。,3.0,0.4571999907493591,"走, 高, 性价比, 免费, 太, 坐, 建议, 观音, 开车, 感觉","['冬季', '梅花', '环境', '观音', '灵验', '香火', '鼎盛', '许得', '愿', '记得', '还愿']",性价比,49,1.5,57893,3
A49,2016-01-10,地铁转公交，特别方便的夏天的景致会更好，因为有莲花节，不过冬天也还可以，毕竟广州冬天也是暖和的，绿树红花，不会什么看头都没有，最大的景点是金身的观音像，特别高大壮观，香火也旺。,2.0,0.3181999921798706,"好玩, 开心, 太, 天气, 项目, 特别, 舒服, 夏天, 热, 风景","['地铁', '公交', '特别', '夏天', '景致', '更好', '莲花', '节', '冬天', '广州', '冬天', '暖和', '绿树', '红花', '看头', '金身', '观音像', '特别', '高大', '壮观', '香火', '旺']",设施,49,4.0,57894,5
A49,2015-12-20,大概半个小时就能确认订票成功，速度还是可以的。现场拿票的时候售票员对拿票流程不熟，要问其他人才知道怎么操作,6.0,0.3671000003814697,"上山, 广东, 导游, 山顶, 时, 走, 到达, 两个, 下午, 坐","['半个', '确认', '成功', '速度', '现场', '拿票', '售票员', '拿票', '流程', '熟', '问', '人才', '操作']",服务,49,1.0,57895,2
A49,2016-02-12,还行吧！节假日人太多了，交通不方便，堵车！,2.0,0.2806999981403351,"好玩, 开心, 太, 天气, 项目, 特别, 舒服, 夏天, 热, 风景","['还行', '节假日', '太', '交通', '堵车']",设施,49,1.5,57896,3
A49,2015-12-24,特别方便，从广州直接坐船到香港，因为同行有个小伙伴通行证说是只能从深圳过关还很苦恼来着，正好在广州最后住**，坐一会儿车就到码头了。,0.0,0.2913999855518341,"值得, 适合, 环境, 干净, 休闲, 公园, 空气清新, 瀑布, 水, 很漂亮","['特别', '广州', '坐船到', '香港', '同行', '有个', '小伙伴', '通行证', '只能', '深圳', '过关', '苦恼', '正好', '广州', '住', '坐', '一会儿', '车', '码头']",卫生,49,1.0,57897,2
A49,2016-02-17,祈福，适合一家人出游的好去处。,0.0,0.7706000208854675,"值得, 适合, 环境, 干净, 休闲, 公园, 空气清新, 瀑布, 水, 很漂亮","['祈福', '适合', '出游', '好去处']",卫生,49,1.0,57898,2
A49,2015-12-20,虽然当天天气不是太好，阴天，但行程不错，游船干净，宽敞，去到**，空气很好，有电瓶车上到山顶，可惜没碰到桃花开的时节，值得下次再去,2.0,0.2152999937534332,"好玩, 开心, 太, 天气, 项目, 特别, 舒服, 夏天, 热, 风景","['当天', '天气', '不是太好', '阴天', '行程', '游船', '干净', '宽敞', '空气', '电瓶车', '山顶', '可惜', '碰到', '桃花开', '时节', '值得', '下次']",设施,49,0.0,57899,1
A49,2016-03-16,曾经的古代的采石场，所以造就了独特的石头景观，山顶可以跳舞珠江景色，莲花塔是标志古建筑。,1.0,0.4474999904632568,"风景, 表演, 值得, 一般般, 位于, 晚上, 好看, 建筑, 美丽, 大自然","['古代', '采石场', '造就', '独特', '石头', '景观', '山顶', '跳舞', '珠江', '景色', '莲花', '塔', '标志', '古建筑']",服务,49,1.0,57900,2
A49,2015-12-04,挺漂亮的，特别是桃花开的时候！那感觉好好！,10.0,0.513700008392334,"喜欢, 下次, 漂亮, 朋友, 值得, 去过, 机会, 字, 开心, 风景优美","['漂亮', '特别', '桃花开', '感觉', '好好']",位置,49,2.0,57901,4
A49,2016-03-08,环境优雅，整洁卫生，假期好去处；而且还是祈福的圣地。,0.0,0.757099986076355,"值得, 适合, 环境, 干净, 休闲, 公园, 空气清新, 瀑布, 水, 很漂亮","['环境', '优雅', '整洁', '卫生', '假期', '好去处', '祈福', '圣地']",卫生,49,3.0,57902,5
A49,2016-03-03,很值得去，景色不错，意义也很好。,11.0,0.4390000104904175,"景色, 美, 感觉, 山上, 值得, 中, 优美, 拍, 交通, 少","['值得', '景色', '意义']",位置,49,1.0,57903,2
A49,2016-03-01,整个行程轻松自由，一家大小坐船游游也不累，去的时候有小雨，空气很好，人也比较少，下次有机会再去,7.0,0.2496999949216842,"环境, 贵, 很好, 没什么, 吃, 东西, 太, 差, 感觉, 风景","['行程', '轻松自由', '一家', '大小', '坐船', '游游', '不累', '小雨', '空气', '少', '下次', '机会']",性价比,49,1.0,57904,2
A49,2016-02-23,好实惠，带父母一起去的，往返坐船各两个钟，**风景优美，烧香不错，行程设计不错。,6.0,0.3855000138282776,"上山, 广东, 导游, 山顶, 时, 走, 到达, 两个, 下午, 坐","['实惠', '父母', '往返', '坐船', '两个', '钟', '风景优美', '烧香', '行程', '设计']",服务,49,1.5,57905,3
A49,2016-02-19,周末节日去比较多看点，但是人流量也很大，门票还可以，里面消费也不算贵，,7.0,0.4830999970436096,"环境, 贵, 很好, 没什么, 吃, 东西, 太, 差, 感觉, 风景","['周末', '节日', '看点', '人流量', '很大', '消费', '不算', '贵']",性价比,49,1.5,57906,3
A49,2015-09-09,九月去的可以错过了莲花盛开的时候，当天超晒，不过观音金身就非常壮观，香火依然鼎盛。如果讲究性价比，可以在景区外买香进去拜观音，价钱相差一两倍。建议大家可以选择10元每人的观光车直接到山顶，再从上往下游玩，不然路程很可观！不得不说景区地图很多位置都不对！坑死人！如果吃不习惯斋菜，可以出景区后光顾附近大排档或者小饭店，地道广州风味，价钱也很平民，好评。,6.0,0.3172999918460846,"上山, 广东, 导游, 山顶, 时, 走, 到达, 两个, 下午, 坐","['九月', '错过', '莲花', '盛开', '当天', '超晒', '观音', '金身', '壮观', '香火', '依然', '鼎盛', '讲究', '性价比', '外', '香', '拜', '观音', '价钱', '相差', '一两倍', '建议', '选择', '每人', '观光车', '山顶', '上往', '路程', '可观', '地图', '位置', '坑', '死', '吃', '习惯', '斋菜', '光顾', '大排档', '饭店', '地道', '广州', '风味', '价钱', '平民', '好评']",服务,49,0.0,57907,1
A49,2016-02-20,客轮很舒服，**港到中港码头很方便，购物也很方便。,3.0,0.2700999975204468,"走, 高, 性价比, 免费, 太, 坐, 建议, 观音, 开车, 感觉","['客轮', '舒服', '港', '中港', '码头', '购物']",性价比,49,1.0,57908,2
A49,2016-02-26,**离广州市区蛮远的，地形地貌比较独特，景色不错，而且有一尊很大的观音像，香火蛮旺的,12.0,0.3458999991416931,"动物, 爬, 岛, 沙滩, 天然, 氧吧, 表演, 广州, 动物园, 种类","['广州市区', '蛮远', '地形', '地貌', '独特', '景色', '一尊', '很大', '观音像', '香火', '蛮旺']",设施,49,1.0,57909,2
A49,2016-02-13,搭船很方便，但到机场的时间太早了，能安排晚一点的班次就更好了。,6.0,0.3043999969959259,"上山, 广东, 导游, 山顶, 时, 走, 到达, 两个, 下午, 坐","['搭船', '机场', '太', '早', '安排', '晚一点', '班次', '更好']",服务,49,1.5,57910,3
A49,2016-02-08,给老人家买的，老人家很满意，很不错的体验,6.0,0.5684999823570251,"上山, 广东, 导游, 山顶, 时, 走, 到达, 两个, 下午, 坐","['老人家', '老人家', '满意', '体验']",服务,49,1.0,57911,2
A49,2016-02-09,时间准，服务好，一如既往，以后还要做！！,5.0,0.6933000087738037,"温泉, 服务, 服务态度, 满意, 泡温泉, 热情, 家人, 工作人员, 方便快捷, 态度","['准', '服务', '一如既往', '做']",服务,49,1.5,57912,3
A49,2016-02-05,取票很方便 ，价格比直接在站内买便宜，有需要会再买,4.0,0.6923999786376953,"便宜, 价格, 优惠, 网上, 现场, 不用, 实惠, 排队, 购票, 订","['价格比', '站内', '便宜']",性价比,49,1.0,57913,2
A49,2016-02-12,要去窗口人工取票！不能在自助取票机上取票的。所以要早去一点！,5.0,0.6330999732017517,"温泉, 服务, 服务态度, 满意, 泡温泉, 热情, 家人, 工作人员, 方便快捷, 态度","['窗口', '人工', '自助', '机上', '早去', '一点']",服务,49,1.0,57914,2
A49,2015-12-06,不错，有好看的莲花，美不胜收，价格优惠，非常值得一去，,4.0,0.4544000029563904,"便宜, 价格, 优惠, 网上, 现场, 不用, 实惠, 排队, 购票, 订","['好看', '莲花', '美不胜收', '价格', '优惠', '值得']",性价比,49,1.0,57915,2
A49,2016-01-11,买票的时候忘了看往返，往返都是分开买的，比双程贵了50快,6.0,0.6833999752998352,"上山, 广东, 导游, 山顶, 时, 走, 到达, 两个, 下午, 坐","['忘', '往返', '往返', '分开', '双程', '贵']",服务,49,-1.0,57916,1
A49,2016-02-02,方便，放心，如果设置一个专用窗口就更好了,4.0,0.490799993276596,"便宜, 价格, 优惠, 网上, 现场, 不用, 实惠, 排队, 购票, 订","['放心', '设置', '专用', '窗口', '更好']",性价比,49,1.0,57917,2
A49,2016-01-08,出票很快，比在官网便宜很多了，整体还不错,5.0,0.387800008058548,"温泉, 服务, 服务态度, 满意, 泡温泉, 热情, 家人, 工作人员, 方便快捷, 态度","['出票', '很快', '官网', '便宜', '整体']",服务,49,1.0,57918,2
A49,2016-01-21,值，里面可以玩一天，太大了，拜神也可以。,7.0,0.692300021648407,"环境, 贵, 很好, 没什么, 吃, 东西, 太, 差, 感觉, 风景","['值', '太', '拜神']",性价比,49,1.5,57919,3
A49,2016-01-08,不错的，挺准时的。下次出行还得需安装选择 。每次去香港多会考虑选择,0.0,0.3116999864578247,"值得, 适合, 环境, 干净, 休闲, 公园, 空气清新, 瀑布, 水, 很漂亮","['准时', '下次', '出行', '需', '安装', '选择', '每次', '香港', '选择']",卫生,49,1.5,57920,3
A49,2015-12-25,挺好的，风景秀丽，观音很大，现代化和古文化的结合。,0.0,0.4959000051021576,"值得, 适合, 环境, 干净, 休闲, 公园, 空气清新, 瀑布, 水, 很漂亮","['风景秀丽', '观音', '很大', '现代化', '古文化']",卫生,49,1.5,57921,3
A49,2015-12-25,带老妈去一次，跟老爸去一次，蛮不错的地方，舒服,2.0,0.7692000269889832,"好玩, 开心, 太, 天气, 项目, 特别, 舒服, 夏天, 热, 风景","['老妈', '老爸', '舒服']",设施,49,1.0,57922,2
A49,2015-12-24,一家人去，。 非常不错的出行，下次还会去,2.0,0.4483999907970428,"好玩, 开心, 太, 天气, 项目, 特别, 舒服, 夏天, 热, 风景","['出行', '下次']",设施,49,1.5,57923,3
A49,2015-12-20,景色美，初一十五过来的人也挺多，山上有百福石刻。,11.0,0.6155999898910522,"景色, 美, 感觉, 山上, 值得, 中, 优美, 拍, 交通, 少","['景色', '美', '初一', '十五', '山上', '有百福', '石刻']",位置,49,1.5,57924,3
A49,2015-09-06,山顶的莲花塔，可以上到顶层，在顶层上观景，真的是很不一样的，2块一位，一开始觉得不值，真正上来一看才明白价值。,1.0,0.3334999978542328,"风景, 表演, 值得, 一般般, 位于, 晚上, 好看, 建筑, 美丽, 大自然","['山顶', '莲花', '塔', '顶层', '顶层', '观景', '真的', '块', '一位', '不值', '一看', '明白', '价值']",服务,49,0.0,57925,1
A49,2015-12-17,还不错吧！有景、有玩的，也能拜观音，门票不贵，性价比不错，值得一去,3.0,0.54830002784729,"走, 高, 性价比, 免费, 太, 坐, 建议, 观音, 开车, 感觉","['有景', '拜', '观音', '贵', '性价比', '值得']",性价比,49,1.0,57926,2
A49,2015-01-31,从广州做地铁去的，里面风景很好，烧香的人特别多,11.0,0.6581000089645386,"景色, 美, 感觉, 山上, 值得, 中, 优美, 拍, 交通, 少","['广州', '做', '地铁', '风景', '烧香', '特别']",位置,49,1.0,57927,2
A49,2015-09-26,还可以吧，主要是看自然风景，山上有一座很大的望海观音雕像和一座寺庙，香火挺旺，山顶上可以看海，风景不错，适合一家人出游,0.0,0.3336000144481659,"值得, 适合, 环境, 干净, 休闲, 公园, 空气清新, 瀑布, 水, 很漂亮","['自然风景', '山上', '一座', '很大', '望海', '观音', '雕像', '一座', '寺庙', '香火', '旺', '山顶', '海', '风景', '适合', '出游']",卫生,49,1.0,57928,2
