A49,2017-08-27,昨天去的浙北大峡谷，今天去九龙峡满足孩子爬山要求，沿着峡谷向上，也许是刚下过雨的原因，瀑布不错。景区从藏龙百瀑旁一条隐蔽的单车道左转上山，差点开过了。上山路上有点滑，老婆挂彩了，售票处提供药水消毒，点个大赞。,6.0,0.3729000091552734,"上山, 广东, 导游, 山顶, 时, 走, 到达, 两个, 下午, 坐","['昨天', '浙北', '大峡谷', '九龙', '峡', '爬山', '峡谷', '向上', '也许', '下过', '雨', '原因', '瀑布', '藏龙', '百瀑', '旁', '一条', '隐蔽', '单车', '道', '左转', '上山', '差点', '开过', '上山', '路上', '滑', '老婆', '挂彩', '售票处', '提供', '药水', '消毒', '赞']",服务,49,-1.0,57804,1
A49,2017-10-03,九龙峡值得来玩，这里山好水好茶好人更好,9.0,0.5008999705314636,"山, 爬山, 好多, 希望, 太, 美的, 钱, 水, 骑, 活动","['九龙', '峡', '值得', '山', '水', '茶', '好人', '更好']",设施,49,1.0,57805,2
A49,2016-02-21,番禺**旅游区是国家4A级旅游区、新世纪羊城八景之一：莲峰观海。除了登顶烧香祈福，拜望海观音宝像，一定不要错过古采石场天然美景！（附**导览图）主要景点有莲花石、燕子岩、八仙岩、莲花岩、观音岩、飞鹰岩、南天门、神仙桥。**古采石场据科学考证是广州南越王墓石料的主要产地，以“人工无意夺天工”的石景奇观闻名于世，与湖北大冶古铜矿场并称为我国两大古矿场遗址。顺着望海观音脚下的“天龙八部梯”（共368级台阶）向下，画风突然转变。远离了山顶烧香祈福的人海，这里格外的幽静、天然。国内罕有的“人工无意夺天工”的石景奇观是此行出乎意料的收获。狮子石形状酷似一头威武的狮子雄居于山崖边，仿佛张口向着珠江怒吼，形态栩栩如生，故**也称作“石狮山”，面前的珠江河段被称为“狮子洋”。“观音岩原来只是一处采石遗留下来的石室，在**，有许多像观音岩一样被挖空的石室。其实被挖空的地方，往往就是石质最优良的地方。因为，一旦发现有好的石料，石匠们就会不断开采，结果就形成了一个又一个的石室。观音岩这里原是尼姑庵，主要供奉观音。据说鸦片战争期间，林则徐曾把这里作为官厅，而**上的其他许多石室则作为士兵的营房。”莲花石：据说，**之所以得名，就是因为这块巨石了。相传，很久以前，南海有一条孽龙，在珠江口兴风作浪，适逢南海观音菩萨路过此地，眼见孽龙遗祸，不禁大发慈悲，将座下莲花掷向水中，镇压海浪。从此，附近泥滩逐渐积成沙洲，衍变为万顷良田，造福人民。而这朵莲花则化为巨石，永镇山中。,3.0,0.3424000144004822,"走, 高, 性价比, 免费, 太, 坐, 建议, 观音, 开车, 感觉","['番禺', '旅游区', '国家级', '旅游区', '新世纪', '羊城', '八景', '莲峰', '观海', '登顶', '烧香', '祈福', '拜望', '海', '观音', '宝像', '错过', '采石场', '天然', '美景', '附', '导览', '图', '莲花', '石', '燕子岩', '八仙', '岩', '莲花', '岩', '观音岩', '飞鹰', '岩', '南天门', '神仙', '桥', '采石场', '科学', '考证', '广州', '南越王', '墓', '石料', '产地', '人工', '无意', '夺', '天工', '石景', '奇观', '闻名于世', '湖北', '大冶', '古铜', '矿场', '称为', '我国', '两', '大古', '矿场', '遗址', '望海', '观音', '脚下', '天龙八部', '梯', '共级', '台阶', '向下', '画风', '远离', '山顶', '烧香', '祈福', '人海', '幽静', '天然', '国内', '罕有', '人工', '无意', '夺', '天工', '石景', '奇观', '此行', '出乎意料', '收获', '狮子', '石', '形状', '酷似', '一头', '威武', '狮子', '雄', '居于', '山崖', '仿佛', '张口', '珠江', '怒吼', '形态', '栩栩如生', '称作', '石狮', '山', '面前', '珠江', '河段', '称为', '狮子', '洋', '观音岩', '一处', '采石', '遗留下来', '石室', '观音岩', '挖空', '石室', '挖空', '石质', '优良', '发现', '有好', '石料', '石匠', '开采', '石室', '观音岩', '原', '尼姑庵', '供奉', '观音', '鸦片战争', '期间', '林则徐', '官厅', '石室', '士兵', '营房', '莲花', '石', '得名', '这块', '巨石', '相传', '很久以前', '南海', '一条', '孽龙', '珠江口', '兴风作浪', '适逢', '南海', '观音菩萨', '路过', '眼见', '孽龙', '遗祸', '不禁', '大发慈悲', '座', '莲花', '掷', '水中', '镇压', '海浪', '泥滩', '积成', '沙洲', '衍变', '万顷', '良田', '造福', '朵', '莲花', '化为', '巨石', '永镇', '山中']",性价比,49,1.0,57806,2
A49,2017-05-15,这个景点还是不错的，因为带着老婆孩子，所以选择一个比藏龙百瀑小的景点是比较明智的，走起来不会太累，全程慢慢悠悠2小时来回，游玩的昨天刚下过大雨，山上水量充足，小瀑布很多，儿子玩水也很开心,3.0,0.2861000001430511,"走, 高, 性价比, 免费, 太, 坐, 建议, 观音, 开车, 感觉","['老婆', '选择', '藏龙', '百瀑', '明智', '走', '太累', '全程', '慢慢悠悠', '来回', '昨天', '下过', '大雨', '山上', '水量', '充足', '小瀑布', '儿子', '玩水', '开心']",性价比,49,2.0,57807,4
A49,2017-11-06,每年必去的一个地方，非常舒服很舒适,0.0,0.692300021648407,"值得, 适合, 环境, 干净, 休闲, 公园, 空气清新, 瀑布, 水, 很漂亮","['舒服', '舒适']",卫生,49,2.0,57808,4
A49,2017-07-02,此景区蛮自然的空气[新是避暑的理想场所值得一[。,0.0,0.2011999934911728,"值得, 适合, 环境, 干净, 休闲, 公园, 空气清新, 瀑布, 水, 很漂亮","['自然', '空气', '[', '新', '避暑', '理想', '场所', '值得', '[']",卫生,49,3.0,57809,5
A49,2017-03-16,这地方是古代采石的矿场，山势风景颇有些武陵源的感觉，只是能看到很多明显的人工开凿痕迹。景区内设施齐全，距离市区约二十公里。,3.0,0.341399997472763,"走, 高, 性价比, 免费, 太, 坐, 建议, 观音, 开车, 感觉","['古代', '采石', '矿场', '山势', '风景', '武陵源', '感觉', '人工', '开凿', '痕迹', '设施', '齐全', '距离', '市区', '约', '二十公里']",性价比,49,1.5,57810,3
A49,2017-07-30,总体感觉不错，既可以坐船游珠江，也可以游玩**；到达**码头有专车送至**入口，有观光车上到山顶，带着80多岁的老人出行也很方便。,3.0,0.5120999813079834,"走, 高, 性价比, 免费, 太, 坐, 建议, 观音, 开车, 感觉","['总体', '感觉', '坐船', '珠江', '到达', '码头', '专车', '送', '入口', '观光车', '山顶', '多岁', '出行']",性价比,49,1.5,57811,3
A49,2017-07-23,相对藏龙百瀑，它的人要少很多，但正因如此，更显清幽。我们开始几乎是包山游玩，很是尽兴。后来才碰上团队，不过我们正好返程了。性价比很高，不错。,3.0,0.5788999795913696,"走, 高, 性价比, 免费, 太, 坐, 建议, 观音, 开车, 感觉","['藏龙百', '瀑', '少', '正因如此', '显', '清幽', '包山', '尽兴', '碰上', '团队', '正好', '返程', '性价比', '高']",性价比,49,1.0,57812,2
A49,2017-10-23,总体比较好，属于开发比较浅的景区，游人少，非常安静，氧吧能算得上,5.0,0.3021000027656555,"温泉, 服务, 服务态度, 满意, 泡温泉, 热情, 家人, 工作人员, 方便快捷, 态度","['总体', '开发', '浅', '游人', '少', '安静', '氧吧', '算']",服务,49,2.0,57813,4
A49,2017-10-28,有山，有湖，有塔，还有观音菩萨像，好地方！,9.0,0.2777000069618225,"山, 爬山, 好多, 希望, 太, 美的, 钱, 水, 骑, 活动","['山', '湖', '塔', '观音菩萨']",设施,49,1.5,57814,3
A49,2017-07-10,风景不错！非常凉爽！山上有个观音庙！,11.0,0.4153999984264374,"景色, 美, 感觉, 山上, 值得, 中, 优美, 拍, 交通, 少","['风景', '凉爽', '山上', '有个', '观音庙']",位置,49,1.0,57815,2
A49,2017-07-29,怎么没儿童票？还是儿童不用票？,4.0,0.7692000269889832,"便宜, 价格, 优惠, 网上, 现场, 不用, 实惠, 排队, 购票, 订","['儿童票', '儿童', '不用']",性价比,49,1.5,57816,3
A49,2016-11-18,姆禺市蚩沙92路公直达，需r1小r左右。景区T票54元。景区H大，可乘h保由山_至山（花塔、花城）。再慢慢[玩下怼⒂^约4至5小甲笥摇,8.0,0.5665000081062317,"空气, 设施, 可惜, 完善, 还行, 游乐, 有意思, 老板, 负离子, 商业","['', '番禺市', '', '乘路', '公', '直达', '需', 'r', 'r', 'T票', 'H', '可乘', 'h保', '', '山_', '山', '花塔', '花城', '慢慢', '[玩', '下', '⒂^', '约', '', '']",设施,49,1.5,57817,3
A49,2017-07-10,风景很好，景区特别大，观音特别宏伟，上香的人很多，空气也挺好，到处开满花，很漂亮,3.0,0.2556999921798706,"走, 高, 性价比, 免费, 太, 坐, 建议, 观音, 开车, 感觉","['风景', '特别', '观音', '特别', '宏伟', '上香', '空气', '开满', '花', '很漂亮']",性价比,49,3.0,57818,5
A49,2017-07-23,还可以吧有点累景色不错一家人去祈福挺好的,9.0,0.3591000139713287,"山, 爬山, 好多, 希望, 太, 美的, 钱, 水, 骑, 活动","['有点累', '景色', '祈福']",设施,49,1.5,57819,3
A49,2016-11-07,交通不是特别方便，只能自驾，或者地铁转公车，一天内可以游览完毕，上午礼佛，中午吃斋，下午游览采石场山水，登高赏花，非常值得一家人来玩,3.0,0.3745000064373016,"走, 高, 性价比, 免费, 太, 坐, 建议, 观音, 开车, 感觉","['交通', '特别', '只能', '自驾', '地铁', '公车', '游览', '完毕', '上午', '礼佛', '中午', '吃斋', '下午', '游览', '采石场', '山水', '登高', '赏花', '值得']",性价比,49,2.0,57820,4
A49,2017-07-08,去过多次已无感，不过无事可以过去游玩一下也是不错的选择。,6.0,0.5009999871253967,"上山, 广东, 导游, 山顶, 时, 走, 到达, 两个, 下午, 坐","['去过', '无感', '事', '选择']",服务,49,1.5,57821,3
A49,2017-07-06,**，广州很著名的地方了，去了很多次，挺有意思的，狮子洋就在对面啊,12.0,0.3388000130653381,"动物, 爬, 岛, 沙滩, 天然, 氧吧, 表演, 广州, 动物园, 种类","['广州', '著名', '有意思', '狮子', '洋', '对面']",设施,49,1.5,57822,3
A49,2017-06-27,南海观音非常高，金光闪闪，保佑着南粤大地，值得一去,3.0,0.4332000017166137,"走, 高, 性价比, 免费, 太, 坐, 建议, 观音, 开车, 感觉","['南海', '观音', '高', '金光闪闪', '保佑', '南粤', '大地', '值得']",性价比,49,1.0,57823,2
A49,2017-06-23,每年去一次，听说那个观音求子还挺灵,6.0,0.4250999987125397,"上山, 广东, 导游, 山顶, 时, 走, 到达, 两个, 下午, 坐","['听说', '观音', '求子', '灵']",服务,49,1.5,57824,3
A49,2017-06-03,值得一去，有机会再去，风景很美，,1.0,0.2912999987602234,"风景, 表演, 值得, 一般般, 位于, 晚上, 好看, 建筑, 美丽, 大自然","['值得', '机会', '风景', '美']",服务,49,2.0,57825,4
A49,2017-05-31,地方挺好的，风景挺好，值得一游,1.0,0.692300021648407,"风景, 表演, 值得, 一般般, 位于, 晚上, 好看, 建筑, 美丽, 大自然","['风景', '值得']",服务,49,1.0,57826,2
A49,2017-06-15,环境美不胜收，特别是白鹭饲养区,12.0,0.4848999977111816,"动物, 爬, 岛, 沙滩, 天然, 氧吧, 表演, 广州, 动物园, 种类","['环境', '美不胜收', '特别', '白鹭', '饲养', '区']",设施,49,1.0,57827,2
A49,2017-06-02,好，空气很好，来这里是不错的选择,8.0,0.692300021648407,"空气, 设施, 可惜, 完善, 还行, 游乐, 有意思, 老板, 负离子, 商业","['空气', '选择']",设施,49,1.5,57828,3
A49,2016-10-14,一到节假日或者佛事日，**就热闹起来，虽然远离市区，但是凭借良好的自然风光和佛教寺院，旅游规划相当成熟，是广州附近广东人常来的地方。,3.0,0.3794000148773193,"走, 高, 性价比, 免费, 太, 坐, 建议, 观音, 开车, 感觉","['节假日', '佛事', '日', '热闹', '远离', '市区', '自然风光', '佛教', '寺院', '规划', '成熟', '广州', '广东']",性价比,49,1.0,57829,2
A49,2016-12-31,**最神圣的就是望海观音了，很壮观很高大很神圣，最赞的就是那天有位信徒从这楼梯一级一级的跪上来的，足见他的诚心，佩服！,12.0,0.26910001039505,"动物, 爬, 岛, 沙滩, 天然, 氧吧, 表演, 广州, 动物园, 种类","['神圣', '望海', '观音', '壮观', '高大', '神圣', '赞', '那天', '有位', '信徒', '楼梯', '一级', '一级', '跪', '足见', '诚心', '佩服']",设施,49,3.0,57830,5
A49,2017-05-30,比较一般，过去的路不太好走，和藏龙百瀑非常相似,3.0,0.5059000253677368,"走, 高, 性价比, 免费, 太, 坐, 建议, 观音, 开车, 感觉","['路', '不太好', '走', '和藏龙百', '瀑']",性价比,49,1.5,57831,3
A49,2017-05-16,这里环境很好，非常值得大家过来旅游。,0.0,0.692300021648407,"值得, 适合, 环境, 干净, 休闲, 公园, 空气清新, 瀑布, 水, 很漂亮","['环境', '值得']",卫生,49,1.0,57832,2
A49,2016-07-18,50块门票，我觉得值20。莲花塔，望海观音，**禅寺，莲花仙境，都一般。广州，这里算可以看海的了，尽管也不算什么海。采石场我倒是喜欢，因为年代久远，人工与自然结合在一起了。到处的‘到此一游’和烧高香的，看多了都是泪。,7.0,0.2189999967813491,"环境, 贵, 很好, 没什么, 吃, 东西, 太, 差, 感觉, 风景","['块', '值', '莲花', '塔', '望海', '观音', '禅寺', '莲花', '仙境', '广州', '算', '海', '不算什么', '海', '采石场', '倒', '喜欢', '年代久远', '人工', '自然', '到此一游', '烧高香', '看多', '泪']",性价比,49,2.0,57833,4
A49,2017-02-06,挺开阔，也号称很灵验，来观看礼佛的人挺多，不过能走车的地方，可以看的比较少，不能走车的景色多，但老人家可能不便。若年轻人可以走采石场一侧，单单礼佛可以直接开车上去的,6.0,0.6875,"上山, 广东, 导游, 山顶, 时, 走, 到达, 两个, 下午, 坐","['开阔', '号称', '灵验', '观看', '礼佛', '走车', '少', '走车', '景色', '老人家', '不便', '年轻人', '走', '采石场', '一侧', '礼佛', '开车']",服务,49,-1.0,57834,1
A49,2016-05-31,广州的**，供奉着观世音菩萨，屹立在珠江口。据说，有她的守护，广州的台风都很少了。景区里有个科普的莲花苑，在这里认识了许多莲花的品种。,12.0,0.7192999720573425,"动物, 爬, 岛, 沙滩, 天然, 氧吧, 表演, 广州, 动物园, 种类","['广州', '供奉', '观世音', '菩萨', '屹立', '珠江口', '守护', '广州', '台风', '有个', '科普', '莲花', '苑', '莲花', '品种']",设施,49,1.5,57835,3
A49,2017-03-31,前天和同事开车游玩过，五人门票带停车费300元，门票是54元一个人,3.0,0.2691999971866607,"走, 高, 性价比, 免费, 太, 坐, 建议, 观音, 开车, 感觉","['前天', '同事', '开车', '停车费']",性价比,49,1.5,57836,3
A49,2017-02-12,这是古代的采石场，景色，山景，风貌。都是不错的,11.0,0.5390999913215637,"景色, 美, 感觉, 山上, 值得, 中, 优美, 拍, 交通, 少","['古代', '采石场', '景色', '山景', '风貌']",位置,49,1.5,57837,3
A49,2017-03-23,**是广州比较有特色的一座山，有一座很大镀金雕像！香火很旺，还有人工采石场的遗址！,9.0,0.4217000007629394,"山, 爬山, 好多, 希望, 太, 美的, 钱, 水, 骑, 活动","['广州', '特色', '一座', '山', '一座', '很大', '镀金', '雕像', '香火', '旺', '人工', '采石场', '遗址']",设施,49,1.0,57838,2
A49,2015-10-25,一家人去的……小孩跑吖跑…登山拜观音…第一次看这么大的金身观音…震慑！雄伟！感叹人的鬼斧神工…^_^斋堂的饭菜一般…不过还是挺方便的，豆腐花挺滑的！交通也方便！,3.0,0.7156000137329102,"走, 高, 性价比, 免费, 太, 坐, 建议, 观音, 开车, 感觉","['跑', '跑', '登山', '拜', '观音', '第一次', '金身', '观音', '震慑', '雄伟', '感叹', '鬼斧神工', '斋堂', '饭菜', '豆腐花', '挺滑', '交通']",性价比,49,0.0,57839,1
A49,2017-01-29,烧香拜佛祈福的好去处，香火旺盛。,0.0,0.5418999791145325,"值得, 适合, 环境, 干净, 休闲, 公园, 空气清新, 瀑布, 水, 很漂亮","['烧香拜佛', '祈福', '好去处', '香火', '旺盛']",卫生,49,1.5,57840,3
A49,2016-12-08,这个景点还是不错的，跟门票的价格来说，性价比还是蛮高的。下次有机会可以考虑再去。全家人都玩得很愉快，既能赏风景又能锻炼身体,2.0,0.4149999916553497,"好玩, 开心, 太, 天气, 项目, 特别, 舒服, 夏天, 热, 风景","['价格', '性价比', '蛮高', '下次', '机会', '全家人', '愉快', '能赏', '风景', '锻炼身体']",设施,49,2.0,57841,4
A49,2016-08-12,小学三年级的时候曾经去过**，这次国庆节假期又再次重游。逢周六日在天字码头有船往返**，结果我们去到码头的时候才知道，这种船票必须提前一天打电话或者在网上预订，而且是必须订双程的，去程8：30，返程15：00。于是我们只好坐地铁到石站下车之后坐番92或者番93。国庆期间，**门票打8折，比团购价还便宜呢。**挺大，如果不想走路，可以坐景区里面的电瓶车，10元一趟。但其实值得看的地方不是很多，我个人认为最漂亮的是采石场遗址，很壮观，爬到最高处俯瞰下来的感觉太好了。总体来说，**挺清静的，感觉不错，有时间可以过来逛逛。,3.0,0.3194000124931335,"走, 高, 性价比, 免费, 太, 坐, 建议, 观音, 开车, 感觉","['小学', '三年级', '去过', '国庆节', '假期', '重游', '周六日', '天字', '码头', '船', '往返', '码头', '船票', '提前', '打电话', '网上', '预订', '订', '双程', '程', '返程', '只好', '坐地铁', '石', '', '站', '下车', '坐', '番', '番', '国庆', '期间', '打折', '比团', '购价', '便宜', '不想', '走路', '坐', '电瓶车', '一趟', '值得', '漂亮', '采石场', '遗址', '壮观', '爬', '最高处', '俯瞰', '感觉', '太好了', '总体', '清静', '感觉', '逛逛']",性价比,49,5.0,57842,5
A49,2016-12-06,**观音圣境，规模宏大，庄严雄伟。望海观音金像高40.88米，霞披狮海，光泽南天，是目前箔金铜像的世界之最。,3.0,0.6331999897956848,"走, 高, 性价比, 免费, 太, 坐, 建议, 观音, 开车, 感觉","['观音', '圣境', '规模宏大', '庄严', '雄伟', '望海', '观音', '金像', '高', '米', '霞', '披', '狮海', '光泽', '南', '天', '箔金', '铜像', '世界之最']",性价比,49,3.0,57843,5
A49,2015-09-03,下了公交车，就有好多卖香烛的，可见**香火是有多旺盛！里面的环境不错，拜神的人很多，据说在这里许愿很灵的哦大爱那里的格桑花！总之，还是很值得去的！,9.0,0.3815999925136566,"山, 爬山, 好多, 希望, 太, 美的, 钱, 水, 骑, 活动","['公交车', '好多', '卖', '香烛', '香火', '旺盛', '环境', '拜神', '许愿', '很灵', '爱', '格桑', '花', '值得']",设施,49,1.0,57844,2
A49,2017-02-11,夏天去有荷花节，不过比较晒。望海观音很雄伟,2.0,0.4131999909877777,"好玩, 开心, 太, 天气, 项目, 特别, 舒服, 夏天, 热, 风景","['夏天', '荷花', '节', '晒', '望海', '观音', '雄伟']",设施,49,1.0,57845,2
A49,2016-11-19,坐地铁四号线石基站然后打个滴滴可以到，进去里面门票要54块，是**的10倍，感觉有点贵了，很多人去那里是去拜观音祈福的，过年过节更是多人！,3.0,0.4449000060558319,"走, 高, 性价比, 免费, 太, 坐, 建议, 观音, 开车, 感觉","['坐地铁', '四号线', '石', '基站', '滴滴', '要块', '倍', '感觉', '贵', '拜', '观音', '祈福', '过年', '过节', '更是']",性价比,49,-1.0,57846,1
A49,2016-02-29,过年期间特意过去祈福的，由于是坐船过去，颇有一番风味，就是景区虽大，但娱乐性不多，风景也一般，没有大惊喜。四个女生走了一天，很累！希望我们都能梦想成真,6.0,0.453900009393692,"上山, 广东, 导游, 山顶, 时, 走, 到达, 两个, 下午, 坐","['过年', '期间', '特意', '祈福', '坐船', '风味', '娱乐性', '风景', '惊喜', '四个', '女生', '走', '累', '希望', '梦想成真']",服务,49,2.0,57847,4
A49,2017-02-05,大石楼的标志性旅游景点啊，建议大家去啊,3.0,0.388700008392334,"走, 高, 性价比, 免费, 太, 坐, 建议, 观音, 开车, 感觉","['大石', '楼', '标志性', '旅游景点', '建议']",性价比,49,1.5,57848,3
A49,2016-03-04,新年新希望！去**拜观音祈求2016年捞乜都畹啵〖胰松硖褰】担⌒南胧鲁桑∈率滤忱！！孩子们聪明伶俐、快高长大！一年胜过一年！开心还是开心,6.0,0.2184000015258789,"上山, 广东, 导游, 山顶, 时, 走, 到达, 两个, 下午, 坐","['新年新', '希望', '拜', '观音', '祈求', '年', '捞', '乜都', '', '掂', '家人', '身体健康', '心想事成', '事事', '顺利', '聪明伶俐', '高', '长大', '一年', '胜过', '一年', '开心', '开心']",服务,49,6.0,57849,5
A49,2015-11-17,门票有点贵！不过风景很好！人特别的多！……,7.0,0.7692000269889832,"环境, 贵, 很好, 没什么, 吃, 东西, 太, 差, 感觉, 风景","['贵', '风景', '特别']",性价比,49,1.0,57850,2
A49,2017-01-23,**，广东省广州市番禺区珠江三角洲珠江口狮子洋畔山脉，是狮子洋西岸的制高点,12.0,0.3463000059127807,"动物, 爬, 岛, 沙滩, 天然, 氧吧, 表演, 广州, 动物园, 种类","['广东省', '广州市', '番禺区', '珠江三角洲', '珠江口', '狮子', '洋畔', '山脉', '狮子', '洋', '西岸', '制高点']",设施,49,1.5,57851,3
A49,2016-04-04,值得一去，观音像傲立江滨，香火旺盛相当震撼，采石场遗址怪石嶙峋。不过商业化比较严重,1.0,0.7092000246047974,"风景, 表演, 值得, 一般般, 位于, 晚上, 好看, 建筑, 美丽, 大自然","['值得', '观音像', '傲立', '江滨', '香火', '旺盛', '震撼', '采石场', '遗址', '怪石嶙峋', '商业化', '比较严重']",服务,49,1.0,57852,2
A49,2016-04-28,特意跟老公一起休假来玩，坐了两个钟车过来，结果让人感觉挺失望的，没什么特色,6.0,0.3851000070571899,"上山, 广东, 导游, 山顶, 时, 走, 到达, 两个, 下午, 坐","['特意', '老公', '休假', '坐', '两个', '钟车', '感觉', '失望', '没什么', '特色']",服务,49,0.0,57853,1
A49,2016-01-31,离广州市区不近，但交通还算方便。这个地方在珠江口边，因此山上视野很好。观音像很神奇，也很灵验，因此香火很盛。早起看海上的日出不错，里面的度假山庄环境很好，周末的时候去住住挺好的。,0.0,0.2967000007629394,"值得, 适合, 环境, 干净, 休闲, 公园, 空气清新, 瀑布, 水, 很漂亮","['广州市区', '交通', '算', '珠江口', '山上', '视野', '观音像', '神奇', '灵验', '香火很盛', '早起', '海上', '日出', '度假', '山庄', '环境', '周末', '住', '住']",卫生,49,1.5,57854,3
A49,2016-12-07,挺好的地方，玩的很开心，喜欢,10.0,0.692300021648407,"喜欢, 下次, 漂亮, 朋友, 值得, 去过, 机会, 字, 开心, 风景优美","['开心', '喜欢']",位置,49,2.0,57855,4
A49,2016-08-01,还不错，风景很美，只是去的时候下雨，没怎么游玩，天气太热，去拜了下就回来了，门口售票处的态度不是很好，希望有待改进就好。,2.0,0.3034000098705292,"好玩, 开心, 太, 天气, 项目, 特别, 舒服, 夏天, 热, 风景","['风景', '美', '下雨', '天气', '太', '热', '拜', '回来', '门口', '售票处', '态度', '希望', '有待', '改进']",设施,49,2.0,57856,4
A49,2015-10-22,听朋友说**风景好，环境好，周末一家自驾游去,7.0,0.4036999940872192,"环境, 贵, 很好, 没什么, 吃, 东西, 太, 差, 感觉, 风景","['听', '朋友', '风景', '环境', '周末', '一家', '自驾游']",性价比,49,1.5,57857,3
A49,2016-12-26,广州人喜欢到**拜观音祈福，香火很旺。,3.0,0.4693000018596649,"走, 高, 性价比, 免费, 太, 坐, 建议, 观音, 开车, 感觉","['广州', '喜欢', '拜', '观音', '祈福', '香火', '旺']",性价比,49,1.0,57858,2
A49,2016-12-31,广州**在番禺，有山有水有观音，高处远望江海一览无遗。,0.0,0.3265999853610992,"值得, 适合, 环境, 干净, 休闲, 公园, 空气清新, 瀑布, 水, 很漂亮","['广州', '番禺', '有山有水', '观音', '高处', '远望', '江海', '一览无遗']",卫生,49,1.0,57859,2
A49,2016-11-30,旅行区风景还可以把，主要过来看一尊大佛的，面积很大，交通还算方便，最好自驾车过来的,0.0,0.3467999994754791,"值得, 适合, 环境, 干净, 休闲, 公园, 空气清新, 瀑布, 水, 很漂亮","['旅行', '区', '风景', '一尊', '大佛', '面积', '很大', '交通', '算', '自驾车']",卫生,49,1.5,57860,3
A49,2016-11-25,请问莲花的花期是什么时候，什么时候去最美,11.0,0.5396000146865845,"景色, 美, 感觉, 山上, 值得, 中, 优美, 拍, 交通, 少","['请问', '莲花', '花期', '最美']",位置,49,1.5,57861,3
