A08,2017-12-02,如果住在附近的老人家里要带小孩的话，这个地方挺不错，没有普通公园那么杂乱，办年卡是个不错的选择 ，对于我这种太老远跑过来的童鞋们就去一二次就差不多了，因为好多动物就知道睡觉(),6.0,0.3244999945163727,"上山, 广东, 导游, 山顶, 时, 走, 到达, 两个, 下午, 坐","['住', '老人家', '挺不错', '公园', '杂乱', '办', '年', '卡', '选择', '太', '老远', '跑过来', '童鞋', '一二次', '好多', '动物', '睡觉']",服务,8,-1.0,27265,1
A08,2020-10-14,在园内的时间有点赶，真要把所有东西都逛完还是太赶了；带着小孩子逛的话还是早上开门就进去、才能慢慢逛，不然的话，就看表演就够呛！这是第三次去了,7.0,0.4386000037193298,"环境, 贵, 很好, 没什么, 吃, 东西, 太, 差, 感觉, 风景","['园内', '真要', '东西', '逛', '太', '逛', '早上', '开门', '慢慢', '逛', '表演', '够呛', '第三次']",性价比,8,-1.0,27266,1
A08,2020-10-13,带着孩子一起去看看，不错，孩子玩的很开心，演出活动现场观众很多。带着孩子一起去看看，不错，孩子玩的很开心，演出活动现场观众很多。,1.0,0.3761000037193298,"风景, 表演, 值得, 一般般, 位于, 晚上, 好看, 建筑, 美丽, 大自然","['开心', '演出', '活动', '现场', '观众', '开心', '演出', '活动', '现场', '观众']",服务,8,2.0,27267,5
A08,2020-01-28,节假日、周末人都太多，优惠门票人挤人，还是错峰出行吧。,2.0,0.5960000157356262,"好玩, 开心, 太, 天气, 项目, 特别, 舒服, 夏天, 热, 风景","['节假日', '周末', '太', '优惠', '挤', '错峰', '出行']",设施,8,1.0,27268,3
A08,2020-04-02,很不错！动物比较齐全，从早上10点玩到下午6点才出园！就是门票在便宜点就好咯。,6.0,0.3185999989509582,"上山, 广东, 导游, 山顶, 时, 走, 到达, 两个, 下午, 坐","['动物', '齐全', '早上', '点玩', '下午', '园', '便宜', '咯']",服务,8,1.0,27269,3
A08,2020-01-18,很不错呢……小朋友都很喜欢！好,10.0,0.5385000109672546,"喜欢, 下次, 漂亮, 朋友, 值得, 去过, 机会, 字, 开心, 风景优美",['喜欢'],位置,8,1.0,27270,3
A08,2020-01-18,好玩！很适合亲子一家人，很好,0.0,0.5109999775886536,"值得, 适合, 环境, 干净, 休闲, 公园, 空气清新, 瀑布, 水, 很漂亮","['好玩', '适合', '亲子']",卫生,8,1.0,27271,3
A08,2020-01-18,很适合亲子活动。动物也多，停车也很方便,5.0,0.2736000120639801,"温泉, 服务, 服务态度, 满意, 泡温泉, 热情, 家人, 工作人员, 方便快捷, 态度","['适合', '亲子活动', '动物', '停车']",服务,8,1.0,27272,3
A08,2020-01-27,孩子玩的很开心，孩子玩的开心啊,2.0,0.692300021648407,"好玩, 开心, 太, 天气, 项目, 特别, 舒服, 夏天, 热, 风景","['开心', '开心']",设施,8,2.0,27273,5
A08,2020-01-17,很多小孩子，适合带小孩玩，但是动物有点少，半天就看完了,0.0,0.3576000034809112,"值得, 适合, 环境, 干净, 休闲, 公园, 空气清新, 瀑布, 水, 很漂亮","['适合', '动物', '少', '半天']",卫生,8,1.0,27274,3
A08,2020-10-11,表演精彩，有马术，肯尼亚舞蹈，摩托车特技，华家班汽车特技表演，现场感受不一样的激情，物有所值，动物有老虎羊驼鸟类等，性价比很高，值得推荐！,12.0,0.4471000134944916,"动物, 爬, 岛, 沙滩, 天然, 氧吧, 表演, 广州, 动物园, 种类","['表演', '精彩', '马术', '肯尼亚', '舞蹈', '摩托车', '特技', '华家班', '汽车', '特技表演', '现场', '感受', '激情', '物有所值', '动物', '老虎', '羊驼', '鸟类', '性价比', '高', '值得', '推荐']",设施,8,2.0,27275,5
A08,2020-01-25,习惯性好评…………………………………………,5.0,0.5385000109672546,"温泉, 服务, 服务态度, 满意, 泡温泉, 热情, 家人, 工作人员, 方便快捷, 态度","['习惯性', '好评']",服务,8,1.0,27276,3
A08,2020-01-16,里面很多动物，值得一看,12.0,0.3815000057220459,"动物, 爬, 岛, 沙滩, 天然, 氧吧, 表演, 广州, 动物园, 种类","['动物', '值得一看']",设施,8,1.0,27277,3
A08,2020-01-15,适合带老人跟小孩来玩 还不错吧,0.0,0.5385000109672546,"值得, 适合, 环境, 干净, 休闲, 公园, 空气清新, 瀑布, 水, 很漂亮",['适合'],卫生,8,1.0,27278,3
A08,2020-01-15,还可以不错的一次旅游物美价廉啊,11.0,0.5382999777793884,"景色, 美, 感觉, 山上, 值得, 中, 优美, 拍, 交通, 少",['物美价廉'],位置,8,1.0,27279,3
A08,2020-01-14,每年至少去一次，小孩子再里面各种喂，很好,6.0,0.5383999943733215,"上山, 广东, 导游, 山顶, 时, 走, 到达, 两个, 下午, 坐",['至少'],服务,8,1.0,27280,3
A08,2020-01-14,来客人，带孩子来玩。孩子很喜欢。,10.0,0.3589999973773956,"喜欢, 下次, 漂亮, 朋友, 值得, 去过, 机会, 字, 开心, 风景优美","['客人', '喜欢']",位置,8,1.0,27281,3
A08,2020-01-23,大人不适合去，小孩就可以。。。,0.0,0.3842000067234039,"值得, 适合, 环境, 干净, 休闲, 公园, 空气清新, 瀑布, 水, 很漂亮","['大人', '适合']",卫生,8,1.0,27282,3
A08,2020-01-14,大型猛兽动物都有，线路规划也比较好，但是喂养太贵了，一点点树叶，一点点麦子，都要20块，,3.0,0.5117999911308289,"走, 高, 性价比, 免费, 太, 坐, 建议, 观音, 开车, 感觉","['大型', '猛兽', '动物', '线路', '规划', '喂养', '太贵', '一点点', '树叶', '一点点', '麦子', '块']",性价比,8,-2.0,27283,1
A08,2020-05-05,**景区值得一去：锦鲤、白天鹅、黑天鹅是动物园里最自由自在的生物，看到它们会很放松快乐！相比之下其他动物都显得很没活力，希望大家一起多多去游园，让动物园有更多的经费不断改善小动物们的生活环境。亲子套票不包含马戏表演很遗憾，建议在购票时提示注明,12.0,0.2912000119686126,"动物, 爬, 岛, 沙滩, 天然, 氧吧, 表演, 广州, 动物园, 种类","['值得', '锦鲤', '白天鹅', '黑天鹅', '动物园', '自由自在', '生物', '放松', '快乐', '相比之下', '动物', '显得', '活力', '希望', '游园', '动物园', '经费', '改善', '动物', '生活', '环境', '亲子', '套票', '包含', '马戏表演', '遗憾', '建议', '购票', '时', '提示', '注明']",设施,8,5.0,27284,5
A08,2020-01-13,一开始没什么动物可看。。走了很久。。里面很大。。,6.0,0.3023000061511993,"上山, 广东, 导游, 山顶, 时, 走, 到达, 两个, 下午, 坐","['没什么', '动物', '走', '很久', '很大']",服务,8,1.0,27285,3
A08,2020-07-01,好玩，适合带小朋友去，能认识不少动物,2.0,0.2928000092506408,"好玩, 开心, 太, 天气, 项目, 特别, 舒服, 夏天, 热, 风景","['好玩', '适合', '动物']",设施,8,1.0,27286,3
A08,2020-07-01,不错，就是动物少点，人比较多！,12.0,0.692300021648407,"动物, 爬, 岛, 沙滩, 天然, 氧吧, 表演, 广州, 动物园, 种类","['动物', '少']",设施,8,1.0,27287,3
A08,2020-10-27,如果专程去看动物的话，不要去，晚上什么也看不见，而且能看得动物很少很少，全部是游乐场，还有一场表演，而且专程去玩游乐场还真的很不值，游乐场单项目还是另外收钱的，总体很遗憾,1.0,0.3203000128269195,"风景, 表演, 值得, 一般般, 位于, 晚上, 好看, 建筑, 美丽, 大自然","['专程去', '动物', '晚上', '看不见', '动物', '游乐场', '一场', '表演', '专程去', '游乐场', '真的', '不值', '游乐场', '项目', '收钱', '总体', '遗憾']",服务,8,-3.0,27288,1
A08,2020-07-01,很不错 值得去 值得推荐，带宝宝去,0.0,0.5331000089645386,"值得, 适合, 环境, 干净, 休闲, 公园, 空气清新, 瀑布, 水, 很漂亮","['值得', '值得', '推荐', '宝宝']",卫生,8,3.0,27289,5
A08,2020-10-24,自己带好吃的，足够的水，带小孩的要带推车。喂动物的胡萝卜，水果可以自备一些。总体感觉一般。自己带好吃的，足够的水，带小孩的要带推车。喂动物的胡萝卜，水果可以自备一些。总体感觉一般。,12.0,0.304500013589859,"动物, 爬, 岛, 沙滩, 天然, 氧吧, 表演, 广州, 动物园, 种类","['好吃', '足够', '水', '要带', '推车', '动物', '胡萝卜', '水果', '自备', '总体', '感觉', '好吃', '足够', '水', '要带', '推车', '动物', '胡萝卜', '水果', '自备', '总体', '感觉']",设施,8,4.0,27290,5
A08,2020-01-09,很好 很好 小朋友非常非常喜欢,7.0,0.5206999778747559,"环境, 贵, 很好, 没什么, 吃, 东西, 太, 差, 感觉, 风景","['很好', '很好', '喜欢']",性价比,8,1.0,27291,3
A08,2020-01-09,很好 小朋友很喜欢 还是会再去的,10.0,0.5385000109672546,"喜欢, 下次, 漂亮, 朋友, 值得, 去过, 机会, 字, 开心, 风景优美",['喜欢'],位置,8,1.0,27292,3
A08,2020-01-10,去过很多次了，带小孩过去很不错,10.0,0.5385000109672546,"喜欢, 下次, 漂亮, 朋友, 值得, 去过, 机会, 字, 开心, 风景优美",['去过'],位置,8,1.0,27293,3
A08,2020-01-18,动物离太远，效果不好！！！！！！,3.0,0.6965000033378601,"走, 高, 性价比, 免费, 太, 坐, 建议, 观音, 开车, 感觉","['动物', '太', '远', '效果', '不好']",性价比,8,-1.0,27294,1
A08,2020-01-08,很好玩！当时去的晚，最重要的是看到了当时的赛车表现！超级帅！,2.0,0.3483999967575073,"好玩, 开心, 太, 天气, 项目, 特别, 舒服, 夏天, 热, 风景","['好玩', '晚', '赛车', '表现', '超级', '帅']",设施,8,1.0,27295,3
A08,2020-01-08,票价优惠后来玩的人挤爆了动物园，尽量早点入园能够避开高峰。,4.0,0.4507000148296356,"便宜, 价格, 优惠, 网上, 现场, 不用, 实惠, 排队, 购票, 订","['票价', '优惠', '挤爆', '动物园', '早点', '入园', '避开', '高峰']",性价比,8,-1.0,27296,1
A08,2020-01-08,带小朋友去的，开开视野，动物不是很活跃,12.0,0.5187000036239624,"动物, 爬, 岛, 沙滩, 天然, 氧吧, 表演, 广州, 动物园, 种类","['开开', '视野', '动物', '活跃']",设施,8,1.0,27297,3
A08,2020-01-08,动物品类多，空气清新（偶尔会有动物翔味儿）。,12.0,0.5127000212669373,"动物, 爬, 岛, 沙滩, 天然, 氧吧, 表演, 广州, 动物园, 种类","['动物', '品类', '空气清新', '动物', '翔', '味儿']",设施,8,1.0,27298,3
A08,2020-01-05,网上预订的进门要带身份证，园内很好玩，一天的时间都不能全部看完动物，要抓紧时间看,4.0,0.3458000123500824,"便宜, 价格, 优惠, 网上, 现场, 不用, 实惠, 排队, 购票, 订","['网上', '预订', '进门', '身份证', '园内', '好玩', '动物', '抓紧时间']",性价比,8,1.0,27299,3
A08,2020-06-11,可观赏价值一般，门票有点贵，一般,7.0,0.5385000109672546,"环境, 贵, 很好, 没什么, 吃, 东西, 太, 差, 感觉, 风景","['观赏价值', '贵']",性价比,8,1.0,27300,3
A08,2020-01-05,带小朋友去的，看了表演，总之推荐一下吧,1.0,0.692300021648407,"风景, 表演, 值得, 一般般, 位于, 晚上, 好看, 建筑, 美丽, 大自然","['表演', '推荐']",服务,8,1.0,27301,3
A08,2020-06-12,里面一般，什么附加的都要钱，不划算，表演稍微还好看点，动物也没什么，不建议去，亲子体验强点，建议坐车，毕竟比较大走路会很累，因为车是全天有效的，可以随意上下，还比较方便。,3.0,0.4063999950885772,"走, 高, 性价比, 免费, 太, 坐, 建议, 观音, 开车, 感觉","['附加', '要钱', '不划算', '表演', '稍微', '好看', '动物', '没什么', '建议', '亲子', '体验', '强', '建议', '坐车', '走路', '累', '车', '全天', '随意']",性价比,8,1.0,27302,3
A08,2020-01-05,老虎养的很好，各种动物也营养不错，种类很多，有很多动物可以近距离接触，很棒！小宝宝特别喜欢！,12.0,0.7627999782562256,"动物, 爬, 岛, 沙滩, 天然, 氧吧, 表演, 广州, 动物园, 种类","['老虎', '养', '很好', '动物', '营养', '种类', '动物', '近距离', '接触', '很棒', '小宝宝', '特别', '喜欢']",设施,8,4.0,27303,5
A08,2020-06-24,不错，地方大，可以玩一整天,0.0,0.5383999943733215,"值得, 适合, 环境, 干净, 休闲, 公园, 空气清新, 瀑布, 水, 很漂亮",['一整天'],卫生,8,1.0,27304,3
A08,2020-01-04,还可以，可惜去晚了，海洋天地都没来得及玩,6.0,0.2375999987125396,"上山, 广东, 导游, 山顶, 时, 走, 到达, 两个, 下午, 坐","['可惜', '去晚', '海洋', '天地']",服务,8,-1.0,27305,1
A08,2020-08-20,海洋天地没有，2大2小680块，里面基本有的玩的或者其他全都另外收费，,3.0,0.3420000076293945,"走, 高, 性价比, 免费, 太, 坐, 建议, 观音, 开车, 感觉","['海洋', '天地', '大小', '块', '收费']",性价比,8,1.0,27306,3
A08,2020-01-04,还好，人太多，环境一般，入园很方便,7.0,0.6129999756813049,"环境, 贵, 很好, 没什么, 吃, 东西, 太, 差, 感觉, 风景","['还好', '太', '环境', '入园']",性价比,8,1.0,27307,3
A08,2020-01-02,很很很很很很很很很很好好好好玩,3.0,0.3589999973773956,"走, 高, 性价比, 免费, 太, 坐, 建议, 观音, 开车, 感觉","['好好', '好玩']",性价比,8,1.0,27308,3
A08,2020-01-01,多次去，小孩玩的很开心，,2.0,0.5385000109672546,"好玩, 开心, 太, 天气, 项目, 特别, 舒服, 夏天, 热, 风景",['开心'],设施,8,1.0,27309,3
A08,2020-01-02,孩子喜欢！挺好！一般平时过去比较实惠！,4.0,0.5192000269889832,"便宜, 价格, 优惠, 网上, 现场, 不用, 实惠, 排队, 购票, 订","['喜欢', '平时', '实惠']",性价比,8,1.0,27310,3
A08,2020-01-03,不错值得购买，套票还有娱乐项目,4.0,0.3625000119209289,"便宜, 价格, 优惠, 网上, 现场, 不用, 实惠, 排队, 购票, 订","['值得', '购买', '套票', '娱乐', '项目']",性价比,8,2.0,27311,5
A08,2020-01-03,人太多了，景点物价太高了，动物不错,3.0,0.7049000263214111,"走, 高, 性价比, 免费, 太, 坐, 建议, 观音, 开车, 感觉","['太', '物价', '太', '高', '动物']",性价比,8,1.0,27312,3
A08,2020-01-01,动物园不是很大，总的来说还行吧,12.0,0.5153999924659729,"动物, 爬, 岛, 沙滩, 天然, 氧吧, 表演, 广州, 动物园, 种类","['动物园', '很大', '还行']",设施,8,1.0,27313,3
A08,2020-12-31,挺好的。人不是很多。满意。下次可以再去,5.0,0.3643999993801117,"温泉, 服务, 服务态度, 满意, 泡温泉, 热情, 家人, 工作人员, 方便快捷, 态度","['满意', '下次']",服务,8,1.0,27314,3
A08,2020-12-31,还不错，带娃去，娃很喜欢，值得去看,9.0,0.4370000064373016,"山, 爬山, 好多, 希望, 太, 美的, 钱, 水, 骑, 活动","['娃', '娃', '喜欢', '值得']",设施,8,2.0,27315,5
A08,2020-12-31,飞车表演惊险刺激;真的很好;总体感觉很不错.，，，,1.0,0.8680999875068665,"风景, 表演, 值得, 一般般, 位于, 晚上, 好看, 建筑, 美丽, 大自然","['飞车', '表演', '惊险刺激', '真的', '总体', '感觉']",服务,8,1.0,27316,3
A08,2020-12-30,价格非常实惠，比到现场购票都便宜,4.0,0.8461999893188477,"便宜, 价格, 优惠, 网上, 现场, 不用, 实惠, 排队, 购票, 订","['价格', '实惠', '现场', '购票', '便宜']",性价比,8,1.0,27317,3
A08,2020-12-30,很好玩，动物很多，票价也还行，值得一去,12.0,0.301499992609024,"动物, 爬, 岛, 沙滩, 天然, 氧吧, 表演, 广州, 动物园, 种类","['好玩', '动物', '票价', '还行', '值得']",设施,8,1.0,27318,3
A08,2020-05-01,今天算是啥东物都看到了，真的很好玩，有孩子的更要带来看看,12.0,0.5271000266075134,"动物, 爬, 岛, 沙滩, 天然, 氧吧, 表演, 广州, 动物园, 种类","['算是', '东物', '真的', '好玩', '带来']",设施,8,1.0,27319,3
A08,2020-12-30,路线安排不错  不走回头路  节目时间也不冲突,3.0,0.3564000129699707,"走, 高, 性价比, 免费, 太, 坐, 建议, 观音, 开车, 感觉","['路线', '安排', '走回头路', '节目', '冲突']",性价比,8,-1.0,27320,1
A08,2020-12-30,去过多次，每次都有新发现，很好,10.0,0.8154000043869019,"喜欢, 下次, 漂亮, 朋友, 值得, 去过, 机会, 字, 开心, 风景优美","['去过', '每次', '新', '发现']",位置,8,1.0,27321,3
A08,2020-06-18,整体不错，挺大的，要想逛完需要一天时间吧，在网上预订和售票处价格基本一样。,6.0,0.4210000038146972,"上山, 广东, 导游, 山顶, 时, 走, 到达, 两个, 下午, 坐","['整体', '挺大', '想', '逛', '网上', '预订', '售票处', '价格']",服务,8,1.0,27322,3
A08,2020-06-18,带老婆孩子去的，还可以，很多动物,7.0,0.3610000014305115,"环境, 贵, 很好, 没什么, 吃, 东西, 太, 差, 感觉, 风景","['老婆', '动物']",性价比,8,1.0,27323,3
A08,2020-01-08,毕竟是夜场票，很多地方不能去。,9.0,0.5383999943733215,"山, 爬山, 好多, 希望, 太, 美的, 钱, 水, 骑, 活动",['夜场'],设施,8,1.0,27324,3
A08,2020-04-30,很适合亲子互动，家庭出游，海洋节目不错野兽谷里的老虎很凶猛，熊猫很可爱，鳄鱼发呆.孔雀开屏很漂亮，长耳狐特别喜欢，很值得去,0.0,0.3961000144481659,"值得, 适合, 环境, 干净, 休闲, 公园, 空气清新, 瀑布, 水, 很漂亮","['适合', '亲子', '互动', '家庭', '出游', '海洋', '节目', '野兽', '谷', '老虎', '凶猛', '熊猫', '可爱', '鳄鱼', '发呆', '孔雀开屏', '很漂亮', '长耳狐', '特别', '喜欢', '值得']",卫生,8,3.0,27325,5
A08,2020-12-29,很好，之前好像有更低的，遗憾没赶上,3.0,0.4302000105381012,"走, 高, 性价比, 免费, 太, 坐, 建议, 观音, 开车, 感觉","['好像', '低', '遗憾', '赶上']",性价比,8,-1.0,27326,1
A08,2020-12-28,挺好玩的，小孩子玩的很开心！！,2.0,0.692300021648407,"好玩, 开心, 太, 天气, 项目, 特别, 舒服, 夏天, 热, 风景","['挺好玩', '开心']",设施,8,1.0,27327,3
A08,2020-12-28,很好，景美。那天天气好，人很多，还有节目表演,2.0,0.4162999987602234,"好玩, 开心, 太, 天气, 项目, 特别, 舒服, 夏天, 热, 风景","['景美', '那天', '天气', '节目', '表演']",设施,8,1.0,27328,3
A08,2020-12-27,带孩子去玩还不错，大人就没什么好玩的。,2.0,0.5110999941825867,"好玩, 开心, 太, 天气, 项目, 特别, 舒服, 夏天, 热, 风景","['大人', '没什么', '好玩']",设施,8,1.0,27329,3
A08,2020-12-27,带孩子去玩，孩子很喜欢。可以陪孩子去玩,10.0,0.692300021648407,"喜欢, 下次, 漂亮, 朋友, 值得, 去过, 机会, 字, 开心, 风景优美","['喜欢', '陪']",位置,8,1.0,27330,3
A08,2020-12-27,好！不错！！很多次了！！！很喜欢的一次！！！！,10.0,0.5385000109672546,"喜欢, 下次, 漂亮, 朋友, 值得, 去过, 机会, 字, 开心, 风景优美",['喜欢'],位置,8,1.0,27331,3
A08,2020-12-27,赶上圣诞，票很便宜，所以人很多。但是总体很不错。小朋友很开心！,6.0,0.3862999975681305,"上山, 广东, 导游, 山顶, 时, 走, 到达, 两个, 下午, 坐","['赶上', '圣诞', '便宜', '总体', '开心']",服务,8,2.0,27332,5
A08,2020-08-03,还OK，路程有点远，不过有马车可以坐,3.0,0.5182999968528748,"走, 高, 性价比, 免费, 太, 坐, 建议, 观音, 开车, 感觉","['路程', '远', '马车', '坐']",性价比,8,1.0,27333,3
A08,2020-12-26,下雨了但还行吧，还看到孔雀溜出来跑到别的走地禽那里玩,3.0,0.3492000102996826,"走, 高, 性价比, 免费, 太, 坐, 建议, 观音, 开车, 感觉","['下雨', '还行', '孔雀', '溜出来', '跑', '走', '地禽']",性价比,8,1.0,27334,3
A08,2020-12-25,人山人海，不过玩得开心，不错！,9.0,0.3609000146389007,"山, 爬山, 好多, 希望, 太, 美的, 钱, 水, 骑, 活动","['人山人海', '开心']",设施,8,1.0,27335,3
A08,2020-12-26,不错，就是人太多，一分钱一分货,2.0,0.5385000109672546,"好玩, 开心, 太, 天气, 项目, 特别, 舒服, 夏天, 热, 风景","['太', '一分钱', '一分货']",设施,8,1.0,27336,3
A08,2020-12-26,很好的体验，绝佳的摄影好地方呢,9.0,0.3095000088214874,"山, 爬山, 好多, 希望, 太, 美的, 钱, 水, 骑, 活动","['很好', '体验', '绝佳', '摄影']",设施,8,1.0,27337,3
A08,2020-12-26,周末去人超级多，尽量错峰出行，否则去动物园看最多的动物是 人……,2.0,0.4763000011444092,"好玩, 开心, 太, 天气, 项目, 特别, 舒服, 夏天, 热, 风景","['周末', '超级', '错峰', '出行', '动物园', '最多', '动物']",设施,8,1.0,27338,3
A08,2020-12-25,直接刷购票人的身份证入园，方便快捷。,4.0,0.6664000153541565,"便宜, 价格, 优惠, 网上, 现场, 不用, 实惠, 排队, 购票, 订","['刷', '购票', '身份证', '入园', '方便快捷']",性价比,8,1.0,27339,3
A08,2020-12-24,如果先了解完行走路线，可以看完所有演出。,6.0,0.3691999912261963,"上山, 广东, 导游, 山顶, 时, 走, 到达, 两个, 下午, 坐","['先', '行走路线', '演出']",服务,8,1.0,27340,3
A08,2020-11-06,最好不要夏天去，其他都挺好的，还可以看熊猫,3.0,0.2892999947071075,"走, 高, 性价比, 免费, 太, 坐, 建议, 观音, 开车, 感觉","['夏天', '挺好', '熊猫']",性价比,8,1.0,27341,3
A08,2020-12-24,很好，孩子玩的特别开心，明年暑假再去,2.0,0.8154000043869019,"好玩, 开心, 太, 天气, 项目, 特别, 舒服, 夏天, 热, 风景","['特别', '开心', '明年', '暑假']",设施,8,2.0,27342,5
A08,2020-12-24,春玫模就是餐厅东西太难吃又贵，其它还可以,7.0,0.8461999893188477,"环境, 贵, 很好, 没什么, 吃, 东西, 太, 差, 感觉, 风景","['', '餐厅', '东西', '太', '难吃', '贵']",性价比,8,-1.0,27343,1
A08,2020-12-23,今天算很愉快地旅游吧…适合小朋友玩需…,5.0,0.5303999781608582,"温泉, 服务, 服务态度, 满意, 泡温泉, 热情, 家人, 工作人员, 方便快捷, 态度","['算', '愉快', '适合', '玩需']",服务,8,2.0,27344,5
A08,2020-12-23,公园有很多各种各样的动物，上次和朋友一起出的，进园之前最好买好食物，里面一杯泡面都要15块钱。,0.0,0.3815000057220459,"值得, 适合, 环境, 干净, 休闲, 公园, 空气清新, 瀑布, 水, 很漂亮","['公园', '各种各样', '动物', '上次', '朋友', '进园', '买好', '食物', '一杯', '泡面', '块钱']",卫生,8,1.0,27345,3
A08,2020-12-23,很不错的动物园，下次有机会再来,10.0,0.5253999829292297,"喜欢, 下次, 漂亮, 朋友, 值得, 去过, 机会, 字, 开心, 风景优美","['动物园', '下次', '机会']",位置,8,1.0,27346,3
A08,2020-12-24,很好玩  下次还去  看到了从来没看到过的动物,2.0,0.3345000147819519,"好玩, 开心, 太, 天气, 项目, 特别, 舒服, 夏天, 热, 风景","['好玩', '下次', '动物']",设施,8,1.0,27347,3
A08,2020-12-23,小孩子非常喜欢，感觉里面有味道,10.0,0.4979000091552734,"喜欢, 下次, 漂亮, 朋友, 值得, 去过, 机会, 字, 开心, 风景优美","['喜欢', '感觉', '味道']",位置,8,1.0,27348,3
A08,2020-12-23,好好一般一般好好一般一般好一般,3.0,0.692300021648407,"走, 高, 性价比, 免费, 太, 坐, 建议, 观音, 开车, 感觉","['好好', '好好']",性价比,8,1.0,27349,3
A08,2020-04-23,比四年前新修了栈道，有更多的散养的老虎、狮子等，不少小朋友、小学生春游，马戏团表演不错,3.0,0.3718000054359436,"走, 高, 性价比, 免费, 太, 坐, 建议, 观音, 开车, 感觉","['四年', '前', '新', '修', '栈道', '散养', '老虎', '狮子', '小学生', '春游', '马戏团', '表演']",性价比,8,1.0,27350,3
A08,2020-12-22,人比动物多，商业氛围太隆，服务还可以。,8.0,0.2164999991655349,"空气, 设施, 可惜, 完善, 还行, 游乐, 有意思, 老板, 负离子, 商业","['人比', '动物', '商业', '氛围', '太隆', '服务']",设施,8,1.0,27351,3
A08,2020-07-29,还不错，小朋友很开心，下次要再一次全天游玩。,10.0,0.51910001039505,"喜欢, 下次, 漂亮, 朋友, 值得, 去过, 机会, 字, 开心, 风景优美","['开心', '下次', '全天']",位置,8,1.0,27352,3
A08,2020-12-20,小孩玩的开心，里面动物挺多的，适合带小孩一起去玩。。,2.0,0.2834999859333038,"好玩, 开心, 太, 天气, 项目, 特别, 舒服, 夏天, 热, 风景","['开心', '动物', '适合']",设施,8,2.0,27353,5
A08,2020-12-18,还不错，可以带小朋友过去涨涨知识。。。。。,12.0,0.5385000109672546,"动物, 爬, 岛, 沙滩, 天然, 氧吧, 表演, 广州, 动物园, 种类","['涨涨', '知识']",设施,8,1.0,27354,3
A08,2020-12-20,挺好的，就去太累了呵呵呵额,2.0,0.692300021648407,"好玩, 开心, 太, 天气, 项目, 特别, 舒服, 夏天, 热, 风景","['太', '累', '呵额']",设施,8,1.0,27355,3
A08,2020-06-06,非常好 我带孩子外地来的 第一站就是这里 感受很不错 设施非常方便和人性化  有婴幼儿推车可以租到 只是这里的天气 跟北方太不一样啦 建议带上晴雨伞 防晒用品 带孩子尽量带点吃的 因为园区比较大 转完要多半天,3.0,0.457500010728836,"走, 高, 性价比, 免费, 太, 坐, 建议, 观音, 开车, 感觉","['外地', '第一站', '感受', '设施', '人性化', '婴幼儿', '推车', '租到', '天气', '北方', '太', '建议', '带上', '晴雨伞', '防晒', '用品', '吃', '园区', '转完', '多半天']",性价比,8,1.0,27356,3
