A08,2020-04-20,不是很好玩，玩了一次就不想再去了,2.0,0.692300021648407,"好玩, 开心, 太, 天气, 项目, 特别, 舒服, 夏天, 热, 风景","['好玩', '不想']",设施,8,1.0,27987,3
A08,2017-05-07,主要是活动价好便宜，动物没什么看的，除了狮子和一些小动物，其他的都看不了，摩托车特技表演还不错，就是人好多啊……,12.0,0.5169000029563904,"动物, 爬, 岛, 沙滩, 天然, 氧吧, 表演, 广州, 动物园, 种类","['活动', '价', '便宜', '动物', '没什么', '狮子', '动物', '摩托车', '特技表演', '好多']",设施,8,1.0,27988,3
A08,2020-02-21,挺好的 不过里面不是很大,0.0,0.5385000109672546,"值得, 适合, 环境, 干净, 休闲, 公园, 空气清新, 瀑布, 水, 很漂亮",['很大'],卫生,8,1.0,27989,3
A08,2020-04-07,对于小孩子都玩的很开心，景区不错就是动物的味道很重，感觉不值得这么多的门票、有点小贵,0.0,0.2424000054597854,"值得, 适合, 环境, 干净, 休闲, 公园, 空气清新, 瀑布, 水, 很漂亮","['开心', '动物', '味道', '重', '感觉', '值得', '小贵']",卫生,8,2.0,27990,5
A08,2020-04-07,**景区，我儿子说很好玩，有很多动物。,2.0,0.5192999839782715,"好玩, 开心, 太, 天气, 项目, 特别, 舒服, 夏天, 热, 风景","['儿子', '好玩', '动物']",设施,8,1.0,27991,3
A08,2020-04-16,总体来说，有点小贵，没有****景区好玩，不过小盆友玩的很开心。,2.0,0.6261000037193298,"好玩, 开心, 太, 天气, 项目, 特别, 舒服, 夏天, 热, 风景","['总体', '小贵', '好玩', '盆友', '开心']",设施,8,1.0,27992,3
A08,2016-05-02,带上爸爸妈妈一起去的，动物品种多，是个科普的好去处！,0.0,0.4945999979972839,"值得, 适合, 环境, 干净, 休闲, 公园, 空气清新, 瀑布, 水, 很漂亮","['带上', '爸爸妈妈', '动物', '品种', '科普', '好去处']",卫生,8,1.0,27993,3
A08,2017-07-13,带孩子们去的。看了老虎的表演和大舞台表演非常值的,1.0,0.4760000109672546,"风景, 表演, 值得, 一般般, 位于, 晚上, 好看, 建筑, 美丽, 大自然","['老虎', '表演', '舞台', '表演', '值']",服务,8,1.0,27994,3
A08,2020-04-06,带小孩还是值得来的，小孩很开心！,2.0,0.692300021648407,"好玩, 开心, 太, 天气, 项目, 特别, 舒服, 夏天, 热, 风景","['值得', '开心']",设施,8,2.0,27995,5
A08,2020-04-06,非常好玩，大并且有特色，就是搞活动，人实在太多了,9.0,0.3950999975204468,"山, 爬山, 好多, 希望, 太, 美的, 钱, 水, 骑, 活动","['好玩', '特色', '搞', '活动', '实在', '太']",设施,8,2.0,27996,5
A08,2020-04-06,动物挺多的，小孩子很喜欢。适合全家一起游玩。,0.0,0.432200014591217,"值得, 适合, 环境, 干净, 休闲, 公园, 空气清新, 瀑布, 水, 很漂亮","['动物', '喜欢', '适合', '全家']",卫生,8,2.0,27997,5
A08,2020-04-06,非常好玩，**景区真的非常大，但是搞特价人也是超级的多。,2.0,0.4151000082492828,"好玩, 开心, 太, 天气, 项目, 特别, 舒服, 夏天, 热, 风景","['好玩', '真的', '搞', '特价', '超级']",设施,8,1.0,27998,3
A08,2020-04-06,看到了喜欢的熊猫，火烈鸟，特别喜欢海洋王国的表演。,10.0,0.4754000008106231,"喜欢, 下次, 漂亮, 朋友, 值得, 去过, 机会, 字, 开心, 风景优美","['喜欢', '熊猫', '火烈鸟', '特别', '喜欢', '海洋', '王国', '表演']",位置,8,3.0,27999,5
A08,2020-04-01,非常好，动物很多，小孩玩的很开心,12.0,0.3698999881744385,"动物, 爬, 岛, 沙滩, 天然, 氧吧, 表演, 广州, 动物园, 种类","['动物', '开心']",设施,8,1.0,28000,3
A08,2020-04-02,很适合小孩子玩的，可以给小孩子长见识,12.0,0.3614000082015991,"动物, 爬, 岛, 沙滩, 天然, 氧吧, 表演, 广州, 动物园, 种类","['适合', '长见识']",设施,8,1.0,28001,3
A08,2020-04-02,很好玩，小孩很喜欢，环境也不错，就是有点臭,10.0,0.51910001039505,"喜欢, 下次, 漂亮, 朋友, 值得, 去过, 机会, 字, 开心, 风景优美","['好玩', '喜欢', '环境']",位置,8,1.0,28002,3
A08,2020-04-02,**景区，值得带小朋友去学习一下！,9.0,0.3794000148773193,"山, 爬山, 好多, 希望, 太, 美的, 钱, 水, 骑, 活动","['值得', '学习']",设施,8,2.0,28003,5
A08,2020-04-03,参加活动就去了，深圳动物园还是不错的，下次白天来,9.0,0.2425000071525573,"山, 爬山, 好多, 希望, 太, 美的, 钱, 水, 骑, 活动","['参加', '活动', '深圳', '动物园', '下次', '白天']",设施,8,1.0,28004,3
A08,2020-04-01,很大的一个动物园，逛上一天还蛮累的。但是能看到很多可爱的小动物，孩子可高兴了。,12.0,0.734000027179718,"动物, 爬, 岛, 沙滩, 天然, 氧吧, 表演, 广州, 动物园, 种类","['很大', '动物园', '逛', '蛮累', '可爱', '动物']",设施,8,1.0,28005,3
A08,2020-04-01,好玩，天夂芎茫很浪漫呢，_心,2.0,0.6154000163078308,"好玩, 开心, 太, 天气, 项目, 特别, 舒服, 夏天, 热, 风景","['好玩', '天', '浪漫', '_心']",设施,8,1.0,28006,3
A08,2020-04-01,很便宜，弟弟暑假来买给他玩一下的，平时我们买都很贵的，逛逛很不错，满意！,2.0,0.2786000072956085,"好玩, 开心, 太, 天气, 项目, 特别, 舒服, 夏天, 热, 风景","['便宜', '弟弟', '暑假', '平时', '很贵', '逛逛', '满意']",设施,8,2.0,28007,5
A08,2020-03-31,景区大，能逛一整天，比前几年改善了好多，现在也有共享宝宝推车,3.0,0.4065999984741211,"走, 高, 性价比, 免费, 太, 坐, 建议, 观音, 开车, 感觉","['逛', '一整天', '前', '几年', '改善', '好多', '共享', '宝宝', '推车']",性价比,8,1.0,28008,3
A08,2020-04-01,园区内很大，动物很多，是孩子们的乐园，值得一去。,0.0,0.654699981212616,"值得, 适合, 环境, 干净, 休闲, 公园, 空气清新, 瀑布, 水, 很漂亮","['园区', '很大', '动物', '乐园', '值得']",卫生,8,2.0,28009,5
A08,2020-03-31,很多景点晚上都不开放，没什么看的所以便宜吧,9.0,0.2700999975204468,"山, 爬山, 好多, 希望, 太, 美的, 钱, 水, 骑, 活动","['晚上', '开放', '没什么', '便宜']",设施,8,2.0,28010,5
A08,2020-03-30,可以玩一整天。。 。能够看得动物还是挺多的,12.0,0.6922000050544739,"动物, 爬, 岛, 沙滩, 天然, 氧吧, 表演, 广州, 动物园, 种类","['一整天', '动物']",设施,8,1.0,28011,3
A08,2017-11-05,到中午人太多，简直是看人头了，最好不要周末来，不过挺适合带孩子来玩的,0.0,0.2671999931335449,"值得, 适合, 环境, 干净, 休闲, 公园, 空气清新, 瀑布, 水, 很漂亮","['中午', '太', '人头', '周末', '适合']",卫生,8,1.0,28012,3
A08,2017-11-05,可以，适合大人带小孩去玩，,0.0,0.3840999901294708,"值得, 适合, 环境, 干净, 休闲, 公园, 空气清新, 瀑布, 水, 很漂亮","['适合', '大人']",卫生,8,1.0,28013,3
A08,2020-03-31,最喜欢**景区的猛兽区了，车开到猛兽区里面，老虎狮子爬在车上，还可以喂肉给它们，太刺激了。,3.0,0.4007999897003174,"走, 高, 性价比, 免费, 太, 坐, 建议, 观音, 开车, 感觉","['喜欢', '猛兽', '区', '车', '开到', '猛兽', '区', '老虎', '狮子', '爬', '车上', '肉', '太', '刺激']",性价比,8,0.0,28014,1
A08,2020-03-30,特别好的一次动物园之旅，孩子玩的很开心，动物很多，大人孩子都能增长见识,12.0,0.4163999855518341,"动物, 爬, 岛, 沙滩, 天然, 氧吧, 表演, 广州, 动物园, 种类","['特别', '动物园', '旅', '开心', '动物', '大人', '增长', '见识']",设施,8,2.0,28015,5
A08,2016-09-14,进园方便，刷二维码即可。服务好，本来周六去的，因为下雨没去，很快就全额退款了。动物园的水上乐园夜场票要带泳衣才免票，看起来不错，下回带泳衣去。铁骥无疆很刺激精彩，可惜女儿太小看了一会就要走，动物园嘛，其实真正看了的也就老虎了，哈哈，总之还不错吧，下回带小孩白天去,6.0,0.3345000147819519,"上山, 广东, 导游, 山顶, 时, 走, 到达, 两个, 下午, 坐","['进园', '刷', '二维码', '即可', '服务', '本来', '周六', '下雨', '很快', '全额', '退款', '动物园', '水上', '乐园', '夜场', '泳衣', '免票', '下回', '泳衣', '铁骥', '无疆', '刺激', '精彩', '可惜', '女儿', '太小', '一会', '走', '动物园', '老虎', '下回', '白天']",服务,8,-1.0,28016,1
A08,2020-04-16,门票太贵，门票太贵，门票太贵，合适价格60-120元,7.0,0.8461999893188477,"环境, 贵, 很好, 没什么, 吃, 东西, 太, 差, 感觉, 风景","['太贵', '太贵', '太贵', '合适', '价格']",性价比,8,1.0,28017,3
A08,2020-03-30,夜场去的，基本不能玩，运气好见到几只羊驼,12.0,0.3946000039577484,"动物, 爬, 岛, 沙滩, 天然, 氧吧, 表演, 广州, 动物园, 种类","['夜场', '运气', '见到', '几只羊', '驼']",设施,8,1.0,28018,3
A08,2017-01-04,"入园方便，建议早点到，园区内wifi覆盖广，导示图一目了然，食品价格合理，和朋友一家人去的，里面的小火车非常好，海洋天地的表演很精彩，猛兽谷也不错，狮虎兽是特色，动物园风景优美，孩子们流连忘返，汽车摩托车特技表演，真的高水平哦，<群虎群狮表演要收费10元,其他的表演不用，5d表演收3元眼镜的费用，游园缆车最好以进园就买，20元可以坐一天，保存好小票可以无数重复坐。**景区动物挺多，节目内容很丰富，真的很适合小朋友和老人。下次还会再去玩的！",3.0,0.2874000072479248,"走, 高, 性价比, 免费, 太, 坐, 建议, 观音, 开车, 感觉","['入园', '建议', '早点', '园区', '覆盖', '广', '导示', '图', '一目了然', '食品', '价格合理', '朋友', '火车', '海洋', '天地', '表演', '精彩', '猛兽', '谷', '狮虎兽', '特色', '动物园', '风景优美', '流连忘返', '汽车', '摩托车', '特技表演', '真的', '高水平', '群虎', '群狮', '表演', '收费', '表演', '不用', '表演', '收元', '眼镜', '费用', '游园', '缆车', '进园', '坐', '保存', '小票', '无数', '重复', '坐', '动物', '节目', '内容', '真的', '适合', '下次']",性价比,8,2.0,28019,5
A08,2020-01-29,进园方便，直接刷身份证三个人同时进。,4.0,0.5449000000953674,"便宜, 价格, 优惠, 网上, 现场, 不用, 实惠, 排队, 购票, 订","['进园', '刷', '身份证', '三个', '进']",性价比,8,1.0,28020,3
A08,2020-03-17,动物园不大，半天就可以看完，挺不错的。,12.0,0.296099990606308,"动物, 爬, 岛, 沙滩, 天然, 氧吧, 表演, 广州, 动物园, 种类","['动物园', '半天', '就可以看', '挺不错']",设施,8,1.0,28021,3
A08,2017-09-05,不知多少年没来过**景区了，没票价格是越来越贵，里面变化很大，多了很多动物，周末人山人海，天气太热都选择坐游览车，中途可以下车看动物，不限次数上下车，去看了好几种动物，买了红萝卜喂喂斑马，没有整个园逛完，天气实在太热，表演也忽视了，下次如果去选择天气凉爽的时候来会好很多。休息的地方很少。这样的价格的话我会选择****景区，树荫多不怕晒，坐的地方很多，比较人性化，深圳的**景区外来人比较多。,3.0,0.2390999943017959,"走, 高, 性价比, 免费, 太, 坐, 建议, 观音, 开车, 感觉","['不知', '年', '没来', '没票', '价格', '越来越', '贵', '变化很大', '动物', '周末', '人山人海', '天气', '太', '热', '选择', '坐', '游览车', '中途', '下车', '动物', '限', '次数', '上下车', '好几种', '动物', '红萝卜', '喂喂', '斑马', '园', '逛', '天气', '实在', '太', '热', '表演', '忽视', '下次', '选择', '天气', '凉爽', '休息', '价格', '我会', '选择', '树荫', '晒', '坐', '人性化', '深圳', '外来人']",性价比,8,1.0,28022,3
A08,2020-03-17,**景区里面的动物很多，是带小孩去认识动物的好地方。,12.0,0.692300021648407,"动物, 爬, 岛, 沙滩, 天然, 氧吧, 表演, 广州, 动物园, 种类","['动物', '动物']",设施,8,1.0,28023,3
A08,2020-04-04,比**差太远，服务也不好、景点吃饭的又贵又难吃，一点品质没有，小朋友玩的项目还要另外收费，差评。,7.0,0.6916000247001648,"环境, 贵, 很好, 没什么, 吃, 东西, 太, 差, 感觉, 风景","['差', '太', '远', '服务', '不好', '吃饭', '贵', '难吃', '一点', '品质', '项目', '收费', '差', '评']",性价比,8,-1.0,28024,1
A08,2020-03-09,活动价预定，便宜的都不能再便宜了！性价比超级高，比广州**景区性价比高很多,3.0,0.4124000072479248,"走, 高, 性价比, 免费, 太, 坐, 建议, 观音, 开车, 感觉","['活动', '价', '预定', '便宜', '便宜', '性价比', '超级', '高', '广州', '性价比', '高']",性价比,8,2.0,28025,5
A08,2020-03-11,很划算，比原价打折很多，推荐！！！,4.0,0.8154000043869019,"便宜, 价格, 优惠, 网上, 现场, 不用, 实惠, 排队, 购票, 订","['划算', '原价', '打折', '推荐']",性价比,8,1.0,28026,3
A08,2020-03-31,太贵了，一个人230不划算,7.0,0.692300021648407,"环境, 贵, 很好, 没什么, 吃, 东西, 太, 差, 感觉, 风景","['太贵', '不划算']",性价比,8,1.0,28027,3
A08,2020-03-11,很同事一起去的，很多地方没有去，但里面的表演很好看，很多动物.非常适合带小朋友一起去,12.0,0.661899983882904,"动物, 爬, 岛, 沙滩, 天然, 氧吧, 表演, 广州, 动物园, 种类","['同事', '表演', '好看', '动物', '非常适合']",设施,8,1.0,28028,3
A08,2020-03-09,各方面都挺好的就是我们去的时候下雨。，小朋友约定的时候一定要看天气，我们忘了看天气。,2.0,0.4356000125408172,"好玩, 开心, 太, 天气, 项目, 特别, 舒服, 夏天, 热, 风景","['挺好', '下雨', '约定', '天气', '忘', '天气']",设施,8,1.0,28029,3
A08,2020-03-09,深圳的动物园可以说是国内最好的几个之一了！规划合理，动物种类多。,12.0,0.5066999793052673,"动物, 爬, 岛, 沙滩, 天然, 氧吧, 表演, 广州, 动物园, 种类","['深圳', '动物园', '国内', '几个', '规划', '动物', '种类']",设施,8,1.0,28030,3
A08,2020-03-09,深圳市里惟一一个可以看到野生动物的地方可以说是不错的，但是有些地方动物的居住面积比较小，看得可怜。,12.0,0.7692000269889832,"动物, 爬, 岛, 沙滩, 天然, 氧吧, 表演, 广州, 动物园, 种类","['深圳市', '惟一', '野生动物', '动物', '居住面积', '可怜']",设施,8,-1.0,28031,1
A08,2020-03-09,没什么特别的感觉，就是钱解决一切,7.0,0.5117999911308289,"环境, 贵, 很好, 没什么, 吃, 东西, 太, 差, 感觉, 风景","['没什么', '特别', '感觉', '钱', '解决']",性价比,8,2.0,28032,5
A08,2017-10-13,好多动物，还能亲手去喂食。。。,12.0,0.3219999969005584,"动物, 爬, 岛, 沙滩, 天然, 氧吧, 表演, 广州, 动物园, 种类","['好多', '动物', '喂食']",设施,8,1.0,28033,3
A08,2017-08-25,**景区于1993年9月28日正式开业，从而成为我国第一家集动物园、植物园、科普园等多种园艺、观赏功能为一体的亚热带新型园林生态环境风景区；深圳市**景区荣获国务院授予的“中华之最”光荣称号，是全国第一家返璞归真的开放式动物园。该园占地一点二平方公里，1993年正式开业，是我国第一座集动物、森林、植物、科普等多种特色和观赏功能为一体的具有亚热带新型园林生态环境系统的风景区。,0.0,0.5055999755859375,"值得, 适合, 环境, 干净, 休闲, 公园, 空气清新, 瀑布, 水, 很漂亮","['年月日', '正式', '开业', '我国', '第一家', '集', '动物园', '植物园', '科普', '园', '多种', '园艺', '观赏', '功能', '一体', '亚热带', '新型', '园林', '生态环境', '风景区', '深圳市', '荣获', '国务院', '授予', '中华', '光荣称号', '全国', '第一家', '返璞归真', '开放式', '动物园', '园', '占地', '一点', '平方公里', '年', '正式', '开业', '我国', '第一座', '集', '动物', '森林', '植物', '科普', '多种', '特色', '观赏', '功能', '一体', '亚热带', '新型', '园林', '生态环境', '系统', '风景区']",卫生,8,3.0,28034,5
A08,2020-03-14,晚上的就那几种动物，胜在便宜，当散散步，看了特技表演还出了意外，那些特技表演者真的是以生命为代价,1.0,0.2414000034332275,"风景, 表演, 值得, 一般般, 位于, 晚上, 好看, 建筑, 美丽, 大自然","['晚上', '几种', '动物', '胜', '便宜', '散散步', '特技表演', '意外', '特技表演', '真的', '生命', '代价']",服务,8,-1.0,28035,1
A08,2017-10-02,海洋馆表演对没看过的还行。一路都是走路。走完累个半死。,3.0,0.5180000066757202,"走, 高, 性价比, 免费, 太, 坐, 建议, 观音, 开车, 感觉","['海洋馆', '表演', '看过', '还行', '一路', '走路', '走', '完累', '半死']",性价比,8,-1.0,28036,1
A08,2016-03-21,很，好玩，很适合带小孩子去,2.0,0.3925000131130218,"好玩, 开心, 太, 天气, 项目, 特别, 舒服, 夏天, 热, 风景","['好玩', '适合']",设施,8,1.0,28037,3
A08,2017-11-21,动物园可真大，我们逛了几个小时，看到了好多动物：如节尾狐猴、珍珠鸡、孔雀、食火鸡、狮虎兽、秃鹤、牦牛、熊、小熊猫、龟蛇鳄鱼岛、大象、火烈鸟、长劲鹿……,3.0,0.4268999993801117,"走, 高, 性价比, 免费, 太, 坐, 建议, 观音, 开车, 感觉","['动物园', '真大', '逛', '几个', '好多', '动物', '如节', '尾', '狐猴', '珍珠鸡', '孔雀', '食火鸡', '狮虎兽', '秃', '鹤', '牦牛', '熊', '小熊猫', '龟', '蛇', '鳄鱼', '岛', '大象', '火烈鸟', '长', '劲', '鹿']",性价比,8,1.0,28038,3
A08,2017-09-25,景色秀丽！虽然看的是夜场，19：30看到了一场精彩绝伦的汽车摩托特技表演！真的很棒！,1.0,0.3388000130653381,"风景, 表演, 值得, 一般般, 位于, 晚上, 好看, 建筑, 美丽, 大自然","['景色', '秀丽', '夜场', '一场', '精彩绝伦', '汽车', '摩托', '特技表演', '真的', '很棒']",服务,8,1.0,28039,3
A08,2017-10-18,动物大致还比较满意，就是国宝熊猫有点失望，太脏了，最有看头还是华家班的表演…,12.0,0.4862000048160553,"动物, 爬, 岛, 沙滩, 天然, 氧吧, 表演, 广州, 动物园, 种类","['动物', '比较满意', '国宝', '熊猫', '失望', '太', '脏', '看头', '华家班', '表演']",设施,8,-1.0,28040,1
A08,2020-02-16,两大一小可以是一个大人两个小孩吗,6.0,0.4059000015258789,"上山, 广东, 导游, 山顶, 时, 走, 到达, 两个, 下午, 坐","['两', '一小', '大人', '两个']",服务,8,1.0,28041,3
A08,2016-08-09,头一晚才决定去的，游玩当日7点55分购买，去到景点入口处直接刷二维码就可以入园了，很方便，就是这个时候去，很热，大多动物都懒得动，三个小时就出园了。另外花50元进去喂老虎，没白来！,6.0,0.2619000077247619,"上山, 广东, 导游, 山顶, 时, 走, 到达, 两个, 下午, 坐","['头', '晚才', '当日', '购买', '入口处', '刷', '二维码', '入园', '热', '动物', '懒得动', '三个', '出园', '花元', '老虎', '没白来']",服务,8,1.0,28042,3
A08,2017-10-04,一颗星都不值得。大家还是多看看景区的微信公众号，或者官网，在那些地方买票吧。有保障也有优惠，别被这边坑了，,6.0,0.3537000119686126,"上山, 广东, 导游, 山顶, 时, 走, 到达, 两个, 下午, 坐","['一颗', '星', '值得', '微信', '公众', '号', '官网', '保障', '优惠', '坑']",服务,8,1.0,28043,3
A08,2017-09-21,动物种类很多，很适合亲子游，表演也很精彩,12.0,0.5809999704360962,"动物, 爬, 岛, 沙滩, 天然, 氧吧, 表演, 广州, 动物园, 种类","['动物', '种类', '适合', '亲子', '表演', '精彩']",设施,8,1.0,28044,3
A08,2017-09-18,值得一去，孩子很开心，可以让孩子认识很多动物,12.0,0.3970000147819519,"动物, 爬, 岛, 沙滩, 天然, 氧吧, 表演, 广州, 动物园, 种类","['值得', '开心', '动物']",设施,8,2.0,28045,5
A08,2017-12-23,取票方便，价格优惠，大赞,4.0,0.5189999938011169,"便宜, 价格, 优惠, 网上, 现场, 不用, 实惠, 排队, 购票, 订","['价格', '优惠', '大赞']",性价比,8,1.0,28046,3
A08,2016-03-07,总体还不错，里面很大，很多动物都是没见过的，好看好看,2.0,0.3278999924659729,"好玩, 开心, 太, 天气, 项目, 特别, 舒服, 夏天, 热, 风景","['总体', '很大', '动物', '没见', '好看', '好看']",设施,8,1.0,28047,3
A08,2017-12-22,10年去玩的，现在又去一次大变样。,1.0,0.5385000109672546,"风景, 表演, 值得, 一般般, 位于, 晚上, 好看, 建筑, 美丽, 大自然","['年', '大变样']",服务,8,1.0,28048,3
A08,2016-12-17,很好玩，动物类别较多。还观看了马戏表演，鸟类表演，海豚和海狮表演。海豚表演项目很多，感觉比香港海洋世界的表演要精彩。园内道路干净平整，成人如果没有老人和小孩，可步行到各景点参观。感列遗憾的一点是没来急观看百兽表演和大家表演。,12.0,0.3616999983787536,"动物, 爬, 岛, 沙滩, 天然, 氧吧, 表演, 广州, 动物园, 种类","['好玩', '动物', '类别', '观看', '马戏表演', '鸟类', '表演', '海豚', '海狮', '表演', '海豚', '表演', '项目', '感觉', '香港', '海洋', '世界', '表演', '精彩', '园内', '道路', '干净', '平整', '成人', '步行', '参观', '感列', '遗憾', '一点', '没来', '急', '观看', '百兽', '表演', '表演']",设施,8,0.0,28049,1
A08,2017-11-12,一::v嫩江路(j.:::一;…::……:义一户:淼……洲:;删省.,3.0,0.5386000275611877,"走, 高, 性价比, 免费, 太, 坐, 建议, 观音, 开车, 感觉","['嫩江', '路', '义', '一户', '淼', '洲', '删省']",性价比,8,1.0,28050,3
A08,2016-10-03,最好上午吃完早点就去，可以玩上一整天，有老虎、大象、猴子、孔雀等，孩子很开心，很值得。最好带上防蚊水。,0.0,0.3048000037670135,"值得, 适合, 环境, 干净, 休闲, 公园, 空气清新, 瀑布, 水, 很漂亮","['上午', '吃', '早点', '一整天', '老虎', '大象', '猴子', '孔雀', '开心', '值得', '带上', '防蚊', '水']",卫生,8,2.0,28051,5
A08,2016-07-20,玩的尽性，表演很精彩，暑假大人小孩一起游玩！网上定票直接扫二维码就可入园，太方便了！,2.0,0.2712000012397766,"好玩, 开心, 太, 天气, 项目, 特别, 舒服, 夏天, 热, 风景","['尽性', '表演', '精彩', '暑假', '大人', '网上', '定票', '扫', '二维码', '可入', '园', '太']",设施,8,1.0,28052,3
A08,2016-10-04,环境很好，想看的动物都有看到，值得一游,11.0,0.3163999915122986,"景色, 美, 感觉, 山上, 值得, 中, 优美, 拍, 交通, 少","['环境', '想看', '动物', '值得']",位置,8,1.0,28053,3
A08,2017-07-17,夜场的表演很不错，后来有摩托车表演，可惜当天下了一场大雨，导致无法正常表演，但是看了前面三分钟，真的全场嗨爆！,1.0,0.3813999891281128,"风景, 表演, 值得, 一般般, 位于, 晚上, 好看, 建筑, 美丽, 大自然","['夜场', '表演', '摩托车', '表演', '可惜', '天下', '一场', '大雨', '导致', '表演', '三分钟', '真的', '全场', '嗨', '爆']",服务,8,-2.0,28054,1
A08,2017-04-04,代理商出票很慢、打了3次电话都才处理。显示20分钟提交付款成功后出票、实际上、我下午2钟付款成功、到晚上20.46才收到短信确认。而且价格还比其他的贵。前面看了其他的217 后来以为逍遥游的包含（熊猫庄园+海运天地）是需要另购票就觉得买这个划算。没想到这两个已经包含在普通成人票的价格内。哎、都买贵了2张24，虽然是小数目但是也是相差摆在哪里 至于动物园吧 就不多说了、动物很少……,6.0,0.3908999860286712,"上山, 广东, 导游, 山顶, 时, 走, 到达, 两个, 下午, 坐","['代理商', '出票', '很慢', '次', '电话', '显示', '分钟', '提交', '付款', '成功', '出票', '实际上', '下午', '钟', '付款', '成功', '晚上', '收到', '短信', '确认', '价格', '贵', '逍遥游', '包含', '熊猫', '庄园', '海运', '天地', '购票', '划算', '没想到', '两个', '包含', '成人', '价格', '贵', '张', '小数目', '相差', '摆在', '动物园', '动物']",服务,8,0.0,28055,1
A08,2017-08-13,夜场实在没什么好看的，动物看不到几个，表演都是走过场，汽车表演还行，打折买的夜场票，原价实在不值，而且里面吃的东西真的贵，还贼难吃，一瓶水8块，一点泡面加2个牛肉20，比**还贵！！,7.0,0.5738999843597412,"环境, 贵, 很好, 没什么, 吃, 东西, 太, 差, 感觉, 风景","['夜场', '实在', '没什么', '好看', '动物', '看不到', '几个', '表演', '走过场', '汽车', '表演', '行', '打折', '夜场', '原价', '实在', '不值', '吃', '东西', '真的', '贵', '贼', '难吃', '一瓶', '水块', '一点', '泡面', '加', '牛肉', '贵']",性价比,8,0.0,28056,1
A08,2016-07-17,不错，就是没走完，很多动物没看到，很可惜。而且门票好贵啊。,12.0,0.2369000017642974,"动物, 爬, 岛, 沙滩, 天然, 氧吧, 表演, 广州, 动物园, 种类","['没走', '动物', '可惜', '贵']",设施,8,-1.0,28057,1
