A08,2015-11-02,这次深圳动物园观看华家班汽车特技表现真的：平，靓，正。,12.0,0.3693000078201294,"动物, 爬, 岛, 沙滩, 天然, 氧吧, 表演, 广州, 动物园, 种类","['深圳', '动物园', '观看', '华家班', '汽车', '特技', '表现', '真的', '平', '靓', '正']",设施,8,1.0,28612,3
A08,2015-09-11,取钱确实很方便，但是动物太少了，就只能看看表演,7.0,0.2962000072002411,"环境, 贵, 很好, 没什么, 吃, 东西, 太, 差, 感觉, 风景","['取', '钱', '确实', '动物', '太', '少', '只能', '表演']",性价比,8,1.0,28613,3
A08,2015-11-01,就是还有其他消费，不爽,9.0,0.421099990606308,"山, 爬山, 好多, 希望, 太, 美的, 钱, 水, 骑, 活动","['消费', '不爽']",设施,8,-1.0,28614,1
A08,2015-11-01,看见大老虎，看车技表演，小孩很开心。,12.0,0.5393999814987183,"动物, 爬, 岛, 沙滩, 天然, 氧吧, 表演, 广州, 动物园, 种类","['老虎', '车技', '表演', '开心']",设施,8,1.0,28615,3
A08,2015-10-31,不错，性价比高，技术很好。,3.0,0.5192999839782715,"走, 高, 性价比, 免费, 太, 坐, 建议, 观音, 开车, 感觉","['性价比', '高', '技术']",性价比,8,1.0,28616,3
A08,2015-10-31,5分，表演精彩，节目好看，值得一去，,1.0,0.8461999893188477,"风景, 表演, 值得, 一般般, 位于, 晚上, 好看, 建筑, 美丽, 大自然","['表演', '精彩', '节目', '好看', '值得']",服务,8,1.0,28617,3
A08,2015-11-01,5分，表演很惊险，很刺激。带小孩去是个不错的选择。,2.0,0.6083999872207642,"好玩, 开心, 太, 天气, 项目, 特别, 舒服, 夏天, 热, 风景","['表演', '惊险', '刺激', '选择']",设施,8,-2.0,28618,1
A08,2015-10-31,5分，表演的很精彩，很赞，很好玩,1.0,0.5486000180244446,"风景, 表演, 值得, 一般般, 位于, 晚上, 好看, 建筑, 美丽, 大自然","['表演', '精彩', '赞', '好玩']",服务,8,1.0,28619,3
A08,2015-10-30,5分，一块钱很便宜，可是我有事没能去，买到便宜的票我已经很开心了，唯一遗憾的是没能去游玩呵呵,3.0,0.4408000111579895,"走, 高, 性价比, 免费, 太, 坐, 建议, 观音, 开车, 感觉","['一块钱', '便宜', '有事', '没能', '便宜', '开心', '唯一', '遗憾', '没能']",性价比,8,2.0,28620,5
A08,2015-10-29,服务态度很差，一点人性化都没有，表演好看，现在天黑得比较快，看不到什么动物，最主要就是去表演的,1.0,0.2457000017166137,"风景, 表演, 值得, 一般般, 位于, 晚上, 好看, 建筑, 美丽, 大自然","['服务态度', '差', '一点', '人性化', '表演', '好看', '天黑', '看不到', '动物', '表演']",服务,8,1.0,28621,3
A08,2015-10-28,5分，景色很美，很好玩，车技表演很精彩。,11.0,0.3470000028610229,"景色, 美, 感觉, 山上, 值得, 中, 优美, 拍, 交通, 少","['景色', '美', '好玩', '车技', '表演', '精彩']",位置,8,1.0,28622,3
A08,2015-10-28,还行吧，车和摩托表演。,6.0,0.2222999930381775,"上山, 广东, 导游, 山顶, 时, 走, 到达, 两个, 下午, 坐","['还行', '车', '摩托', '表演']",服务,8,1.0,28623,3
A08,2015-06-04,拖家带口来到**景区，网上预定好直接拿票，不用排队，方便。感觉里面的工作人员态度好好，下次去玩还是这样定票好,4.0,0.2931999862194061,"便宜, 价格, 优惠, 网上, 现场, 不用, 实惠, 排队, 购票, 订","['拖家带口', '来到', '网上', '预定', '拿票', '不用', '排队', '感觉', '工作人员', '态度', '好好', '下次', '定票']",性价比,8,1.0,28624,3
A08,2015-10-28,4分，表演不错，园内很多路都禁止通行了，如果可以有更多园子夜间开放就更好了。,3.0,0.3434999883174896,"走, 高, 性价比, 免费, 太, 坐, 建议, 观音, 开车, 感觉","['表演', '园内', '路', '禁止通行', '园子', '夜间', '开放', '更好']",性价比,8,1.0,28625,3
A08,2015-10-27,不错，很便宜，早点去还可以看老虎这些，还要去,4.0,0.5138000249862671,"便宜, 价格, 优惠, 网上, 现场, 不用, 实惠, 排队, 购票, 订","['便宜', '早点', '老虎']",性价比,8,1.0,28626,3
A08,2015-10-26,星期六人很多 取票很方便 二维码就可以进,3.0,0.4043000042438507,"走, 高, 性价比, 免费, 太, 坐, 建议, 观音, 开车, 感觉","['星期六', '二维码', '进']",性价比,8,1.0,28627,3
A08,2015-10-26,5分，我们去看的是夜场，铁骑无疆，很刺激。也有小动物，很可爱，反正觉得挺不错的。,12.0,0.3454999923706054,"动物, 爬, 岛, 沙滩, 天然, 氧吧, 表演, 广州, 动物园, 种类","['夜场', '铁骑', '无疆', '刺激', '动物', '可爱', '反正', '挺不错']",设施,8,0.0,28628,1
A08,2015-10-26,带小朋友去好好玩…推荐大家。,2.0,0.692300021648407,"好玩, 开心, 太, 天气, 项目, 特别, 舒服, 夏天, 热, 风景","['好玩', '推荐']",设施,8,1.0,28629,3
A08,2015-10-26,玩的很开心，小孩子也很尽兴，表演也很精彩。,1.0,0.4172999858856201,"风景, 表演, 值得, 一般般, 位于, 晚上, 好看, 建筑, 美丽, 大自然","['开心', '尽兴', '表演', '精彩']",服务,8,2.0,28630,5
A08,2015-10-26,很好玩，小孩说明天还要去，就是表演时间安排都集中在中午左右，吃饭时间来不及。好地方宝宝还要去,6.0,0.4796000123023987,"上山, 广东, 导游, 山顶, 时, 走, 到达, 两个, 下午, 坐","['好玩', '明天', '表演', '安排', '中午', '吃饭时间', '宝宝']",服务,8,1.0,28631,3
A08,2015-10-26,5分，下次还想我去玩。景色很美。,11.0,0.4636000096797943,"景色, 美, 感觉, 山上, 值得, 中, 优美, 拍, 交通, 少","['下次', '想', '景色', '美']",位置,8,1.0,28632,3
A08,2015-10-26,评分：5分，节目非常好，马戏表演时间太短，玩一天刚刚好，园内餐饮太少，价格偏高，质量有待提高！,9.0,0.3181999921798706,"山, 爬山, 好多, 希望, 太, 美的, 钱, 水, 骑, 活动","['评分', '节目', '马戏表演', '太短', '刚刚', '园内', '餐饮', '太', '少', '价格', '偏', '高', '质量', '有待', '提高']",设施,8,1.0,28633,3
A08,2015-10-26,5分，华家班的车技演出很精彩，很赞！！！,1.0,0.7692999839782715,"风景, 表演, 值得, 一般般, 位于, 晚上, 好看, 建筑, 美丽, 大自然","['华家班', '车技', '演出', '精彩', '赞']",服务,8,1.0,28634,3
A08,2015-06-02,还行，里面挺大的，早上九点去的，逛了一整天都还没有逛完！,6.0,0.617900013923645,"上山, 广东, 导游, 山顶, 时, 走, 到达, 两个, 下午, 坐","['行', '挺大', '早上', '九点', '逛', '一整天', '逛']",服务,8,1.0,28635,3
A08,2015-11-09,很好！老人很方便。都开心,2.0,0.5385000109672546,"好玩, 开心, 太, 天气, 项目, 特别, 舒服, 夏天, 热, 风景",['开心'],设施,8,1.0,28636,3
A08,2015-11-09,? 鸟类可以看，还有飞车,12.0,0.3591000139713287,"动物, 爬, 岛, 沙滩, 天然, 氧吧, 表演, 广州, 动物园, 种类","['鸟类', '飞车']",设施,8,1.0,28637,3
A08,2015-10-25,很多动物，半天还看不完，建议早上就过去。,6.0,0.2696999907493591,"上山, 广东, 导游, 山顶, 时, 走, 到达, 两个, 下午, 坐","['动物', '半天', '看不完', '建议', '早上']",服务,8,1.0,28638,3
A08,2015-08-11,微信订票减20，下来是200元！,6.0,0.3589000105857849,"上山, 广东, 导游, 山顶, 时, 走, 到达, 两个, 下午, 坐","['微信', '减']",服务,8,1.0,28639,3
A08,2015-10-25,5分，景色好美，演出很精彩，小孩大人都很喜欢,1.0,0.3021000027656555,"风景, 表演, 值得, 一般般, 位于, 晚上, 好看, 建筑, 美丽, 大自然","['景色', '美', '演出', '精彩', '大人', '喜欢']",服务,8,1.0,28640,3
A08,2015-08-10,不错的一次游玩，她和小家玩得非常高兴，下回还带上家人去。,9.0,0.4158999919891357,"山, 爬山, 好多, 希望, 太, 美的, 钱, 水, 骑, 活动","['小家', '非常高兴', '下回', '带上', '家人']",设施,8,1.0,28641,3
A08,2015-11-05,景色很美，很好玩。汽车特技很刺激。,11.0,0.2973000109195709,"景色, 美, 感觉, 山上, 值得, 中, 优美, 拍, 交通, 少","['景色', '美', '好玩', '汽车', '特技', '刺激']",位置,8,-1.0,28642,1
A08,2015-10-21,取票很方便，表演很精彩！,1.0,0.692300021648407,"风景, 表演, 值得, 一般般, 位于, 晚上, 好看, 建筑, 美丽, 大自然","['表演', '精彩']",服务,8,1.0,28643,3
A08,2015-05-27,很好玩，十月一号再去,2.0,0.5386000275611877,"好玩, 开心, 太, 天气, 项目, 特别, 舒服, 夏天, 热, 风景","['好玩', '十月', '一号']",设施,8,1.0,28644,3
A08,2015-10-19,订票就是方便，多快好省，谢谢,10.0,0.5385000109672546,"喜欢, 下次, 漂亮, 朋友, 值得, 去过, 机会, 字, 开心, 风景优美","['多快好省', '谢谢']",位置,8,1.0,28645,3
A08,2015-10-18,5分，动物园很大，里面的项目也很有意思。不过美中不足的是里面的车子都不是电动车，污染严重。,8.0,0.3050999939441681,"空气, 设施, 可惜, 完善, 还行, 游乐, 有意思, 老板, 负离子, 商业","['动物园', '很大', '项目', '有意思', '美中不足', '车子', '电动车', '污染']",设施,8,-1.0,28646,1
A08,2015-10-18,5分。景c很m合一家人的休f[挺好玩的。,1.0,0.2696000039577484,"风景, 表演, 值得, 一般般, 位于, 晚上, 好看, 建筑, 美丽, 大自然","['景c', 'm合', '休f', '[', '挺好玩']",服务,8,1.0,28647,3
A08,2015-10-19,在门口旁边的团队取票室拿票，很方便,4.0,0.5802000164985657,"便宜, 价格, 优惠, 网上, 现场, 不用, 实惠, 排队, 购票, 订","['门口', '旁边', '团队', '取', '票室', '拿票']",性价比,8,1.0,28648,3
A08,2015-10-18,5分，项目很是刺激，很好玩,2.0,0.7692000269889832,"好玩, 开心, 太, 天气, 项目, 特别, 舒服, 夏天, 热, 风景","['项目', '刺激', '好玩']",设施,8,-1.0,28649,1
A08,2015-10-18,动物园里的动物很多，还可以喂食，小朋友们非常高兴！,12.0,0.4066999852657318,"动物, 爬, 岛, 沙滩, 天然, 氧吧, 表演, 广州, 动物园, 种类","['动物园', '动物', '喂食', '非常高兴']",设施,8,1.0,28650,3
A08,2015-08-05,玩了一天，一大家子去游玩,0.0,0.5379999876022339,"值得, 适合, 环境, 干净, 休闲, 公园, 空气清新, 瀑布, 水, 很漂亮",['一大家子'],卫生,8,1.0,28651,3
A08,2015-08-03,很棒是一次非常不错的近距离接触和体验,12.0,0.8154000043869019,"动物, 爬, 岛, 沙滩, 天然, 氧吧, 表演, 广州, 动物园, 种类","['很棒', '近距离', '接触', '体验']",设施,8,1.0,28652,3
A08,2015-08-04,玩的很开心，下次再买，，，,10.0,0.692300021648407,"喜欢, 下次, 漂亮, 朋友, 值得, 去过, 机会, 字, 开心, 风景优美","['开心', '下次']",位置,8,1.0,28653,3
A08,2015-10-30,因为离得近，晚上玩了一下，总体感觉很好，就是时间有点短。,11.0,0.8154000043869019,"景色, 美, 感觉, 山上, 值得, 中, 优美, 拍, 交通, 少","['晚上', '总体', '感觉', '短']",位置,8,1.0,28654,3
A08,2015-10-28,景色很美，节目很精彩,11.0,0.4156000018119812,"景色, 美, 感觉, 山上, 值得, 中, 优美, 拍, 交通, 少","['景色', '美', '节目', '精彩']",位置,8,1.0,28655,3
A08,2015-10-12,5分景色好美，动物也多遗憾的是没有蟒蛇。,11.0,0.4180000126361847,"景色, 美, 感觉, 山上, 值得, 中, 优美, 拍, 交通, 少","['景色', '美', '动物', '遗憾', '蟒蛇']",位置,8,-1.0,28656,1
A08,2015-10-13,5分，动物成群，各种演出和表演都很不错，不过还是少一些动物演出，动物被折磨的好可怜。,12.0,0.5131999850273132,"动物, 爬, 岛, 沙滩, 天然, 氧吧, 表演, 广州, 动物园, 种类","['动物', '成群', '演出', '表演', '少', '动物', '演出', '动物', '折磨', '可怜']",设施,8,-2.0,28657,1
A08,2015-09-13,价格是大坑，环境好点，太坑爹了！,0.0,0.520799994468689,"值得, 适合, 环境, 干净, 休闲, 公园, 空气清新, 瀑布, 水, 很漂亮","['价格', '大坑', '环境', '太坑', '爹']",卫生,8,1.0,28658,3
A08,2015-03-09,很好玩，宝贝很开心…………,2.0,0.4762000143527984,"好玩, 开心, 太, 天气, 项目, 特别, 舒服, 夏天, 热, 风景","['好玩', '宝贝', '开心']",设施,8,1.0,28659,3
A08,2015-10-12,5分，小孩子很开心！下次还会带小孩去玩。,10.0,0.692300021648407,"喜欢, 下次, 漂亮, 朋友, 值得, 去过, 机会, 字, 开心, 风景优美","['开心', '下次']",位置,8,1.0,28660,3
A08,2015-10-26,3表演节目很精彩，缺憾是参与性的项目较少或性价比太低。,1.0,0.3583999872207641,"风景, 表演, 值得, 一般般, 位于, 晚上, 好看, 建筑, 美丽, 大自然","['表演', '节目', '精彩', '缺憾', '参与性', '项目', '少', '性价比', '太', '低']",服务,8,1.0,28661,3
A08,2015-10-12,5分！景色很美，很好玩,11.0,0.5194000005722046,"景色, 美, 感觉, 山上, 值得, 中, 优美, 拍, 交通, 少","['景色', '美', '好玩']",位置,8,1.0,28662,3
A08,2015-10-26,景色很美很好玩下次再来昨天玩的很开心啊,2.0,0.4390999972820282,"好玩, 开心, 太, 天气, 项目, 特别, 舒服, 夏天, 热, 风景","['景色', '很美', '好玩', '下次', '昨天', '开心']",设施,8,1.0,28663,3
A08,2015-10-11,深圳休闲娱乐的好地方，这是第三次去了，还不错！,0.0,0.6154000163078308,"值得, 适合, 环境, 干净, 休闲, 公园, 空气清新, 瀑布, 水, 很漂亮","['深圳', '休闲', '娱乐', '第三次']",卫生,8,1.0,28664,3
A08,2015-10-11,玩一天轻轻松松?，全家去很惬意。,0.0,0.692300021648407,"值得, 适合, 环境, 干净, 休闲, 公园, 空气清新, 瀑布, 水, 很漂亮","['轻轻松松', '全家', '惬意']",卫生,8,2.0,28665,5
A08,2015-08-21,去**景区看看各种野生动物，可以开发小朋友的想象力和爱心。动物园是假期值得带小朋友去的一个不错的地方。,12.0,0.4061999917030334,"动物, 爬, 岛, 沙滩, 天然, 氧吧, 表演, 广州, 动物园, 种类","['野生动物', '开发', '想象力', '爱心', '动物园', '假期', '值得']",设施,8,3.0,28666,5
A08,2015-07-29,老人小孩都玩得很开心，小盆友很喜欢，适合亲子活动,2.0,0.4386000037193298,"好玩, 开心, 太, 天气, 项目, 特别, 舒服, 夏天, 热, 风景","['开心', '盆友', '喜欢', '适合', '亲子活动']",设施,8,3.0,28667,5
A08,2015-10-08,很好玩，就是马车太坑爹了。就那么小一圈。,0.0,0.2691999971866607,"值得, 适合, 环境, 干净, 休闲, 公园, 空气清新, 瀑布, 水, 很漂亮","['好玩', '马车', '太坑', '爹', '一圈']",卫生,8,1.0,28668,3
A08,2015-10-25,景色很美，动物很多，价格适中，很好玩，特别是还有飞车表演,11.0,0.2691999971866607,"景色, 美, 感觉, 山上, 值得, 中, 优美, 拍, 交通, 少","['景色', '美', '动物', '价格', '适中', '好玩', '特别', '飞车', '表演']",位置,8,1.0,28669,3
A08,2015-10-08,评分 5分 很漂亮 动物萌,12.0,0.515999972820282,"动物, 爬, 岛, 沙滩, 天然, 氧吧, 表演, 广州, 动物园, 种类","['评分', '很漂亮', '动物', '萌']",设施,8,1.0,28670,3
A08,2015-10-08,非常不错，就是院内的二次消费太多，但总体来说很不错,3.0,0.5321999788284302,"走, 高, 性价比, 免费, 太, 坐, 建议, 观音, 开车, 感觉","['院内', '二次', '消费', '太', '总体']",性价比,8,1.0,28671,3
A08,2015-10-08,孩子很开心，下次还可以再去！,10.0,0.692300021648407,"喜欢, 下次, 漂亮, 朋友, 值得, 去过, 机会, 字, 开心, 风景优美","['开心', '下次']",位置,8,1.0,28672,3
A08,2015-10-07,景点还不错，门票有点贵，里面喂食的收费太吭爹了,3.0,0.4950000047683716,"走, 高, 性价比, 免费, 太, 坐, 建议, 观音, 开车, 感觉","['贵', '喂食', '收费', '太', '吭', '爹']",性价比,8,1.0,28673,3
A08,2015-10-07,门票有点贵，其他还可以,7.0,0.5385000109672546,"环境, 贵, 很好, 没什么, 吃, 东西, 太, 差, 感觉, 风景",['贵'],性价比,8,1.0,28674,3
A08,2015-10-07,4分，好玩，动物很多，很原生态,0.0,0.2777999937534332,"值得, 适合, 环境, 干净, 休闲, 公园, 空气清新, 瀑布, 水, 很漂亮","['好玩', '动物', '原生态']",卫生,8,1.0,28675,3
A08,2015-10-07,5分，看了海豚表演和其它动物的表演，很有趣，值得了。,12.0,0.5200999975204468,"动物, 爬, 岛, 沙滩, 天然, 氧吧, 表演, 广州, 动物园, 种类","['海豚', '表演', '动物', '表演', '有趣', '值得']",设施,8,2.0,28676,5
A08,2015-10-07,5分，景色宜人，好多表演，值得一去。,0.0,0.366100013256073,"值得, 适合, 环境, 干净, 休闲, 公园, 空气清新, 瀑布, 水, 很漂亮","['景色宜人', '好多', '表演', '值得']",卫生,8,1.0,28677,3
A08,2015-10-07,孩子还真喜欢，动物就哪些,10.0,0.5188999772071838,"喜欢, 下次, 漂亮, 朋友, 值得, 去过, 机会, 字, 开心, 风景优美","['真', '喜欢', '动物']",位置,8,1.0,28678,3
A08,2015-10-07,很好玩，动物很多，距离近,3.0,0.2759000062942505,"走, 高, 性价比, 免费, 太, 坐, 建议, 观音, 开车, 感觉","['好玩', '动物', '距离']",性价比,8,1.0,28679,3
A08,2015-10-07,一定不能搞错时间，不然亏大了,7.0,0.3592999875545501,"环境, 贵, 很好, 没什么, 吃, 东西, 太, 差, 感觉, 风景","['搞错', '亏']",性价比,8,1.0,28680,3
A08,2015-10-06,5分。很棒的体验。下小雨天，刚好人不多。就是里面卖的喂动物的食物比较贵。,7.0,0.2694000005722046,"环境, 贵, 很好, 没什么, 吃, 东西, 太, 差, 感觉, 风景","['很棒', '体验', '小雨', '天', '人不多', '卖', '动物', '食物', '贵']",性价比,8,1.0,28681,3
A08,2015-10-06,5分，绝对物超所值！很棒！不错！,1.0,0.692300021648407,"风景, 表演, 值得, 一般般, 位于, 晚上, 好看, 建筑, 美丽, 大自然","['物超所值', '很棒']",服务,8,1.0,28682,3
A08,2015-10-06,非常好玩，不过下着雨，里面收费项目太多，票价有点贵,2.0,0.3440000116825104,"好玩, 开心, 太, 天气, 项目, 特别, 舒服, 夏天, 热, 风景","['好玩', '下着雨', '收费', '项目', '太', '票价', '贵']",设施,8,1.0,28683,3
A08,2015-10-06,很好玩，哈哈哈哈哈哈哈哈,1.0,0.5192999839782715,"风景, 表演, 值得, 一般般, 位于, 晚上, 好看, 建筑, 美丽, 大自然","['好玩', '哈哈哈哈', '哈哈哈哈']",服务,8,1.0,28684,3
A08,2015-10-05,景区很大，从早上八点半玩到下午三点半。。表演很精彩,6.0,0.5006999969482422,"上山, 广东, 导游, 山顶, 时, 走, 到达, 两个, 下午, 坐","['很大', '早上', '八点半', '下午', '三点', '表演', '精彩']",服务,8,1.0,28685,3
A08,2015-10-05,当天就用了，挺方面的。,4.0,0.5385000109672546,"便宜, 价格, 优惠, 网上, 现场, 不用, 实惠, 排队, 购票, 订","['当天', '就用']",性价比,8,1.0,28686,3
A08,2015-10-05,不错，挺方便的，很好找！就是遇到台风天，匆匆忙忙逛了一下，走马观花,6.0,0.534500002861023,"上山, 广东, 导游, 山顶, 时, 走, 到达, 两个, 下午, 坐","['好找', '台风', '天', '匆匆忙忙', '逛', '走马观花']",服务,8,-1.0,28687,1
A08,2015-10-04,二维码电子票很方便，小孩也玩得很开心。,4.0,0.5331000089645386,"便宜, 价格, 优惠, 网上, 现场, 不用, 实惠, 排队, 购票, 订","['二维码', '电子', '开心']",性价比,8,1.0,28688,3
A08,2015-10-04,5分，景色很美，很接近大自然，还体验了平常体验不到的，很好玩，很开心,11.0,0.2856999933719635,"景色, 美, 感觉, 山上, 值得, 中, 优美, 拍, 交通, 少","['景色', '美', '接近', '大自然', '体验', '平常', '体验', '不到', '好玩', '开心']",位置,8,0.0,28689,1
A08,2015-10-04,5分，好多大草原的动物，好可爱，不枉此行，羊驼萌萌的,12.0,0.5059999823570251,"动物, 爬, 岛, 沙滩, 天然, 氧吧, 表演, 广州, 动物园, 种类","['好多', '草原', '动物', '可爱', '枉', '此行', '羊驼', '萌', '萌']",设施,8,1.0,28690,3
A08,2015-10-04,其实家庭可以去到买年票更实惠，一年多次入园,4.0,0.3395000100135803,"便宜, 价格, 优惠, 网上, 现场, 不用, 实惠, 排队, 购票, 订","['家庭', '年票', '实惠', '一年', '入园']",性价比,8,1.0,28691,3
A08,2015-10-04,景色很美，很好玩，动物表演很精彩,11.0,0.2984000146389007,"景色, 美, 感觉, 山上, 值得, 中, 优美, 拍, 交通, 少","['景色', '美', '好玩', '动物', '表演', '精彩']",位置,8,1.0,28692,3
A08,2015-10-04,购票取票很方便。只不过动物园没什么好玩的。,12.0,0.3407999873161316,"动物, 爬, 岛, 沙滩, 天然, 氧吧, 表演, 广州, 动物园, 种类","['购票', '只不过', '动物园', '没什么', '好玩']",设施,8,1.0,28693,3
A08,2015-10-04,购票方便，只不过动物园没什么好玩的。,12.0,0.3407999873161316,"动物, 爬, 岛, 沙滩, 天然, 氧吧, 表演, 广州, 动物园, 种类","['购票', '只不过', '动物园', '没什么', '好玩']",设施,8,1.0,28694,3
A08,2015-10-03,5分，放养的动物，很多品种。又好看又好玩！,12.0,0.6633999943733215,"动物, 爬, 岛, 沙滩, 天然, 氧吧, 表演, 广州, 动物园, 种类","['放养', '动物', '品种', '好看', '好玩']",设施,8,1.0,28695,3
A08,2015-10-03,5分，景色很好，地方好大，值得一去。,11.0,0.692300021648407,"景色, 美, 感觉, 山上, 值得, 中, 优美, 拍, 交通, 少","['景色', '值得']",位置,8,1.0,28696,3
A08,2015-10-03,5分，孩子玩得很尽兴，如果能多些动物出现就更好了。,12.0,0.2162999957799911,"动物, 爬, 岛, 沙滩, 天然, 氧吧, 表演, 广州, 动物园, 种类","['尽兴', '多些', '动物', '更好']",设施,8,1.0,28697,3
A08,2015-10-03,很高兴，很好玩，下次还去！,2.0,0.4523999989032745,"好玩, 开心, 太, 天气, 项目, 特别, 舒服, 夏天, 热, 风景","['好玩', '下次']",设施,8,1.0,28698,3
A08,2015-10-03,很好，风景很美，很好玩，下次还去！,2.0,0.6152999997138977,"好玩, 开心, 太, 天气, 项目, 特别, 舒服, 夏天, 热, 风景","['风景', '美', '好玩', '下次']",设施,8,1.0,28699,3
A08,2015-10-03,5，铁骑无疆表演很精彩,1.0,0.6923999786376953,"风景, 表演, 值得, 一般般, 位于, 晚上, 好看, 建筑, 美丽, 大自然","['铁骑', '无疆', '表演', '精彩']",服务,8,1.0,28700,3
A08,2015-07-22,玩得很开心，很快乐，宝宝开心。,10.0,0.8154000043869019,"喜欢, 下次, 漂亮, 朋友, 值得, 去过, 机会, 字, 开心, 风景优美","['开心', '快乐', '宝宝', '开心']",位置,8,3.0,28701,5
A08,2015-10-02,很不错，不用排队或者自助买票了。,4.0,0.7692000269889832,"便宜, 价格, 优惠, 网上, 现场, 不用, 实惠, 排队, 购票, 订","['不用', '排队', '自助']",性价比,8,1.0,28702,3
A08,2015-10-02,5分，活动很棒，很好玩，十分的开心,2.0,0.6083999872207642,"好玩, 开心, 太, 天气, 项目, 特别, 舒服, 夏天, 热, 风景","['活动', '很棒', '好玩', '开心']",设施,8,2.0,28703,5
A08,2015-07-21,挺好的，带孩子看啦表演，动物园里的动物给孩子们带来了很多快乐和知识！,12.0,0.7239000201225281,"动物, 爬, 岛, 沙滩, 天然, 氧吧, 表演, 广州, 动物园, 种类","['表演', '动物园', '动物', '带来', '快乐', '知识']",设施,8,1.0,28704,3
A08,2015-10-02,4分，车技表演很刺激，就是晚上节目有缩水,1.0,0.6115999817848206,"风景, 表演, 值得, 一般般, 位于, 晚上, 好看, 建筑, 美丽, 大自然","['车技', '表演', '刺激', '晚上', '节目', '缩水']",服务,8,-1.0,28705,1
A08,2015-10-01,5分，景色很美，很好玩。,11.0,0.5194000005722046,"景色, 美, 感觉, 山上, 值得, 中, 优美, 拍, 交通, 少","['景色', '美', '好玩']",位置,8,1.0,28706,3
A08,2015-10-02,取票真的很方便，又能省个十几块,9.0,0.4672999978065491,"山, 爬山, 好多, 希望, 太, 美的, 钱, 水, 骑, 活动","['真的', '省', '十几块']",设施,8,1.0,28707,3
A08,2015-10-02,第三次去，里面的设施感觉比以前要完善，就是里面收费比较高，而且什么都要钱，能便宜点就好了,3.0,0.2612000107765198,"走, 高, 性价比, 免费, 太, 坐, 建议, 观音, 开车, 感觉","['第三次', '设施', '感觉', '完善', '收费', '高', '要钱', '便宜']",性价比,8,1.0,28708,3
A08,2015-10-02,5分！景色不错，节目好！让人惊喜！,1.0,0.51910001039505,"风景, 表演, 值得, 一般般, 位于, 晚上, 好看, 建筑, 美丽, 大自然","['景色', '节目', '惊喜']",服务,8,1.0,28709,3
A08,2015-09-30,挺好的，取票方便，还很便宜。,4.0,0.5385000109672546,"便宜, 价格, 优惠, 网上, 现场, 不用, 实惠, 排队, 购票, 订",['便宜'],性价比,8,1.0,28710,3
A08,2015-09-30,喂老虎很好玩，孩子玩得很开心,2.0,0.5160999894142151,"好玩, 开心, 太, 天气, 项目, 特别, 舒服, 夏天, 热, 风景","['老虎', '好玩', '开心']",设施,8,1.0,28711,3
A08,2015-09-30,取票方便，价格便宜，服务好,5.0,0.692300021648407,"温泉, 服务, 服务态度, 满意, 泡温泉, 热情, 家人, 工作人员, 方便快捷, 态度","['价格便宜', '服务']",服务,8,1.0,28712,3
A08,2015-09-30,网上订购，取票快，服务态度也好,5.0,0.2773999869823456,"温泉, 服务, 服务态度, 满意, 泡温泉, 热情, 家人, 工作人员, 方便快捷, 态度","['网上', '订购', '服务态度']",服务,8,1.0,28713,3
